,First author,Year,Title,Journal,Abstract,wos_link,fulltext_link
36,"Helton, AM",Jan 2018 ,How network structure can affect nitrogen removal by streams,FRESHWATER BIOLOGY,"1. Streams and rivers can be highly reactive sites for nitrogen (N) transformation and removal. Empirical and model-based research show how location in a stream network affects rates of N removal. Because the structure of stream networks can vary widely and N cycling in headwater streams may affect N cycling in downstream reaches, we hypothesised that network structure may affect whole stream network processing of N.2. We generated three stream networks with the same catchment area but differing shapes, based on optimal channel network theory. We applied a model of nitrate (NO3-) transport and denitrification, and implemented model scenarios to examine how network shape affects NO3- removal with (1) increased NO3- loading from the catchment, (2) altered spatial distributions of NO3- loading and (3) decreased drainage density (i. e. loss of headwater streams).3. For all stream networks, the fraction of total NO3- removed decreased with increasing NO3- loading from the catchment. Stream networks in narrow catchments removed a higher fraction of NO3- 3, particularly at intermediate NO3- loading rates. Network shape also controlled the distribution of removal in small versus large streams, with larger streams removing a higher fraction of the total NO3- load in narrower networks.4. The effects of network shape on NO3- removal when the spatial distribution of NO3- loading was altered varied with the magnitude of NO3- loading. At low loads, NO3- was entirely removed when added to distal parts of the stream network, and about 50% removed when added near the outlet; there was no effect of network shape. At intermediate and high loads, the fraction of total NO3- load removed by the narrow stream network was 1.59 higher than the rectangular and square networks when NO3- was added to distal parts of the networks. Network shape did not have an effect when NO3- load occurred near the outlet, regardless of the magnitude of the NO3- load.5. The fraction of total NO3- removed by the stream network was up to 5% lower when drainage density was reduced from 1.0 to 0.74 km(-1), with the least change for the narrow network. Reducing the drainage density also altered the role of small relative to large streams, with the net effect of moving the location of NO3- removal downstream.Show less",https://www.webofscience.com/wos/woscc/full-record/WOS:000423280700011,https://www.webofscience.com/api/gateway?GWVersion=2&SrcAuth=OpenURL&SrcApp=WOS&DestURL=https%3A%2F%2Fwww.redi-bw.de%2Flinks%2Funist%3Furl_ver%3DZ39.88-2004%26url_ctx_fmt%3Dinfo%3Aofi%2Ffmt%3Akev%3Amtx%3Actx%26rft.atitle%3DHow%2Bnetwork%2Bstructure%2Bcan%2Baffect%2Bnitrogen%2Bremoval%2Bby%2Bstreams%26rft.aufirst%3DAshley%2BM.%26rft.auinit%3DAM%26rft.aulast%3DHelton%26rft.date%3D2018%26rft_id%3Dinfo%3Adoi%2F10.1111%252Ffwb.12990%26rft.eissn%3D1365-2427%26rft.epage%3D140%26rft.genre%3Darticle%26rft.issn%3D0046-5070%26rft.issue%3D1%26rft.jtitle%3DFRESHWATER%2BBIOLOGY%26rft_val_fmt%3Dinfo%3Aofi%2Ffmt%3Akev%3Amtx%3Ajournal%26rft.pages%3D128-140%26rfr_id%3Dinfo%3Asid%2Fwebofscience.com%3AWOS%3AWOS%26rft.spage%3D128%26rft.stitle%3DFRESHWATER%2BBIOL%26rft.volume%3D63%26rft.au%3DHelton%252C%2BAM%26rft.au%3DHall%252C%2BRO%26rft.au%3DBertuzzo%252C%2BE&DestApp=OTHER_OpenURL&SrcAppSID=EUW1ED0E6F0AOwgVwm9KDMIQcxgqv&SrcJTitle=FRESHWATER+BIOLOGY&SrcPubType=MD_FORMAT
37,"Harrison, PJ",Symposium on Coastal Ecosystem Responses to Changing Nutrient Inputs from Large Temperate and Sub-Tropical Rivers,Physical-biological coupling in the Pearl River Estuary,CONTINENTAL SHELF RESEARCH,,https://www.webofscience.com/wos/woscc/full-record/WOS:000257620200002,https://www.webofscience.com/api/gateway?GWVersion=2&SrcAuth=OpenURL&SrcApp=WOS&DestURL=https%3A%2F%2Fwww.redi-bw.de%2Flinks%2Funist%3Furl_ver%3DZ39.88-2004%26url_ctx_fmt%3Dinfo%3Aofi%2Ffmt%3Akev%3Amtx%3Actx%26rft.atitle%3DPhysical-biological%2Bcoupling%2Bin%2Bthe%2BPearl%2BRiver%2BEstuary%26rft.aufirst%3DPaul%2BJ.%26rft.auinit%3DPJ%26rft.aulast%3DHarrison%26rft.date%3D2008%26rft_id%3Dinfo%3Adoi%2F10.1016%252Fj.csr.2007.02.011%26rft.eissn%3D1873-6955%26rft.epage%3D1415%26rft.genre%3Darticle%26rft.issn%3D0278-4343%26rft.issue%3D12%26rft.jtitle%3DCONTINENTAL%2BSHELF%2BRESEARCH%26rft_val_fmt%3Dinfo%3Aofi%2Ffmt%3Akev%3Amtx%3Ajournal%26rft.pages%3D1405-1415%26rfr_id%3Dinfo%3Asid%2Fwebofscience.com%3AWOS%3AWOS%26rft.spage%3D1405%26rft.stitle%3DCONT%2BSHELF%2BRES%26rft.volume%3D28%26rft.au%3DHarrison%252C%2BPJ%26rft.au%3DYin%252C%2BKD%26rft.au%3DLiu%252C%2BHB&DestApp=OTHER_OpenURL&SrcAppSID=EUW1ED0E6F0AOwgVwm9KDMIQcxgqv&SrcJTitle=CONTINENTAL+SHELF+RESEARCH&SrcPubType=MD_FORMAT
38,"Rai, PK",Jul 2018 ,Coupling of 1D models (SWAT and SWMM) with 2D model (iRIC) for mapping inundation in Brahmani and Baitarani river delta,NATURAL HAZARDS,"River flooding has been causing extensive losses to life and property, which is a serious concern worldwide. To minimize these losses, suitable planning and management practices are required for the floodplain mapping. Flash floods occur almost every year in the deltaic region of Brahmani and Baitarani river basins in India, during the monsoon season. Generally, 1D modelling is considered as a regular practice. But nowadays, model formulations include 1D for the representation of river channels and 2D for representing river floodplains. In the absence of uniform observations, a hybrid model (1D-2D coupled model) has been developed for this deltaic region to identify the extent of inundation and its depth during the flooding, since 1D models alone do not provide detailed information of flooding. Thus, a well-known 2D river hydrodynamic model iRIC was externally coupled with 1D (SWAT and SWMM) models to simulate and visualize flood scenarios and to identify the flood-prone areas. The hydrological model SWAT was calibrated and validated for Brahmani river deltaic basin, with the observed discharge data available. However for Baitarani river basin, observed flow data were missing and only gauge data were available at few monitoring stations. Hence, for Baitarani river basin, the SWMM model was developed and calibrated with the help of Monte Carlo method. Finally, the SWAT- and SWMM-based tributary stream flow outputs were fed together into the iRIC hydrodynamic model as input for flood inundation mapping. The discharge and water gauge data were used for the calibration and validation. The results obtained from the coupled model were found to be in good agreement with the observed data (RMSE value is 0.77 and 0.79 during calibration and validation, respectively), which enabled identification of the flood-prone areas. The developed model may be used as a tool for effective planning and management of natural disasters such as flash floods.Show less",https://www.webofscience.com/wos/woscc/full-record/WOS:000433913500027,https://www.webofscience.com/api/gateway?GWVersion=2&SrcAuth=OpenURL&SrcApp=WOS&DestURL=https%3A%2F%2Fwww.redi-bw.de%2Flinks%2Funist%3Furl_ver%3DZ39.88-2004%26url_ctx_fmt%3Dinfo%3Aofi%2Ffmt%3Akev%3Amtx%3Actx%26rft.atitle%3DCoupling%2Bof%2B1D%2Bmodels%2B%2528SWAT%2Band%2BSWMM%2529%2Bwith%2B2D%2Bmodel%2B%2528iRIC%2529%2Bfor%2Bmapping%2Binundation%2Bin%2BBrahmani%2Band%2BBaitarani%2Briver%2Bdelta%26rft.aufirst%3DPawan%2BKumar%26rft.auinit%3DPK%26rft.aulast%3DRai%26rft.date%3D2018%26rft_id%3Dinfo%3Adoi%2F10.1007%252Fs11069-018-3281-4%26rft.eissn%3D1573-0840%26rft.epage%3D1840%26rft.genre%3Darticle%26rft.issn%3D0921-030X%26rft.issue%3D3%26rft.jtitle%3DNATURAL%2BHAZARDS%26rft_val_fmt%3Dinfo%3Aofi%2Ffmt%3Akev%3Amtx%3Ajournal%26rft.pages%3D1821-1840%26rfr_id%3Dinfo%3Asid%2Fwebofscience.com%3AWOS%3AWOS%26rft.spage%3D1821%26rft.stitle%3DNAT%2BHAZARDS%26rft.volume%3D92%26rft.au%3DRai%252C%2BPK%26rft.au%3DDhanya%252C%2BCT%26rft.au%3DChahar%252C%2BBR&DestApp=OTHER_OpenURL&SrcAppSID=EUW1ED0E6F0AOwgVwm9KDMIQcxgqv&SrcJTitle=NATURAL+HAZARDS&SrcPubType=MD_FORMAT
39,"Tagami, K",Dec 2006 ,"Concentrations of chlorine, bromine and iodine in Japanese rivers",CHEMOSPHERE,"Concentrations of halogens (Cl, Br and 1) in 30 Japanese rivers were measured by ion chromatography and inductively coupled plasma mass spectrometry to understand their behavior in the terrestrial environment. Concentrations of Cl, Br and I in each river, obtained at 10 sampling points from the upper stream to the river mouth, tended to increase near the river mouth. The ranges of geometric means of Cl, Br and I in each river were 1.0-19.4 mgl(-1), 2.5-67.9 mu gl(-1), and 0.18-8.34 mu gl(-1), respectively. To compare halogen behavior, the concentration ratios, Br/Cl and I/Cl, were calculated. The Br/Cl range was (2.3-7.8) x 10(-3) (geometric mean: 3.74 x 10(-3)), and it was nearly constant except for the Yoneshiro river. It was estimated that 60-80% of total Br in the middle to lower parts of this river was the excess Br. The Br chemical form in all the rivers is generally considered to be Br-. The I/Cl ratios had different trends in rivers flowing into the Japan Sea and Pacific Ocean, possibly due to the different geological features in the river catchments. (c) 2006 Elsevier Ltd. All rights reserved.Show less",https://www.webofscience.com/wos/woscc/full-record/WOS:000243019400056,https://www.webofscience.com/api/gateway?GWVersion=2&SrcAuth=OpenURL&SrcApp=WOS&DestURL=https%3A%2F%2Fwww.redi-bw.de%2Flinks%2Funist%3Furl_ver%3DZ39.88-2004%26url_ctx_fmt%3Dinfo%3Aofi%2Ffmt%3Akev%3Amtx%3Actx%26rft.atitle%3DConcentrations%2Bof%2Bchlorine%252C%2Bbromine%2Band%2Biodine%2Bin%2BJapanese%2Brivers%26rft.aufirst%3DKeiko%26rft.auinit%3DK%26rft.aulast%3DTagami%26rft.date%3D2006%26rft_id%3Dinfo%3Adoi%2F10.1016%252Fj.chemosphere.2006.04.077%26rft.eissn%3D1879-1298%26rft.epage%3D2365%26rft.genre%3Darticle%26rft.issn%3D0045-6535%26rft.issue%3D11%26rft.jtitle%3DCHEMOSPHERE%26rft_val_fmt%3Dinfo%3Aofi%2Ffmt%3Akev%3Amtx%3Ajournal%26rft.pages%3D2358-2365%26rfr_id%3Dinfo%3Asid%2Fwebofscience.com%3AWOS%3AWOS%26rft.spage%3D2358%26rft.stitle%3DCHEMOSPHERE%26rft.volume%3D65%26rft.au%3DTagami%252C%2BK%26rft.au%3DUchida%252C%2BS&DestApp=OTHER_OpenURL&SrcAppSID=EUW1ED0E6F0AOwgVwm9KDMIQcxgqv&SrcJTitle=CHEMOSPHERE&SrcPubType=MD_FORMAT
40,"Lorang, MS",Aug 2005 ,Using airborne multispectral imagery to evaluate geomorphic work across floodplains of gravel-bed rivers,ECOLOGICAL APPLICATIONS,"Fluvial processes of cut and fill alluviation and channel abandonment or avulsion are essential for maintaining the ecological health of floodplain ecosystems characteristic of gravel-bed rivers. These dynamic processes shape the floodplain landscape, resulting in a shifting mosaic of habitats, both above and below ground. We present a new and innovative methodology to quantitatively assess the geomorphic work potential necessary to maintain a shifting habitat mosaic for gravel-bed river floodplains. This approach can be used to delineate critical habitats for preservation through land acquisition and conservation easements, often critical elements of river restoration plans worldwide. Spatially explicit modeling of water depth, flow velocity, shear stress, and stream power derived from surface hydraulic measurements was combined with airborne multispectral remote sensing for detailed modeling of floodplain water surfaces over tens to hundreds of square kilometers. The model results were then combined within a GIS framework to determine potential nodes of channel avulsion that delineate spatially explicit zones across the floodplain where the potential for geomorphic work is the greatest. Results of this study demonstrate the utility of integrating existing multispectral remote sensing data coupled with time-lagged ground-based measures of flow hydraulics to model fluvial processes at relatively fine spatial resolutions but over broad regional extents.Show less",https://www.webofscience.com/wos/woscc/full-record/WOS:000230876900011,https://www.webofscience.com/api/gateway?GWVersion=2&SrcAuth=OpenURL&SrcApp=WOS&DestURL=https%3A%2F%2Fwww.redi-bw.de%2Flinks%2Funist%3Furl_ver%3DZ39.88-2004%26url_ctx_fmt%3Dinfo%3Aofi%2Ffmt%3Akev%3Amtx%3Actx%26rft.atitle%3DUsing%2Bairborne%2Bmultispectral%2Bimagery%2Bto%2Bevaluate%2Bgeomorphic%2Bwork%2Bacross%2Bfloodplains%2Bof%2Bgravel-bed%2Brivers%26rft.aufirst%3DMS%26rft.auinit%3DMS%26rft.aulast%3DLorang%26rft.date%3D2005%26rft_id%3Dinfo%3Adoi%2F10.1890%252F03-5290%26rft.eissn%3D1939-5582%26rft.epage%3D1222%26rft.genre%3Darticle%26rft.issn%3D1051-0761%26rft.issue%3D4%26rft.jtitle%3DECOLOGICAL%2BAPPLICATIONS%26rft_val_fmt%3Dinfo%3Aofi%2Ffmt%3Akev%3Amtx%3Ajournal%26rft.pages%3D1209-1222%26rfr_id%3Dinfo%3Asid%2Fwebofscience.com%3AWOS%3AWOS%26rft.spage%3D1209%26rft.stitle%3DECOL%2BAPPL%26rft.volume%3D15%26rft.au%3DLorang%252C%2BMS%26rft.au%3DWhited%252C%2BDC%26rft.au%3DStanford%252C%2BJA&DestApp=OTHER_OpenURL&SrcAppSID=EUW1ED0E6F0AOwgVwm9KDMIQcxgqv&SrcJTitle=ECOLOGICAL+APPLICATIONS&SrcPubType=MD_FORMAT
41,"Barnes, RT",Nov 2019 ,Hydrogeologic Controls of Surface Water-Groundwater Nitrogen Dynamics Within a Tidal Freshwater Zone,JOURNAL OF GEOPHYSICAL RESEARCH-BIOGEOSCIENCES,"Microbial processing of reactive nitrogen in stream sediments and connected aquifers can remove and transform nitrogen prior to its discharge into coastal waters, decreasing the likelihood of harmful algal blooms and low oxygen levels in estuaries. Canonical wisdom points to the decreased capacity of rivers to retain nitrogen as they flow toward the coast. However, how tidal freshwater zones, which often extend hundreds of kilometers inland, process and remove nitrogen remains unknown. Using geochemical measurements and numerical models, we show that tidal pumping results in the rapid cycling of nitrogen within distinct zones throughout the riparian aquifer. Near the fluctuating water table nitrification dominates, with high nitrate concentrations (>10 mg N/L) and consistent isotopic composition. Beneath this zone, isotopes reveal that nitrate is both denitrified and added over the tidal cycle, maintaining nitrate concentrations >3-4 mg N/L. In most of the riparian aquifer and streambed, nitrate concentrations are <0.5 mg N/L, suggesting denitrification dominates. Model results reveal that oxygen delivery to groundwater from the overlying unsaturated soil fuels mineralization and nitrification, with subsequent denitrification in low-oxygen, high organic matter regions. Depending on flow paths, tidal freshwater zones could be sources of nitrate in regions with permeable sediment and low organic matter content.Plain Language Summary Human activities related to energy and food production add large amounts of reactive nitrogen to the landscape. Rain and snow wash some of that nitrogen into rivers and eventually to the coast. The addition of excess nitrogen to coastal ecosystems can cause excessive algal growth and low-oxygen conditions, which can lead to fish kills. As nitrogen travels to the coast, microbes in the sediment beneath and near the river process and remove large portions of this nitrogen. It is unclear how daily tidal fluctuations within the freshwater tidal zone alter these processes. Geochemical measurements of pore water beneath the stream and within the stream bank reveal that there are different zones of nitrogen processing, where differences in sediment type and water exchange control the supply of reactants. Zones of nitrate production exist within the stream bank aquifer, but conditions favoring nitrate removal dominate the aquifer. Therefore, depending on how water moves through the subsurface, it is possible that tidal fresh water zones could act as a source of nitrate to the stream channel, exacerbating coastal management challenges.Key PointsHydrologic fluctuations drive diel nitrogen dynamics within the tidal freshwater zone Organic matter content and hydrologic connectivity determine whether nitrate production or nitrate removal dominates within bank storage zones Tidal freshwater zones are a sink of groundwater borne nitrateShow less",https://www.webofscience.com/wos/woscc/full-record/WOS:000495173200001,https://www.webofscience.com/api/gateway?GWVersion=2&SrcAuth=OpenURL&SrcApp=WOS&DestURL=https%3A%2F%2Fwww.redi-bw.de%2Flinks%2Funist%3Furl_ver%3DZ39.88-2004%26url_ctx_fmt%3Dinfo%3Aofi%2Ffmt%3Akev%3Amtx%3Actx%26rft.atitle%3DHydrogeologic%2BControls%2Bof%2BSurface%2BWater-Groundwater%2BNitrogen%2BDynamics%2BWithin%2Ba%2BTidal%2BFreshwater%2BZone%26rft.aufirst%3DRebecca%2BT.%26rft.auinit%3DRT%26rft.aulast%3DBarnes%26rft.date%3D2019%26rft_id%3Dinfo%3Adoi%2F10.1029%252F2019JG005164%26rft.eissn%3D2169-8961%26rft.epage%3D3355%26rft.genre%3Darticle%26rft.issn%3D2169-8953%26rft.issue%3D11%26rft.jtitle%3DJOURNAL%2BOF%2BGEOPHYSICAL%2BRESEARCH-BIOGEOSCIENCES%26rft_val_fmt%3Dinfo%3Aofi%2Ffmt%3Akev%3Amtx%3Ajournal%26rft.pages%3D3343-3355%26rfr_id%3Dinfo%3Asid%2Fwebofscience.com%3AWOS%3AWOS%26rft.spage%3D3343%26rft.stitle%3DJ%2BGEOPHYS%2BRES-BIOGEO%26rft.volume%3D124%26rft.au%3DBarnes%252C%2BRT%26rft.au%3DSawyer%252C%2BAH%26rft.au%3DHastings%252C%2BMG&DestApp=OTHER_OpenURL&SrcAppSID=EUW1ED0E6F0AOwgVwm9KDMIQcxgqv&SrcJTitle=JOURNAL+OF+GEOPHYSICAL+RESEARCH-BIOGEOSCIENCES&SrcPubType=MD_FORMAT
42,"Molina-Moctezuma, A",Jan 2021 ,"Restoration of rapids habitat in a Great Lakes connecting channel, the St. Marys River, Michigan",RESTORATION ECOLOGY,"Aquatic habitat has been extensively altered throughout the Laurentian Great Lakes to increase navigation connectivity. In particular, the St. Marys River, a Great Lakes connecting channel, lost >50% of its historic rapids habitat over the past century. In 2016, the natural flow was restored to the Little Rapids area of the St. Marys River. The goal of our study was to evaluate physical and ecological responses to the restoration of the Little Rapids area. Extensive habitat and biological data were collected prior to restoration (2013 and 2014), and after restoration (2017 and 2018). Measured parameters included total suspended solids, current velocity, benthic macroinvertebrates, and larval, juvenile, and adult fishes. Total suspended solids stayed low (<4 mg/L) following restoration, with the exception of a single construction-related event. Pre-restoration data indicated that all measured velocities were below the target flow rate of 0.24 m/s, whereas 70% of the measured habitat was above the target flow post-restoration. Abundance and richness of benthic macroinvertebrates were reduced following restoration (>90% reduction). We observed a 45% increase in richness of larval fish 2 years after restoration and a 131% increase in catch per unit effort. For adult fishes, the proportion of individuals with a preference for fast-moving waters increased from 1.5 to 45% in the restored area, and from 7 to 15% upstream of the restored area; a similar response was observed for lithophilic spawners. The physical and biological conditions of the Little Rapids improved and resembled conditions typical of rapids habitat extent in other areas of the river and other systems.Show less",https://www.webofscience.com/wos/woscc/full-record/WOS:000597308100001,https://www.webofscience.com/api/gateway?GWVersion=2&SrcAuth=OpenURL&SrcApp=WOS&DestURL=https%3A%2F%2Fwww.redi-bw.de%2Flinks%2Funist%3Furl_ver%3DZ39.88-2004%26url_ctx_fmt%3Dinfo%3Aofi%2Ffmt%3Akev%3Amtx%3Actx%26rft.artnum%3DARTN%2Be13310%26rft.atitle%3DRestoration%2Bof%2Brapids%2Bhabitat%2Bin%2Ba%2BGreat%2BLakes%2Bconnecting%2Bchannel%252C%2Bthe%2BSt.%2BMarys%2BRiver%252C%2BMichigan%26rft.aufirst%3DAlejandro%26rft.auinit%3DA%26rft.aulast%3DMolina-Moctezuma%26rft.date%3D2021%26rft_id%3Dinfo%3Adoi%2F10.1111%252Frec.13310%26rft.eissn%3D1526-100X%26rft.genre%3Darticle%26rft.issn%3D1061-2971%26rft.issue%3D1%26rft.jtitle%3DRESTORATION%2BECOLOGY%26rft_val_fmt%3Dinfo%3Aofi%2Ffmt%3Akev%3Amtx%3Ajournal%26rfr_id%3Dinfo%3Asid%2Fwebofscience.com%3AWOS%3AWOS%26rft.stitle%3DRESTOR%2BECOL%26rft.volume%3D29%26rft.au%3DMolina-Moctezuma%252C%2BA%26rft.au%3DEllis%252C%2BE%26rft.au%3DMoerke%252C%2BA&DestApp=OTHER_OpenURL&SrcAppSID=EUW1ED0E6F0AOwgVwm9KDMIQcxgqv&SrcJTitle=RESTORATION+ECOLOGY&SrcPubType=MD_FORMAT
43,"Forsman, KJ",Jan 15 2002 ,The effects of partly irreversible solute exchange: comparison between conservative and sorptive transport in streams,JOURNAL OF HYDROLOGY,"Contaminant transport in streams and rivers is often affected by the solute exchange between the main stream and various adjacent storage zones as well as chemical and biological processes. This paper focuses on the difference between the effects of conservative and reactive solute exchange, respectively, in terms of an analytical transport model that takes into account main stream advection, solute exchange with storage zones, instantaneous equilibrium sorption and first order reactions. The effects of longitudinal variation of water flow and hydraulic radius as well as transversal variation of streambed porosity were included in the analysis, which was conducted on a reach by reach basis. To be able to use a temporally variable upstream concentration as boundary concentration, the measured breakthroughs were divided into 30-150 segments of constant concentration and the solutions were obtained as the sum of solutions for all segments. An experiment in Uppland County in Sweden, constitutes the basis for this study. Results from a simultaneous injection of the tracers tritium, (H2O)-H-3, and chromium Cr-51(III), made it possible to distinguish between conservative and reactive transport along a 30 km. reach of the Sava Stream. The peak concentration of the reactive chromium decreased faster with distance, than that of tritium. The main hypothesis is that the chromium exchange is affected by both rapid sorption processes and slower reactions in the subsurface storage zones. In this framework, the slow processes appear as irreversible, which is true at least on the time scale represented by the data. The irreversibility is probably caused by the net effect of various slow chemical processes, e.g. solute precipitation/co-precipitation and irreversible sorption, which decreases the washout rate after the main bulk of the solute has passed by in the stream. A fully reversible exchange description, with instantaneous equilibrium partitioning, gives a clearly overestimated tail for chromium, which is not the case with the present concept. Results obtained by independently evaluating seven subreaches of the stream give mean Reaction Damkohler numbers for the storage zone equalling 2.63 for the transport of Cr-51 and 0 for (H2O)-H-3. (C) 2002 Elsevier Science B.V. All rights reserved.Show less",https://www.webofscience.com/wos/woscc/full-record/WOS:000173119800001,https://www.webofscience.com/api/gateway?GWVersion=2&SrcAuth=OpenURL&SrcApp=WOS&DestURL=https%3A%2F%2Fwww.redi-bw.de%2Flinks%2Funist%3Furl_ver%3DZ39.88-2004%26url_ctx_fmt%3Dinfo%3Aofi%2Ffmt%3Akev%3Amtx%3Actx%26rft.atitle%3DThe%2Beffects%2Bof%2Bpartly%2Birreversible%2Bsolute%2Bexchange%253A%2Bcomparison%2Bbetween%2Bconservative%2Band%2Bsorptive%2Btransport%2Bin%2Bstreams%26rft.aufirst%3DKJ%26rft.auinit%3DKJ%26rft.aulast%3DForsman%26rft.date%3D2002%26rft_id%3Dinfo%3Adoi%2F10.1016%252FS0022-1694%252801%252900527-3%26rft.epage%3D15%26rft.genre%3Darticle%26rft.issn%3D0022-1694%26rft.issue%3D1-2%26rft.jtitle%3DJOURNAL%2BOF%2BHYDROLOGY%26rft_val_fmt%3Dinfo%3Aofi%2Ffmt%3Akev%3Amtx%3Ajournal%26rft.pages%3D1-15%26rfr_id%3Dinfo%3Asid%2Fwebofscience.com%3AWOS%3AWOS%26rft.spage%3D1%26rft.stitle%3DJ%2BHYDROL%26rft.volume%3D256%26rft.au%3DForsman%252C%2BKJ%26rft.au%3DJohansson%252C%2BH%26rft.au%3DJonsson%252C%2BK&DestApp=OTHER_OpenURL&SrcAppSID=EUW1ED0E6F0AOwgVwm9KDMIQcxgqv&SrcJTitle=JOURNAL+OF+HYDROLOGY&SrcPubType=MD_FORMAT
