,First author,Year,Title,Journal,Abstract,wos_link,fulltext_link
34,"Singh, HV",Jun 2018 ,"Floodplain restoration increases hyporheic flow in the Yakima River Watershed, Washington",ECOLOGICAL ENGINEERING,"Hyporheic exchange between a river channel and its floodplain region assists in mediating processes such as nutrient removal and temperature regulation. Floodplain restoration in the form of levee setbacks are often carried out to improve the hyporheic exchange. In this study Light Detection and Ranging (LiDAR) data were used along with the head data from observation wells and stage data from rivers to setup and calibrate a groundwater model for 458 km(2) of area within Gap to Gap reach of the Yakima River, WA. This area has witnessed several efforts of floodplain restoration in the form of levee setbacks. The groundwater model was used to quantify hyporheic flow emerging from the Yakima River in steady and transient states during pre-restoration (using LiDAR data of 2008) and post-restoration period (after levee setback using LiDAR data of 2013). The comparison of results from the model runs during pre and post-restoration periods showed that the length of the pathlines increased after levee setback for both steady and transient state model simulations. The largest increase of about 62 m was noticed in the month of September 2014 (pre: 398 m and post: 460 m). The study also showed that the direction of the flow changed following levee setback, expanding the area for hyporheic flux exchange between surface and groundwater. The model run during transient state also suggested that pathlines were longer during drier months compared to wet months. Overall, the study showed that levee setbacks improved the hyporheic connection between surface and groundwater in the Yakima floodplain which demonstrates that levee setback can provide a valuable hydrologic tool to restore ecosystem processes in previously leveed rivers.Show less",https://www.webofscience.com/wos/woscc/full-record/WOS:000428958100015,https://www.webofscience.com/api/gateway?GWVersion=2&SrcAuth=OpenURL&SrcApp=WOS&DestURL=https%3A%2F%2Fwww.redi-bw.de%2Flinks%2Funist%3Furl_ver%3DZ39.88-2004%26url_ctx_fmt%3Dinfo%3Aofi%2Ffmt%3Akev%3Amtx%3Actx%26rft.atitle%3DFloodplain%2Brestoration%2Bincreases%2Bhyporheic%2Bflow%2Bin%2Bthe%2BYakima%2BRiver%2BWatershed%252C%2BWashington%26rft.aufirst%3DHarsh%2BVardhan%26rft.auinit%3DHV%26rft.aulast%3DSingh%26rft.date%3D2018%26rft_id%3Dinfo%3Adoi%2F10.1016%252Fj.ecoleng.2018.02.001%26rft.eissn%3D1872-6992%26rft.epage%3D120%26rft.genre%3Darticle%26rft.issn%3D0925-8574%26rft.jtitle%3DECOLOGICAL%2BENGINEERING%26rft_val_fmt%3Dinfo%3Aofi%2Ffmt%3Akev%3Amtx%3Ajournal%26rft.pages%3D110-120%26rfr_id%3Dinfo%3Asid%2Fwebofscience.com%3AWOS%3AWOS%26rft.spage%3D110%26rft.stitle%3DECOL%2BENG%26rft.volume%3D116%26rft.au%3DSingh%252C%2BHV%26rft.au%3DFaulkner%252C%2BBR%26rft.au%3DForshay%252C%2BKJ&DestApp=OTHER_OpenURL&SrcAppSID=EUW1ED0B4D3jWybG240azZugnCgwX&SrcJTitle=ECOLOGICAL+ENGINEERING&SrcPubType=MD_FORMAT
35,"Fowler, RT",Sep 2002 ,Influence of hydrologic exchange patterns on water chemistry and hyporheic invertebrate communities in three gravel-bed rivers,NEW ZEALAND JOURNAL OF MARINE AND FRESHWATER RESEARCH,"The influence of hydraulic exchange patterns on hyporheic water chemistry and invertebrate community composition was measured in three gravel-bed rivers of southern Hawke's Bay, North Island, New Zealand. Based on patterns reported overseas we predict that down-welling waters will be similar to surface waters in chemical characteristics and epigean animals will be more common in down-welling waters than in up-wellings, which would have a different chemical signature to the surface waters and a fauna dominated by hypogean invertebrates. Conductivity, pH, and temperature of hyporheic water were least like those of surface waters at up-wellings in the groundwater-fed Makaretu River. Only 6% of the invertebrate fauna of these up-wellings comprised epigean animals. In contrast, in the groundwater-recharging Tukituki and Waipawa Rivers, hyporheic water chemistry was similar to that of surface water in down-wellings and 40% of the community comprised epigean animals by abundance. Significant increases (P < 0.05) in species diversity and taxonomic richness was also identified in down-welling zones compared with up-wellings. Species diversity and taxonomic richness were lowest in up-wellings in the Makaretu where hypogean animals dominated the hyporheic fauna. Species diversity and taxonomic richness were higher in down-wellings than up-wellings because more epigean taxa were present.Show less",https://www.webofscience.com/wos/woscc/full-record/WOS:000179133600002,https://www.webofscience.com/api/gateway?GWVersion=2&SrcAuth=OpenURL&SrcApp=WOS&DestURL=https%3A%2F%2Fwww.redi-bw.de%2Flinks%2Funist%3Furl_ver%3DZ39.88-2004%26url_ctx_fmt%3Dinfo%3Aofi%2Ffmt%3Akev%3Amtx%3Actx%26rft.atitle%3DInfluence%2Bof%2Bhydrologic%2Bexchange%2Bpatterns%2Bon%2Bwater%2Bchemistry%2Band%2Bhyporheic%2Binvertebrate%2Bcommunities%2Bin%2Bthree%2Bgravel-bed%2Brivers%26rft.aufirst%3DRT%26rft.auinit%3DRT%26rft.aulast%3DFowler%26rft.date%3D2002%26rft_id%3Dinfo%3Adoi%2F10.1080%252F00288330.2002.9517102%26rft.eissn%3D1175-8805%26rft.epage%3D482%26rft.genre%3Darticle%26rft.issn%3D0028-8330%26rft.issue%3D3%26rft.jtitle%3DNEW%2BZEALAND%2BJOURNAL%2BOF%2BMARINE%2BAND%2BFRESHWATER%2BRESEARCH%26rft_val_fmt%3Dinfo%3Aofi%2Ffmt%3Akev%3Amtx%3Ajournal%26rft.pages%3D471-482%26rfr_id%3Dinfo%3Asid%2Fwebofscience.com%3AWOS%3AWOS%26rft.spage%3D471%26rft.stitle%3DNEW%2BZEAL%2BJ%2BMAR%2BFRESH%26rft.volume%3D36%26rft.au%3DFowler%252C%2BRT%26rft.au%3DScarsbrook%252C%2BMR&DestApp=OTHER_OpenURL&SrcAppSID=EUW1ED0B4D3jWybG240azZugnCgwX&SrcJTitle=NEW+ZEALAND+JOURNAL+OF+MARINE+AND+FRESHWATER+RESEARCH&SrcPubType=MD_FORMAT
36,"Soulsby, C",Nov-dec 2001 ,Hydrochemistry of the hyporheic zone in salmon spawning gravels: A preliminary assessment in a degraded agricultural stream,REGULATED RIVERS-RESEARCH & MANAGEMENT,"Hydrochemical changes were monitored in a simulated, sea run salmon redd in a small agricultural stream in northeast Scotland following the 1998-1999 spawning season. Immediately after redd construction, the hydrochemical characteristics of hyporheic water, at depths of 0.1 m and 0.3 m, were very similar to stream water. These apparently well-mixed waters were alkaline, well-oxygenated and enriched in nutrients. In the weeks and months following redd construction, clear and statistically significant differences in the chemistry of stream and hyporheic waters were observed. Typically, hyporheic water had lower concentrations of dissolved oxygen (mean 7.35 mg L-1 at 0.3 m depth) than stream waters (mean = 11.26 mg L-1). Alkalinity, calcium, sulphate and conductivity levels tended to be higher in hyporheic waters, with concentrations increasing with depth. These data implied an increasing influence of groundwater with depth in the hyporheic zone following redd construction; an inference supported by subsequent hydraulic head measurements, which revealed an upwards groundwater flux in the stream bed. However, groundwater-surface water interactions were dynamic and complex: road salts eluted into the stream during periods of snowmelt simulated tracer experiments that implied that a reversed hydraulic gradient may occur at high flows with deeper streamwater penetration and mixing in the hyporheic zone. High flows also result in the mobilization of fine sediments from the stream bed which subsequently infiltrated into spawning gravels. These appear to cause `capping' of redds and probably reduce the hydraulic conductivity of the redd matrix. Infiltrating sediments also contain a small, but probably important organic component, the decomposition of which may contribute to oxygen consumption and nutrient mineralization in the hyporheic zone. Copyright (C) 2001 John Wiley & Sons, Ltd.Show less",https://www.webofscience.com/wos/woscc/full-record/WOS:000172755500003,https://www.webofscience.com/api/gateway?GWVersion=2&SrcAuth=OpenURL&SrcApp=WOS&DestURL=https%3A%2F%2Fwww.redi-bw.de%2Flinks%2Funist%3Furl_ver%3DZ39.88-2004%26url_ctx_fmt%3Dinfo%3Aofi%2Ffmt%3Akev%3Amtx%3Actx%26rft.atitle%3DHydrochemistry%2Bof%2Bthe%2Bhyporheic%2Bzone%2Bin%2Bsalmon%2Bspawning%2Bgravels%253A%2BA%2Bpreliminary%2Bassessment%2Bin%2Ba%2Bdegraded%2Bagricultural%2Bstream%26rft.aufirst%3DC%26rft.auinit%3DC%26rft.aulast%3DSoulsby%26rft.date%3D2001%26rft_id%3Dinfo%3Adoi%2F10.1002%252Frrr.625%26rft.epage%3D665%26rft.genre%3Darticle%26rft.issn%3D0886-9375%26rft.issue%3D6%26rft.jtitle%3DREGULATED%2BRIVERS-RESEARCH%2B%2526%2BMANAGEMENT%26rft_val_fmt%3Dinfo%3Aofi%2Ffmt%3Akev%3Amtx%3Ajournal%26rft.pages%3D651-665%26rfr_id%3Dinfo%3Asid%2Fwebofscience.com%3AWOS%3AWOS%26rft.spage%3D651%26rft.stitle%3DREGUL%2BRIVER%26rft.volume%3D17%26rft.au%3DSoulsby%252C%2BC%26rft.au%3DMalcolm%252C%2BIA%26rft.au%3DYoungson%252C%2BAF&DestApp=OTHER_OpenURL&SrcAppSID=EUW1ED0B4D3jWybG240azZugnCgwX&SrcJTitle=REGULATED+RIVERS-RESEARCH+%26+MANAGEMENT&SrcPubType=MD_FORMAT
37,"Malcolm, IA",Feb 28 2003 ,Heterogeneity in ground water-surface water interactions in the hyporheic zone of a salmonid spawning stream,HYDROLOGICAL PROCESSES,"Spatial and temporal variability in ground water-surface water interactions in the hyporheic zone of a salmonid spawning stream was investigated. Four locations in a 150-m reach of the stream were studied using hydrometric and hydrochemical tracing techniques. A high degree of hydrological connectivity between the riparian hillslope and the stream channel was indicated at two locations, where hydrochemical changes and hydraulic gradients indicated that the hyporheic zone was dominated by upwelling ground water. The chemistry of ground water reflected relatively long residence times and reducing conditions with high levels of alkalinity and conductivity, low dissolved oxygen (DO) and nitrate. At the other locations, connectivity was less evident and, at most times, the hyporheic zone was dominated by downwelling stream water characterized by high DO, low alkalinity and conductivity. Substantial variability in hyporheic chemistry was evident at fine (<10 m) spatial scales and changed rapidly over the course of hydrological events. The nature of the hydrochemical response varied among locations depending on the strength of local ground water influence. It is suggested that greater emphasis on spatial and temporal heterogeneity in ground water-surface water interactions in the hyporheic zone is necessary for a consideration of hydrochemical effects on many aspects of stream ecology. For example, the survival of salmonid eggs in hyporheic gravels varied considerably among the locations studied and was shown to be associated with variation in interstitial chemistry. River restoration schemes and watershed management strategies based only on the surface expression of catchment characteristics risk excluding consideration of potentially critical subsurface processes. Copyright (C) 2002 John Wiley Sons, Ltd.Show less",https://www.webofscience.com/wos/woscc/full-record/WOS:000181010500005,https://www.webofscience.com/api/gateway?GWVersion=2&SrcAuth=OpenURL&SrcApp=WOS&DestURL=https%3A%2F%2Fwww.redi-bw.de%2Flinks%2Funist%3Furl_ver%3DZ39.88-2004%26url_ctx_fmt%3Dinfo%3Aofi%2Ffmt%3Akev%3Amtx%3Actx%26rft.atitle%3DHeterogeneity%2Bin%2Bground%2Bwater-surface%2Bwater%2Binteractions%2Bin%2Bthe%2Bhyporheic%2Bzone%2Bof%2Ba%2Bsalmonid%2Bspawning%2Bstream%26rft.aufirst%3DIA%26rft.auinit%3DIA%26rft.aulast%3DMalcolm%26rft.date%3D2003%26rft_id%3Dinfo%3Adoi%2F10.1002%252Fhyp.1156%26rft.epage%3D617%26rft.genre%3Darticle%26rft.issn%3D0885-6087%26rft.issue%3D3%26rft.jtitle%3DHYDROLOGICAL%2BPROCESSES%26rft_val_fmt%3Dinfo%3Aofi%2Ffmt%3Akev%3Amtx%3Ajournal%26rft.pages%3D601-617%26rfr_id%3Dinfo%3Asid%2Fwebofscience.com%3AWOS%3AWOS%26rft.spage%3D601%26rft.stitle%3DHYDROL%2BPROCESS%26rft.volume%3D17%26rft.au%3DMalcolm%252C%2BIA%26rft.au%3DSoulsby%252C%2BC%26rft.au%3DPetry%252C%2BJ&DestApp=OTHER_OpenURL&SrcAppSID=EUW1ED0B4D3jWybG240azZugnCgwX&SrcJTitle=HYDROLOGICAL+PROCESSES&SrcPubType=MD_FORMAT
38,"Boano, F",General Assembly of the European-Geosciences-Union,Quantifying the impact of groundwater discharge on the surface-subsurface exchange,HYDROLOGICAL PROCESSES,,https://www.webofscience.com/wos/woscc/full-record/WOS:000268382600002,https://www.webofscience.com/api/gateway?GWVersion=2&SrcAuth=OpenURL&SrcApp=WOS&DestURL=https%3A%2F%2Fwww.redi-bw.de%2Flinks%2Funist%3Furl_ver%3DZ39.88-2004%26url_ctx_fmt%3Dinfo%3Aofi%2Ffmt%3Akev%3Amtx%3Actx%26rft.atitle%3DQuantifying%2Bthe%2Bimpact%2Bof%2Bgroundwater%2Bdischarge%2Bon%2Bthe%2Bsurface-subsurface%2Bexchange%26rft.aufirst%3DFulvio%26rft.auinit%3DF%26rft.aulast%3DBoano%26rft.date%3D2009%26rft_id%3Dinfo%3Adoi%2F10.1002%252Fhyp.7278%26rft.epage%3D2116%26rft.genre%3Darticle%26rft.issn%3D1099-1085%26rft.issue%3D15%26rft.jtitle%3DHYDROLOGICAL%2BPROCESSES%26rft_val_fmt%3Dinfo%3Aofi%2Ffmt%3Akev%3Amtx%3Ajournal%26rft.pages%3D2108-2116%26rfr_id%3Dinfo%3Asid%2Fwebofscience.com%3AWOS%3AWOS%26rft.spage%3D2108%26rft.stitle%3DHYDROL%2BPROCESS%26rft.volume%3D23%26rft.au%3DBoano%252C%2BF%26rft.au%3DRevelli%252C%2BR%26rft.au%3DRidolfi%252C%2BL&DestApp=OTHER_OpenURL&SrcAppSID=EUW1ED0B4D3jWybG240azZugnCgwX&SrcJTitle=HYDROLOGICAL+PROCESSES&SrcPubType=MD_FORMAT
39,"Iepure, S",Dec 2014 ,"Geochemical, geological and hydrological influence on ostracod assemblages distribution in the hyporheic zone of two Mediterranean rivers in central Spain",INTERNATIONAL REVIEW OF HYDROBIOLOGY,"On the catchment spatial scale, rivers can be considered a patchy discontinuity from headwaters to mouth with significant implications on the structure and functioning of the hyporheic zone (HZ) biota. The present study aims to determine the spatial variation of ostracod assemblages from a fluvial HZ of two groundwater-fed rivers of the Jarama basin (Central Spain). We hypothesised that ostracod abundance and composition are subject to changes in water condition, substratum type geology and surface water/groundwater exchanges along the hyporheic flow path. Individual measures of 29 physico-chemical parameters, water discharge, sediment size and sediment organic matter (as loss of ignition) were measured at a depth of 20-40cm at 20 hyporheic sites of the Henares and Tajuna Rivers. The results show that factors like elevation, carbonate water type, high permeable riverbed substratum and groundwater upwelling at headwaters contribute to shape a diverse, mixed assemblage formed by stygophyle and stygoxene ostracods (14 species). Conversely, low-mineralised waters, siliceous riverbeds with poor permeability, and relatively low surface/ground water exchanges in the middle and lower sectors, limit species diversity and ostracod abundance to exclusively stygoxene elements (nine species). Ostracod abundance correlates positively with fine sands (0.125-0.25mm) (Spearman, r=0.70), and negatively with temperature (r=-0.40), SO42- (r=-0.45) and Mg2+ (r=-0.40). Trace metal (Cu, Mn, Ni) accumulation in the intermediate and lower sectors of both rivers appears harmful for Ilyocypris brady (r=-0.46) and Pryonocypris zenkeri (r=-0.40), whereas As relates negatively to the abundance of Candona candida (r=-0.51), Pryonocypris zenkeri (r=-0.60) and Herpetocypris brevicaudata (r=-0.72). The results highlight the significance of recent ostracods as a proxy to assess the water conditions in a HZ and to provide forthcoming approaches to depict surface-subsurface hydrological exchanges.Show less",https://www.webofscience.com/wos/woscc/full-record/WOS:000345999500004,https://www.webofscience.com/api/gateway?GWVersion=2&SrcAuth=OpenURL&SrcApp=WOS&DestURL=https%3A%2F%2Fwww.redi-bw.de%2Flinks%2Funist%3Furl_ver%3DZ39.88-2004%26url_ctx_fmt%3Dinfo%3Aofi%2Ffmt%3Akev%3Amtx%3Actx%26rft.atitle%3DGeochemical%252C%2Bgeological%2Band%2Bhydrological%2Binfluence%2Bon%2Bostracod%2Bassemblages%2Bdistribution%2Bin%2Bthe%2Bhyporheic%2Bzone%2Bof%2Btwo%2BMediterranean%2Brivers%2Bin%2Bcentral%2BSpain%26rft.aufirst%3DSanda%26rft.auinit%3DS%26rft.aulast%3DIepure%26rft.date%3D2014%26rft_id%3Dinfo%3Adoi%2F10.1002%252Firoh.201301727%26rft.eissn%3D1522-2632%26rft.epage%3D449%26rft.genre%3Darticle%26rft.issn%3D1434-2944%26rft.issue%3D6%26rft.jtitle%3DINTERNATIONAL%2BREVIEW%2BOF%2BHYDROBIOLOGY%26rft_val_fmt%3Dinfo%3Aofi%2Ffmt%3Akev%3Amtx%3Ajournal%26rft.pages%3D435-449%26rfr_id%3Dinfo%3Asid%2Fwebofscience.com%3AWOS%3AWOS%26rft.spage%3D435%26rft.stitle%3DINT%2BREV%2BHYDROBIOL%26rft.volume%3D99%26rft.au%3DIepure%252C%2BS%26rft.au%3DMeffe%252C%2BR%26rft.au%3Dde%2BBustamante%252C%2BI&DestApp=OTHER_OpenURL&SrcAppSID=EUW1ED0B4D3jWybG240azZugnCgwX&SrcJTitle=INTERNATIONAL+REVIEW+OF+HYDROBIOLOGY&SrcPubType=MD_FORMAT
40,"Bianchin, M",Jul 10 2010 ,Quantifying hyporheic exchange in a tidal river using temperature time series,WATER RESOURCES RESEARCH,"An investigation into groundwater-surface water interaction (GSWI) beneath a large tidally influenced river was conducted to determine the effect of tides on the development of a hyporheic zone (HZ) and to quantify mixing of river water and groundwater. Temperature measurements, coupled with independent hydraulic head measurements, were used to detect groundwater flow within the riverbed. GWSI under tidal forcing produced a 1 m deep HZ. Time-averaged riverbed temperature profiles displayed a distinct compressed convex pattern: clear evidence of net groundwater discharge. However, the instantaneous time series data indicate that riverbed temperatures were affected by tidal forcing to a depth of 1 m. Heat transport modeling revealed that instantaneous velocities within the shallow sediments of the riverbed are rather high, creating a zone of vigorous exchange during either a flooding or ebbing tide. Furthermore, the magnitude of the tidal pressure gradient was found to be significantly greater than the pressure gradient expected across 0.8 m high dunes, evidence that bed-form-driven exchange under these conditions, and this scale of observation, did not contribute to the development of the HZ. Conditions for exchange induced by shear and current bed form are favorable during ebbing tidal conditions only; flow paths are therefore limited in depth. Exchange flow paths in an estuary setting are complex; they are limited in duration and space and dominated by tidal pumping.Show less",https://www.webofscience.com/wos/woscc/full-record/WOS:000279827100002,https://www.webofscience.com/api/gateway?GWVersion=2&SrcAuth=OpenURL&SrcApp=WOS&DestURL=https%3A%2F%2Fwww.redi-bw.de%2Flinks%2Funist%3Furl_ver%3DZ39.88-2004%26url_ctx_fmt%3Dinfo%3Aofi%2Ffmt%3Akev%3Amtx%3Actx%26rft.artnum%3DARTN%2BW07507%26rft.atitle%3DQuantifying%2Bhyporheic%2Bexchange%2Bin%2Ba%2Btidal%2Briver%2Busing%2Btemperature%2Btime%2Bseries%26rft.aufirst%3DM.%26rft.auinit%3DM%26rft.aulast%3DBianchin%26rft.date%3D2010%26rft_id%3Dinfo%3Adoi%2F10.1029%252F2009WR008365%26rft.eissn%3D1944-7973%26rft.genre%3Darticle%26rft.issn%3D0043-1397%26rft.jtitle%3DWATER%2BRESOURCES%2BRESEARCH%26rft_val_fmt%3Dinfo%3Aofi%2Ffmt%3Akev%3Amtx%3Ajournal%26rfr_id%3Dinfo%3Asid%2Fwebofscience.com%3AWOS%3AWOS%26rft.stitle%3DWATER%2BRESOUR%2BRES%26rft.volume%3D46%26rft.au%3DBianchin%252C%2BM%26rft.au%3DSmith%252C%2BL%26rft.au%3DBeckie%252C%2BR&DestApp=OTHER_OpenURL&SrcAppSID=EUW1ED0B4D3jWybG240azZugnCgwX&SrcJTitle=WATER+RESOURCES+RESEARCH&SrcPubType=MD_FORMAT
41,"Dole-Olivier, MJ",Oct 15 2022 ,Drivers of functional diversity in the hyporheic zone of a large river,SCIENCE OF THE TOTAL ENVIRONMENT,"The effects of regional (hydrogeology and geomorphology) and local (sediment and hydrology) characteristics on hyporheic assemblages were studied along a 40-km reach of a large gravel-bed river. Hyporheic water and fauna were sampled at the upstream and downstream positions of 15 large gravel bars. The resulting 30 stations varied in their sediment grain size, stability and direction of river-aquifer exchanges. The study concludes that at the 40-km (sector) scale, the longitudinal distribution of hyporheic fauna was controlled by 1) the hydrogeology of the valley (i.e. gaining vs loosing sectors) that modifies abundance and taxonomic richness of stygobites 2) current channel morphometry of the river (i.e. shape and location of meanders), and 3) historical changes (i.e. river incision) which modify abundance and richness of assemblages. At the local scale, we found that surface grain size and stability of the sediment evaluated by visual observation were poor predictors of hyporheos composition. In contrast, the local hydrology (i.e. downwellings, upwellings, low vertical exchanges) explained a large part of the abundance, taxonomic richness and composition of the hyporheic assemblages. Stations with low vertical exchanges were found poorly colonized, while the upwelling zones were rich in stygobites and downwelling areas harbor abundant and species-rich temporary hyporheos. It was also observed that functional diversity was controlled by the same parameters, with high relative abundances of stygobites in upwelling zones and POM feeders in downwelling zones. The heterogeneity of hydrological patterns, with alternation of upwellings and downwellings may represent the optimal spatial structure for hyporheic biodiversity conservation and resilience in rivers.Show less",https://www.webofscience.com/wos/woscc/full-record/WOS:000886029600016,https://www.webofscience.com/api/gateway?GWVersion=2&SrcAuth=OpenURL&SrcApp=WOS&DestURL=https%3A%2F%2Fwww.redi-bw.de%2Flinks%2Funist%3Furl_ver%3DZ39.88-2004%26url_ctx_fmt%3Dinfo%3Aofi%2Ffmt%3Akev%3Amtx%3Actx%26rft.artnum%3DARTN%2B156985%26rft.atitle%3DDrivers%2Bof%2Bfunctional%2Bdiversity%2Bin%2Bthe%2Bhyporheic%2Bzone%2Bof%2Ba%2Blarge%2Briver%26rft.aufirst%3DMarie-Jose%26rft.auinit%3DMJ%26rft.aulast%3DDole-Olivier%26rft.date%3D2022%26rft_id%3Dinfo%3Adoi%2F10.1016%252Fj.scitotenv.2022.156985%26rft.eissn%3D1879-1026%26rft.genre%3Darticle%26rft.issn%3D0048-9697%26rft.jtitle%3DSCIENCE%2BOF%2BTHE%2BTOTAL%2BENVIRONMENT%26rft_val_fmt%3Dinfo%3Aofi%2Ffmt%3Akev%3Amtx%3Ajournal%26rfr_id%3Dinfo%3Asid%2Fwebofscience.com%3AWOS%3AWOS%26rft.stitle%3DSCI%2BTOTAL%2BENVIRON%26rft.volume%3D843%26rft.au%3DDole-Olivier%252C%2BMJ%26rft.au%3DDes%2BChatelliers%252C%2BMC%26rft.au%3DMarmonier%252C%2BP&DestApp=OTHER_OpenURL&SrcAppSID=EUW1ED0B4D3jWybG240azZugnCgwX&SrcJTitle=SCIENCE+OF+THE+TOTAL+ENVIRONMENT&SrcPubType=MD_FORMAT
42,"Munz, M",Nov 15 2011 ,Reducing monitoring gaps at the aquifer-river interface by modelling groundwater-surface water exchange flow patterns,HYDROLOGICAL PROCESSES,"This study investigates spatial patterns and temporal dynamics of aquifer-river exchange flow at a reach of the River Leith, UK. Observations of sub-channel vertical hydraulic gradients at the field site indicate the dominance of groundwater up-welling into the river and the absence of groundwater recharge from surface water. However, observed hydraulic heads do not provide information on potential surface water infiltration into the top 0-15 cm of the streambed as these depths are not covered by the existing experimental infrastructure. In order to evaluate whether surface water infiltration is likely to occur outside the 'window of detection', i.e. the shallow streambed, a numerical groundwater model is used to simulate hydrological exchanges between the aquifer and the river. Transient simulations of the successfully validated model (Nash and Sutcliff efficiency of 0.91) suggest that surface water infiltration is marginal and that the possibility of significant volumes of surface water infiltrating into non-monitored shallow streambed sediments can be excluded for the simulation period. Furthermore, the simulation results show that with increasing head differences between river and aquifer towards the end of the simulation period, the impact of streambed topography and hydraulic conductivity on spatial patterns of exchange flow rates decreases. A set of peak flow scenarios with altered groundwater-surface water head gradients is simulated in order to quantify the potential for surface water infiltration during characteristic winter flow conditions following the observation period. The results indicate that, particularly at the beginning of peak flow conditions, head gradients are likely to cause substantial increase in surface water infiltration into the streambed. The study highlights the potential for the improvement of process understanding of hyporheic exchange flow patterns at the stream reach scale by simulating aquifer-river exchange fluxes with a standard numerical groundwater model and a simple but robust model structure and parameterization. Copyright (C) 2011 John Wiley & Sons, Ltd.Show less",https://www.webofscience.com/wos/woscc/full-record/WOS:000296278100002,https://www.webofscience.com/api/gateway?GWVersion=2&SrcAuth=OpenURL&SrcApp=WOS&DestURL=https%3A%2F%2Fwww.redi-bw.de%2Flinks%2Funist%3Furl_ver%3DZ39.88-2004%26url_ctx_fmt%3Dinfo%3Aofi%2Ffmt%3Akev%3Amtx%3Actx%26rft.atitle%3DReducing%2Bmonitoring%2Bgaps%2Bat%2Bthe%2Baquifer-river%2Binterface%2Bby%2Bmodelling%2Bgroundwater-surface%2Bwater%2Bexchange%2Bflow%2Bpatterns%26rft.aufirst%3DMatthias%26rft.auinit%3DM%26rft.aulast%3DMunz%26rft.date%3D2011%26rft_id%3Dinfo%3Adoi%2F10.1002%252Fhyp.8080%26rft.eissn%3D1099-1085%26rft.epage%3D3562%26rft.genre%3Darticle%26rft.issn%3D0885-6087%26rft.issue%3D23%26rft.jtitle%3DHYDROLOGICAL%2BPROCESSES%26rft_val_fmt%3Dinfo%3Aofi%2Ffmt%3Akev%3Amtx%3Ajournal%26rft.pages%3D3547-3562%26rfr_id%3Dinfo%3Asid%2Fwebofscience.com%3AWOS%3AWOS%26rft.spage%3D3547%26rft.stitle%3DHYDROL%2BPROCESS%26rft.volume%3D25%26rft.au%3DMunz%252C%2BM%26rft.au%3DKrause%252C%2BS%26rft.au%3DBinley%252C%2BA&DestApp=OTHER_OpenURL&SrcAppSID=EUW1ED0B4D3jWybG240azZugnCgwX&SrcJTitle=HYDROLOGICAL+PROCESSES&SrcPubType=MD_FORMAT
