,Unnamed: 0,First author,Year,Title,Journal,Abstract,wos_link,fulltext_link,doi,Keywords,Plus keywords,Research areas,Corresponding address
0,0,"Larsen, IJ",Jul 2012 ,Landslide erosion coupled to tectonics and river incision,NATURE GEOSCIENCE,"The steep topography of mountain landscapes arises from interactions among tectonic rock uplift, valley incision and landslide erosion on hillslopes. Hillslopes in rapidly uplifting landscapes are thought to respond to river incision into bedrock by steepening to a maximum stable or 'threshold' angle(1-3). Landslide erosion rates are predicted to increase nonlinearly as hillslope angles approach the threshold angle(1-7). However, the key tenet of this emerging threshold hillslope model of landscape evolution-the coupled response of landslide erosion to tectonic and fluvial forcing-remains untested. Here we quantify landslide erosion rates in the eastern Himalaya, based on mapping more than 15,000 landslides on satellite images. We show that landslide erosion rates are significantly correlated with exhumation rates and stream power and that small increases in mean hillslope angles beyond 30 degrees translate into large and significant increases in landslide erosion. Extensive landsliding in response to a large outburst flood indicates that lateral river erosion is a key driver of landslide erosion on threshold hillslopes. Our results confirm the existence of threshold hillslopes and demonstrate that an increase in landslide erosion rates, rather than steepened hillslope angles, is the primary mechanism by which steep uplands respond to and balance rapid rates of rock uplift and bedrock river incision in tectonically active mountain belts.Show less",https://www.webofscience.com/wos/woscc/full-record/WOS:000307098400015,https://www.webofscience.com/api/gateway?GWVersion=2&SrcAuth=OpenURL&SrcApp=WOS&DestURL=https%3A%2F%2Fwww.redi-bw.de%2Flinks%2Funist%3Furl_ver%3DZ39.88-2004%26url_ctx_fmt%3Dinfo%3Aofi%2Ffmt%3Akev%3Amtx%3Actx%26rft.atitle%3DLandslide%2Berosion%2Bcoupled%2Bto%2Btectonics%2Band%2Briver%2Bincision%26rft.aufirst%3DIsaac%2BJ.%26rft.auinit%3DIJ%26rft.aulast%3DLarsen%26rft.date%3D2012%26rft_id%3Dinfo%3Adoi%2F10.1038%252Fngeo1479%26rft.epage%3D473%26rft.genre%3Darticle%26rft.issn%3D1752-0894%26rft.issue%3D7%26rft.jtitle%3DNATURE%2BGEOSCIENCE%26rft_val_fmt%3Dinfo%3Aofi%2Ffmt%3Akev%3Amtx%3Ajournal%26rft.pages%3D468-473%26rfr_id%3Dinfo%3Asid%2Fwebofscience.com%3AWOS%3AWOS%26rft.spage%3D468%26rft.stitle%3DNAT%2BGEOSCI%26rft.volume%3D5%26rft.au%3DLarsen%252C%2BIJ%26rft.au%3DMontgomery%252C%2BDR&DestApp=OTHER_OpenURL&SrcAppSID=EUW1ED0A842rfIDuzr9JRdDbngbvZ&SrcJTitle=NATURE+GEOSCIENCE&SrcPubType=MD_FORMAT,10.1038/ngeo1479,,"ACTIVE MOUNTAIN-RANGES,BARWA-GYALA-PERI,THRESHOLD HILLSLOPES,TSANGPO GORGE,SEDIMENT FLUX,ROCK UPLIFT,EVOLUTION,HIMALAYA,TIBET,RATES",,"Univ Washington, Dept Earth & Space Sci, Seattle, WA 98195 USA"
1,1,"Oviedo-Vargas, D",Dec 2015 ,The effect of regional groundwater on carbon dioxide and methane emissions from a lowland rainforest stream in Costa Rica,JOURNAL OF GEOPHYSICAL RESEARCH-BIOGEOSCIENCES,"In the tropical rainforest at La Selva Biological Station in Costa Rica, regional bedrock groundwater high in dissolved carbon discharges into some streams and wetlands, with the potential for multiple cascading effects on ecosystem carbon pools and fluxes. We investigated carbon dioxide (CO2) and methane (CH4) degassing from two streams at La Selva: the Arboleda, where approximately one third of the streamflow is from regional groundwater, and the Taconazo, fed exclusively by local groundwater recharged within the catchment. The regional groundwater inflow to the Arboleda had no measurable effect on stream gas exchange velocity, dissolved CH4 concentration, or CH4 emissions but significantly increased stream CO2 concentration and degassing. CO2 evasion from the reach of the Arboleda receiving regional groundwater (lower Arboleda) averaged 5.5molCm(-2)d(-1), similar to 7.5 times higher than the average (0.7molCm(-2)d(-1)) from the stream reaches with no regional groundwater inflow (the Taconazo and upper Arboleda). Carbon emissions from both streams were dominated by CO2; CH4 accounted for only 0.06-1.70% of the total (average of both streams: 5x10(-3)molCm(-2)d(-1)). Annual stream degassing fluxes normalized by watershed area were 48 and 299gCm(-2) for the Taconazo and Arboleda, respectively. CO2 degassing from the Arboleda is a significant carbon flux, similar in magnitude to the average net ecosystem exchange estimated by eddy covariance. Examining the effects of catchment connections to underlying hydrogeological systems can help avoid overestimation of ecosystem respiration and advance our understanding of carbon source/sink status and overall terrestrial ecosystem carbon budgets.Show less",https://www.webofscience.com/wos/woscc/full-record/WOS:000368938500007,https://www.webofscience.com/api/gateway?GWVersion=2&SrcAuth=OpenURL&SrcApp=WOS&DestURL=https%3A%2F%2Fwww.redi-bw.de%2Flinks%2Funist%3Furl_ver%3DZ39.88-2004%26url_ctx_fmt%3Dinfo%3Aofi%2Ffmt%3Akev%3Amtx%3Actx%26rft.atitle%3DThe%2Beffect%2Bof%2Bregional%2Bgroundwater%2Bon%2Bcarbon%2Bdioxide%2Band%2Bmethane%2Bemissions%2Bfrom%2Ba%2Blowland%2Brainforest%2Bstream%2Bin%2BCosta%2BRica%26rft.aufirst%3DDiana%26rft.auinit%3DD%26rft.aulast%3DOviedo-Vargas%26rft.date%3D2015%26rft_id%3Dinfo%3Adoi%2F10.1002%252F2015JG003009%26rft.eissn%3D2169-8961%26rft.epage%3D2595%26rft.genre%3Darticle%26rft.issn%3D2169-8953%26rft.issue%3D12%26rft.jtitle%3DJOURNAL%2BOF%2BGEOPHYSICAL%2BRESEARCH-BIOGEOSCIENCES%26rft_val_fmt%3Dinfo%3Aofi%2Ffmt%3Akev%3Amtx%3Ajournal%26rft.pages%3D2579-2595%26rfr_id%3Dinfo%3Asid%2Fwebofscience.com%3AWOS%3AWOS%26rft.spage%3D2579%26rft.stitle%3DJ%2BGEOPHYS%2BRES-BIOGEO%26rft.volume%3D120%26rft.au%3DOviedo-Vargas%252C%2BD%26rft.au%3DGenereux%252C%2BDP%26rft.au%3DOberbauer%252C%2BSF&DestApp=OTHER_OpenURL&SrcAppSID=EUW1ED0A842rfIDuzr9JRdDbngbvZ&SrcJTitle=JOURNAL+OF+GEOPHYSICAL+RESEARCH-BIOGEOSCIENCES&SrcPubType=MD_FORMAT,10.1002/2015JG003009,"carbon,greenhouse gas,streams,gas exchange,regional groundwater","DIFFUSION-COEFFICIENTS,NITROUS-OXIDE,INORGANIC CARBON,AMAZONIAN RIVERS,NITRIC-OXIDE,LA-SELVA,WATER,CO2,FLOW,FLUXES",,"N Carolina State Univ, Marine Earth & Atmospher Sci, Raleigh, NC 27695 USA"
2,2,"Lin, Y",Oct 1 2011 ,Modelling transport and transformation of mercury fractions in heavily contaminated mountain streams by coupling a GIS-based hydrological model with a mercury chemistry model,SCIENCE OF THE TOTAL ENVIRONMENT,"Many heavily polluted areas are located in remote regions that lack routine hydrologic monitoring. A modelling method that can produce scenarios of water chemistry trends for regions that lack hydrological data is therefore needed. The Wanshan mining area, in Guizhou province in south-western China, is such a region, as it is heavily polluted with mercury (Hg). In order to model Hg transport in a stream draining the Wanshan mining area, a Geographic Information System (GIS) hydrologic model (HEC-HMS) was coupled with a simulation model for Hg fractions in water (WASP Hg). Hydrological variations in the stream flow can thereby be simulated based on readily available precipitation data. The WASP 7 MERC Hg model was used for simulating variations in total Hg, dissolved Hg and methyl-Hg concentrations.The results of HEC-HMS modelling of flow show clear seasonal variation. Winter (Oct-Dec) constitutes the dry season with low flow, while the summer season (Jun-Aug) is rainy with high flow. 48% of total annual precipitation happens in the three summer months. The stream flows at the high flow events were several times higher than normal flow. The modelled total suspended solids and Hg concentrations were tested against monitoring data from two sampling campaigns conducted in September 2007 and August 2008. The model produced reasonable simulations for TSS, THg, DHg and MeHg, with relative errors generally around 10% for the modelled parameters. High flow events are the main contributors for release of both suspended particles and Hg. The three high flow events account for about 50% of annual discharge of THg. The annual total discharge of Hg was 8.8 kg Hg high up in the stream and 2.6 kg where the stream meets a large river 20 km downstream of the pollution source. Hence, about 70% of Hg is retained in the stream through sedimentation. (C) 2011 Elsevier B.V. All rights reserved.Show less",https://www.webofscience.com/wos/woscc/full-record/WOS:000295765200013,https://www.webofscience.com/api/gateway?GWVersion=2&SrcAuth=OpenURL&SrcApp=WOS&DestURL=https%3A%2F%2Fwww.redi-bw.de%2Flinks%2Funist%3Furl_ver%3DZ39.88-2004%26url_ctx_fmt%3Dinfo%3Aofi%2Ffmt%3Akev%3Amtx%3Actx%26rft.atitle%3DModelling%2Btransport%2Band%2Btransformation%2Bof%2Bmercury%2Bfractions%2Bin%2Bheavily%2Bcontaminated%2Bmountain%2Bstreams%2Bby%2Bcoupling%2Ba%2BGIS-based%2Bhydrological%2Bmodel%2Bwith%2Ba%2Bmercury%2Bchemistry%2Bmodel%26rft.aufirst%3DYan%26rft.auinit%3DY%26rft.aulast%3DLin%26rft.date%3D2011%26rft_id%3Dinfo%3Adoi%2F10.1016%252Fj.scitotenv.2011.07.033%26rft.epage%3D4605%26rft.genre%3Darticle%26rft.issn%3D0048-9697%26rft.issue%3D21%26rft.jtitle%3DSCIENCE%2BOF%2BTHE%2BTOTAL%2BENVIRONMENT%26rft_val_fmt%3Dinfo%3Aofi%2Ffmt%3Akev%3Amtx%3Ajournal%26rft.pages%3D4596-4605%26rfr_id%3Dinfo%3Asid%2Fwebofscience.com%3AWOS%3AWOS%26rft.spage%3D4596%26rft.stitle%3DSCI%2BTOTAL%2BENVIRON%26rft.volume%3D409%26rft.au%3DLin%252C%2BY%26rft.au%3DLarssen%252C%2BT%26rft.au%3DZhang%252C%2BH&DestApp=OTHER_OpenURL&SrcAppSID=EUW1ED0A842rfIDuzr9JRdDbngbvZ&SrcJTitle=SCIENCE+OF+THE+TOTAL+ENVIRONMENT&SrcPubType=MD_FORMAT,10.1016/j.scitotenv.2011.07.033,"Hg,Modelling,GIS,HEC-HMS,WASP,Particle transport,Fluvial stream","ABANDONED HG MINES,AQUATIC ENVIRONMENT,SOUTHWESTERN CHINA,GUIZHOU PROVINCE,CARSON RIVER,HEC-HMS,METHYLMERCURY,SEDIMENTS,WATER,FATE",,"Univ Oslo, Dept Chem, POB 1033, N-0315 Oslo, Norway"
3,3,"Koch, JC",Jan 8 2010 ,"Effect of unsteady flow on nitrate loss in an oligotrophic, glacial meltwater stream",JOURNAL OF GEOPHYSICAL RESEARCH-BIOGEOSCIENCES,"The McMurdo Dry Valleys of Antarctica are among the coldest, driest ecosystems on Earth. During the austral summer, glacial meltwater supports cyanobacterial mat communities in some streams, but they are not ubiquitous. We conducted a nitrate (NO3-) enrichment tracer injection in Huey Creek to quantify NO3- loss in a Dry Valley stream where algal mats would not obscure hyporheic microbial processes. Unsteady streamflow led to diel variability in the tracer concentration and in surface/subsurface water and solute exchange. Subsequently, concentrations of NO3-, nitrite (NO2-), ammonium (NH4+), and dissolved organic carbon (DOC) varied significantly during the injection, with a net loss of NO3-, NO2-, and DOC, and production of nitrous oxide. These mass changes within a reach were often coincident with high streamflows. Reactivity also coincided with the highest DOC concentrations, suggesting that DOC is the primary limitation to heterotrophic microbial activity in the stream. Together, streamflow and DOC availability create the hot spots and hot moments that dominate NO3- reactivity and removal in this polar desert ecosystem. The combination of spatially and temporally variable hyporheic dynamics and solute availability underscore the limitations of common nutrient uptake metrics and transient storage models when unsteady flow conditions exist.Show less",https://www.webofscience.com/wos/woscc/full-record/WOS:000273507800002,https://www.webofscience.com/api/gateway?GWVersion=2&SrcAuth=OpenURL&SrcApp=WOS&DestURL=https%3A%2F%2Fwww.redi-bw.de%2Flinks%2Funist%3Furl_ver%3DZ39.88-2004%26url_ctx_fmt%3Dinfo%3Aofi%2Ffmt%3Akev%3Amtx%3Actx%26rft.artnum%3DARTN%2BG01001%26rft.atitle%3DEffect%2Bof%2Bunsteady%2Bflow%2Bon%2Bnitrate%2Bloss%2Bin%2Ban%2Boligotrophic%252C%2Bglacial%2Bmeltwater%2Bstream%26rft.aufirst%3DJoshua%2BC.%26rft.auinit%3DJC%26rft.aulast%3DKoch%26rft.date%3D2010%26rft_id%3Dinfo%3Adoi%2F10.1029%252F2009JG001030%26rft.eissn%3D2169-8961%26rft.genre%3Darticle%26rft.issn%3D2169-8953%26rft.jtitle%3DJOURNAL%2BOF%2BGEOPHYSICAL%2BRESEARCH-BIOGEOSCIENCES%26rft_val_fmt%3Dinfo%3Aofi%2Ffmt%3Akev%3Amtx%3Ajournal%26rfr_id%3Dinfo%3Asid%2Fwebofscience.com%3AWOS%3AWOS%26rft.stitle%3DJ%2BGEOPHYS%2BRES-BIOGEO%26rft.volume%3D115%26rft.au%3DKoch%252C%2BJC%26rft.au%3DMcKnight%252C%2BDM%26rft.au%3DBaeseman%252C%2BJL&DestApp=OTHER_OpenURL&SrcAppSID=EUW1ED0A842rfIDuzr9JRdDbngbvZ&SrcJTitle=JOURNAL+OF+GEOPHYSICAL+RESEARCH-BIOGEOSCIENCES&SrcPubType=MD_FORMAT,10.1029/2009JG001030,,"MCMURDO DRY VALLEYS,HYPORHEIC EXCHANGE,TAYLOR VALLEY,TRANSIENT STORAGE,ANTARCTICA,ECOSYSTEM,BIOGEOCHEMISTRY,GEOCHEMISTRY,INTERFACE,CHEMISTRY",,"Univ Colorado, Inst Arctic & Alpine Res, Boulder, CO 80303 USA"
4,4,"Galia, T",,Spatiotemporal variations of large wood and river channel morphology in a rapidly degraded reach of an intermittent river,EARTH SURFACE PROCESSES AND LANDFORMS,"The links between rapid channel degradation and related large wood (LW) recruitment and storage are still not precisely understood, especially in aquatic systems with high human and natural pressures such as intermittent rivers in the peri-Mediterranean region. In this study, by using multidisciplinary research (analysis of satellite images time series, detailed field inventory, and simulated hydrological data), we focused on rapid upstream propagation of channel degradation (i.e., incision and consequent channel widening) in an intermittent Mediterranean river (Evrotas River, southern Greece) as a response to short-term intensive gravel extraction from the active channel and removal of riparian vegetation in the 2013-2016 period. Subsequently, our objective was to link this channel transformation with the spatiotemporal changes of LW storage in the active channel. We found that short-term and spatially limited human impact, coupled with high flows, allowed rapid upstream progression (similar to 2 km) of erosion processes (approximately twofold widening of the active channel) during the relatively short 2-year period (2017-2019). This morphological response accelerated LW recruitment through bank erosion and its subsequent storage in the active channel. Incision and channel widening processes were interrupted in the 2019-2021 period due to the prevalence of relatively low, geomorphologically non-effective flows. However, the storage of LW in the channel continued to increase as a result of the higher trapping efficiency of the widened channel, a delay between tree death and its final uprooting, or by LW recruitment processes not directly related to flood events. We suggest that freshly recruited LW has the potential to accelerate the establishment of a new channel equilibrium and increase channel heterogeneity through its interaction with flows and sediments.Show less",https://www.webofscience.com/wos/woscc/full-record/WOS:000908314400001,https://www.webofscience.com/api/gateway?GWVersion=2&SrcAuth=OpenURL&SrcApp=WOS&DestURL=https%3A%2F%2Fwww.redi-bw.de%2Flinks%2Funist%3Furl_ver%3DZ39.88-2004%26url_ctx_fmt%3Dinfo%3Aofi%2Ffmt%3Akev%3Amtx%3Actx%26rft.atitle%3DSpatiotemporal%2Bvariations%2Bof%2Blarge%2Bwood%2Band%2Briver%2Bchannel%2Bmorphology%2Bin%2Ba%2Brapidly%2Bdegraded%2Breach%2Bof%2Ban%2Bintermittent%2Briver%26rft.aufirst%3DTomas%26rft.auinit%3DT%26rft.aulast%3DGalia%26rft.date%3D2023%26rft_id%3Dinfo%3Adoi%2F10.1002%252Fesp.5531%26rft.eissn%3D1096-9837%26rft.genre%3Darticle%26rft.issn%3D0197-9337%26rft.jtitle%3DEARTH%2BSURFACE%2BPROCESSES%2BAND%2BLANDFORMS%26rft_val_fmt%3Dinfo%3Aofi%2Ffmt%3Akev%3Amtx%3Ajournal%26rfr_id%3Dinfo%3Asid%2Fwebofscience.com%3AWOS%3AWOS%26rft.stitle%3DEARTH%2BSURF%2BPROC%2BLAND%26rft.au%3DGalia%252C%2BT%26rft.au%3DSkarpich%252C%2BV%26rft.au%3DSpalovsky%252C%2BV&DestApp=OTHER_OpenURL&SrcAppSID=EUW1ED0A842rfIDuzr9JRdDbngbvZ&SrcJTitle=EARTH+SURFACE+PROCESSES+AND+LANDFORMS&SrcPubType=MD_FORMAT,10.1002/esp.5531,"channel degradation,incision,intermittent river,large wood,Mediterranean,non-perennial stream","MEDITERRANEAN RIVERS,EPHEMERAL STREAM,HUMAN IMPACTS,ALPINE RIVER,FLOOD,MODEL,TRANSPORT,DEBRIS,SWAT,IDENTIFICATION",,"Univ Ostrava, Dept Phys Geog & Geoecol, Ostrava 70103, Czech Republic"
5,5,"Kobayashi, S",Apr 15 2022 ,"Local flow convergence, bed scour, and aquatic habitat formation during floods around wooden training structures placed on sand-gravel bars",SCIENCE OF THE TOTAL ENVIRONMENT,"Riverine ponds, which are formed and sustained through sediment erosion and deposition, are key habitats for enhancing biodiversity in river reaches. The objective of this study was to understand the roles of traditional river-training wooden structures called ""seigyu"" on the formation of ponds on nonvegetated bars. Here, the spatial and temporal patterns of the flow and bedform coupled with pond formations for several flood events were assessed. The surface flow patterns were monitored by an unmanned aerial vehicle (UAV) and evaluated by large-scale particle image velocimetry (LSPIV); the maximum flow velocities were 1.3 m s-1 and 1.9 m s-1 during floods when seigyu units were partially and fully submerged, respectively. Although the overall mean flow velocity was greater for the latter events, the spatial variation in flow velocity and dissipation rate of turbulent kinetic energy (TKE) around seigyu was greater for the former events. Such flow patterns affected both bed formation and ecological habitats; ponds were formed at locations beside and behind seigyu, where the flow converged and bed scouring occurred during floods. The frequency and size of ponds around seigyu increased in the early half of the season, and they decreased in the other half when floods were greater in magnitude, which suggests that the bed scouring effect of seigyu was greater in flood stages with partial than fully submergence. Although the bar ponds lack shade to temper the effects of incident light and atmospheric conditions, the ponds displayed smaller daily oscillations in temperature than did the main river, probably due to hyporheic water supply to the ponds. Because many aquatic species cannot tolerate extremely high temperatures in summer, the generation and maintenance of deeper ponds by scouring with sufficient water exchange with the hyporheic zone can be key to enhancing colonization by various aquatic species.Show less",https://www.webofscience.com/wos/woscc/full-record/WOS:000766808600011,https://www.webofscience.com/api/gateway?GWVersion=2&SrcAuth=OpenURL&SrcApp=WOS&DestURL=https%3A%2F%2Fwww.redi-bw.de%2Flinks%2Funist%3Furl_ver%3DZ39.88-2004%26url_ctx_fmt%3Dinfo%3Aofi%2Ffmt%3Akev%3Amtx%3Actx%26rft.artnum%3DARTN%2B152992%26rft.atitle%3DLocal%2Bflow%2Bconvergence%252C%2Bbed%2Bscour%252C%2Band%2Baquatic%2Bhabitat%2Bformation%2Bduring%2Bfloods%2Baround%2Bwooden%2Btraining%2Bstructures%2Bplaced%2Bon%2Bsand-gravel%2Bbars%26rft.aufirst%3DSohei%26rft.auinit%3DS%26rft.aulast%3DKobayashi%26rft.date%3D2022%26rft_id%3Dinfo%3Adoi%2F10.1016%252Fj.scitotenv.2022.152992%26rft.eissn%3D1879-1026%26rft.genre%3Darticle%26rft.issn%3D0048-9697%26rft.jtitle%3DSCIENCE%2BOF%2BTHE%2BTOTAL%2BENVIRONMENT%26rft_val_fmt%3Dinfo%3Aofi%2Ffmt%3Akev%3Amtx%3Ajournal%26rfr_id%3Dinfo%3Asid%2Fwebofscience.com%3AWOS%3AWOS%26rft.stitle%3DSCI%2BTOTAL%2BENVIRON%26rft.volume%3D817%26rft.au%3DKobayashi%252C%2BS%26rft.au%3DKantoush%252C%2BSA%26rft.au%3DSumi%252C%2BT&DestApp=OTHER_OpenURL&SrcAppSID=EUW1ED0A842rfIDuzr9JRdDbngbvZ&SrcJTitle=SCIENCE+OF+THE+TOTAL+ENVIRONMENT&SrcPubType=MD_FORMAT,10.1016/j.scitotenv.2022.152992,"Gravel bars,River training structure,Scour holes,LSPIV,Submergence,Water temperature","HYPORHEIC EXCHANGE,FLOODPLAIN PONDS,LIFE-HISTORY,RIVER,STREAM,CONNECTIVITY,DIVERSITY,RESTORATION,SEDIMENT,DYNAMICS",,"Wenzhou Univ, Coll Life & Environm Sci, Wenzhou 325035, Zhejiang, Peoples R China"
6,6,"Chang, CM",Jan 7 2013 ,Stochastic analysis of stream-groundwater interaction subject to temporally correlated recharge,JOURNAL OF HYDROLOGY,"In this article, the coupled equations describing the transient groundwater flow and stream flow fluctuations are solved based on the Fourier-Stieltjes integral representation, where the lateral inflow term in the stream flow perturbation equation connects the process of groundwater flow to that of stream flow. The closed-form solutions describing the variability in groundwater flow specific discharge and stream flow discharge are developed to quantify the influence of the variability in temporally correlated recharge in an unconfined aquifer on the stream flow discharge. We found from the closed-form solutions that the temporal correlation scale and the variance of recharge fields influence the variability in groundwater flow specific discharge and the stream flow discharge positively. In addition, the hydraulic diffusivity coefficient takes the role of reducing the variability in stream flow discharge. (C) 2012 Elsevier B.V. All rights reserved.Show less",https://www.webofscience.com/wos/woscc/full-record/WOS:000313861800042,https://www.webofscience.com/api/gateway?GWVersion=2&SrcAuth=OpenURL&SrcApp=WOS&DestURL=https%3A%2F%2Fwww.redi-bw.de%2Flinks%2Funist%3Furl_ver%3DZ39.88-2004%26url_ctx_fmt%3Dinfo%3Aofi%2Ffmt%3Akev%3Amtx%3Actx%26rft.atitle%3DStochastic%2Banalysis%2Bof%2Bstream-groundwater%2Binteraction%2Bsubject%2Bto%2Btemporally%2Bcorrelated%2Brecharge%26rft.aufirst%3DChing-Min%26rft.auinit%3DCM%26rft.aulast%3DChang%26rft.date%3D2013%26rft_id%3Dinfo%3Adoi%2F10.1016%252Fj.jhydrol.2012.10.003%26rft.eissn%3D1879-2707%26rft.epage%3D495%26rft.genre%3Darticle%26rft.issn%3D0022-1694%26rft.jtitle%3DJOURNAL%2BOF%2BHYDROLOGY%26rft_val_fmt%3Dinfo%3Aofi%2Ffmt%3Akev%3Amtx%3Ajournal%26rft.pages%3D490-495%26rfr_id%3Dinfo%3Asid%2Fwebofscience.com%3AWOS%3AWOS%26rft.spage%3D490%26rft.stitle%3DJ%2BHYDROL%26rft.volume%3D476%26rft.au%3DChang%252C%2BCM%26rft.au%3DYeh%252C%2BHD&DestApp=OTHER_OpenURL&SrcAppSID=EUW1ED0A842rfIDuzr9JRdDbngbvZ&SrcJTitle=JOURNAL+OF+HYDROLOGY&SrcPubType=MD_FORMAT,10.1016/j.jhydrol.2012.10.003,"Stochastic analysis,Stream-aquifer system,Diffusion waves,Temporally correlated groundwater recharge,Variance of stream flow discharge","SPECTRAL-ANALYSIS,DIFFUSION WAVE,FLUCTUATIONS,UNIFORM",,"Natl Chiao Tung Univ, Inst Environm Engn, Hsinchu, Taiwan"
7,7,"Doi, H",2007 ,Stream macroinvertebrate community affected by point-source metal pollution,INTERNATIONAL REVIEW OF HYDROBIOLOGY,"The impacts of mining activities on aquatic biota have been documented in many stream ecosystems. In mining streams, point-source heavy metal pollution often appears in the stream. We hypothesize that this pollution is toxic to macroinvertebrates owing to high concentrations of metals and therefore affects macroinvertebrate community structure. We investigated macroinvertebrate community structure in mountain streams, including heavy metal-polluted sites and neutral-pH streams, to determine the relationship between community structure and environmental factors such as low pH and heavy metal concentrations. Based on multidimensional scaling ordination, the macroinvertebrate community at heavy metal pollution sites was remarkably different from that at the other sites. Inductively coupled plasma mass spectrometry revealed high concentrations of aluminum and iron in surface water at the polluted sites. Macroinvertebrate community structure at the metal pollution sites was significantly different from that at other sites in the same stream and in neutral-pH streams. Thus, point-source metal pollution may reduce the density and diversity of in situ macroinvertebrates.Show less",https://www.webofscience.com/wos/woscc/full-record/WOS:000247622800003,https://www.webofscience.com/api/gateway?GWVersion=2&SrcAuth=OpenURL&SrcApp=WOS&DestURL=https%3A%2F%2Fwww.redi-bw.de%2Flinks%2Funist%3Furl_ver%3DZ39.88-2004%26url_ctx_fmt%3Dinfo%3Aofi%2Ffmt%3Akev%3Amtx%3Actx%26rft.atitle%3DStream%2Bmacroinvertebrate%2Bcommunity%2Baffected%2Bby%2Bpoint-source%2Bmetal%2Bpollution%26rft.aufirst%3DHideyuki%26rft.auinit%3DH%26rft.aulast%3DDoi%26rft.date%3D2007%26rft_id%3Dinfo%3Adoi%2F10.1002%252Firoh.200610923%26rft.epage%3D266%26rft.genre%3Darticle%26rft.issn%3D1434-2944%26rft.issue%3D3%26rft.jtitle%3DINTERNATIONAL%2BREVIEW%2BOF%2BHYDROBIOLOGY%26rft_val_fmt%3Dinfo%3Aofi%2Ffmt%3Akev%3Amtx%3Ajournal%26rft.pages%3D258-266%26rfr_id%3Dinfo%3Asid%2Fwebofscience.com%3AWOS%3AWOS%26rft.spage%3D258%26rft.stitle%3DINT%2BREV%2BHYDROBIOL%26rft.volume%3D92%26rft.au%3DDoi%252C%2BH%26rft.au%3DTakagi%252C%2BA%26rft.au%3DKikuchi%252C%2BE&DestApp=OTHER_OpenURL&SrcAppSID=EUW1ED0A842rfIDuzr9JRdDbngbvZ&SrcJTitle=INTERNATIONAL+REVIEW+OF+HYDROBIOLOGY&SrcPubType=MD_FORMAT,10.1002/iroh.200610923,"acidic stream,community structure,Ephemeroptera,metal pollution,mountain stream,Plecoptera","HEAVY-METALS,MOUNTAIN STREAMS,RESPONSES,EXPOSURE",,"Tohoku Univ, Grad Sch Life Sci, Aoba Ku, 2-1-1,Katahira, Sendai, Miyagi 980, Japan"
