,Unnamed: 0,First author,Year,Title,Journal,Abstract,wos_link,fulltext_link,doi,Keywords,Plus keywords,Research areas,Corresponding address
23,23,"Rucker, DF",May 2021 ,"Bedrock architecture, soil texture, and hyporheic zone characterization combining electrical resistivity and induced polarization imaging",JOURNAL OF APPLIED GEOPHYSICS,"The shallow (<15 m depth) subsurface environment of a short reach along a bedrock stream was investigated with electrical resistivity and induced polarization (IP) to map details of bedrock and soil sediments. The bedrock is mostly comprised of limestone, and is generally resistive compared to the overlying soil. The soil-bedrock interface was determined through a trial and error approach using a sharp boundary feature in the inversion model. The inferred bedrock surface determined from the inversions exhibited undulating patterns with troughs and ridges. A near continuous trough ran alongside the stream within the floodplain, and is suggestive of a paleochannel among other interpretations of this feature. The structure of the electrical resistivity above the bedrock showed small-scale elongated features. The chargeability from the IP method showed larger scale features. High values of chargeability were associated with the sediments in the floodplain, and low values were associated with bedrock, stream, and soil on the elevated banks above the stream. If the chargeability is associated with membrane polarization characteristic of clayey soils, then IP seems to highlight the mere existence of clay, while the resistivity may be more discernable of the relative proportion of clay. Vegetation differences may also explain the chargeability distribution, where parts of the survey with high chargeability had dense pine with no understory making the soils more organically rich. (C) 2021 Elsevier B.V. All rights reserved.Show less",https://www.webofscience.com/wos/woscc/full-record/WOS:000640179900001,https://www.webofscience.com/api/gateway?GWVersion=2&SrcAuth=OpenURL&SrcApp=WOS&DestURL=https%3A%2F%2Fwww.redi-bw.de%2Flinks%2Funist%3Furl_ver%3DZ39.88-2004%26url_ctx_fmt%3Dinfo%3Aofi%2Ffmt%3Akev%3Amtx%3Actx%26rft.artnum%3DARTN%2B104306%26rft.atitle%3DBedrock%2Barchitecture%252C%2Bsoil%2Btexture%252C%2Band%2Bhyporheic%2Bzone%2Bcharacterization%2Bcombining%2Belectrical%2Bresistivity%2Band%2Binduced%2Bpolarization%2Bimaging%26rft.aufirst%3DDale%2BF.%26rft.auinit%3DDF%26rft.aulast%3DRucker%26rft.date%3D2021%26rft_id%3Dinfo%3Adoi%2F10.1016%252Fj.jappgeo.2021.104306%26rft.eissn%3D1879-1859%26rft.genre%3Darticle%26rft.issn%3D0926-9851%26rft.jtitle%3DJOURNAL%2BOF%2BAPPLIED%2BGEOPHYSICS%26rft_val_fmt%3Dinfo%3Aofi%2Ffmt%3Akev%3Amtx%3Ajournal%26rfr_id%3Dinfo%3Asid%2Fwebofscience.com%3AWOS%3AWOS%26rft.stitle%3DJ%2BAPPL%2BGEOPHYS%26rft.volume%3D188%26rft.au%3DRucker%252C%2BDF%26rft.au%3DTsai%252C%2BCH%26rft.au%3DDerolph%252C%2BC&DestApp=OTHER_OpenURL&SrcAppSID=EUW1ED0A842rfIDuzr9JRdDbngbvZ&SrcJTitle=JOURNAL+OF+APPLIED+GEOPHYSICS&SrcPubType=MD_FORMAT,10.1016/j.jappgeo.2021.104306,"Bedrock mapping,Soil texture,Chargeability,Resistivity,Hyporheic zone","SOLUTE TRANSPORT,OAK-RIDGE,TEMPERATURE,EXCHANGE,MERCURY,CONDUCTIVITY,QUANTIFICATION,PERMEABILITY,PARAMETERS,CREEK",,"hydroGEOPHYSICS Inc, Tucson, AZ 85713 USA"
24,24,"Morel-Seytoux, HJ",Feb 2016 ,Impact of aquifer desaturation on steady-state river seepage,ADVANCES IN WATER RESOURCES,"Flow exchange between surface and ground water is of great importance be it for beneficial allocation and use of the water resources or for the proper exercise of water rights. That exchange can take place under a saturated or unsaturated flow regime. Which regimes occur depend on conditions in the vicinity of the interactive area. Withdrawals partially sustained by seepage may not bring about desaturation but greater amounts eventually will. The problem considered in this paper deals only with the steady-state case. It is meant as a first step toward a simple, yet accurate and physically based treatment of the transient situation. The primary purpose of the article is to provide simple criteria for determination of the initiation of desaturation in an aquifer originally in saturated hydraulic connection with a river or a recharge area. The extent of the unsaturated zone in the aquifer will increase with increasing withdrawals while at the same time the seepage rate from the river increases. However the seepage increase will stop once infiltration takes place strictly by gravity in the aquifer and is no longer opposed by the capillary rise from the water table below the riverbed. Following desaturation simple criteria are derived and simple analytical formulae provided to estimate the river seepage based on the position of the water table mound below the clogging layer and at some distance away from the river bank. They fully account for the unsaturated flow phenomena, including the existence of a drainage entry pressure. Two secondary objectives were to verify that (1) the assumption of uniform vertical flow through a clogging layer and that (2) the approximation of the water table mound below the seepage area as a flat surface were both reasonably legitimate. This approach will be especially advantageous for the implementation of the methodology in large-scale applications of integrated hydrologic models used for management. (C) 2015 Elsevier Ltd. All rights reserved.Show less",https://www.webofscience.com/wos/woscc/full-record/WOS:000371311800005,https://www.webofscience.com/api/gateway?GWVersion=2&SrcAuth=OpenURL&SrcApp=WOS&DestURL=https%3A%2F%2Fwww.redi-bw.de%2Flinks%2Funist%3Furl_ver%3DZ39.88-2004%26url_ctx_fmt%3Dinfo%3Aofi%2Ffmt%3Akev%3Amtx%3Actx%26rft.atitle%3DImpact%2Bof%2Baquifer%2Bdesaturation%2Bon%2Bsteady-state%2Briver%2Bseepage%26rft.aufirst%3DHubert%2BJ.%26rft.auinit%3DHJ%26rft.aulast%3DMorel-Seytoux%26rft.date%3D2016%26rft_id%3Dinfo%3Adoi%2F10.1016%252Fj.advwatres.2015.09.012%26rft.eissn%3D1872-9657%26rft.epage%3D31%26rft.genre%3Darticle%26rft.issn%3D0309-1708%26rft.jtitle%3DADVANCES%2BIN%2BWATER%2BRESOURCES%26rft_val_fmt%3Dinfo%3Aofi%2Ffmt%3Akev%3Amtx%3Ajournal%26rft.pages%3D21-31%26rfr_id%3Dinfo%3Asid%2Fwebofscience.com%3AWOS%3AWOS%26rft.spage%3D21%26rft.stitle%3DADV%2BWATER%2BRESOUR%26rft.volume%3D88%26rft.au%3DMorel-Seytoux%252C%2BHJ%26rft.au%3DMiracapillo%252C%2BC%26rft.au%3DMehl%252C%2BS&DestApp=OTHER_OpenURL&SrcAppSID=EUW1ED0A842rfIDuzr9JRdDbngbvZ&SrcJTitle=ADVANCES+IN+WATER+RESOURCES&SrcPubType=MD_FORMAT,10.1016/j.advwatres.2015.09.012,"Stream-aquifer interaction,Saturated exchange,Incipient desaturation,Unsaturated seepage","STREAM-DEPLETION,EQUATION,DERIVATION,RECHARGE,MODELS",,"Hydroprose Int Consulting, 328 Beech Ave, Santa Rosa, CA 95409 USA"
25,25,"Tippler, C",2014 ,The influence of concrete on the geochemical qualities of urban streams,MARINE AND FRESHWATER RESEARCH,"The geochemical signature of freshwater streams can be used to determine the extent and nature of modification to stream water geochemistry due to urban development. This approach used the Gibbs (1970) diagram as a model for evaluation of changes to ionic composition linked to urban development. In this multi-year study, the geochemistry of 21 waterways in the Georges River catchment, Sydney, were monitored and compared with the level of urban development as measured by sub-catchment imperviousness and directly connected imperviousness. The results reflect a strong relationship between the intensity of sub-catchment urban development and stream geochemistry. All major geochemical attributes increased with escalating levels of urban development. The largest increase was for bicarbonate, which increased 18 times from a mean of 6.4 mg L-1 at non-urban streams to a mean of 118 mg L-1 at urban streams. Similarly, mean concentrations of calcium increased by 14 times (from 2 to 27.9 mg L-1). Mean salinity was enriched in the most urban streams, compared with non-urban streams, by more than 6 times. We attribute this, in part, to the influence of urban geology, notably concrete stormwater infrastructure. Changes in stream geochemistry due to urban development are an important element of the urban stream syndrome.Show less",https://www.webofscience.com/wos/woscc/full-record/WOS:000344381700007,https://www.webofscience.com/api/gateway?GWVersion=2&SrcAuth=OpenURL&SrcApp=WOS&DestURL=https%3A%2F%2Fwww.redi-bw.de%2Flinks%2Funist%3Furl_ver%3DZ39.88-2004%26url_ctx_fmt%3Dinfo%3Aofi%2Ffmt%3Akev%3Amtx%3Actx%26rft.atitle%3DThe%2Binfluence%2Bof%2Bconcrete%2Bon%2Bthe%2Bgeochemical%2Bqualities%2Bof%2Burban%2Bstreams%26rft.aufirst%3DCarl%26rft.auinit%3DC%26rft.aulast%3DTippler%26rft.date%3D2014%26rft_id%3Dinfo%3Adoi%2F10.1071%252FMF13164%26rft.eissn%3D1448-6059%26rft.epage%3D1017%26rft.genre%3Darticle%26rft.issn%3D1323-1650%26rft.issue%3D11%26rft.jtitle%3DMARINE%2BAND%2BFRESHWATER%2BRESEARCH%26rft_val_fmt%3Dinfo%3Aofi%2Ffmt%3Akev%3Amtx%3Ajournal%26rft.pages%3D1009-1017%26rfr_id%3Dinfo%3Asid%2Fwebofscience.com%3AWOS%3AWOS%26rft.spage%3D1009%26rft.stitle%3DMAR%2BFRESHWATER%2BRES%26rft.volume%3D65%26rft.au%3DTippler%252C%2BC%26rft.au%3DWright%252C%2BIA%26rft.au%3DHanlon%252C%2BA&DestApp=OTHER_OpenURL&SrcAppSID=EUW1ED0A842rfIDuzr9JRdDbngbvZ&SrcJTitle=MARINE+AND+FRESHWATER+RESEARCH&SrcPubType=MD_FORMAT,10.1071/MF13164,"geochemistry,Gibbs diagram,impervious surface,ionic pollution,urbanisation,urban stream syndrome","RAINWATER COMPOSITION,IMPERVIOUS SURFACE,WATER,RIVER,URBANIZATION,AUSTRALIA,TOXICITY,CONDUCTIVITY,IMPACT",,"Univ Western Sydney, Sch Sci & Hlth, Locked Bag 1791, Penrith, NSW 2751, Australia"
26,26,"Hein, CL",May 2011 ,Effects of coupled natural and anthropogenic factors on the community structure of diadromous fish and shrimp species in tropical island streams,FRESHWATER BIOLOGY,"P>1. Overlapping river and road networks provide a framework for studying the complex interactions between natural and human systems, with river-road intersections as focal areas of study. Roads can alter the morphology of stream channels, pose barriers to freshwater fauna, provide easy access to streams for humans and non-native species and accelerate the expansion of urban development.2. We determined what variables control the structure of diadromous fish and shrimp communities and assessed whether particular road crossings altered community structure in north-eastern Puerto Rico. We identified 24 sites that represented a range of river and road sizes across two catchments that drain El Yunque National Forest in Puerto Rico.3. The location of natural barriers and the size of stream pools were the most important variables for predicting six of fifteen fish and shrimp distributions. Predatory fishes were predicted to be limited to areas in the river network below large, steep waterfalls, whereas adult shrimp Atya lanipes (Atyidae) were predicted to be present above these waterfalls. The fish Awaous banana was predicted to be present in pools > 11.6 m wide, whereas the shrimp Xiphocaris elongata was predicted to be present in pools < 10.4 m wide. The distributions of nine species were predicted poorly, but three of these species were common and three were rare.4. Although urban and agricultural land covers were among the top three predictors of five species distributions, they were probably good predictors because they were correlated with the natural gradient. Further study is necessary to disentangle natural and anthropogenic gradients.5. Road crossings, 10 of which were culverts, were not dispersal barriers for fishes or shrimps. On average, species were present both upstream and downstream from road crossings at 68% of sites where they occurred. Absences upstream or downstream from road crossings occurred at 16% of sites each and likely resulted from a failure to detect species.6. Several existing features of these catchments and taxa may aid in fish and shrimp conservation. The headwaters are protected by management practices of El Yunque National Forest, connectivity within the river network has been maintained, and the diadromous life history of these organisms makes them resilient to pulsed disturbances.Show less",https://www.webofscience.com/wos/woscc/full-record/WOS:000289171400017,https://www.webofscience.com/api/gateway?GWVersion=2&SrcAuth=OpenURL&SrcApp=WOS&DestURL=https%3A%2F%2Fwww.redi-bw.de%2Flinks%2Funist%3Furl_ver%3DZ39.88-2004%26url_ctx_fmt%3Dinfo%3Aofi%2Ffmt%3Akev%3Amtx%3Actx%26rft.atitle%3DEffects%2Bof%2Bcoupled%2Bnatural%2Band%2Banthropogenic%2Bfactors%2Bon%2Bthe%2Bcommunity%2Bstructure%2Bof%2Bdiadromous%2Bfish%2Band%2Bshrimp%2Bspecies%2Bin%2Btropical%2Bisland%2Bstreams%26rft.aufirst%3DCatherine%2BL.%26rft.auinit%3DCL%26rft.aulast%3DHein%26rft.date%3D2011%26rft_id%3Dinfo%3Adoi%2F10.1111%252Fj.1365-2427.2010.02537.x%26rft.eissn%3D1365-2427%26rft.epage%3D1015%26rft.genre%3Darticle%26rft.issn%3D0046-5070%26rft.issue%3D5%26rft.jtitle%3DFRESHWATER%2BBIOLOGY%26rft_val_fmt%3Dinfo%3Aofi%2Ffmt%3Akev%3Amtx%3Ajournal%26rft.pages%3D1002-1015%26rfr_id%3Dinfo%3Asid%2Fwebofscience.com%3AWOS%3AWOS%26rft.spage%3D1002%26rft.stitle%3DFRESHWATER%2BBIOL%26rft.volume%3D56%26rft.au%3DHein%252C%2BCL%26rft.au%3DPike%252C%2BAS%26rft.au%3DCrowl%252C%2BTA&DestApp=OTHER_OpenURL&SrcAppSID=EUW1ED0A842rfIDuzr9JRdDbngbvZ&SrcJTitle=FRESHWATER+BIOLOGY&SrcPubType=MD_FORMAT,10.1111/j.1365-2427.2010.02537.x,"diadromous,distribution models,random forests,roads,tropical stream","FRESH-WATER SHRIMP,NERITINA-VIRGINEA GASTROPODA,UPSTREAM MIGRATION,PUERTO-RICO,POPULATION-STRUCTURE,URBANIZATION,PATTERNS,MODELS,CLASSIFICATION,BIOCOMPLEXITY",,"Abisko Sci Res Stn, Climate Impacts Res Ctr, SE-98107 Abisko, Sweden"
27,27,"Liu, SX",Nov 2016 ,Online Visual Analytics of Text Streams,IEEE TRANSACTIONS ON VISUALIZATION AND COMPUTER GRAPHICS,"We present an online visual analytics approach to helping users explore and understand hierarchical topic evolution in high-volume text streams. The key idea behind this approach is to identify representative topics in incoming documents and align them with the existing representative topics that they immediately follow (in time). To this end, we learn a set of streaming tree cuts from topic trees based on user-selected focus nodes. A dynamic Bayesian network model has been developed to derive the tree cuts in the incoming topic trees to balance the fitness of each tree cut and the smoothness between adjacent tree cuts. By connecting the corresponding topics at different times, we are able to provide an overview of the evolving hierarchical topics. A sedimentation-based visualization has been designed to enable the interactive analysis of streaming text data from global patterns to local details. We evaluated our method on real-world datasets and the results are generally favorable.Show less",https://www.webofscience.com/wos/woscc/full-record/WOS:000384578800010,https://www.webofscience.com/api/gateway?GWVersion=2&SrcAuth=OpenURL&SrcApp=WOS&DestURL=https%3A%2F%2Fwww.redi-bw.de%2Flinks%2Funist%3Furl_ver%3DZ39.88-2004%26url_ctx_fmt%3Dinfo%3Aofi%2Ffmt%3Akev%3Amtx%3Actx%26rft.atitle%3DOnline%2BVisual%2BAnalytics%2Bof%2BText%2BStreams%26rft.aufirst%3DShixia%26rft.auinit%3DSX%26rft.aulast%3DLiu%26rft.date%3D2016%26rft_id%3Dinfo%3Adoi%2F10.1109%252FTVCG.2015.2509990%26rft.eissn%3D1941-0506%26rft.epage%3D2466%26rft.genre%3Darticle%26rft.issn%3D1077-2626%26rft.issue%3D11%26rft.jtitle%3DIEEE%2BTRANSACTIONS%2BON%2BVISUALIZATION%2BAND%2BCOMPUTER%2BGRAPHICS%26rft_val_fmt%3Dinfo%3Aofi%2Ffmt%3Akev%3Amtx%3Ajournal%26rft.pages%3D2451-2466%26rfr_id%3Dinfo%3Asid%2Fwebofscience.com%3AWOS%3AWOS%26rft.spage%3D2451%26rft.stitle%3DIEEE%2BT%2BVIS%2BCOMPUT%2BGR%26rft.volume%3D22%26rft.au%3DLiu%252C%2BSX%26rft.au%3DYin%252C%2BJL%26rft.au%3DPei%252C%2BJ&DestApp=OTHER_OpenURL&SrcAppSID=EUW1ED0A842rfIDuzr9JRdDbngbvZ&SrcJTitle=IEEE+TRANSACTIONS+ON+VISUALIZATION+AND+COMPUTER+GRAPHICS&SrcPubType=MD_FORMAT,10.1109/TVCG.2015.2509990,"Streaming text data,evolutionary tree clustering,streaming tree cut,streaming topic visualization","COLLECTIONS,TOPICS",,"Tsinghua Univ, Sch Software, State Key lab Intell Tech & Syst, TNList Lab, Beijing, Peoples R China"
28,28,"Korus, JT",Jul 1 2020 ,"Transient streambed hydraulic conductivity in channel and bar environments, Loup River, Nebraska",HYDROLOGICAL PROCESSES,"Streambed hydraulic conductivity (K) and vertical K (K- v) are key controls on groundwater and surface water exchange and biogeochemical fluxes through the hyporheic zone, but drivers of transient hydraulic properties in different fluvial environments are poorly understood. This study combines hydrogeology, geophysics, and sedimentology to reveal mechanisms of K and K- v transience in the upper 0.5 m of a sandy streambed during low discharge. Hydraulic tests (44 slug tests, 130 falling-head permeameter tests) and 130 grain-size analyses were repeated three times over 8 weeks on a 1,200 m(2) grid spanning: (a) a channel with continuously flowing water and mobile bed load; (b) an adjacent mid-channel bar that was stationary and infrequently submerged. Aerial photographs and ground-penetrating radar show scour and complete reworking of fluvial sediments in the channel. Bar sediments below the water table remained immobile, but infrequent flows of moderate discharge reworked the uppermost few centimetres of the bar top. Despite differences in sediment mobility and stream flow characteristics across environments, K and K- v exhibited order-of-magnitude differences in spatial heterogeneity and temporal variability in both the channel and bar. Mean K and K- v values in the channel were comparatively stable over time. In the immobile bar, mean K declined 20% and K- v declined 26% after increased discharge temporarily inundated the bar. Grain-size distributions were steady across both environments over time, but repeat geophysical surveys of the bar show a decrease in electrical conductivity, likely from porosity reduction. These findings suggest that sediment dynamics and stream flow characteristics in different streambed environments are important drivers of K transience during low discharge conditions. Specifically, pore clogging can be an important mechanism of transience over short durations (weeks to months) in immobile sediments subject to infrequent flows and minor reworking.Show less",https://www.webofscience.com/wos/woscc/full-record/WOS:000534577400001,https://www.webofscience.com/api/gateway?GWVersion=2&SrcAuth=OpenURL&SrcApp=WOS&DestURL=https%3A%2F%2Fwww.redi-bw.de%2Flinks%2Funist%3Furl_ver%3DZ39.88-2004%26url_ctx_fmt%3Dinfo%3Aofi%2Ffmt%3Akev%3Amtx%3Actx%26rft.atitle%3DTransient%2Bstreambed%2Bhydraulic%2Bconductivity%2Bin%2Bchannel%2Band%2Bbar%2Benvironments%252C%2BLoup%2BRiver%252C%2BNebraska%26rft.aufirst%3DJesse%2BT.%26rft.auinit%3DJT%26rft.aulast%3DKorus%26rft.date%3D2020%26rft_id%3Dinfo%3Adoi%2F10.1002%252Fhyp.13777%26rft.eissn%3D1099-1085%26rft.epage%3D3077%26rft.genre%3Darticle%26rft.issn%3D0885-6087%26rft.issue%3D14%26rft.jtitle%3DHYDROLOGICAL%2BPROCESSES%26rft_val_fmt%3Dinfo%3Aofi%2Ffmt%3Akev%3Amtx%3Ajournal%26rft.pages%3D3061-3077%26rfr_id%3Dinfo%3Asid%2Fwebofscience.com%3AWOS%3AWOS%26rft.spage%3D3061%26rft.stitle%3DHYDROL%2BPROCESS%26rft.volume%3D34%26rft.au%3DKorus%252C%2BJT%26rft.au%3DFraundorfer%252C%2BWP%26rft.au%3DKarnik%252C%2BK&DestApp=OTHER_OpenURL&SrcAppSID=EUW1ED0A842rfIDuzr9JRdDbngbvZ&SrcJTitle=HYDROLOGICAL+PROCESSES&SrcPubType=MD_FORMAT,10.1002/hyp.13777,"fluvial sediments,geophysics,groundwater,heterogeneity,hydraulic tests,hyporheic zone,porosity,temporal variability","SEDIMENT CHARACTERISTICS,TEMPORAL VARIABILITY,HYPORHEIC ZONE,HETEROGENEITY,FLOW,HYDROGEOLOGY,DEPOSITS,IMPACTS,SYSTEM,CREEK",,"Univ Nebraska Lincoln, Sch Nat Resources, Conservat & Survey Div, Lincoln, NE 68583 USA"
29,29,"Zhang, PP",May 24 2022 ,The Impact of the Three Gorges Reservoir on Water Exchange Between the Yangtze River and Poyang Lake,FRONTIERS IN EARTH SCIENCE,"The Three Gorges Reservoir (TGR) operation has profoundly altered the hydrological regimes and ecosystem in the middle and lower Yangtze River basin. Its impacts on the river flow regime, sedimentation, lake level decline, and biodiversity have been extensively studied. However, the quantitative influence of the TGR on the downstream water exchange between the Yangtze River and Poyang Lake is lacking attention. In this study, we developed a machine learning model to investigate the river-lake water exchange variations under the TGR operation in typical hydrological years, compared with the natural scenario (i.e., no TGR). The results show that the machine learning model could provide a fast and accurate approach to identify the long-distance impact of reservoirs. The operation of the TGR has significant effects on the water exchange between the Yangtze River and Poyang Lake in the impounding period, with a 10,000 m(3)/s decrease in reservoir discharge approximately causing a 4,000 m(3)/s decrease in river-lake water exchange in the dry year and a decrease of 6,000 m(3)/s and 8,000 m(3)/s in reservoir discharge causing an increase of 4,000 m(3)/s and 6,000 m(3)/s in the normal year and the wet year, respectively. The TGR effect varies with different hydrological conditions of the river and lake, showing longer time range (from May to October) and greater degree (1.5 times the change rate in other years) in the wet year. The TGR operation is beneficial to the water maintenance of the lake in the dry year and flood control in the lake area in the wet year. This study provides a constructive approach and valuable information for decision making in water resource management and ecosystem protection in large river-lake systems.Show less",https://www.webofscience.com/wos/woscc/full-record/WOS:000820442200001,https://www.webofscience.com/api/gateway?GWVersion=2&SrcAuth=OpenURL&SrcApp=WOS&DestURL=https%3A%2F%2Fwww.redi-bw.de%2Flinks%2Funist%3Furl_ver%3DZ39.88-2004%26url_ctx_fmt%3Dinfo%3Aofi%2Ffmt%3Akev%3Amtx%3Actx%26rft.artnum%3DARTN%2B876286%26rft.atitle%3DThe%2BImpact%2Bof%2Bthe%2BThree%2BGorges%2BReservoir%2Bon%2BWater%2BExchange%2BBetween%2Bthe%2BYangtze%2BRiver%2Band%2BPoyang%2BLake%26rft.aufirst%3DPeipei%26rft.auinit%3DPP%26rft.aulast%3DZhang%26rft.date%3D2022%26rft_id%3Dinfo%3Adoi%2F10.3389%252Ffeart.2022.876286%26rft.eissn%3D2296-6463%26rft.genre%3Darticle%26rft.jtitle%3DFRONTIERS%2BIN%2BEARTH%2BSCIENCE%26rft_val_fmt%3Dinfo%3Aofi%2Ffmt%3Akev%3Amtx%3Ajournal%26rfr_id%3Dinfo%3Asid%2Fwebofscience.com%3AWOS%3AWOS%26rft.stitle%3DFRONT%2BEARTH%2BSC-SWITZ%26rft.volume%3D10%26rft.au%3DZhang%252C%2BPP%26rft.au%3DMao%252C%2BJQ%26rft.au%3DHu%252C%2BTF&DestApp=OTHER_OpenURL&SrcAppSID=EUW1ED0A842rfIDuzr9JRdDbngbvZ&SrcJTitle=FRONTIERS+IN+EARTH+SCIENCE&SrcPubType=MD_FORMAT,10.3389/feart.2022.876286,"Three Gorges Reservoir,operation scheme,Poyang Lake,machine learning model,water exchange","WETLAND VEGETATION,FLOW REGULATION,DAM,HYDROPOWER,BIODIVERSITY,DYNAMICS,REGIMES,MIDDLE",,"Hohai Univ, Coll Water Conservancy & Hydropower Engn, Nanjing, Peoples R China"
30,30,"Uchida, S",Rare Earths 2004 Conference,"Concentrations of REEs, Th and U in river waters collected in Japan",JOURNAL OF ALLOYS AND COMPOUNDS,,https://www.webofscience.com/wos/woscc/full-record/WOS:000235445300120,https://www.webofscience.com/api/gateway?GWVersion=2&SrcAuth=OpenURL&SrcApp=WOS&DestURL=https%3A%2F%2Fwww.redi-bw.de%2Flinks%2Funist%3Furl_ver%3DZ39.88-2004%26url_ctx_fmt%3Dinfo%3Aofi%2Ffmt%3Akev%3Amtx%3Actx%26rft.atitle%3DConcentrations%2Bof%2BREEs%252C%2BTh%2Band%2BU%2Bin%2Briver%2Bwaters%2Bcollected%2Bin%2BJapan%26rft.aufirst%3DS%26rft.auinit%3DS%26rft.aulast%3DUchida%26rft.date%3D2006%26rft_id%3Dinfo%3Adoi%2F10.1016%252Fj.jallcom.2004.12.104%26rft.epage%3D528%26rft.genre%3Darticle%26rft.issn%3D0925-8388%26rft.jtitle%3DJOURNAL%2BOF%2BALLOYS%2BAND%2BCOMPOUNDS%26rft_val_fmt%3Dinfo%3Aofi%2Ffmt%3Akev%3Amtx%3Ajournal%26rft.pages%3D525-528%26rfr_id%3Dinfo%3Asid%2Fwebofscience.com%3AWOS%3AWOS%26rft.spage%3D525%26rft.stitle%3DJ%2BALLOY%2BCOMPD%26rft.volume%3D408%26rft.au%3DUchida%252C%2BS%26rft.au%3DTagami%252C%2BK%26rft.au%3DHirai%252C%2BI&DestApp=OTHER_OpenURL&SrcAppSID=EUW1ED0A842rfIDuzr9JRdDbngbvZ&SrcJTitle=JOURNAL+OF+ALLOYS+AND+COMPOUNDS&SrcPubType=MD_FORMAT,10.1016/j.jallcom.2004.12.104,"rare earth elements,surface river water,distribution,inductively coupled plasma mass spectrometry","RARE-EARTH-ELEMENTS,PLANTS",,"Natl Inst Radiol Sci, Off Biospher Assessment Waste Disposal, Inage Ku, Anagawa 4-9-1, Chiba 2638555, Japan"
