,Unnamed: 0,First author,Year,Title,Journal,Abstract,wos_link,fulltext_link,doi,Keywords,Plus keywords,Research areas,Corresponding address
0,0,"Liu, YY",Feb 7 2017 ,Coupled Hydro-Biogeochemical Processes Controlling Cr Reductive Immobilization in Columbia River Hyporheic Zone,ENVIRONMENTAL SCIENCE & TECHNOLOGY,"An experiment and modeling study was conducted to investigate coupled hydro-biogeochemical processes controlling reductive immobilization of groundwater Cr in the hyporheic zone (HZ) at the U.S. Department of Energy's Hanford Site, where dynamic surface water groundwater exchange occurs on a daily basis. Experiments were performed to calibrate kinetic models, and the calibrated models were incorporated into a multicomponent reactive transport model to simulate Cr redox transformation and immobilization under field hydrological conditions. The results revealed that the rates of Cr(VI) reduction, Cr(III) accumulation, and Cr(VI) release to the river are mostly affected by dynamic sediment redox conditions represented by Fe(II) reactivity, which is controlled by its cyclic interaction with O-2 carried by river water, microbial activities, and the supply and bioavailability of organic carbon (OC) that is present in the HZ and/or carried by transport. In addition, the HZ geophysical properties including hydraulic conductivity and the thickness of the top alluvial layer have a significant influence on Cr reactive transport and immobilization by controlling residence times for reactions and the supply rates of O-2, Cr, and OC into the HZ. The results provide important insights into the dynamic redox environments in the HZ that can reductively immobilize contaminants.Show less",https://www.webofscience.com/wos/woscc/full-record/WOS:000393738700058,https://www.webofscience.com/api/gateway?GWVersion=2&SrcAuth=OpenURL&SrcApp=WOS&DestURL=https%3A%2F%2Fwww.redi-bw.de%2Flinks%2Funist%3Furl_ver%3DZ39.88-2004%26url_ctx_fmt%3Dinfo%3Aofi%2Ffmt%3Akev%3Amtx%3Actx%26rft.atitle%3DCoupled%2BHydro-Biogeochemical%2BProcesses%2BControlling%2BCr%2BReductive%2BImmobilization%2Bin%2BColumbia%2BRiver%2BHyporheic%2BZone%26rft.aufirst%3DYuanyuan%26rft.auinit%3DYY%26rft.aulast%3DLiu%26rft.date%3D2017%26rft_id%3Dinfo%3Adoi%2F10.1021%252Facs.est.6b05099%26rft.eissn%3D1520-5851%26rft.epage%3D1517%26rft.genre%3Darticle%26rft.issn%3D0013-936X%26rft.issue%3D3%26rft.jtitle%3DENVIRONMENTAL%2BSCIENCE%2B%2526%2BTECHNOLOGY%26rft_val_fmt%3Dinfo%3Aofi%2Ffmt%3Akev%3Amtx%3Ajournal%26rft.pages%3D1508-1517%26rfr_id%3Dinfo%3Asid%2Fwebofscience.com%3AWOS%3AWOS%26rft.spage%3D1508%26rft.stitle%3DENVIRON%2BSCI%2BTECHNOL%26rft.volume%3D51%26rft.au%3DLiu%252C%2BYY%26rft.au%3DXu%252C%2BF%26rft.au%3DLiu%252C%2BCX&DestApp=OTHER_OpenURL&SrcAppSID=EUW1ED0F39vUy74Y9nfvfg8aiKYkH&SrcJTitle=ENVIRONMENTAL+SCIENCE+%26+TECHNOLOGY&SrcPubType=MD_FORMAT,10.1021/acs.est.6b05099,,"ORGANIC-CARBON,CHROMIUM(VI) REDUCTION,HEXAVALENT CHROMIUM,BACTERIAL REDUCTION,CHROMATE REDUCTION,TRANSIENT STORAGE,BATCH EXPERIMENTS,SURFACE-WATER,STREAM,GROUNDWATER",,"Pacific Northwest Natl Lab, Richland, WA 99354 USA"
1,1,"Cheng, FY",Jun 2021 ,"Nevertheless, They Persisted: Can Hyporheic Zones Increase the Persistence of Estrogens in Streams?",WATER RESOURCES RESEARCH,"The presence of estrogens has been linked to adverse ecological effects in surface waters downstream of agricultural and domestic wastewater sources. While laboratory studies suggest that these estrogens should not persist because of fast degradation rates, elevated concentrations in surface waters impacted by agricultural activities are commonly observed. Using a combination of measured data and a stream-hyporheic zone (HZ) model applied to a 100 km reach in a tile-drained catchment, we show that the HZ can increase the persistence of estrogens. Field data reveal high concentrations of sorbed estrogens in sediments and elevated in-stream concentrations during low-flow summer months, suggesting that the HZ acts as a source of estrogens when transport into the streams is minimal. Model results provide further insight into the underlying mechanisms that enable sustained estrogen concentrations in streams, with the HZ acting as a source of dissolved estrogens for 95% of the year. We show that stream water interactions with the HZ may lead to overall suppression of degradation processes and an increase in the persistence of estrogens. Results suggest that when the model considered exchange in the HZ, approximately 28%-49% of estrogen mass remained in the stream ecosystem, while all estrogen mass was degraded in a 100-km reach in the model without the HZ. The remaining mass increased with increasing estrogen sorption coefficient, and this would potentially increase the lag time for lowering estrogen concentrations in surface water bodies even when inputs have ceased. Our findings highlight the importance of including HZ dynamics in estrogen transport models.Show less",https://www.webofscience.com/wos/woscc/full-record/WOS:000667245100014,https://www.webofscience.com/api/gateway?GWVersion=2&SrcAuth=OpenURL&SrcApp=WOS&DestURL=https%3A%2F%2Fwww.redi-bw.de%2Flinks%2Funist%3Furl_ver%3DZ39.88-2004%26url_ctx_fmt%3Dinfo%3Aofi%2Ffmt%3Akev%3Amtx%3Actx%26rft.artnum%3DARTN%2Be2020WR028518%26rft.atitle%3DNevertheless%252C%2BThey%2BPersisted%253A%2BCan%2BHyporheic%2BZones%2BIncrease%2Bthe%2BPersistence%2Bof%2BEstrogens%2Bin%2BStreams%253F%26rft.aufirst%3DFrederick%2BY.%26rft.auinit%3DFY%26rft.aulast%3DCheng%26rft.date%3D2021%26rft_id%3Dinfo%3Adoi%2F10.1029%252F2020WR028518%26rft.eissn%3D1944-7973%26rft.genre%3Darticle%26rft.issn%3D0043-1397%26rft.issue%3D6%26rft.jtitle%3DWATER%2BRESOURCES%2BRESEARCH%26rft_val_fmt%3Dinfo%3Aofi%2Ffmt%3Akev%3Amtx%3Ajournal%26rfr_id%3Dinfo%3Asid%2Fwebofscience.com%3AWOS%3AWOS%26rft.stitle%3DWATER%2BRESOUR%2BRES%26rft.volume%3D57%26rft.au%3DCheng%252C%2BFY%26rft.au%3DPreisendanz%252C%2BHE%26rft.au%3DBasu%252C%2BNB&DestApp=OTHER_OpenURL&SrcAppSID=EUW1ED0F39vUy74Y9nfvfg8aiKYkH&SrcJTitle=WATER+RESOURCES+RESEARCH&SrcPubType=MD_FORMAT,10.1029/2020WR028518,"agricultural legacies,contaminant fate,emerging contaminants,estrogen,hyporheic zone","ENDOCRINE DISRUPTING CHEMICALS,NATURAL ESTROGENS,SOLUTE TRANSPORT,FATHEAD MINNOWS,MODEL STRUCTURE,ORGANIC-CARBON,UNITED-STATES,17-BETA-ESTRADIOL,WATER,RIVER",,"Univ Waterloo, Dept Civil & Environm Engn, Waterloo, ON, Canada"
2,2,"Mojarrad, BB",Feb 2019 ,Fragmentation of the Hyporheic Zone Due to Regional Groundwater Circulation,WATER RESOURCES RESEARCH,"By use of numerical modeling and field observations, this work quantified the effects of catchment-scale upwelling groundwater on the hyporheic (below stream) fluxes over a wide range of spatial scales. A groundwater flow model was developed that specifically accounted for the hydrostatic and dynamic head fluctuations induced by the streambed topography. Although the magnitudes and relative importance of these streambed-induced fluxes were found to be highly sensitive to site-specific hydromorphological properties, we showed that streambed topographic structures exert a predominant control on the magnitude of hyporheic exchange fluxes in a Swedish boreal catchment. The magnitude of the exchange intensity evaluated at the streambed interface was found to be dominated by the streambed-induced hydraulic head across stream order. However, the catchment-scale groundwater flow field substantially affected the distribution of groundwater discharge points and thus decreased the fragmentation of the hyporheic zone, specifically by shifting the cumulative density function toward larger areas of coherent upwelling at the streambed interface. This work highlights the spectrum of spatial scales affecting the surface water-groundwater exchange patterns and resolves the roles of key mechanisms in controlling the fragmentation of the hyporheic zone.Show less",https://www.webofscience.com/wos/woscc/full-record/WOS:000461858900020,https://www.webofscience.com/api/gateway?GWVersion=2&SrcAuth=OpenURL&SrcApp=WOS&DestURL=https%3A%2F%2Fwww.redi-bw.de%2Flinks%2Funist%3Furl_ver%3DZ39.88-2004%26url_ctx_fmt%3Dinfo%3Aofi%2Ffmt%3Akev%3Amtx%3Actx%26rft.atitle%3DFragmentation%2Bof%2Bthe%2BHyporheic%2BZone%2BDue%2Bto%2BRegional%2BGroundwater%2BCirculation%26rft.aufirst%3DB.%2BB.%26rft.auinit%3DBB%26rft.aulast%3DMojarrad%26rft.date%3D2019%26rft_id%3Dinfo%3Adoi%2F10.1029%252F2018WR024609%26rft.eissn%3D1944-7973%26rft.epage%3D1262%26rft.genre%3Darticle%26rft.issn%3D0043-1397%26rft.issue%3D2%26rft.jtitle%3DWATER%2BRESOURCES%2BRESEARCH%26rft_val_fmt%3Dinfo%3Aofi%2Ffmt%3Akev%3Amtx%3Ajournal%26rft.pages%3D1242-1262%26rfr_id%3Dinfo%3Asid%2Fwebofscience.com%3AWOS%3AWOS%26rft.spage%3D1242%26rft.stitle%3DWATER%2BRESOUR%2BRES%26rft.volume%3D55%26rft.au%3DMojarrad%252C%2BBB%26rft.au%3DRiml%252C%2BJ%26rft.au%3DLaudon%252C%2BH&DestApp=OTHER_OpenURL&SrcAppSID=EUW1ED0F39vUy74Y9nfvfg8aiKYkH&SrcJTitle=WATER+RESOURCES+RESEARCH&SrcPubType=MD_FORMAT,10.1029/2018WR024609,"GW-SW interaction,hyporheic zone,multiscale modeling,fragmentation of upwelling zones","SURFACE WATER INTERACTIONS,BED FORMS,NONSORBING SOLUTES,EXCHANGE PROCESSES,STREAM,DISCHARGE,RIVER,TRANSPORT,AQUIFER,FLOW",,"KTH Royal Inst Technol, Dept Sustainable Dev Environm Sci & Engn, Stockholm, Sweden"
3,3,"Briggs, MA",Jun 2013 ,"Relating hyporheic fluxes, residence times, and redox-sensitive biogeochemical processes upstream of beaver dams",FRESHWATER SCIENCE,"Small dams enhance the development of patchy microenvironments along stream corridors by trapping sediment and creating complex streambed morphologies. This patchiness drives intricate hyporheic flux patterns that govern the exchange of O-2 and redox-sensitive solutes between the water column and the stream bed. We used multiple tracer techniques, naturally occurring and injected, to evaluate hyporheic flow dynamics and associated biogeochemical cycling and microbial reactivity around 2 beaver dams in Wyoming (USA). High-resolution fiber-optic distributed temperature sensing was used to collect temperature data over 9 vertical streambed profiles and to generate comprehensive vertical flux maps using 1-dimensional (1-D) heat-transport modeling. Coincident with these locations, vertical profiles of hyporheic water were collected every week and analyzed for dissolved O2, pH, dissolved organic C, and several conservative and redox-sensitive solutes. In addition, hyporheic and net stream aerobic microbial reactivity were analyzed with a constant-rate injection of the biologically sensitive resazurin (Raz) smart tracer. The combined results revealed a heterogeneous system with rates of downwelling hyporheic flow organized by morphologic unit and tightly coupled to the redox conditions of the subsurface. Principal component analysis was used to summarize the variability of all redox-sensitive species, and results indicated that hyporheic water varied from oxic-stream-like to anoxic-reduced in direct response to the hydrodynamic conditions and associated residence times. The anaerobic transition threshold predicted by the mean O-2 Damko ""hler number seemed to overestimate the actual transition as indicated by multiple secondary electron acceptors, illustrating the gradient nature of anaerobic transition. Temporal flux variability in low-flux morphologies generated a much greater range in hyporheic redox conditions compared to high-flux zones, and chemical responses to changing flux rates were consistent with those predicted from the empirical relationship between redox condition and residence time. The Raz tracer revealed that hyporheic flow paths have strong net aerobic respiration, particularly at higher residence time, but this reactive exchange did not affect the net stream signal at the reach scale.Show less",https://www.webofscience.com/wos/woscc/full-record/WOS:000318774500021,https://www.webofscience.com/api/gateway?GWVersion=2&SrcAuth=OpenURL&SrcApp=WOS&DestURL=https%3A%2F%2Fwww.redi-bw.de%2Flinks%2Funist%3Furl_ver%3DZ39.88-2004%26url_ctx_fmt%3Dinfo%3Aofi%2Ffmt%3Akev%3Amtx%3Actx%26rft.atitle%3DRelating%2Bhyporheic%2Bfluxes%252C%2Bresidence%2Btimes%252C%2Band%2Bredox-sensitive%2Bbiogeochemical%2Bprocesses%2Bupstream%2Bof%2Bbeaver%2Bdams%26rft.aufirst%3DMartin%2BA.%26rft.auinit%3DMA%26rft.aulast%3DBriggs%26rft.date%3D2013%26rft_id%3Dinfo%3Adoi%2F10.1899%252F12-110.1%26rft.eissn%3D2161-9565%26rft.epage%3D641%26rft.genre%3Darticle%26rft.issn%3D2161-9549%26rft.issue%3D2%26rft.jtitle%3DFRESHWATER%2BSCIENCE%26rft_val_fmt%3Dinfo%3Aofi%2Ffmt%3Akev%3Amtx%3Ajournal%26rft.pages%3D622-641%26rfr_id%3Dinfo%3Asid%2Fwebofscience.com%3AWOS%3AWOS%26rft.spage%3D622%26rft.stitle%3DFRESHW%2BSCI%26rft.volume%3D32%26rft.au%3DBriggs%252C%2BMA%26rft.au%3DLautz%252C%2BLK%26rft.au%3DGonzalez-Pinzon%252C%2BR&DestApp=OTHER_OpenURL&SrcAppSID=EUW1ED0F39vUy74Y9nfvfg8aiKYkH&SrcJTitle=FRESHWATER+SCIENCE&SrcPubType=MD_FORMAT,10.1899/12-110.1,"hyporheic,biogeochemistry,residence time,redox,beaver dam,nitrate,hotspot,resazurin,smart tracer.","ELECTRON-ACCEPTING PROCESSES,GROUNDWATER EXCHANGE,HYDROLOGICAL EXCHANGE,WATER FLUX,STREAM,HEAT,ZONE,AQUIFER,TRACER,FLOW",,"US Geol Survey, Off Groundwater, Branch Geophys, Unit 5015, 11 Sherman Pl, Storrs, CT 06269 USA"
4,4,"Trauth, N",Jan 2017 ,Single discharge events increase reactive efficiency of the hyporheic zone,WATER RESOURCES RESEARCH,"In this study, we investigate the impact of single stream discharge events on water exchange, solute transport, and reactions in the hyporheic zone below a natural in-stream gravel bar. We set up a reactive transport groundwater model with streamflow scenarios that vary by event duration and peak discharge. A steady ambient groundwater flow field is assumed that results in losing, neutral, or gaining stream conditions depending on the stream stage. Across the streambed dissolved oxygen, organic carbon, and nitrate are transported into the subsurface. Additional nitrate is received from upwelling groundwater. Aerobic respiration and denitrification are simulated for scenarios with different stream solute concentrations. Results show that hyporheic exchange flux, solute transport, and consumption increase during events. However, their intensities depend highly on the interplay between event characteristics and ambient groundwater conditions. During events where reversals in the hydraulic gradient occur stream water and solutes infiltrate deeper into the aquifer where they have more time to react. For those events, the reactive efficiency of the hyporheic zone (solute consumption as fraction of influx) for aerobic respiration and denitrification is up to 2.7 and 10 times higher compared to base flow conditions. The fraction of stream nitrate load consumed in the hyporheic zone increases with stream discharge (up to 150 mg/m(2)/h), but remains below the value under base flow conditions for weak events. Events also increase denitrification of groundwater borne nitrate, but groundwater nitrate flux to the stream decreases by up to 33% due to temporary gradient reversals.Show less",https://www.webofscience.com/wos/woscc/full-record/WOS:000394911200046,https://www.webofscience.com/api/gateway?GWVersion=2&SrcAuth=OpenURL&SrcApp=WOS&DestURL=https%3A%2F%2Fwww.redi-bw.de%2Flinks%2Funist%3Furl_ver%3DZ39.88-2004%26url_ctx_fmt%3Dinfo%3Aofi%2Ffmt%3Akev%3Amtx%3Actx%26rft.atitle%3DSingle%2Bdischarge%2Bevents%2Bincrease%2Breactive%2Befficiency%2Bof%2Bthe%2Bhyporheic%2Bzone%26rft.aufirst%3DNico%26rft.auinit%3DN%26rft.aulast%3DTrauth%26rft.date%3D2017%26rft_id%3Dinfo%3Adoi%2F10.1002%252F2016WR019488%26rft.eissn%3D1944-7973%26rft.epage%3D798%26rft.genre%3Darticle%26rft.issn%3D0043-1397%26rft.issue%3D1%26rft.jtitle%3DWATER%2BRESOURCES%2BRESEARCH%26rft_val_fmt%3Dinfo%3Aofi%2Ffmt%3Akev%3Amtx%3Ajournal%26rft.pages%3D779-798%26rfr_id%3Dinfo%3Asid%2Fwebofscience.com%3AWOS%3AWOS%26rft.spage%3D779%26rft.stitle%3DWATER%2BRESOUR%2BRES%26rft.volume%3D53%26rft.au%3DTrauth%252C%2BN%26rft.au%3DFleckenstein%252C%2BJH&DestApp=OTHER_OpenURL&SrcAppSID=EUW1ED0F39vUy74Y9nfvfg8aiKYkH&SrcJTitle=WATER+RESOURCES+RESEARCH&SrcPubType=MD_FORMAT,10.1002/2016WR019488,"hyporheic zone,discharge events,transient groundwater model,reactive transport,denitrification","RIVER-AQUIFER INTERACTIONS,4TH-ORDER MOUNTAIN STREAM,DISSOLVED ORGANIC-CARBON,EXCHANGE FLUXES,STORM DYNAMICS,RIPARIAN ZONE,GROUNDWATER,NITRATE,WATER,DENITRIFICATION",,"UFZ Helmholtz Ctr Environm Res, Dept Hydrogeol, Leipzig, Germany"
5,5,"Briggs, MA",Jun 22 2010 ,Surface and hyporheic transient storage dynamics throughout a coastal stream network,WATER RESOURCES RESEARCH,"Transient storage of stream water and associated solutes is expected to vary along stream networks in response to related changes in stream hydraulic conditions and morphologic gradients. These spatial changes are relevant to a wide variety of processes (e. g., biogeochemical cycling), yet data regarding these dynamics are limited and almost exclusively confined to the general storage terms of transient storage models with a single-storage zone (1-SZ). We used a transient storage model with two-storage zones (2-SZ) to simulate field data from conservative solute injections conducted in a coastal stream network in Massachusetts to separately quantify surface transient storage (STS) and hyporheic transient storage (HTS). Solute tracer additions were performed at basin-wide, low-flow conditions, and results were compared with respect to stream size. Strong positive relationships with reach contributing area indicated that the size of the main channel and the size and residence time in surface and hyporheic storage zones all increased from small to large streams. Conversely, longitudinal dispersion and the storage zone exchange coefficients had no consistent trends downstream. The influence of storage exchange on median transport time (F-MED(200)) was consistently large for STS and negligible for HTS. When compared to 1-SZ model estimates, we found that the general 1-SZ model storage terms did not consistently describe either STS or HTS exchange. Overall our results indicated that many zone-specific (STS and HTS) storage dynamics were sensitive to the combination of hydraulic and morphologic gradients along the stream network and followed positive trends with stream size.Show less",https://www.webofscience.com/wos/woscc/full-record/WOS:000279315900001,https://www.webofscience.com/api/gateway?GWVersion=2&SrcAuth=OpenURL&SrcApp=WOS&DestURL=https%3A%2F%2Fwww.redi-bw.de%2Flinks%2Funist%3Furl_ver%3DZ39.88-2004%26url_ctx_fmt%3Dinfo%3Aofi%2Ffmt%3Akev%3Amtx%3Actx%26rft.artnum%3DARTN%2BW06516%26rft.atitle%3DSurface%2Band%2Bhyporheic%2Btransient%2Bstorage%2Bdynamics%2Bthroughout%2Ba%2Bcoastal%2Bstream%2Bnetwork%26rft.aufirst%3DMartin%2BA.%26rft.auinit%3DMA%26rft.aulast%3DBriggs%26rft.date%3D2010%26rft_id%3Dinfo%3Adoi%2F10.1029%252F2009WR008222%26rft.eissn%3D1944-7973%26rft.genre%3Darticle%26rft.issn%3D0043-1397%26rft.jtitle%3DWATER%2BRESOURCES%2BRESEARCH%26rft_val_fmt%3Dinfo%3Aofi%2Ffmt%3Akev%3Amtx%3Ajournal%26rfr_id%3Dinfo%3Asid%2Fwebofscience.com%3AWOS%3AWOS%26rft.stitle%3DWATER%2BRESOUR%2BRES%26rft.volume%3D46%26rft.au%3DBriggs%252C%2BMA%26rft.au%3DGooseff%252C%2BMN%26rft.au%3DHopkinson%252C%2BCS&DestApp=OTHER_OpenURL&SrcAppSID=EUW1ED0F39vUy74Y9nfvfg8aiKYkH&SrcJTitle=WATER+RESOURCES+RESEARCH&SrcPubType=MD_FORMAT,10.1029/2009WR008222,,"RESIDENCE TIME DISTRIBUTION,HYDRAULIC CHARACTERISTICS,WATER EXCHANGE,RETENTION,NITROGEN,DENITRIFICATION,TRANSPORT,OREGON,RIVER,ZONE",,"Colorado Sch Mines, Hydrol Sci & Engn Program, Golden, CO 80401 USA"
6,6,"Ward, AS",Dec 20 2019 ,Spatial and temporal variation in river corridor exchange across a 5th-order mountain stream network,HYDROLOGY AND EARTH SYSTEM SCIENCES,"Although most field and modeling studies of river corridor exchange have been conducted at scales ranging from tens to hundreds of meters, results of these studies are used to predict their ecological and hydrological influences at the scale of river networks. Further complicating prediction, exchanges are expected to vary with hydrologic forcing and the local geomorphic setting. While we desire predictive power, we lack a complete spatiotemporal relationship relating discharge to the variation in geologic setting and hydrologic forcing that is expected across a river basin. Indeed, the conceptual model of Wondzell (2011) predicts systematic variation in river corridor exchange as a function of (1) variation in baseflow over time at a fixed location, (2) variation in discharge with location in the river network, and (3) local geomorphic setting. To test this conceptual model we conducted more than 60 solute tracer studies including a synoptic campaign in the 5th-order river network of the H. J. Andrews Experimental Forest (Oregon, USA) and replicate-intime experiments in four watersheds. We interpret the data using a series of metrics describing river corridor exchange and solute transport, testing for consistent direction and magnitude of relationships relating these metrics to discharge and local geomorphic setting. We confirmed systematic decrease in river corridor exchange space through the river networks, from headwaters to the larger main stem. However, we did not find systematic variation with changes in discharge through time or with local geomorphic setting. While interpretation of our results is complicated by problems with the analytical methods, the results are sufficiently robust for us to conclude that space-for-time and time-for-space substitutions are not appropriate in our study system. Finally, we suggest two strategies that will improve the interpretability of tracer test results and help the hyporheic community develop robust datasets that will enable comparisons across multiple sites and/or discharge conditions.Show less",https://www.webofscience.com/wos/woscc/full-record/WOS:000504011700001,https://www.webofscience.com/api/gateway?GWVersion=2&SrcAuth=OpenURL&SrcApp=WOS&DestURL=https%3A%2F%2Fwww.redi-bw.de%2Flinks%2Funist%3Furl_ver%3DZ39.88-2004%26url_ctx_fmt%3Dinfo%3Aofi%2Ffmt%3Akev%3Amtx%3Actx%26rft.atitle%3DSpatial%2Band%2Btemporal%2Bvariation%2Bin%2Briver%2Bcorridor%2Bexchange%2Bacross%2Ba%2B5th-order%2Bmountain%2Bstream%2Bnetwork%26rft.aufirst%3DAdam%2BS.%26rft.auinit%3DAS%26rft.aulast%3DWard%26rft.date%3D2019%26rft_id%3Dinfo%3Adoi%2F10.5194%252Fhess-23-5199-2019%26rft.eissn%3D1607-7938%26rft.epage%3D5225%26rft.genre%3Darticle%26rft.issn%3D1027-5606%26rft.issue%3D12%26rft.jtitle%3DHYDROLOGY%2BAND%2BEARTH%2BSYSTEM%2BSCIENCES%26rft_val_fmt%3Dinfo%3Aofi%2Ffmt%3Akev%3Amtx%3Ajournal%26rft.pages%3D5199-5225%26rfr_id%3Dinfo%3Asid%2Fwebofscience.com%3AWOS%3AWOS%26rft.spage%3D5199%26rft.stitle%3DHYDROL%2BEARTH%2BSYST%2BSC%26rft.volume%3D23%26rft.au%3DWard%252C%2BAS%26rft.au%3DWondzell%252C%2BSM%26rft.au%3DWisnoski%252C%2BNI&DestApp=OTHER_OpenURL&SrcAppSID=EUW1ED0F39vUy74Y9nfvfg8aiKYkH&SrcJTitle=HYDROLOGY+AND+EARTH+SYSTEM+SCIENCES&SrcPubType=MD_FORMAT,10.5194/hess-23-5199-2019,,"SCALE TRANSIENT STORAGE,HYPORHEIC EXCHANGE,SOLUTE TRANSPORT,GROUNDWATER EXCHANGE,CASCADE MOUNTAINS,GEOMORPHIC CONTROLS,MASS-TRANSFER,FLOW,ZONE,PARAMETERS",,"Indiana Univ, ONeill Sch Publ & Environm Affairs, Bloomington, IN 47405 USA"
