,Unnamed: 0,First author,Year,Title,Journal,Abstract,wos_link,fulltext_link,doi,Keywords,Plus keywords,Research areas,Corresponding address
31,31,"Gong, Y",May 2021 ,Evaluation of the Sustainable Coupling Coordination of the Logistics Industry and the Manufacturing Industry in the Yangtze River Economic Belt,SUSTAINABILITY,"In order to promote the sustainable and coordinated development of the logistics industry and the manufacturing industry in the Yangtze River Economic Belt of China and provide the policy makers with decision-making references, this paper explored the spatio-temporal evolution of the coupling coordination development level of the two industries. A three-stage super-efficiency SBM model, which eliminated the influence of environmental factors and random errors, was constructed to make it possible to conduct an in-depth comparative analysis on the effective decision-making units (DMUs), making the calculation results more accurate. This was the main contribution of this paper. Based on the new model considering undesirable output, this paper analyzed the panel data of 11 provinces and cities in the Yangtze River Economic Belt from 2007 to 2017 and investigated the coordination development level from the dimensions of time and space considering the energy input and carbon emissions of the two industries. Our main research findings were as follows. First, due to the relative lagging of the logistics industry in promoting the development of the manufacturing industry, the overall level of the coordination between the two industries was at a stage of limited coordination. Second, the regional differences were significant with a spatial evolution pattern of ""high in the east and low in the west"". Third, environmental factors affected the input efficiency of the logistics industry and the manufacturing industry, especially the latter. Overall, this paper made theoretical and practical contributions to promoting the joint development of the two industries, improving the logistics industry and upgrading the manufacturing industry.Show less",https://www.webofscience.com/wos/woscc/full-record/WOS:000650928500001,https://www.webofscience.com/api/gateway?GWVersion=2&SrcAuth=OpenURL&SrcApp=WOS&DestURL=https%3A%2F%2Fwww.redi-bw.de%2Flinks%2Funist%3Furl_ver%3DZ39.88-2004%26url_ctx_fmt%3Dinfo%3Aofi%2Ffmt%3Akev%3Amtx%3Actx%26rft.artnum%3DARTN%2B5167%26rft.atitle%3DEvaluation%2Bof%2Bthe%2BSustainable%2BCoupling%2BCoordination%2Bof%2Bthe%2BLogistics%2BIndustry%2Band%2Bthe%2BManufacturing%2BIndustry%2Bin%2Bthe%2BYangtze%2BRiver%2BEconomic%2BBelt%26rft.aufirst%3DYing%26rft.auinit%3DY%26rft.aulast%3DGong%26rft.date%3D2021%26rft_id%3Dinfo%3Adoi%2F10.3390%252Fsu13095167%26rft.eissn%3D2071-1050%26rft.genre%3Darticle%26rft.issue%3D9%26rft.jtitle%3DSUSTAINABILITY%26rft_val_fmt%3Dinfo%3Aofi%2Ffmt%3Akev%3Amtx%3Ajournal%26rfr_id%3Dinfo%3Asid%2Fwebofscience.com%3AWOS%3AWOS%26rft.stitle%3DSUSTAINABILITY-BASEL%26rft.volume%3D13%26rft.au%3DGong%252C%2BY%26rft.au%3DYang%252C%2BXQ%26rft.au%3DZhou%252C%2BYF&DestApp=OTHER_OpenURL&SrcAppSID=EUW1ED0A842rfIDuzr9JRdDbngbvZ&SrcJTitle=SUSTAINABILITY&SrcPubType=MD_FORMAT,10.3390/su13095167,"logistics,manufacturing,sustainable development,coupling coordination,Yangtze River Economic Belt,three-stage super-efficiency SBM model","EFFICIENCY,TOURISM",,"Chongqing Technol & Business Univ, Chongqing Engn Technol Res Ctr Informat Managemen, Chongqing 400067, Peoples R China"
32,32,"Liu, XY",Sep 2021 ,Adaptive Transfer Learning Based on a Two-Stream Densely Connected Residual Shrinkage Network for Transformer Fault Diagnosis over Vibration Signals,ELECTRONICS,"Vibration signal analysis is an efficient online transformer fault diagnosis method for improving the stability and safety of power systems. Operation in harsh interference environments and the lack of fault samples are the most challenging aspects of transformer fault diagnosis. High-precision performance is difficult to achieve when using conventional fault diagnosis methods. Thus, this study proposes a transformer fault diagnosis method based on the adaptive transfer learning of a two-stream densely connected residual shrinkage network over vibration signals. First, novel time-frequency analysis methods (i.e., Synchrosqueezed Wavelet Transform and Synchrosqueezed Generalized S-transform) are proposed to convert vibration signals into different images, effectively expanding the samples and extracting effective features of signals. Second, a Two-stream Densely Connected Residual Shrinkage (TSDen2NetRS) network is presented to achieve a high accuracy fault diagnosis under different working conditions. Furthermore, the Residual Shrinkage layer (RS layer) is applied as a nonlinear transformation layer to the deep learning framework to remove unimportant features and enhance anti-interference performance. Lastly, an adaptive transfer learning algorithm that can automatically select the source data set by using the domain measurement method is proposed. This algorithm accelerates the training of the deep learning network and improves accuracy when the number of samples is small. Vibration experiments of transformers are conducted under different operating conditions, and their results show the effectiveness and robustness of the proposed method.Show less",https://www.webofscience.com/wos/woscc/full-record/WOS:000694163800001,https://www.webofscience.com/api/gateway?GWVersion=2&SrcAuth=OpenURL&SrcApp=WOS&DestURL=https%3A%2F%2Fwww.redi-bw.de%2Flinks%2Funist%3Furl_ver%3DZ39.88-2004%26url_ctx_fmt%3Dinfo%3Aofi%2Ffmt%3Akev%3Amtx%3Actx%26rft.artnum%3DARTN%2B2130%26rft.atitle%3DAdaptive%2BTransfer%2BLearning%2BBased%2Bon%2Ba%2BTwo-Stream%2BDensely%2BConnected%2BResidual%2BShrinkage%2BNetwork%2Bfor%2BTransformer%2BFault%2BDiagnosis%2Bover%2BVibration%2BSignals%26rft.aufirst%3DXiaoyan%26rft.auinit%3DXY%26rft.aulast%3DLiu%26rft.date%3D2021%26rft_id%3Dinfo%3Adoi%2F10.3390%252Felectronics10172130%26rft.eissn%3D2079-9292%26rft.genre%3Darticle%26rft.issue%3D17%26rft.jtitle%3DELECTRONICS%26rft_val_fmt%3Dinfo%3Aofi%2Ffmt%3Akev%3Amtx%3Ajournal%26rfr_id%3Dinfo%3Asid%2Fwebofscience.com%3AWOS%3AWOS%26rft.stitle%3DELECTRONICS-SWITZ%26rft.volume%3D10%26rft.au%3DLiu%252C%2BXY%26rft.au%3DHe%252C%2BYG%26rft.au%3DWang%252C%2BL&DestApp=OTHER_OpenURL&SrcAppSID=EUW1ED0A842rfIDuzr9JRdDbngbvZ&SrcJTitle=ELECTRONICS&SrcPubType=MD_FORMAT,10.3390/electronics10172130,"synchrosqueezed,two-stream,TSDen2NetRS,residual shrinkage layer,adaptive transfer learning","CONVOLUTIONAL NEURAL-NETWORK,POWERED RFID SENSOR,CLASSIFICATION",,"Wuhan Univ, Sch Elect Engn & Automat, Wuhan 430072, Peoples R China"
33,33,"Zarnetske, JP",Mar 10 2011 ,Dynamics of nitrate production and removal as a function of residence time in the hyporheic zone,JOURNAL OF GEOPHYSICAL RESEARCH-BIOGEOSCIENCES,"Biogeochemical reactions associated with stream nitrogen cycling, such as nitrification and denitrification, can be strongly controlled by water and solute residence times in the hyporheic zone (HZ). We used a whole-stream steady state N-15-labeled nitrate ((NO3-)-N-15) and conservative tracer (Cl-) addition to investigate the spatial and temporal physiochemical conditions controlling the denitrification dynamics in the HZ of an upland agricultural stream. We measured solute concentrations ((NO3-)-N-15, N-15(2) (g), as well as NO3-, NH3, DOC, DO, Cl ), and hydraulic transport parameters (head, flow rates, flow paths, and residence time distributions) of the reach and along HZ flow paths of an instrumented gravel bar. HZ exchange was observed across the entire gravel bar (i.e., in all wells) with flow path lengths up to 4.2 m and corresponding median residence times greater than 28.5 h. The HZ transitioned from a net nitrification environment at its head (short residence times) to a net denitrification environment at its tail (long residence times). NO3- increased at short residence times from 0.32 to 0.54 mg-N L-1 until a threshold of 6.9 h and then consistently decreased from 0.54 to 0.03 mg-N L-1. Along these same flow paths, declines were seen in DO (from 8.31 to 0.59 mg-O-2 L-1) and DOC (from 3.0 to 1.7 mg-C L-1). The rates of the DO and DOC removal and net nitrification were greatest during short residence times, while the rate of denitrification was greatest at long residence times. (NO3-)-N-15 tracing confirmed that a fraction of the NO3- removal was via denitrification as N-15(2) was produced across the entire gravel bar HZ. Production of N-15(2) across all observed flow paths and residence times indicated that denitrification microsites are present even where nitrification was the net outcome. These findings demonstrate that the HZ is an active nitrogen sink in this system and that the distinction between net nitrification and denitrification in the HZ is a function of residence time and exhibits threshold behavior. Consequently, incorporation of HZ exchange and water residence time characterizations will improve mechanistic predictions of nitrogen cycling in streams.Show less",https://www.webofscience.com/wos/woscc/full-record/WOS:000288325900001,https://www.webofscience.com/api/gateway?GWVersion=2&SrcAuth=OpenURL&SrcApp=WOS&DestURL=https%3A%2F%2Fwww.redi-bw.de%2Flinks%2Funist%3Furl_ver%3DZ39.88-2004%26url_ctx_fmt%3Dinfo%3Aofi%2Ffmt%3Akev%3Amtx%3Actx%26rft.artnum%3DARTN%2BG01025%26rft.atitle%3DDynamics%2Bof%2Bnitrate%2Bproduction%2Band%2Bremoval%2Bas%2Ba%2Bfunction%2Bof%2Bresidence%2Btime%2Bin%2Bthe%2Bhyporheic%2Bzone%26rft.aufirst%3DJay%2BP.%26rft.auinit%3DJP%26rft.aulast%3DZarnetske%26rft.date%3D2011%26rft_id%3Dinfo%3Adoi%2F10.1029%252F2010JG001356%26rft.eissn%3D2169-8961%26rft.genre%3Darticle%26rft.issn%3D2169-8953%26rft.jtitle%3DJOURNAL%2BOF%2BGEOPHYSICAL%2BRESEARCH-BIOGEOSCIENCES%26rft_val_fmt%3Dinfo%3Aofi%2Ffmt%3Akev%3Amtx%3Ajournal%26rfr_id%3Dinfo%3Asid%2Fwebofscience.com%3AWOS%3AWOS%26rft.stitle%3DJ%2BGEOPHYS%2BRES-BIOGEO%26rft.volume%3D116%26rft.au%3DZarnetske%252C%2BJP%26rft.au%3DHaggerty%252C%2BR%26rft.au%3DBaker%252C%2BMA&DestApp=OTHER_OpenURL&SrcAppSID=EUW1ED0A842rfIDuzr9JRdDbngbvZ&SrcJTitle=JOURNAL+OF+GEOPHYSICAL+RESEARCH-BIOGEOSCIENCES&SrcPubType=MD_FORMAT,10.1029/2010JG001356,,"DESERT STREAM,SUBSURFACE EXCHANGE,ORGANIC-CARBON,NITROGEN,DENITRIFICATION,RETENTION,CHANNEL,RIVER,BIOAVAILABILITY,NITRIFICATION",,"Oregon State Univ, Dept Geosci, Corvallis, OR 97331 USA"
34,34,"Chisholm, G",Jan 20 2020 ,Decoupled electrolysis using a silicotungstic acid electron-coupled-proton buffer in a proton exchange membrane cell,ELECTROCHIMICA ACTA,"The storage of renewably-generated energy as hydrogen via the electrolysis of water is a fundamental cornerstone of a sustainable hydrogen economy. Conventional electrolysers usually require stable power inputs in order to operate effectively and safely and so may be unsuited to harnessing renewable power, which is often intermittent and diffuse. Electrolysis mediated by Electron-Coupled-Proton Buffers has the potential to overcome some of the challenges surrounding electrolysis using low and/or sporadic power inputs (especially those related to gas crossover) as the use of Electron-Coupled-Proton Buffers allows the oxygen and hydrogen evolution reactions to be completely decoupled from one another. Herein, we show that silicotungstic acid can be used as an Electron-Coupled-Proton Buffer in a proton exchange membrane cell, decoupling the hydrogen and oxygen evolution reactions at steady state current densities as high as 500 mA cm(-2). O-2 and H-2 can be produced continuously by this system by cycling a fixed volume of the Electron-Coupled-Proton Buffer solution. Even at current densities as low as 25 mA cm(-2), the level of hydrogen in the oxygen stream is <0.4%, whereas a conventional proton exchange membrane electrolyser operating at this current density produces oxygen containing nearly 2% hydrogen (unacceptable for most applications). Furthermore, using silicotungstic acid as an Electron-Coupled-Proton Buffer also confers greater tolerance to non-deionised water inputs and reduces fluoride release from the perfluorosulfonated membrane (a marker for membrane degradation) relative to a conventional proton exchange membrane electrolyser. Together, these results highlight the promise and potential advantages of Electron-Coupled-Proton Buffers (and silicotungstic acid in particular) for the electrolytic production of hydrogen and oxygen over a wide range of current densities, such as might be delivered by renewable power inputs. (c) 2019 The Authors. Published by Elsevier Ltd.Show less",https://www.webofscience.com/wos/woscc/full-record/WOS:000506011100018,https://www.webofscience.com/api/gateway?GWVersion=2&SrcAuth=OpenURL&SrcApp=WOS&DestURL=https%3A%2F%2Fwww.redi-bw.de%2Flinks%2Funist%3Furl_ver%3DZ39.88-2004%26url_ctx_fmt%3Dinfo%3Aofi%2Ffmt%3Akev%3Amtx%3Actx%26rft.artnum%3DARTN%2B135255%26rft.atitle%3DDecoupled%2Belectrolysis%2Busing%2Ba%2Bsilicotungstic%2Bacid%2Belectron-coupled-proton%2Bbuffer%2Bin%2Ba%2Bproton%2Bexchange%2Bmembrane%2Bcell%26rft.aufirst%3DGreig%26rft.auinit%3DG%26rft.aulast%3DChisholm%26rft.date%3D2020%26rft_id%3Dinfo%3Adoi%2F10.1016%252Fj.electacta.2019.135255%26rft.eissn%3D1873-3859%26rft.genre%3Darticle%26rft.issn%3D0013-4686%26rft.jtitle%3DELECTROCHIMICA%2BACTA%26rft_val_fmt%3Dinfo%3Aofi%2Ffmt%3Akev%3Amtx%3Ajournal%26rfr_id%3Dinfo%3Asid%2Fwebofscience.com%3AWOS%3AWOS%26rft.stitle%3DELECTROCHIM%2BACTA%26rft.volume%3D331%26rft.au%3DChisholm%252C%2BG%26rft.au%3DCronin%252C%2BL%26rft.au%3DSymes%252C%2BMD&DestApp=OTHER_OpenURL&SrcAppSID=EUW1ED0A842rfIDuzr9JRdDbngbvZ&SrcJTitle=ELECTROCHIMICA+ACTA&SrcPubType=MD_FORMAT,10.1016/j.electacta.2019.135255,"Oxygen evolution reaction,Mediated electrolysis,Decoupled electrolysis,Electron-coupled-proton buffer,Polyoxometalate","WATER ELECTROLYSIS,HYDROGEN-PRODUCTION,OXYGEN EVOLUTION,HALF-REACTIONS,DEGRADATION,CHALLENGES,EFFICIENT,ELECTROCATALYSIS,GENERATION,REDUCTION",,"Univ Glasgow, Sch Chem, WestCHEM, Glasgow G12 8QQ, Lanark, Scotland"
35,35,"Anibas, C",Jan 24 2011 ,A simple thermal mapping method for seasonal spatial patterns of groundwater-surface water interaction,JOURNAL OF HYDROLOGY,"A simple thermal mapping method for simulating seasonal and spatial patterns of groundwater-surface water interaction is developed and tested for a segment of the Aa River, Belgium. Spatially distributed temperature profiles in the hyporheic zone of the river are measured in winter and summer seasons of three consecutive years. Inverse modeling of the one-dimensional heat transport equation is applied to estimate vertical advective fluxes using the numerical STRIVE model and an analytical model. Results of the study show that seasonal flux estimates for summer and winter can be derived with a minimum data input and simulation effort. The estimated fluxes are analyzed via non-parametric statistical tests, while spatial interpolation techniques are used to generate maps of distributed flux exchange. The estimated seepage is compared with volumetric flux obtained from piezometer measurements and output of a groundwater model. The thermal method shows higher discharge rates in winter and that the relative contribution of exfiltration to the river discharge is higher in summer. A higher flux and a more heterogeneous flow pattern are observed in the upper reach of the river compared to the lower reach. This spatial difference shows the importance of the local geomorphology and to a lesser extent the hydrogeologic setting on hyporheic flux exchange in the river. A significantly higher flux is noted on the banks than in the center of the river, which is driven by the relatively high hydraulic conductivity of the river banks. It is concluded that bank flow in groundwater-surface water interaction deserves more attention. The main channel of the Aa River alone accounts for about 15% of the total river discharge at its outlet. As the developed thermal method is cost-effective, simple and fast, it is recommended for use in identifying zones of interest in initial stages of field investigations of groundwater-surface water interaction. (C) 2010 Elsevier B.V. All rights reserved.Show less",https://www.webofscience.com/wos/woscc/full-record/WOS:000287074300009,https://www.webofscience.com/api/gateway?GWVersion=2&SrcAuth=OpenURL&SrcApp=WOS&DestURL=https%3A%2F%2Fwww.redi-bw.de%2Flinks%2Funist%3Furl_ver%3DZ39.88-2004%26url_ctx_fmt%3Dinfo%3Aofi%2Ffmt%3Akev%3Amtx%3Actx%26rft.atitle%3DA%2Bsimple%2Bthermal%2Bmapping%2Bmethod%2Bfor%2Bseasonal%2Bspatial%2Bpatterns%2Bof%2Bgroundwater-surface%2Bwater%2Binteraction%26rft.aufirst%3DChristian%26rft.auinit%3DC%26rft.aulast%3DAnibas%26rft.date%3D2011%26rft_id%3Dinfo%3Adoi%2F10.1016%252Fj.jhydrol.2010.11.036%26rft.eissn%3D1879-2707%26rft.epage%3D104%26rft.genre%3Darticle%26rft.issn%3D0022-1694%26rft.issue%3D1-2%26rft.jtitle%3DJOURNAL%2BOF%2BHYDROLOGY%26rft_val_fmt%3Dinfo%3Aofi%2Ffmt%3Akev%3Amtx%3Ajournal%26rft.pages%3D93-104%26rfr_id%3Dinfo%3Asid%2Fwebofscience.com%3AWOS%3AWOS%26rft.spage%3D93%26rft.stitle%3DJ%2BHYDROL%26rft.volume%3D397%26rft.au%3DAnibas%252C%2BC%26rft.au%3DBuis%252C%2BK%26rft.au%3DBatelaan%252C%2BO&DestApp=OTHER_OpenURL&SrcAppSID=EUW1ED0A842rfIDuzr9JRdDbngbvZ&SrcJTitle=JOURNAL+OF+HYDROLOGY&SrcPubType=MD_FORMAT,10.1016/j.jhydrol.2010.11.036,"Heat transport modeling,Temperature,Hyporheic zone,Groundwater-surface water interaction,FEMME,Belgium","EXCHANGE PROCESSES,NETE CATCHMENT,TEMPERATURE,STREAM,DISCHARGE,SEEPAGE,AQUIFER,FLOW,HETEROGENEITY,PROFILES",,"Vrije Univ Brussel, Dept Hydrol & Hydraul Engn, Pl Laan 2, B-1050 Brussels, Belgium"
36,36,"Li, J",Apr 2020 ,QoE-Driven Coupled Uplink and Downlink Rate Adaptation for 360-Degree Video Live Streaming,IEEE COMMUNICATIONS LETTERS,"360-degree video provides an immersive 360-degree viewing experience and has been widely used in many areas. The 360-degree video live streaming systems involve capturing, compression, uplink (camera to video server) and downlink (video server to user) transmissions. However, few studies have jointly investigated such complex systems, especially the rate adaptation for the coupled uplink and downlink in the 360-degree video streaming under limited bandwidth constraints. In this letter, we propose a quality of experience (QoE)-driven 360-degree video live streaming system, in which a video server performs rate adaptation based on the uplink and downlink bandwidths and information concerning each user's real-time field-of-view (FoV). We formulate it as a nonlinear integer programming problem and propose an algorithm, which combines the Karush-Kuhn-Tucker (KKT) condition and branch and bound method, to solve it. The numerical results show that the proposed optimization model can improve users' QoE significantly in comparison with other baseline schemes.Show less",https://www.webofscience.com/wos/woscc/full-record/WOS:000528817100034,https://www.webofscience.com/api/gateway?GWVersion=2&SrcAuth=OpenURL&SrcApp=WOS&DestURL=https%3A%2F%2Fwww.redi-bw.de%2Flinks%2Funist%3Furl_ver%3DZ39.88-2004%26url_ctx_fmt%3Dinfo%3Aofi%2Ffmt%3Akev%3Amtx%3Actx%26rft.atitle%3DQoE-Driven%2BCoupled%2BUplink%2Band%2BDownlink%2BRate%2BAdaptation%2Bfor%2B360-Degree%2BVideo%2BLive%2BStreaming%26rft.aufirst%3DJie%26rft.auinit%3DJ%26rft.aulast%3DLi%26rft.date%3D2020%26rft_id%3Dinfo%3Adoi%2F10.1109%252FLCOMM.2020.2966193%26rft.eissn%3D1558-2558%26rft.epage%3D867%26rft.genre%3Darticle%26rft.issn%3D1089-7798%26rft.issue%3D4%26rft.jtitle%3DIEEE%2BCOMMUNICATIONS%2BLETTERS%26rft_val_fmt%3Dinfo%3Aofi%2Ffmt%3Akev%3Amtx%3Ajournal%26rft.pages%3D863-867%26rfr_id%3Dinfo%3Asid%2Fwebofscience.com%3AWOS%3AWOS%26rft.spage%3D863%26rft.stitle%3DIEEE%2BCOMMUN%2BLETT%26rft.volume%3D24%26rft.au%3DLi%252C%2BJ%26rft.au%3DFeng%252C%2BRS%26rft.au%3DLi%252C%2BQY&DestApp=OTHER_OpenURL&SrcAppSID=EUW1ED0A842rfIDuzr9JRdDbngbvZ&SrcJTitle=IEEE+COMMUNICATIONS+LETTERS&SrcPubType=MD_FORMAT,10.1109/LCOMM.2020.2966193,"Virtual reality,360-degree video,video streaming,quality of experience,rate adaptation,Karush-Kuhn-Tucker condition,uplink",,,"Hefei Univ Technol, Sch Elect Engn & Automat, Hefei 23009, Peoples R China"
37,37,"Fischer, CD",May 20 2013 ,Hydrogen recovery from the purge stream of an HDA process using the concept of Mass Exchange Networks,INTERNATIONAL JOURNAL OF HYDROGEN ENERGY,"In this paper we use the concept of Mass Exchange Networks to design the hydrogen recovery from the purge stream of an HDA Process by implementing a recently proposed counter current gas permeation equipment to exchange hydrogen between the purge and the toluene feed to the process. This design would correspond to the final design refinement step in the Douglas [1,2] hierarchical process design procedure, proposed by Fischer and Iribarren [3]. The goal of this design is recovering part of the hydrogen available in the purge stream, and results in a process alternative different from other flow sheet recently proposed by Bouton and Luyben [4], also resorting to gas permeation membrane units, but in a traditional arrangement. Two different types of available zeolite ceramic membranes were studied, of different permeability and selectivity. The here proposed mass exchange design recovers a similar amount of hydrogen as the process alternative proposed by Bouton and Luyben [4] who use a less expensive type of polymeric membrane, but need a compressor to recycle the permeate stream because they use transmembrane pressure as the driving force. The here proposed design at actual cost of zeolite membranes allows an 153.9% increase of the Net Annual Savings with respect to the pressure driven membrane system when using the less selective ceramic membrane, while this figure descents to a 32.61% when using the most selective (which is also the most expensive alternative). Copyright (C) 2013, Hydrogen Energy Publications, LLC. Published by Elsevier Ltd. All rights reserved.Show less",https://www.webofscience.com/wos/woscc/full-record/WOS:000319233000012,https://www.webofscience.com/api/gateway?GWVersion=2&SrcAuth=OpenURL&SrcApp=WOS&DestURL=https%3A%2F%2Fwww.redi-bw.de%2Flinks%2Funist%3Furl_ver%3DZ39.88-2004%26url_ctx_fmt%3Dinfo%3Aofi%2Ffmt%3Akev%3Amtx%3Actx%26rft.atitle%3DHydrogen%2Brecovery%2Bfrom%2Bthe%2Bpurge%2Bstream%2Bof%2Ban%2BHDA%2Bprocess%2Busing%2Bthe%2Bconcept%2Bof%2BMass%2BExchange%2BNetworks%26rft.aufirst%3DCarlos%26rft.auinit%3DCD%26rft.aulast%3DDaniel%2BFischer%26rft.date%3D2013%26rft_id%3Dinfo%3Adoi%2F10.1016%252Fj.ijhydene.2013.03.055%26rft.eissn%3D1879-3487%26rft.epage%3D6390%26rft.genre%3Darticle%26rft.issn%3D0360-3199%26rft.issue%3D15%26rft.jtitle%3DINTERNATIONAL%2BJOURNAL%2BOF%2BHYDROGEN%2BENERGY%26rft_val_fmt%3Dinfo%3Aofi%2Ffmt%3Akev%3Amtx%3Ajournal%26rft.pages%3D6381-6390%26rfr_id%3Dinfo%3Asid%2Fwebofscience.com%3AWOS%3AWOS%26rft.spage%3D6381%26rft.stitle%3DINT%2BJ%2BHYDROGEN%2BENERG%26rft.volume%3D38%26rft.au%3DFischer%252C%2BCD%26rft.au%3DIribarren%252C%2BOA&DestApp=OTHER_OpenURL&SrcAppSID=EUW1ED0A842rfIDuzr9JRdDbngbvZ&SrcJTitle=INTERNATIONAL+JOURNAL+OF+HYDROGEN+ENERGY&SrcPubType=MD_FORMAT,10.1016/j.ijhydene.2013.03.055,"HDA,Hydrogen,Mass exchange,Recovery,Mass integration","MEMBRANES,DESIGN",,"INGAR CONICET UTN, Inst Proc Design & Dev, Avellaneda 3657, RA-3000 Santa Fe, Argentina"
