,Unnamed: 0,First author,Year,Title,Journal,Abstract,wos_link,fulltext_link,doi,Keywords,Plus keywords,Research areas,Corresponding address
16,16,"Ibrahim, A",Aug 1 2020 ,Estimating the Hyporheic Depth Beneath a Pool-Riffle Bedform Using the Rankine Body Analytical Method,JOURNAL OF HYDROLOGIC ENGINEERING,"The hyporheic zone connects groundwater and surface water allowing active exchange of water and solute, and thus plays a vital role in many hydrological and ecological processes. Many sophisticated high-dimensional models have been developed to study the hyporheic zone, but they require extensive site information and may involve significant time and effort to set up. This emphasizes the need for a preliminary characterization. This paper proposes an analytical model based on the Rankine body method to estimate the maximum hyporheic depth using minimal site information. The hydraulic conductivity of the alluvium is not needed, and for thick alluvium it is not necessary to know the location of any underlying impervious layer. Applied to an idealized pool-riffle sequence, the proposed method is able to calculate the maximum hyporheic depth to within 20% of those from a two-dimensional (2D) reference numerical model for a wide range of conditions. Comparable results are also achieved with other independent studies for hyporheic zone under various bedforms, surface flows, and alluvium conditions. The proposed method provides a quick estimate of the hyporheic depth, which would be useful in the design of a field data collection program and/or a numerical modeling study.Show less",https://www.webofscience.com/wos/woscc/full-record/WOS:000542680000002,https://www.webofscience.com/api/gateway?GWVersion=2&SrcAuth=OpenURL&SrcApp=WOS&DestURL=https%3A%2F%2Fwww.redi-bw.de%2Flinks%2Funist%3Furl_ver%3DZ39.88-2004%26url_ctx_fmt%3Dinfo%3Aofi%2Ffmt%3Akev%3Amtx%3Actx%26rft.artnum%3DARTN%2B04020034%26rft.atitle%3DEstimating%2Bthe%2BHyporheic%2BDepth%2BBeneath%2Ba%2BPool-Riffle%2BBedform%2BUsing%2Bthe%2BRankine%2BBody%2BAnalytical%2BMethod%26rft.aufirst%3DAhmad%26rft.auinit%3DA%26rft.aulast%3DIbrahim%26rft.date%3D2020%26rft_id%3Dinfo%3Adoi%2F10.1061%252F%2528ASCE%2529HE.1943-5584.0001944%26rft.eissn%3D1943-5584%26rft.genre%3Darticle%26rft.issn%3D1084-0699%26rft.issue%3D8%26rft.jtitle%3DJOURNAL%2BOF%2BHYDROLOGIC%2BENGINEERING%26rft_val_fmt%3Dinfo%3Aofi%2Ffmt%3Akev%3Amtx%3Ajournal%26rfr_id%3Dinfo%3Asid%2Fwebofscience.com%3AWOS%3AWOS%26rft.stitle%3DJ%2BHYDROL%2BENG%26rft.volume%3D25%26rft.au%3DIbrahim%252C%2BA%26rft.au%3DSteffler%252C%2BP%26rft.au%3DShe%252C%2BYT&DestApp=OTHER_OpenURL&SrcAppSID=EUW1ED0C934DBaBOmaBFvAACNzVIP&SrcJTitle=JOURNAL+OF+HYDROLOGIC+ENGINEERING&SrcPubType=MD_FORMAT,10.1061/(ASCE)HE.1943-5584.0001944,"Analytical model,Rankine body,Hyporheic zone delineation,Hyporheic depth,Coupled groundwater and surface water models,Pool-riffle bedform","BED FORMS,NONSORBING SOLUTES,STREAM,WATER,ZONE,FLOW,EXCHANGE,SCIENCE,MODEL",,"Univ Alberta, Dept Civil & Environm Engn, Edmonton, AB T6G 1H9, Canada"
17,17,"Phanikumar, MS",May 1 2007 ,Separating surface storage from hyporheic retention in natural streams using wavelet decomposition of acoustic Doppler current profiles,WATER RESOURCES RESEARCH,"The ability to separate surface storage (e.g., due to in-channel features such as eddies and pools) from retention due to hyporheic exchange is important in many solute transport considerations; however, current stream tracer approaches do not allow such separation. We examined transient storage processes in a fourth-order Michigan stream using tracer studies, numerical flow and transport models, and hydrodynamic data obtained from acoustic Doppler current profiler (ADCP) surveys. Since the high-resolution, three-dimensional velocity fields obtained from an ADCP relate to in-channel processes, we used wavelet decomposition to separate the flow into regions of slow and fast moving zones and to estimate the relative sizes of the main channel (A) and the storage zones (AS). Transport modeling based on the tracer data provided estimates of storage zone sizes that included contributions from both surface storage and hyporheic exchange. By coupling the estimates from tracer data with those obtained from an ADCP we were able to assess the relative importance of surface storage in different stream reaches. Estimated (A(S)/A) values in three test reaches ranged from 0.12 to 0.22, and transient storage residence times varied from approximately 4 min in a run reach dominated by surface storage (reach A) to about 13 min in a reach with some potential for hyporheic exchange (reach C). In reach A the (A(S)/A) values estimated from tracer and ADCP data were in good agreement, indicating that in-channel processes were the main mechanism responsible for storage in this reach. Reach C estimates, however, showed that surface storage (A(S)/A= 0.05) accounted for only a fraction of the transient storage estimated using tracer data (A(S)/A = 0.12), which indicated that hyporheic exchange contributed to transient storage in the reach. The wavelet decomposition approach based on the ADCP data provides a framework to better constrain transient storage models and to eliminate unrealistic parameters.Show less",https://www.webofscience.com/wos/woscc/full-record/WOS:000246309700004,https://www.webofscience.com/api/gateway?GWVersion=2&SrcAuth=OpenURL&SrcApp=WOS&DestURL=https%3A%2F%2Fwww.redi-bw.de%2Flinks%2Funist%3Furl_ver%3DZ39.88-2004%26url_ctx_fmt%3Dinfo%3Aofi%2Ffmt%3Akev%3Amtx%3Actx%26rft.artnum%3DARTN%2BW05406%26rft.atitle%3DSeparating%2Bsurface%2Bstorage%2Bfrom%2Bhyporheic%2Bretention%2Bin%2Bnatural%2Bstreams%2Busing%2Bwavelet%2Bdecomposition%2Bof%2Bacoustic%2BDoppler%2Bcurrent%2Bprofiles%26rft.aufirst%3DMantha%2BS.%26rft.auinit%3DMS%26rft.aulast%3DPhanikumar%26rft.date%3D2007%26rft_id%3Dinfo%3Adoi%2F10.1029%252F2006WR005104%26rft.eissn%3D1944-7973%26rft.genre%3Darticle%26rft.issn%3D0043-1397%26rft.issue%3D5%26rft.jtitle%3DWATER%2BRESOURCES%2BRESEARCH%26rft_val_fmt%3Dinfo%3Aofi%2Ffmt%3Akev%3Amtx%3Ajournal%26rfr_id%3Dinfo%3Asid%2Fwebofscience.com%3AWOS%3AWOS%26rft.stitle%3DWATER%2BRESOUR%2BRES%26rft.volume%3D43%26rft.au%3DPhanikumar%252C%2BMS%26rft.au%3DAslam%252C%2BI%26rft.au%3DVoice%252C%2BTC&DestApp=OTHER_OpenURL&SrcAppSID=EUW1ED0C934DBaBOmaBFvAACNzVIP&SrcJTitle=WATER+RESOURCES+RESEARCH&SrcPubType=MD_FORMAT,10.1029/2006WR005104,,"TRANSIENT STORAGE,LONGITUDINAL DISPERSION,SOLUTE TRANSPORT,MOUNTAIN STREAMS,WATER EXCHANGE,DEAD ZONE,MODEL,FLOW,DISTRIBUTIONS,RIVERS",,"Michigan State Univ, Dept Civil & Environm Engn, A130 Engn Res Complex, E Lansing, MI 48824 USA"
18,18,"Wang, Z",Jun 15 2022 ,Streambed microbial communities in the transition zone between groundwater and a first-order stream as impacted by bidirectional water exchange,WATER RESEARCH,"The input of nitrate and other agricultural pollutants in higher-order streams largely derives from first-order streams. The streambed as the transition zone between groundwater and stream water has a decisive impact on the attenuation of such pollutants. This reactivity is not yet well understood for lower-order agricultural streams, which are often anthropogenically altered and lack the streambed complexity allowing for extensive hyporheic exchange. Reactive hot spots in such streambeds have been hypothesized as a function of hydrology, which controls the local gaining (groundwater exfiltration) or losing (infiltration) of stream water. However, streambed microbial communities and activities associated with such reactive zones remain mostly uncharted. In this study, sediments of a first-order agriculturally impacted stream in southern Germany were investigated. Along with a hydraulic dissection of distinct gaining and losing reaches of the stream, community composition and the abundance of bacterial communities in the streambed were investigated using PacBio long-read sequencing of bacterial 16S rRNA gene amplicons, and qPCR of bacterial 16S rRNA and denitrification genes (nirK and nirS). We show that bidirectional water exchange between groundwater and the stream represents an important control for sediment microbiota, especially for nitrate-reducing populations. Typical heterotrophic denitrifiers were most abundant in a midstream net losing section, while up-and downstream net gaining sections were associated with an enrichment of sulfur-oxidizing potential nitrate reducers affiliated with Sulfuricurvum and Thiobacillus spp. Dispersal-based community assembly was found to dominate such spots of groundwater exfiltration. Our results indicate a coupling of N-and S-cycling processes in the streambed of an agricultural first-order stream, and a prominent control of microbiology by hydrology and hydrochemistry in situ. Such detailed local heterogeneities in exchange fluxes and streambed microbiomes have not been reported to date, but seem relevant for understanding the reactivity of lower-order streams.Show less",https://www.webofscience.com/wos/woscc/full-record/WOS:000795907900002,https://www.webofscience.com/api/gateway?GWVersion=2&SrcAuth=OpenURL&SrcApp=WOS&DestURL=https%3A%2F%2Fwww.redi-bw.de%2Flinks%2Funist%3Furl_ver%3DZ39.88-2004%26url_ctx_fmt%3Dinfo%3Aofi%2Ffmt%3Akev%3Amtx%3Actx%26rft.artnum%3DARTN%2B118334%26rft.atitle%3DStreambed%2Bmicrobial%2Bcommunities%2Bin%2Bthe%2Btransition%2Bzone%2Bbetween%2Bgroundwater%2Band%2Ba%2Bfirst-order%2Bstream%2Bas%2Bimpacted%2Bby%2Bbidirectional%2Bwater%2Bexchange%26rft.aufirst%3DZhe%26rft.auinit%3DZ%26rft.aulast%3DWang%26rft.date%3D2022%26rft_id%3Dinfo%3Adoi%2F10.1016%252Fj.watres.2022.118334%26rft.eissn%3D1879-2448%26rft.genre%3Darticle%26rft.issn%3D0043-1354%26rft.jtitle%3DWATER%2BRESEARCH%26rft_val_fmt%3Dinfo%3Aofi%2Ffmt%3Akev%3Amtx%3Ajournal%26rfr_id%3Dinfo%3Asid%2Fwebofscience.com%3AWOS%3AWOS%26rft.stitle%3DWATER%2BRES%26rft.volume%3D217%26rft.au%3DWang%252C%2BZ%26rft.au%3DJimenez-Fernandez%252C%2BO%26rft.au%3DLueders%252C%2BT&DestApp=OTHER_OpenURL&SrcAppSID=EUW1ED0C934DBaBOmaBFvAACNzVIP&SrcJTitle=WATER+RESEARCH&SrcPubType=MD_FORMAT,10.1016/j.watres.2022.118334,"Lower-order streams,Streambed microbiomes,Nitrate reduction,Losing and gaining stream,Groundwater-surface water exchange","SP-NOV.,HYPORHEIC ZONE,ASSEMBLY PROCESSES,NITRITE REDUCTASE,DRAINAGE DITCHES,NITRATE-REMOVAL,DENITRIFICATION,RIVER,DYNAMICS,STORAGE",,"Univ Bayreuth, Bayreuth Ctr Ecol & Environm Res BayCEER, Chair Ecol Microbiol, Bayreuth, Germany"
19,19,"Siergieiev, D",2015 ,Modelling hyporheic processes for regulated rivers under transient hydrological and hydrogeological conditions,HYDROLOGY AND EARTH SYSTEM SCIENCES,"Understanding the effects of major hydrogeological controls on hyporheic exchange and bank storage is essential for river water management, groundwater abstraction, restoration and ecosystem sustainability. Analytical models cannot adequately represent complex settings with, for example, transient boundary conditions, varying geometry of surface water-groundwater interface, unsaturated and overland flow, etc. To understand the influence of parameters such as (1) sloping river banks, (2) varying hydraulic conductivity of the riverbed and (3) different river discharge wave scenarios on hyporheic exchange characteristics such as (a) bank storage, (b) return flows and (c) residence time, a 2-D hydrogeological conceptual model and, subsequently, an adequate numerical model were developed. The numerical model was calibrated against observations in the aquifer adjacent to the hydropower-regulated Lule River, northern Sweden, which has predominantly diurnal discharge fluctuations during summer and long-lasting discharge peaks during autumn and winter. Modelling results revealed that bank storage increased with river wave amplitude, wave duration and smaller slope of the river bank, while maximum exchange flux decreased with wave duration. When a homogeneous clogging layer covered the entire river-aquifer interface, hydraulic conductivity positively affected bank storage. The presence of a clogging layer with hydraulic conductivity < 0.001 m d(-1) significantly reduced the exchange flows and virtually eliminated bank storage. The bank storage return/fill time ratio was positively related to wave amplitude and the hydraulic conductivity of the interface and negatively to wave duration and bank slope. Discharge oscillations with short duration and small amplitude decreased bank storage and, therefore, the hyporheic exchange, which has implications for solute fluxes, redox conditions and the potential of riverbeds as fish-spawning locations. Based on these results, river regulation strategies can be improved by considering the effect of certain wave event configurations on hyporheic exchange to ensure harmonious hydrogeochemical functioning of the river-aquifer interfaces and related ecosystems.Show less",https://www.webofscience.com/wos/woscc/full-record/WOS:000348929800018,https://www.webofscience.com/api/gateway?GWVersion=2&SrcAuth=OpenURL&SrcApp=WOS&DestURL=https%3A%2F%2Fwww.redi-bw.de%2Flinks%2Funist%3Furl_ver%3DZ39.88-2004%26url_ctx_fmt%3Dinfo%3Aofi%2Ffmt%3Akev%3Amtx%3Actx%26rft.atitle%3DModelling%2Bhyporheic%2Bprocesses%2Bfor%2Bregulated%2Brivers%2Bunder%2Btransient%2Bhydrological%2Band%2Bhydrogeological%2Bconditions%26rft.aufirst%3DD.%26rft.auinit%3DD%26rft.aulast%3DSiergieiev%26rft.date%3D2015%26rft_id%3Dinfo%3Adoi%2F10.5194%252Fhess-19-329-2015%26rft.eissn%3D1607-7938%26rft.epage%3D340%26rft.genre%3Darticle%26rft.issn%3D1027-5606%26rft.issue%3D1%26rft.jtitle%3DHYDROLOGY%2BAND%2BEARTH%2BSYSTEM%2BSCIENCES%26rft_val_fmt%3Dinfo%3Aofi%2Ffmt%3Akev%3Amtx%3Ajournal%26rft.pages%3D329-340%26rfr_id%3Dinfo%3Asid%2Fwebofscience.com%3AWOS%3AWOS%26rft.spage%3D329%26rft.stitle%3DHYDROL%2BEARTH%2BSYST%2BSC%26rft.volume%3D19%26rft.au%3DSiergieiev%252C%2BD%26rft.au%3DEhlert%252C%2BL%26rft.au%3DLiedl%252C%2BR&DestApp=OTHER_OpenURL&SrcAppSID=EUW1ED0C934DBaBOmaBFvAACNzVIP&SrcJTitle=HYDROLOGY+AND+EARTH+SYSTEM+SCIENCES&SrcPubType=MD_FORMAT,10.5194/hess-19-329-2015,,"FLOW REGULATION,SURFACE-WATER,BANK STORAGE,GROUNDWATER,ZONE,EXCHANGE,STAGE,DISCHARGE,RESPONSES,AQUIFER",,"Lulea Univ Technol, Div Geosci & Environm Engn, S-95187 Lulea, Sweden"
20,20,"Stonedahl, SH",Nov 2015 ,Visualizing Hyporheic Flow Through Bedforms Using Dye Experiments and Simulation,JOVE-JOURNAL OF VISUALIZED EXPERIMENTS,"Advective exchange between the pore space of sediments and the overlying water column, called hyporheic exchange in fluvial environments, drives solute transport in rivers and many important biogeochemical processes. To improve understanding of these processes through visual demonstration, we created a hyporheic flow simulation in the multi-agent computer modeling platform NetLogo. The simulation shows virtual tracer flowing through a streambed covered with two-dimensional bedforms. Sediment, flow, and bedform characteristics are used as input variables for the model. We illustrate how these simulations match experimental observations from laboratory flume experiments based on measured input parameters. Dye is injected into the flume sediments to visualize the porewater flow. For comparison virtual tracer particles are placed at the same locations in the simulation. This coupled simulation and lab experiment has been used successfully in undergraduate and graduate laboratories to directly visualize river-porewater interactions and show how physically-based flow simulations can reproduce environmental phenomena. Students took photographs of the bed through the transparent flume walls and compared them to shapes of the dye at the same times in the simulation. This resulted in very similar trends, which allowed the students to better understand both the flow patterns and the mathematical model. The simulations also allow the user to quickly visualize the impact of each input parameter by running multiple simulations. This process can also be used in research applications to illustrate basic processes, relate interfacial fluxes and porewater transport, and support quantitative process-based modeling.Show less",https://www.webofscience.com/wos/woscc/full-record/WOS:000368573900050,https://www.webofscience.com/api/gateway?GWVersion=2&SrcAuth=OpenURL&SrcApp=WOS&DestURL=https%3A%2F%2Fwww.redi-bw.de%2Flinks%2Funist%3Furl_ver%3DZ39.88-2004%26url_ctx_fmt%3Dinfo%3Aofi%2Ffmt%3Akev%3Amtx%3Actx%26rft.artnum%3DARTN%2Be53285%26rft.atitle%3DVisualizing%2BHyporheic%2BFlow%2BThrough%2BBedforms%2BUsing%2BDye%2BExperiments%2Band%2BSimulation%26rft.aufirst%3DSusa%2BH.%26rft.auinit%3DSH%26rft.aulast%3DStonedahl%26rft.date%3D2015%26rft_id%3Dinfo%3Adoi%2F10.3791%252F53285%26rft.genre%3Darticle%26rft.issn%3D1940-087X%26rft.issue%3D105%26rft.jtitle%3DJOVE-JOURNAL%2BOF%2BVISUALIZED%2BEXPERIMENTS%26rft_val_fmt%3Dinfo%3Aofi%2Ffmt%3Akev%3Amtx%3Ajournal%26rfr_id%3Dinfo%3Asid%2Fwebofscience.com%3AWOS%3AWOS%26rft.stitle%3DJOVE-J%2BVIS%2BEXP%26rft.au%3DStonedahl%252C%2BSH%26rft.au%3DRoche%252C%2BKR%26rft.au%3DPackman%252C%2BAI&DestApp=OTHER_OpenURL&SrcAppSID=EUW1ED0C934DBaBOmaBFvAACNzVIP&SrcJTitle=JOVE-JOURNAL+OF+VISUALIZED+EXPERIMENTS&SrcPubType=MD_FORMAT,10.3791/53285,"Engineering,Issue 105,Hyporheic,Flume,Bedforms,Simulation,Dye,Ripples,Solute","NONSORBING SOLUTES,EXCHANGE,STREAM,TRANSPORT,NITROGEN,IMPACT,CREEK",,"St Ambrose Univ, Engn & Phys Sci, Davenport, IA 52803 USA"
21,21,"Peyrard, D",Oct 15 2008 ,A coupled vertically integrated model to describe lateral exchanges between surface and subsurface in large alluvial floodplains with a fully penetrating river,HYDROLOGICAL PROCESSES,"This paper presents a vertically averaged model for studying water and solute exchanges between a large river and its adjacent alluvial aquifer flow. The hydrolic model couples horizontal 2D Saint Venant equation for river flow and a 2D Dupuit equation for aquifer flow. The dynamic coupling between river and aquifer is provided by continuity of fluxes and water level elevation between the two domains. Equations are solved simultaneously by linking the two hydrological system matrices in a single global matrix in order to ensure the continuity conditions between river and aquifer and to accurately model two-way coupling between these two domains. The model is applied to a large reach (about 36 km(2)) of the Garonne River (south-western France) and its floodplain, including an instrumented site in a meander. Simulated hydraulic heads are compared with experimental measurements on the Garonne River and aquifer in the floodplain. Model verification includes comparisons for one point sampling date (27 piezometers, 30 March 2000) and for hydraulic heads variations measured continuously over 5 months (5 piezometers, 1 June 2000). The model accurately reproduces the strong hydraulic connections between the Garonne River and its aquifer, which are confirmed by the simultaneous variation of the water level in the river and in piezometers located near the river bank. The simulations also confirmed that the model is able to reproduce ground water flow dynamics during flood events. Given these result, the hydraulic model was coupled with a solute-transport component, based on advection-dispersion equations, to investigate the theoretical dynamics of a conservative tracer over 5 years throughout the 36 km(2) reach studied. Meanders were shown to favour exchanges between river and aquifer, and although the tracer was diluted in the river, the contamination moved from the injection plots and affected both river banks. Copyright (c) 2008 John Wiley & Sons, Ltd.Show less",https://www.webofscience.com/wos/woscc/full-record/WOS:000260193500009,https://www.webofscience.com/api/gateway?GWVersion=2&SrcAuth=OpenURL&SrcApp=WOS&DestURL=https%3A%2F%2Fwww.redi-bw.de%2Flinks%2Funist%3Furl_ver%3DZ39.88-2004%26url_ctx_fmt%3Dinfo%3Aofi%2Ffmt%3Akev%3Amtx%3Actx%26rft.atitle%3DA%2Bcoupled%2Bvertically%2Bintegrated%2Bmodel%2Bto%2Bdescribe%2Blateral%2Bexchanges%2Bbetween%2Bsurface%2Band%2Bsubsurface%2Bin%2Blarge%2Balluvial%2Bfloodplains%2Bwith%2Ba%2Bfully%2Bpenetrating%2Briver%26rft.aufirst%3DD.%26rft.auinit%3DD%26rft.aulast%3DPeyrard%26rft.date%3D2008%26rft_id%3Dinfo%3Adoi%2F10.1002%252Fhyp.7035%26rft.eissn%3D1099-1085%26rft.epage%3D4273%26rft.genre%3Darticle%26rft.issn%3D0885-6087%26rft.issue%3D21%26rft.jtitle%3DHYDROLOGICAL%2BPROCESSES%26rft_val_fmt%3Dinfo%3Aofi%2Ffmt%3Akev%3Amtx%3Ajournal%26rft.pages%3D4257-4273%26rfr_id%3Dinfo%3Asid%2Fwebofscience.com%3AWOS%3AWOS%26rft.spage%3D4257%26rft.stitle%3DHYDROL%2BPROCESS%26rft.volume%3D22%26rft.au%3DPeyrard%252C%2BD%26rft.au%3DSauvage%252C%2BS%26rft.au%3DQuintard%252C%2BM&DestApp=OTHER_OpenURL&SrcAppSID=EUW1ED0C934DBaBOmaBFvAACNzVIP&SrcJTitle=HYDROLOGICAL+PROCESSES&SrcPubType=MD_FORMAT,10.1002/hyp.7035,"ecohydrology,river-aquifer interactions,transport,coupled model,Garonne River,2D Saint Venant,2D Dupuit","GARONNE RIVER,GROUNDWATER,WATER,DENITRIFICATION,STREAM,ZONE,SIMULATION,CATCHMENT,HYDROLOGY,WETLAND",,"Univ Toulouse 3, ENSAT, CNRS INP, Lab Ecol Fonct EcoLab,UMR 5245, Ave Agrobiopole BP 32607, F-31326 Castanet Tolosan, France"
22,22,"Ward, AS",Apr 2018 ,"Simulation of dynamic expansion, contraction, and connectivity in a mountain stream network",ADVANCES IN WATER RESOURCES,"Headwater stream networks expand and contract in response to changes in stream discharge. The changes in the extent of the stream network are also controlled by geologic or geomorphic setting - some reaches go dry even under relatively wet conditions, other reaches remain flowing under relatively dry conditions. While such patterns are well recognized, we currently lack tools to predict the extent of the stream network and the times and locations where the network is dry within large river networks. Here, we develop a perceptual model of the river corridor in a headwater mountainous catchment, translate this into a reduced-complexity mechanistic model, and implement the model to examine connectivity and network extent over an entire water year. Our model agreed reasonably well with our observations, showing that the extent and connectivity of the river network was most sensitive to hydrologic forcing under the lowest discharges (Q(gauge) < 1 L s(-1)), that at intermediate discharges (1 L s(-1) < Q(gauge) < 10 L s(-1)) the extent of the network changed dramatically with changes in discharge, and that under wet conditions (Q(gauge) > 10 L s(-1)) the extent of the network was relatively insensitive to hydrologic forcing and was instead determined by the network topology. We do not expect that the specific thresholds observed in this study would be transferable to other catchments with different geology, topology, or hydrologic forcing. However, we expect that the general pattern should be robust: the dominant controls will shift from hydrologic forcing to geologic setting as discharge increases. Furthermore, our method is readily transferable as the model can be applied with minimal data requirements (a single stream gauge, a digital terrain model, and estimates of hydrogeologic properties) to estimate flow duration or connectivity along the river corridor in unstudied catchments. As the available information increases, the model could be better calibrated to match site-specific observations of network extent, locations of dry reaches, or solute break through curves as demonstrated in this study. Based on the low initial data requirements and ability to later tune the model to a specific site, we suggest example applications of this parsimonious model that may prove useful to both researchers and managers. (C) 2018 Elsevier Ltd. All rights reserved.Show less",https://www.webofscience.com/wos/woscc/full-record/WOS:000427410700005,https://www.webofscience.com/api/gateway?GWVersion=2&SrcAuth=OpenURL&SrcApp=WOS&DestURL=https%3A%2F%2Fwww.redi-bw.de%2Flinks%2Funist%3Furl_ver%3DZ39.88-2004%26url_ctx_fmt%3Dinfo%3Aofi%2Ffmt%3Akev%3Amtx%3Actx%26rft.atitle%3DSimulation%2Bof%2Bdynamic%2Bexpansion%252C%2Bcontraction%252C%2Band%2Bconnectivity%2Bin%2Ba%2Bmountain%2Bstream%2Bnetwork%26rft.aufirst%3DAdam%2BS.%26rft.auinit%3DAS%26rft.aulast%3DWard%26rft.date%3D2018%26rft_id%3Dinfo%3Adoi%2F10.1016%252Fj.advwatres.2018.01.018%26rft.eissn%3D1872-9657%26rft.epage%3D82%26rft.genre%3Darticle%26rft.issn%3D0309-1708%26rft.jtitle%3DADVANCES%2BIN%2BWATER%2BRESOURCES%26rft_val_fmt%3Dinfo%3Aofi%2Ffmt%3Akev%3Amtx%3Ajournal%26rft.pages%3D64-82%26rfr_id%3Dinfo%3Asid%2Fwebofscience.com%3AWOS%3AWOS%26rft.spage%3D64%26rft.stitle%3DADV%2BWATER%2BRESOUR%26rft.volume%3D114%26rft.au%3DWard%252C%2BAS%26rft.au%3DSchmadel%252C%2BNM%26rft.au%3DWondzell%252C%2BSM&DestApp=OTHER_OpenURL&SrcAppSID=EUW1ED0C934DBaBOmaBFvAACNzVIP&SrcJTitle=ADVANCES+IN+WATER+RESOURCES&SrcPubType=MD_FORMAT,10.1016/j.advwatres.2018.01.018,"River corridor,Hyporheic,Solute tracer,Riparian,Network,Stream","HYPORHEIC EXCHANGE FLOW,SANTA-CLARA COUNTY,COBBLE-BED STREAM,TRANSIENT-STORAGE,SOLUTE TRANSPORT,GROUNDWATER EXCHANGE,NONSORBING SOLUTES,CASCADE MOUNTAINS,UVAS CREEK,RIVER",,"Indiana Univ, Sch Publ & Environm Affairs, Bloomington, IN 47405 USA"
