,Unnamed: 0,First author,Year,Title,Journal,Abstract,wos_link,fulltext_link,doi,Keywords,Plus keywords,Research areas,Corresponding address
0,0,"Kasahara, T",2009 ,Treating causes not symptoms: restoration of surface-groundwater interactions in rivers,MARINE AND FRESHWATER RESEARCH,"Many river restoration projects seek to address issues associated with impaired hydrological and ecological connectivity in longitudinal (e. g. effects of dams, weirs) or lateral (e. g. alienated floodplain) dimensions. Efforts to restore the vertical dimension of impaired stream-groundwater exchange are rare, hampered by limited understanding of the factors controlling this linkage in natural alluvial rivers. We propose a simplified two-axis model of the 'primary drivers' (sediment structure and vertical hydraulic gradient) of stream-groundwater exchange that acknowledges their interaction and provides a practical template to help researchers and river managers pose hypothesis-driven solutions to restoration of damaged or lost vertical connectivity. Many human activities impact on one or both of these drivers, and we review some of the tools available for treating the causes (rather than symptoms) in impacted stream reaches. For example, creating riffle-pool sequences along stream reaches will enhance vertical hydraulic gradient, whereas flushing flows can remove clogging layers and sustain sediment permeability. Our model is a first step to specifying mechanisms for recovery of lost vertical connectivity. Assessing results of river restoration using this approach at reach to catchment scales will provide scientific insights into the interplay of hydrology, fluvial geomorphology and river ecosystem function at appropriately broad scales.Show less",https://www.webofscience.com/wos/woscc/full-record/WOS:000270029800012,https://www.webofscience.com/api/gateway?GWVersion=2&SrcAuth=OpenURL&SrcApp=WOS&DestURL=https%3A%2F%2Fwww.redi-bw.de%2Flinks%2Funist%3Furl_ver%3DZ39.88-2004%26url_ctx_fmt%3Dinfo%3Aofi%2Ffmt%3Akev%3Amtx%3Actx%26rft.atitle%3DTreating%2Bcauses%2Bnot%2Bsymptoms%253A%2Brestoration%2Bof%2Bsurface-groundwater%2Binteractions%2Bin%2Brivers%26rft.aufirst%3DTamao%26rft.auinit%3DT%26rft.aulast%3DKasahara%26rft.date%3D2009%26rft_id%3Dinfo%3Adoi%2F10.1071%252FMF09047%26rft.eissn%3D1448-6059%26rft.epage%3D981%26rft.genre%3Darticle%26rft.issn%3D1323-1650%26rft.issue%3D9%26rft.jtitle%3DMARINE%2BAND%2BFRESHWATER%2BRESEARCH%26rft_val_fmt%3Dinfo%3Aofi%2Ffmt%3Akev%3Amtx%3Ajournal%26rft.pages%3D976-981%26rfr_id%3Dinfo%3Asid%2Fwebofscience.com%3AWOS%3AWOS%26rft.spage%3D976%26rft.stitle%3DMAR%2BFRESHWATER%2BRES%26rft.volume%3D60%26rft.au%3DKasahara%252C%2BT%26rft.au%3DDatry%252C%2BT%26rft.au%3DBoulton%252C%2BAJ&DestApp=OTHER_OpenURL&SrcAppSID=EUW1ED0C934DBaBOmaBFvAACNzVIP&SrcJTitle=MARINE+AND+FRESHWATER+RESEARCH&SrcPubType=MD_FORMAT,10.1071/MF09047,"conservation,groundwater,hydrological exchange,hyporheic zone,river health,river restoration,sediment structure","SUBSURFACE WATER EXCHANGE,HYPORHEIC ZONE,LOW-ENERGY,STREAM,MODEL,ASSEMBLAGES,TRANSPORT,QUALITY,SYSTEM,DEBRIS",,"Mahidol Univ, Fac Environm & Resource Studies, 999 Phuttamonthon 4 Rd, Nakhon Pathom 73170, Thailand"
1,1,"Denfeld, BA",2013 ,"Summer CO2 evasion from streams and rivers in the Kolyma River basin, north-east Siberia",POLAR RESEARCH,"Inland water systems are generally supersaturated in carbon dioxide (CO2) and are increasingly recognized as playing an important role in the global carbon cycle. The Arctic may be particularly important in this respect, given the abundance of inland waters and carbon contained in Arctic soils; however, a lack of trace gas measurements from small streams in the Arctic currently limits this understanding. We investigated the spatial variability of CO2 evasion during the summer low-flow period from streams and rivers in the northern portion of the Kolyma River basin in north-eastern Siberia. To this end, partial pressure of carbon dioxide (pCO(2)) and gas exchange velocities (k) were measured at a diverse set of streams and rivers to calculate CO2 evasion fluxes. We combined these CO2 evasion estimates with satellite remote sensing and geographic information system techniques to calculate total areal CO2 emissions. Our results show that small streams are substantial sources of atmospheric CO2 owing to high pCO(2) and k, despite being a small portion of total inland water surface area. In contrast, large rivers were generally near equilibrium with atmospheric CO2. Extrapolating our findings across the Panteleikha - Ambolikha sub-watersheds demonstrated that small streams play a major role in CO2 evasion, accounting for 86% of the total summer CO2 emissions from inland waters within these two sub-watersheds. Further expansion of these regional CO2 emission estimates across time and space will be critical to accurately quantify and understand the role of Arctic streams and rivers in the global carbon budget.Show less",https://www.webofscience.com/wos/woscc/full-record/WOS:000328488200001,https://www.webofscience.com/api/gateway?GWVersion=2&SrcAuth=OpenURL&SrcApp=WOS&DestURL=https%3A%2F%2Fwww.redi-bw.de%2Flinks%2Funist%3Furl_ver%3DZ39.88-2004%26url_ctx_fmt%3Dinfo%3Aofi%2Ffmt%3Akev%3Amtx%3Actx%26rft.artnum%3DARTN%2B19704%26rft.atitle%3DSummer%2BCO2%2Bevasion%2Bfrom%2Bstreams%2Band%2Brivers%2Bin%2Bthe%2BKolyma%2BRiver%2Bbasin%252C%2Bnorth-east%2BSiberia%26rft.aufirst%3DBlaize%2BA.%26rft.auinit%3DBA%26rft.aulast%3DDenfeld%26rft.date%3D2013%26rft_id%3Dinfo%3Adoi%2F10.3402%252Fpolar.v32i0.19704%26rft.eissn%3D1751-8369%26rft.genre%3Darticle%26rft.issn%3D0800-0395%26rft.jtitle%3DPOLAR%2BRESEARCH%26rft_val_fmt%3Dinfo%3Aofi%2Ffmt%3Akev%3Amtx%3Ajournal%26rfr_id%3Dinfo%3Asid%2Fwebofscience.com%3AWOS%3AWOS%26rft.stitle%3DPOLAR%2BRES%26rft.volume%3D32%26rft.au%3DDenfeld%252C%2BBA%26rft.au%3DFrey%252C%2BKE%26rft.au%3DHolmes%252C%2BRM&DestApp=OTHER_OpenURL&SrcAppSID=EUW1ED0C934DBaBOmaBFvAACNzVIP&SrcJTitle=POLAR+RESEARCH&SrcPubType=MD_FORMAT,10.3402/polar.v32i0.19704,"Arctic streams and rivers,CO2 evasion,inland water surface area,Kolyma River,pCO(2),Siberia","DISSOLVED ORGANIC-CARBON,DIOXIDE,PERMAFROST,SUPERSATURATION,DYNAMICS,WATERS,LAKES,CH4",,"Clark Univ, Grad Sch Geog, 950 Main St, Worcester, MA 01610 USA"
2,2,"Lewin, J",Jun 15 2014 ,Defining large river channel patterns: Alluvial exchange and plurality,GEOMORPHOLOGY,"Large rivers have anabranching channels with components that may be defined as braided, meandering or straight. This paper shows that application of such holistic terminologies is complicated by recognition of within-type and transitional-type variety, a confusingly varied use of terms, and a coverage of pattern characteristics that for many large rivers is incomplete. In natural states, big rivers can be plural systems in which main, accessory, tributary and floodplain channels and lakes differ functionally and vary in terms of morphological dynamics. A distinction is drawn between the hydrological and geomorphological connectivity of components in big river plural systems. At any one time, even at flood stage, only some channels are geomorphologically active. Six types of geomorphological connectivity are described that range from coupled, through to partially-coupled and decoupled. The interplay between geomorphological and hydrological connectivity in large rivers is shown to determine habitat status and therefore ecological diversity. For improved understanding of the dynamics as well as the forms of these large composite systems, it is helpful to: (1) adopt element-level specification, not only for sediment bodies, but also for functioning channels; (2) track the sediment transfer processes and exchanges that produce channel forms over the highly varied timescales operating within large rivers; and (3) recognise the ways in which partially coupled and connected geomorphological systems produce naturally a composite set of forms at different rates. Such augmenting information will provide an improved platform for both river management and ecological understanding. (C) 2013 Elsevier B.V. All rights reserved.Show less",https://www.webofscience.com/wos/woscc/full-record/WOS:000336703400008,https://www.webofscience.com/api/gateway?GWVersion=2&SrcAuth=OpenURL&SrcApp=WOS&DestURL=https%3A%2F%2Fwww.redi-bw.de%2Flinks%2Funist%3Furl_ver%3DZ39.88-2004%26url_ctx_fmt%3Dinfo%3Aofi%2Ffmt%3Akev%3Amtx%3Actx%26rft.atitle%3DDefining%2Blarge%2Briver%2Bchannel%2Bpatterns%253A%2BAlluvial%2Bexchange%2Band%2Bplurality%26rft.aufirst%3DJohn%26rft.auinit%3DJ%26rft.aulast%3DLewin%26rft.date%3D2014%26rft_id%3Dinfo%3Adoi%2F10.1016%252Fj.geomorph.2013.02.024%26rft.eissn%3D1872-695X%26rft.epage%3D98%26rft.genre%3Darticle%26rft.issn%3D0169-555X%26rft.jtitle%3DGEOMORPHOLOGY%26rft_val_fmt%3Dinfo%3Aofi%2Ffmt%3Akev%3Amtx%3Ajournal%26rft.pages%3D83-98%26rfr_id%3Dinfo%3Asid%2Fwebofscience.com%3AWOS%3AWOS%26rft.spage%3D83%26rft.stitle%3DGEOMORPHOLOGY%26rft.volume%3D215%26rft.au%3DLewin%252C%2BJ%26rft.au%3DAshworth%252C%2BPJ&DestApp=OTHER_OpenURL&SrcAppSID=EUW1ED0C934DBaBOmaBFvAACNzVIP&SrcJTitle=GEOMORPHOLOGY&SrcPubType=MD_FORMAT,10.1016/j.geomorph.2013.02.024,"Fluvial geomorphology,Big rivers,River channel patterns,Classification,Channel-floodplain coupling,River management","SAND BRAID-BAR,BRITISH-COLUMBIA,SEDIMENTARY PROCESSES,SQUAMISH RIVER,JAMUNA RIVER,AMAZON RIVER,RIO PARANA,BED,EVOLUTION,DYNAMICS",,"Aberystwyth Univ, Inst Geog & Earth Sci, Aberystwyth SY23 3DB, Dyfed, Wales"
3,3,"Schmitgen, LM",Dec 2021 ,Model Choice Impacts the Quantification of Seasonal Hyporheic Exchange Depths and Fluxes,WATER RESOURCES RESEARCH,"Direction and depths of hyporheic exchange fluxes at the groundwater - surface water interface are drivers of biogeochemical processes influencing nutrient cycling and water quality. Model concepts on the dynamic relationship between hyporheic exchange fluxes and exchange depth are typically based on the assumption of a linear relationship between both measures. Here, we quantify seasonal and episodic variations of hyporheic exchange fluxes and hyporheic exchange depths with methods of heat tracing. Numerically (FLUX-BOT) and analytically (VFLUX; method based on temperature amplitude dampening developed by Hatch et al., 2006, https://doi.org/10.1029/2005wr004787) working program scripts were used to solve the one-dimensional conduction-advection-dispersion equation and compute hyporheic flux rates from three vertical sediment water temperature profiles recorded continuously in a small low mountain creek between 2011 and 2017. By comparing the behavior of two differing water temperature-based modeling approaches, dissimilarities in the sensitivity to sediment thermal properties were identified. Besides the differences in parameter responsivity differences in how the temperature data is incorporated, explain deviating behavior of the models regarding exchange flux and depth calculations. We show that the vertical extension of hyporheic exchange depth has a distinctive seasonal pattern over seven years, which differs according to the positioning in the riffle-pool-sequence. Surface water levels, groundwater levels and stream discharges show significant correlations with both flux direction and hyporheic zone extension. Temperature derived flux data allowed for establishing a significant relationship between hyporheic exchange fluxes and hyporheic exchange depths.Show less",https://www.webofscience.com/wos/woscc/full-record/WOS:000735901700067,https://www.webofscience.com/api/gateway?GWVersion=2&SrcAuth=OpenURL&SrcApp=WOS&DestURL=https%3A%2F%2Fwww.redi-bw.de%2Flinks%2Funist%3Furl_ver%3DZ39.88-2004%26url_ctx_fmt%3Dinfo%3Aofi%2Ffmt%3Akev%3Amtx%3Actx%26rft.artnum%3DARTN%2Be2021WR030298%26rft.atitle%3DModel%2BChoice%2BImpacts%2Bthe%2BQuantification%2Bof%2BSeasonal%2BHyporheic%2BExchange%2BDepths%2Band%2BFluxes%26rft.aufirst%3DLara-Maria%26rft.auinit%3DLM%26rft.aulast%3DSchmitgen%26rft.date%3D2021%26rft_id%3Dinfo%3Adoi%2F10.1029%252F2021WR030298%26rft.eissn%3D1944-7973%26rft.genre%3Darticle%26rft.issn%3D0043-1397%26rft.issue%3D12%26rft.jtitle%3DWATER%2BRESOURCES%2BRESEARCH%26rft_val_fmt%3Dinfo%3Aofi%2Ffmt%3Akev%3Amtx%3Ajournal%26rfr_id%3Dinfo%3Asid%2Fwebofscience.com%3AWOS%3AWOS%26rft.stitle%3DWATER%2BRESOUR%2BRES%26rft.volume%3D57%26rft.au%3DSchmitgen%252C%2BLM%26rft.au%3DBierl%252C%2BR%26rft.au%3DSchuetz%252C%2BT&DestApp=OTHER_OpenURL&SrcAppSID=EUW1ED0C934DBaBOmaBFvAACNzVIP&SrcJTitle=WATER+RESOURCES+RESEARCH&SrcPubType=MD_FORMAT,10.1029/2021WR030298,,"TEMPERATURE TIME-SERIES,WATER FLUX,THERMAL-DIFFUSIVITY,RESIDENCE TIMES,GROUNDWATER,ZONE,STREAM,HEAT,FLOW,VARIABILITY",,"Univ Trier, Dept Hydrol, Fac Reg & Environm Sci, Trier, Germany"
4,4,"Zimmer, MA",Mar 2015 ,Pre- and postrestoration assessment of stream water-groundwater interactions: effects on hydrological and chemical heterogeneity in the hyporheic zone,FRESHWATER SCIENCE,"Reach-scale stream restoration with natural channel design is often used to improve stream ecosystem structure and function. Some investigators have studied the effects of restoration on the hyporheic zone, but most used space-for-time substitution instead of comparing the same reach before and after restoration. We examined spatial patterns of hyporheic exchange rates and geochemistry during base flow in a 30-m pool-riffle-pool sequence before and 1 y after the stream was restored by installation of a cross-vane and engineered rock-riffle. Prerestoration vertical hyporheic exchange rates were relatively uniform across the riffle bedform. Average downwelling was 30 cm/d at or upstream of the riffle, and average upwelling was 30 cm/d downstream of the riffle. Downwelling hyporheic exchange rates increased up to an order of magnitude adjacent to the cross-vane and in the engineered rock-riffle. Prerestoration porewater [NO3-] was distributed along a wide and continuous gradient (0.1-3.8 mg/L), with higher concentrations in areas of downwelling and lower concentrations in areas of upwelling. Postrestoration [NO3-] was distributed bimodally with relatively high concentrations (>1.6 mg/L) adjacent to the cross-vane and low concentrations (<1 mg/L) elsewhere. These results suggest that rapid flushing of surface water through the subsurface creates residence times too short to yield net changes in [NO3-] along flow paths around the cross-vane. Distinct zones of groundwater upwelling were present before and after restoration, but the size of the zone of upwelling increased downstream of the cross-vane after restoration, possibly because higher permeability material was placed over the original, lower permeability sediment during restoration, creating an effective anisotropy that favored horizontal flow and produced larger apparent zones of groundwater discharge.Show less",https://www.webofscience.com/wos/woscc/full-record/WOS:000349995000022,https://www.webofscience.com/api/gateway?GWVersion=2&SrcAuth=OpenURL&SrcApp=WOS&DestURL=https%3A%2F%2Fwww.redi-bw.de%2Flinks%2Funist%3Furl_ver%3DZ39.88-2004%26url_ctx_fmt%3Dinfo%3Aofi%2Ffmt%3Akev%3Amtx%3Actx%26rft.atitle%3DPre-%2Band%2Bpostrestoration%2Bassessment%2Bof%2Bstream%2Bwater-groundwater%2Binteractions%253A%2Beffects%2Bon%2Bhydrological%2Band%2Bchemical%2Bheterogeneity%2Bin%2Bthe%2Bhyporheic%2Bzone%26rft.aufirst%3DMargaret%2BA.%26rft.auinit%3DMA%26rft.aulast%3DZimmer%26rft.date%3D2015%26rft_id%3Dinfo%3Adoi%2F10.1086%252F679514%26rft.eissn%3D2161-9565%26rft.epage%3D300%26rft.genre%3Darticle%26rft.issn%3D2161-9549%26rft.issue%3D1%26rft.jtitle%3DFRESHWATER%2BSCIENCE%26rft_val_fmt%3Dinfo%3Aofi%2Ffmt%3Akev%3Amtx%3Ajournal%26rft.pages%3D287-300%26rfr_id%3Dinfo%3Asid%2Fwebofscience.com%3AWOS%3AWOS%26rft.spage%3D287%26rft.stitle%3DFRESHW%2BSCI%26rft.volume%3D34%26rft.au%3DZimmer%252C%2BMA%26rft.au%3DLautz%252C%2BLK&DestApp=OTHER_OpenURL&SrcAppSID=EUW1ED0C934DBaBOmaBFvAACNzVIP&SrcJTitle=FRESHWATER+SCIENCE&SrcPubType=MD_FORMAT,10.1086/679514,"surface-water-groundwater interactions,restoration,biogeochemistry,stream bed,Natural Channel Design,cross-vane,engineered rock-riffle","FRESH-WATER,ISOTOPIC FRACTIONATION,BED FORMS,EXCHANGE,RESTORATION,CHANNEL,RIVERS,EQUILIBRIUM,PERSPECTIVE,PATTERNS",,"Duke Univ, Div Earth & Ocean Sci, Durham, NC 27708 USA"
5,5,"TRISKA, FJ",Apr 1993 ,PATTERNS OF HYDROLOGICAL EXCHANGE AND NUTRIENT TRANSFORMATION IN THE HYPORHEIC ZONE OF A GRAVEL-BOTTOM STREAM - EXAMINING TERRESTRIAL AQUATIC LINKAGES,FRESHWATER BIOLOGY,"1. The terrestrial-aquatic interface beneath a riparian corridor was investigated as a region of hydrological and biological control of nutrient flux. Subsurface flow paths were defined from the channel toward the riparian zone and also from the riparian zone toward the channel using tracer-injection studies. Solute transport had a rapid channel component (m min-1) and a slow hyporheic flow component (m h-1, m day-1). Subsurface flow beneath the riparian zone approximated a straight path entering at meanders but could also cross beneath the stream, possibly using relic channels.2. Dissolved oxygen (DO) concentration in the hyporheic zone ranged from < 1.0 to 9.5 mg l-1 due to permeability variations in bankside sediments. DO concentration was related to the proportion of stream water in the lateral hyporheic zone, indicating that the channel water was the DO source.3. The magnitude and timing of lateral water exchange was linked to previously published studies of nitrification and denitrification. Both nitrification potential and channel exchange decreased with distance from the channel and were absent at sites lacking effective exchange, due to low DO. Field amendment of ammonium to an aerobic flow path indicated nitrification potential under natural hydrological conditions. Denitrification potential was inversely related to channel exchange and was insignificant in channel sediments. Field amendment of acetylene plus nitrate to a flow path with low DO and minimal channel exchange indicated denitrification of amended nitrate.4. Comparison of hydraulic head to distribution of the biologically important solutes DO, ammonium, and nitrate was useful for interpreting previous findings and conceptualizing the riparian zone as a functioning ecotone between terrestrial and aquatic systems.Show less",https://www.webofscience.com/wos/woscc/full-record/WOS:A1993KY58300008,https://www.webofscience.com/api/gateway?GWVersion=2&SrcAuth=OpenURL&SrcApp=WOS&DestURL=https%3A%2F%2Fwww.redi-bw.de%2Flinks%2Funist%3Furl_ver%3DZ39.88-2004%26url_ctx_fmt%3Dinfo%3Aofi%2Ffmt%3Akev%3Amtx%3Actx%26rft.atitle%3DPATTERNS%2BOF%2BHYDROLOGICAL%2BEXCHANGE%2BAND%2BNUTRIENT%2BTRANSFORMATION%2BIN%2BTHE%2BHYPORHEIC%2BZONE%2BOF%2BA%2BGRAVEL-BOTTOM%2BSTREAM%2B-%2BEXAMINING%2BTERRESTRIAL%2BAQUATIC%2BLINKAGES%26rft.aufirst%3DFJ%26rft.auinit%3DFJ%26rft.aulast%3DTRISKA%26rft.date%3D1993%26rft_id%3Dinfo%3Adoi%2F10.1111%252Fj.1365-2427.1993.tb00762.x%26rft.eissn%3D1365-2427%26rft.epage%3D274%26rft.genre%3Darticle%26rft.issn%3D0046-5070%26rft.issue%3D2%26rft.jtitle%3DFRESHWATER%2BBIOLOGY%26rft_val_fmt%3Dinfo%3Aofi%2Ffmt%3Akev%3Amtx%3Ajournal%26rft.pages%3D259-274%26rfr_id%3Dinfo%3Asid%2Fwebofscience.com%3AWOS%3AWOS%26rft.spage%3D259%26rft.stitle%3DFRESHWATER%2BBIOL%26rft.volume%3D29%26rft.au%3DTRISKA%252C%2BFJ%26rft.au%3DDUFF%252C%2BJH%26rft.au%3DAVANZINO%252C%2BRJ&DestApp=OTHER_OpenURL&SrcAppSID=EUW1ED0C934DBaBOmaBFvAACNzVIP&SrcJTitle=FRESHWATER+BIOLOGY&SrcPubType=MD_FORMAT,10.1111/j.1365-2427.1993.tb00762.x,,"3RD-ORDER STREAM,RETENTION,TRANSPORT,DYNAMICS,BUDGETS,CHANNEL,WATER,FLOW",,"US GEOL SURVEY, DIV WATER RESOURCES, 345 MIDDLEFIELD RD, MENLO PK, CA 94025 USA"
6,6,"Salehin, M",Sep 2003 ,Comparison of transient storage in vegetated and unvegetated reaches of a small agricultural stream in Sweden: seasonal variation and anthropogenic manipulation,ADVANCES IN WATER RESOURCES,"In this work, we compare solute transport and hyporheic exchange in vegetated and unvegetated reaches of Sava Brook, an agricultural stream in Sweden subject to extreme variations in channel vegetation and morphology due to both natural seasonal effects and anthropogenic manipulation. A solute injection experiment was conducted in September, 2001 (late summer), at which time there was extensive in-channel vegetation in upstream reaches but none in downstream reaches due to channel excavation by farmers. Experimental results are interpreted using both the advective storage path model and the transient storage model. Results from the vegetated and excavated reaches of the stream are compared both with each other and with the results of a previous experiment conducted in April, 1998 (early spring), when the stream was not excavated but there was only minimal vegetation present in the area due to natural seasonal effects. Results from the two injection experiments are compared by using scaled parameters that appropriately include the effects of stream velocity and depth on hyporheic exchange. This analysis indicates that the variation of solute storage time in all non-excavated agricultural reaches is attributable to differences in stream flow depth, velocity, and the hydraulic conductivity of the streambed sediments. Mixing in vegetated reaches is characterized by rapid exchange and considerable lag of the mean solute peak relative to the mean channel velocity. In addition, excavation altered the stream channel geometry so as to increase the storage time of solutes and reduce the effective exchange rate. This work indicates the need to consider the effect of specific processes when analyzing hyporheic exchange using tracer-injection methods, and supports the use of model frameworks with the potential to explicitly include different formulations for various hyporheic and dead zone transport processes. (C) 2003 Elsevier Ltd. All rights reserved.Show less",https://www.webofscience.com/wos/woscc/full-record/WOS:000185236900005,https://www.webofscience.com/api/gateway?GWVersion=2&SrcAuth=OpenURL&SrcApp=WOS&DestURL=https%3A%2F%2Fwww.redi-bw.de%2Flinks%2Funist%3Furl_ver%3DZ39.88-2004%26url_ctx_fmt%3Dinfo%3Aofi%2Ffmt%3Akev%3Amtx%3Actx%26rft.atitle%3DComparison%2Bof%2Btransient%2Bstorage%2Bin%2Bvegetated%2Band%2Bunvegetated%2Breaches%2Bof%2Ba%2Bsmall%2Bagricultural%2Bstream%2Bin%2BSweden%253A%2Bseasonal%2Bvariation%2Band%2Banthropogenic%2Bmanipulation%26rft.aufirst%3DM%26rft.auinit%3DM%26rft.aulast%3DSalehin%26rft.date%3D2003%26rft_id%3Dinfo%3Adoi%2F10.1016%252FS0309-1708%252803%252900084-8%26rft.eissn%3D1872-9657%26rft.epage%3D964%26rft.genre%3Darticle%26rft.issn%3D0309-1708%26rft.issue%3D9%26rft.jtitle%3DADVANCES%2BIN%2BWATER%2BRESOURCES%26rft_val_fmt%3Dinfo%3Aofi%2Ffmt%3Akev%3Amtx%3Ajournal%26rft.pages%3D951-964%26rfr_id%3Dinfo%3Asid%2Fwebofscience.com%3AWOS%3AWOS%26rft.spage%3D951%26rft.stitle%3DADV%2BWATER%2BRESOUR%26rft.volume%3D26%26rft.au%3DSalehin%252C%2BM%26rft.au%3DPackman%252C%2BAI%26rft.au%3DWorman%252C%2BA&DestApp=OTHER_OpenURL&SrcAppSID=EUW1ED0C934DBaBOmaBFvAACNzVIP&SrcJTitle=ADVANCES+IN+WATER+RESOURCES&SrcPubType=MD_FORMAT,10.1016/S0309-1708(03)00084-8,"surface water hydrology,solute transport,tracer methods,stream-groundwater interactions,hyporheic exchange,vegetation","NONSORBING SOLUTES,TRANSPORT,EXCHANGE,IODIDE,FLOW,DISINFECTION,OXIDATION,MODEL",,"Northwestern Univ, Dept Civil & Environm Engn, Evanston, IL 60208 USA"
7,7,"Zhang, JL",2017 ,"Quantifying the Spatial Variations of Hyporheic Water Exchange at Catchment Scale Using the Thermal Method: A Case Study in the Weihe River, China",ADVANCES IN METEOROLOGY,"Understanding the dynamics of hyporheic water exchange (HWE) has been limited by the hydrological heterogeneity at large catchment scale. The thermal method has been widely used to understand water exchange patterns in a hyporheic zone. This study was conducted in theWeihe River catchment in Shaanxi Province, China. A conceptual model was developed to determine water transfer patterns, and a one-dimensional heat diffusion-advection equation was employed to estimate vertical fluxes of ten different segments in the hyporheic zone in various ten segments of the catchment. The amount of water exchange varied from 78.47 mm/d to 23.66 mm/d and a decreasing trend from the upstream to downstream of catchment was observed. The spatial correlation of variability between the water exchange and distance is 0.62. The results indicate that mountain's topography trend is the primary driver influencing the distribution of river tributaries, and the water exchange amount has a decreasing trend from upstream to downstream of the main river channel.Show less",https://www.webofscience.com/wos/woscc/full-record/WOS:000396850800001,https://www.webofscience.com/api/gateway?GWVersion=2&SrcAuth=OpenURL&SrcApp=WOS&DestURL=https%3A%2F%2Fwww.redi-bw.de%2Flinks%2Funist%3Furl_ver%3DZ39.88-2004%26url_ctx_fmt%3Dinfo%3Aofi%2Ffmt%3Akev%3Amtx%3Actx%26rft.artnum%3DARTN%2B6159325%26rft.atitle%3DQuantifying%2Bthe%2BSpatial%2BVariations%2Bof%2BHyporheic%2BWater%2BExchange%2Bat%2BCatchment%2BScale%2BUsing%2Bthe%2BThermal%2BMethod%253A%2BA%2BCase%2BStudy%2Bin%2Bthe%2BWeihe%2BRiver%252C%2BChina%26rft.aufirst%3DJunlong%26rft.auinit%3DJL%26rft.aulast%3DZhang%26rft.date%3D2017%26rft_id%3Dinfo%3Adoi%2F10.1155%252F2017%252F6159325%26rft.eissn%3D1687-9317%26rft.genre%3Darticle%26rft.issn%3D1687-9309%26rft.jtitle%3DADVANCES%2BIN%2BMETEOROLOGY%26rft_val_fmt%3Dinfo%3Aofi%2Ffmt%3Akev%3Amtx%3Ajournal%26rfr_id%3Dinfo%3Asid%2Fwebofscience.com%3AWOS%3AWOS%26rft.stitle%3DADV%2BMETEOROL%26rft.volume%3D2017%26rft.au%3DZhang%252C%2BJL%26rft.au%3DSong%252C%2BJX%26rft.au%3DWang%252C%2BYY&DestApp=OTHER_OpenURL&SrcAppSID=EUW1ED0C934DBaBOmaBFvAACNzVIP&SrcJTitle=ADVANCES+IN+METEOROLOGY&SrcPubType=MD_FORMAT,10.1155/2017/6159325,,"SURFACE-WATER,GROUNDWATER,STREAM,TEMPERATURE,AQUIFER,HEAT,FLUX,FLOW,VARIABILITY,TOPOGRAPHY",,"Northwest Univ, Coll Urban & Environm Sci, Xian 710127, Peoples R China"
