,Unnamed: 0,First author,Year,Title,Journal,Abstract,wos_link,fulltext_link,doi,Keywords,Plus keywords,Research areas,Corresponding address
15,15,"Drincic, A",Oct 1 2018 ,Determination of hexavalent Cr in river sediments by speciated isotope dilution inductively coupled plasma mass spectrometry,SCIENCE OF THE TOTAL ENVIRONMENT,"During a sampling campaign in September 2015, elevated chromium (Cr) concentrations were observed in sediments of industrially exposed sites of the Sava River (stainless steel production and impact of metallurgic industry). To verify if sediments also contained hazardous hexavalent Cr (Cr(VI)), there was a need to develop a sensitive and reliable analytical procedure for its determination. In the determination of Cr(VI) in environmental samples, it is necessary to evaluate the suitability of the applied analytical methodology for each individual sample matrix. In these studies, the use of isotopically enriched Cr tracers importantly contribute to the validity of the obtained results. In the present work, an analytical procedure was optimised for the extraction of total Cr(VI) from sediments and the content of Cr(VI) determined by high performance liquid chromatography coupled to inductively coupled plasma mass spectrometry (HPLC-ICP-MS). To leach the total amount of Cr(VI) from sediments, an ultrasound-assisted extraction procedure was applied at 80 degrees C, using 2% NaOH + 3% Na2CO3 as the extraction solution. The addition of 0.4 mol L-1 MgCl2 prevented oxidation of Cr(III) during the extraction step. To control for species interconversion and for an accurate calculation of Cr(VI) concentration by speciated isotope dilution (ID)-ICP-MS, the alkaline extract was doubly spiked with enriched Cr-50(VI) and Cr-53(III). The accuracy of the determination of Cr(VI) was verified by analysing the certified referencematerial CRM041 (Cr(VI) in soil), and by spike recovery test. Low limits of detection (LOD) and quantification (LOQ) (1.25 and 4.0 ae g Cr(VI) kg(-1), respectively) and good repeatability of measurement (relative standard deviation better than +/- 4.8%) were obtained. The analytical data revealed that Cr(VI) concentrations in sediments of the Sava River did not represent any known environmental hazard. (C) 2018 The Authors. Published by Elsevier B.V.Show less",https://www.webofscience.com/wos/woscc/full-record/WOS:000436605400122,https://www.webofscience.com/api/gateway?GWVersion=2&SrcAuth=OpenURL&SrcApp=WOS&DestURL=https%3A%2F%2Fwww.redi-bw.de%2Flinks%2Funist%3Furl_ver%3DZ39.88-2004%26url_ctx_fmt%3Dinfo%3Aofi%2Ffmt%3Akev%3Amtx%3Actx%26rft.atitle%3DDetermination%2Bof%2Bhexavalent%2BCr%2Bin%2Briver%2Bsediments%2Bby%2Bspeciated%2Bisotope%2Bdilution%2Binductively%2Bcoupled%2Bplasma%2Bmass%2Bspectrometry%26rft.aufirst%3DAna%26rft.auinit%3DA%26rft.aulast%3DDrincic%26rft.date%3D2018%26rft_id%3Dinfo%3Adoi%2F10.1016%252Fj.scitotenv.2018.05.112%26rft.eissn%3D1879-1026%26rft.epage%3D1294%26rft.genre%3Darticle%26rft.issn%3D0048-9697%26rft.jtitle%3DSCIENCE%2BOF%2BTHE%2BTOTAL%2BENVIRONMENT%26rft_val_fmt%3Dinfo%3Aofi%2Ffmt%3Akev%3Amtx%3Ajournal%26rft.pages%3D1286-1294%26rfr_id%3Dinfo%3Asid%2Fwebofscience.com%3AWOS%3AWOS%26rft.spage%3D1286%26rft.stitle%3DSCI%2BTOTAL%2BENVIRON%26rft.volume%3D637%26rft.au%3DDrincic%252C%2BA%26rft.au%3DZuliani%252C%2BT%26rft.au%3DMilacic%252C%2BR&DestApp=OTHER_OpenURL&SrcAppSID=EUW1ED0A842rfIDuzr9JRdDbngbvZ&SrcJTitle=SCIENCE+OF+THE+TOTAL+ENVIRONMENT&SrcPubType=MD_FORMAT,10.1016/j.scitotenv.2018.05.112,"The Sava River,Sediments,Cr(VI),Alkaline extraction,Speciated isotope dilution inductively coupled,plasma mass spectrometry","ICP-MS,POLYATOMIC INTERFERENCES,SAVA RIVER,CR(VI),CHROMIUM,WATER,SOIL,CHROMATOGRAPHY,GROUNDWATER,GENERATION",,"Jozef Stefan Inst, Dept Environm Sci, Jamova 39, Ljubljana 1000, Slovenia"
16,16,"Ihara, M",Jul 2020 ,Wastewater-derived antagonistic activities of G protein-coupled receptor-acting pharmaceuticals in river water,JOURNAL OF APPLIED TOXICOLOGY,"Pharmaceuticals are widely detected in aquatic environments, and their potential risks to aquatic species are of concern because they are designed to be biologically active. Here, we used an in vitro assay, called the transforming growth factor alpha shedding assay, to measure the biological activities of G protein-coupled receptor (GPCR)-acting pharmaceuticals present in river water and effluents from municipal wastewater treatment plants (WWTPs) in Japan from 2014 to 2016. Antagonistic activities against angiotensin (AT1), dopamine (D2), adrenergic (beta 1), acetylcholine (M1) and histamine (H1) receptors were detected in river water, and were stronger downstream than upstream owing to effluent from WWTPs along the river. Ozonation at one WWTP reduced these activities. Concentrations of sulpiride (D2 antagonist) could explain 73% of antagonistic activities against the D2 receptor; those of metoprolol, atenolol and propranolol (beta 1 antagonists) could explain 16% of activities against the beta 1 receptor; and those of pirenzepine (M1 antagonist) could explain 15% of activities against the M1 receptor. Therefore, other receptor antagonists also occur. GPCR-acting pharmaceuticals should be given more attention in environmental monitoring and toxicity testing.Show less",https://www.webofscience.com/wos/woscc/full-record/WOS:000514369600001,https://www.webofscience.com/api/gateway?GWVersion=2&SrcAuth=OpenURL&SrcApp=WOS&DestURL=https%3A%2F%2Fwww.redi-bw.de%2Flinks%2Funist%3Furl_ver%3DZ39.88-2004%26url_ctx_fmt%3Dinfo%3Aofi%2Ffmt%3Akev%3Amtx%3Actx%26rft.atitle%3DWastewater-derived%2Bantagonistic%2Bactivities%2Bof%2BG%2Bprotein-coupled%2Breceptor-acting%2Bpharmaceuticals%2Bin%2Briver%2Bwater%26rft.aufirst%3DMasaru%26rft.auinit%3DM%26rft.aulast%3DIhara%26rft.date%3D2020%26rft_id%3Dinfo%3Adoi%2F10.1002%252Fjat.3952%26rft.eissn%3D1099-1263%26rft.epage%3D917%26rft.genre%3Darticle%26rft.issn%3D0260-437X%26rft.issue%3D7%26rft.jtitle%3DJOURNAL%2BOF%2BAPPLIED%2BTOXICOLOGY%26rft_val_fmt%3Dinfo%3Aofi%2Ffmt%3Akev%3Amtx%3Ajournal%26rft.pages%3D908-917%26rfr_id%3Dinfo%3Asid%2Fwebofscience.com%3AWOS%3AWOS%26rft.spage%3D908%26rft.stitle%3DJ%2BAPPL%2BTOXICOL%26rft.volume%3D40%26rft.au%3DIhara%252C%2BM%26rft.au%3DHanamoto%252C%2BS%26rft.au%3DTanaka%252C%2BH&DestApp=OTHER_OpenURL&SrcAppSID=EUW1ED0A842rfIDuzr9JRdDbngbvZ&SrcJTitle=JOURNAL+OF+APPLIED+TOXICOLOGY&SrcPubType=MD_FORMAT,10.1002/jat.3952,"GPCR-acting pharmaceuticals,ozonation,river water,TGF alpha shedding assay,WWTP effluent","PERSONAL CARE PRODUCTS,ENVIRONMENTAL RISK,IN-VITRO,BEHAVIOR,REMOVAL,ASSAY",,"Kyoto Univ, Grad Sch Engn, Res Ctr Environm Qual Management, Otsu, Shiga 5200811, Japan"
17,17,"Gooseff, MN",Aug 30 2005 ,"A stream tracer technique employing ionic tracers and specific conductance data applied to the Maimai catchment, New Zealand",HYDROLOGICAL PROCESSES,"The stream tracer technique and transient storage models (TSMs) have become common tools in stream solute and hyporheic exchange studies. The expense and logistics associated with water sample collection and analysis often results in limited temporal resolution of stream tracer breakthrough curves (BTCs). Samples are often collected without a priori or real-time knowledge of BTC information, which can result in poor sample coverage of the critical shoulder (initial rise) and tail (post-steady state fall) of the BTC. We illustrate the use of specific conductance (SC) measurements as a surrogate for conservative dissolved tracer (Br-) samples. The advantages of collecting SC data for use in the TSM are (1) cost, (2) ease of data collection, and (3) well-defined breakthrough curves, which strengthen TSM parameter optimization. This method is based on developing an ion concentration (IC)-SC relationship from limited discrete tracer solute samples. SC data can be collected on a more frequent basis at no additional analysis cost. TSM simulations can then be run for the conservative tracer data derived from SC breakthrough curves and the IC-SC relationship. This technique was tested in a 120 m reach of stream (2-60 m subreaches) in the Maimai M15 catchment, New Zealand during baseflow recession. Dissolved LiBr was injected for 12-92 h, with Br- as the conservative ion of interest. Four TSM simulations using the OTIS model are optimized using UCODE to fit (1) Br- data derived from the Br--SC relationship (n = 1307 observations at each of two stream sampling sites), (2) all stream Br- data collected (n = 58 in upper reach, n = 60 in lower reach), (3) half of the stream Br- data collected, and (4) 20 stream Br- samples from each site. No two simulations resulted in the same optimal parameter values. Results suggest that the greater the frequency of observations, the greater the confidence in estimated parameter values. Br- -SC simulations resulted in the best overall model fits to the data, with the lowest calculated error variance of 6-37, narrowest 95% parameter estimate confidence intervals, and the highest correlation coefficient of 0-99 942, among the four simulations. This is largely due to the improved representation of the shoulder and tail of the BTC with this method. The IC-SC correlation method is robust in situations in which (1) changes in background SC data can be accounted for, and (2) the data used to define the IC-SC relationship are representative of the range of data collected. This method provides more efficient sample analysis, improved data resolution, and improved model results compared to the alternative stream tracer data gathering methods presented. Additionally, we describe a new parameterization of the cross-sectional area of the stream during flow recession, as a function of discharge, based on a stream hydraulic geometry relationship. This variant of the OTIS model provides a more realistic representation of stream dynamics during unsteady discharge. Copyright (c) 2005 John Wiley & Sons, Ltd.Show less",https://www.webofscience.com/wos/woscc/full-record/WOS:000231587100003,https://www.webofscience.com/api/gateway?GWVersion=2&SrcAuth=OpenURL&SrcApp=WOS&DestURL=https%3A%2F%2Fwww.redi-bw.de%2Flinks%2Funist%3Furl_ver%3DZ39.88-2004%26url_ctx_fmt%3Dinfo%3Aofi%2Ffmt%3Akev%3Amtx%3Actx%26rft.atitle%3DA%2Bstream%2Btracer%2Btechnique%2Bemploying%2Bionic%2Btracers%2Band%2Bspecific%2Bconductance%2Bdata%2Bapplied%2Bto%2Bthe%2BMaimai%2Bcatchment%252C%2BNew%2BZealand%26rft.aufirst%3DMN%26rft.auinit%3DMN%26rft.aulast%3DGooseff%26rft.date%3D2005%26rft_id%3Dinfo%3Adoi%2F10.1002%252Fhyp.5685%26rft.eissn%3D1099-1085%26rft.epage%3D2506%26rft.genre%3Darticle%26rft.issn%3D0885-6087%26rft.issue%3D13%26rft.jtitle%3DHYDROLOGICAL%2BPROCESSES%26rft_val_fmt%3Dinfo%3Aofi%2Ffmt%3Akev%3Amtx%3Ajournal%26rft.pages%3D2491-2506%26rfr_id%3Dinfo%3Asid%2Fwebofscience.com%3AWOS%3AWOS%26rft.spage%3D2491%26rft.stitle%3DHYDROL%2BPROCESS%26rft.volume%3D19%26rft.au%3DGooseff%252C%2BMN%26rft.au%3DMcGlynn%252C%2BBL&DestApp=OTHER_OpenURL&SrcAppSID=EUW1ED0A842rfIDuzr9JRdDbngbvZ&SrcJTitle=HYDROLOGICAL+PROCESSES&SrcPubType=MD_FORMAT,10.1002/hyp.5685,"transient storage,hyporheic zone,solute transport modelling,bromide,tracer test,specific conductance,OTIS","TRANSIENT STORAGE,SOLUTE TRANSPORT,MOUNTAIN STREAM,WATER EXCHANGE,RETENTION,MODEL,ZONES,FLOW,METABOLISM,GENERATION",,"Colorado Sch Mines, Dept Geol & Geol Engn, 1516 Illinois St, Golden, CO 80401 USA"
18,18,"Milne, BT",Jun 2017 ,Horton Ratios Link Self-Similarity with Maximum Entropy of Eco-Geomorphological Properties in Stream Networks,ENTROPY,"Stream networks are branched structures wherein water and energy move between land and atmosphere, modulated by evapotranspiration and its interaction with the gravitational dissipation of potential energy as runoff. These actions vary among climates characterized by Budyko theory, yet have not been integrated with Horton scaling, the ubiquitous pattern of eco-hydrological variation among Strahler streams that populate river basins. From Budyko theory, we reveal optimum entropy coincident with high biodiversity. Basins on either side of optimum respond in opposite ways to precipitation, which we evaluated for the classic Hubbard Brook experiment in New Hampshire and for the Whitewater River basin in Kansas. We demonstrate that Horton ratios are equivalent to Lagrange multipliers used in the extremum function leading to Shannon information entropy being maximal, subject to constraints. Properties of stream networks vary with constraints and inter-annual variation in water balance that challenge vegetation to match expected resource supply throughout the network. The entropy-Horton framework informs questions of biodiversity, resilience to perturbations in water supply, changes in potential evapotranspiration, and land use changes that move ecosystems away from optimal entropy with concomitant loss of productivity and biodiversity.Show less",https://www.webofscience.com/wos/woscc/full-record/WOS:000404454500012,https://www.webofscience.com/api/gateway?GWVersion=2&SrcAuth=OpenURL&SrcApp=WOS&DestURL=https%3A%2F%2Fwww.redi-bw.de%2Flinks%2Funist%3Furl_ver%3DZ39.88-2004%26url_ctx_fmt%3Dinfo%3Aofi%2Ffmt%3Akev%3Amtx%3Actx%26rft.artnum%3DARTN%2B249%26rft.atitle%3DHorton%2BRatios%2BLink%2BSelf-Similarity%2Bwith%2BMaximum%2BEntropy%2Bof%2BEco-Geomorphological%2BProperties%2Bin%2BStream%2BNetworks%26rft.aufirst%3DBruce%2BT.%26rft.auinit%3DBT%26rft.aulast%3DMilne%26rft.date%3D2017%26rft_id%3Dinfo%3Adoi%2F10.3390%252Fe19060249%26rft.eissn%3D1099-4300%26rft.genre%3Darticle%26rft.issue%3D6%26rft.jtitle%3DENTROPY%26rft_val_fmt%3Dinfo%3Aofi%2Ffmt%3Akev%3Amtx%3Ajournal%26rfr_id%3Dinfo%3Asid%2Fwebofscience.com%3AWOS%3AWOS%26rft.stitle%3DENTROPY-SWITZ%26rft.volume%3D19%26rft.au%3DMilne%252C%2BBT%26rft.au%3DGupta%252C%2BVK&DestApp=OTHER_OpenURL&SrcAppSID=EUW1ED0A842rfIDuzr9JRdDbngbvZ&SrcJTitle=ENTROPY&SrcPubType=MD_FORMAT,10.3390/e19060249,"Budyko,coupled eco-hydrology,Horton law,networks,scaling,Strahler streams,vegetation","INFORMATION-THEORY,WATER,VEGETATION,FOREST,RIVER,THERMODYNAMICS,EVAPOTRANSPIRATION,PATTERNS,LAWS,COEXISTENCE",,"1 Univ New Mexico, Dept Biol, MSC03-2020, Albuquerque, NM 87131 USA"
19,19,"Green, MD",Aug 2022 ,Rethinking biodiversity patterns and processes in stream ecosystems,ECOLOGICAL MONOGRAPHS,"A major goal of community ecology is understanding the processes responsible for generating biodiversity patterns along spatial and environmental gradients. In stream ecosystems, system-specific conceptual frameworks have dominated research describing biodiversity change along longitudinal gradients of river networks. However, support for these conceptual frameworks has been mixed, mainly applicable to specific stream ecosystems and biomes, and these frameworks have placed less emphasis on general mechanisms driving biodiversity patterns. Rethinking biodiversity patterns and processes in stream ecosystems with a focus on the overarching mechanisms common across ecosystems will provide a more holistic understanding of why biodiversity patterns vary along river networks. In this study, we apply the theory of ecological communities (TEC) conceptual framework to stream ecosystems to focus explicitly on the core ecological processes structuring communities: dispersal, speciation, niche selection, and ecological drift. Using a unique case study from high-elevation networks of connected lakes and streams, we sampled stream invertebrate communities in the Sierra Nevada, California, USA to test established stream ecology frameworks and compared them with the TEC framework. Local diversity increased and beta-diversity decreased moving downstream from the headwaters, consistent with the river continuum concept and the small but mighty framework of mountain stream biodiversity. Local diversity was also structured by distance below upstream lakes, where diversity increased with distance below upstream lakes, in support of the serial discontinuity concept. Despite some support for the biodiversity patterns predicted from the stream ecology frameworks, no single framework was fully supported, suggesting ""context dependence."" By framing our results under the TEC, we found that species diversity was structured by niche selection, where local diversity was highest in environmentally favorable sites. Local diversity was also highest in sites with small community sizes, countering the predicted effects of ecological drift. Moreover, higher beta-diversity in the headwaters was influenced by dispersal and niche selection, where environmentally harsh and spatially isolated sites exhibit higher community variation. Taken together our results suggest that combining system-specific ecological frameworks with the TEC provides a powerful approach for inferring the mechanisms driving biodiversity patterns and provides a path toward generalization of biodiversity research across ecosystems.Show less",https://www.webofscience.com/wos/woscc/full-record/WOS:000794048100001,https://www.webofscience.com/api/gateway?GWVersion=2&SrcAuth=OpenURL&SrcApp=WOS&DestURL=https%3A%2F%2Fwww.redi-bw.de%2Flinks%2Funist%3Furl_ver%3DZ39.88-2004%26url_ctx_fmt%3Dinfo%3Aofi%2Ffmt%3Akev%3Amtx%3Actx%26rft.artnum%3DARTN%2Be1520%26rft.atitle%3DRethinking%2Bbiodiversity%2Bpatterns%2Band%2Bprocesses%2Bin%2Bstream%2Becosystems%26rft.aufirst%3DMatthew%2BD.%26rft.auinit%3DMD%26rft.aulast%3DGreen%26rft.date%3D2022%26rft_id%3Dinfo%3Adoi%2F10.1002%252Fecm.1520%26rft.eissn%3D1557-7015%26rft.genre%3Darticle%26rft.issn%3D0012-9615%26rft.issue%3D3%26rft.jtitle%3DECOLOGICAL%2BMONOGRAPHS%26rft_val_fmt%3Dinfo%3Aofi%2Ffmt%3Akev%3Amtx%3Ajournal%26rfr_id%3Dinfo%3Asid%2Fwebofscience.com%3AWOS%3AWOS%26rft.stitle%3DECOL%2BMONOGR%26rft.volume%3D92%26rft.au%3DGreen%252C%2BMD%26rft.au%3DAnderson%252C%2BKE%26rft.au%3DSpasojevic%252C%2BMJ&DestApp=OTHER_OpenURL&SrcAppSID=EUW1ED0A842rfIDuzr9JRdDbngbvZ&SrcJTitle=ECOLOGICAL+MONOGRAPHS&SrcPubType=MD_FORMAT,10.1002/ecm.1520,"community assembly,diversity,macroinvertebrate,spatial,stream ecology,theory of ecological communities","SPECIES-DIVERSITY,BETA DIVERSITY,MACROINVERTEBRATE COMMUNITIES,INVERTEBRATE COMMUNITIES,LONGITUDINAL TRENDS,LANDSCAPE POSITION,REGIONAL RICHNESS,LAKE OUTLETS,DISPERSAL,SIMULIIDAE",,"Univ Calif Riverside, Dept Evolut Ecol & Organismal Biol, Riverside, CA 92521 USA"
20,20,"Mishra, AK",Jun 23 2020 ,Geo-hydrological inferences through morphometric aspects of the Himalayan glacial-fed river: a case study of the Madhyamaheshwar River basin,ARABIAN JOURNAL OF GEOSCIENCES,"Morphometric parameters are usually prerequisites for the assessment of hydrological facets of a basin. Quantitative evaluation of a drainage basin further helps in the micro-level study of its physiographic characteristics. In this study, an attempt has been made to determine the detailed aspects of morphometric characteristics of the Madhyamaheshwar River basin, a watershed of the Mandakini River that constitutes a part of the Alaknanda River. There are a large number of drainage systems which have their source in the Himalaya. This study was performed using the hydrology tool in geographic information system (GIS) environment. Evaluation of linear, aerial, and relief morphometric parameters was achieved through digital delineation and drainage analysis to provide hydrological insights. A detailed morphometric analysis obtained in this study enlightens distinctive morphometric settings of stream within the drainage system like stream behaviour, the interrelation between connected streams, system's inputs and outputs of matter, and energy. The geometric structure of the basin is ideal for flood velocity assessment backing significantly to stream energy and erosive patterns. Such geometric forms are ideal for increasing flood velocities, which contribute greatly to the available stream energy, and erosion and transportation capacities. Features such as hydrogeology have been evaluated to anticipate the drainage characteristics of the river. This study is also vital regarding the understandings of the subsurface lithology of the basin and sustainable management of the river resources.Show less",https://www.webofscience.com/wos/woscc/full-record/WOS:000544878600001,https://www.webofscience.com/api/gateway?GWVersion=2&SrcAuth=OpenURL&SrcApp=WOS&DestURL=https%3A%2F%2Fwww.redi-bw.de%2Flinks%2Funist%3Furl_ver%3DZ39.88-2004%26url_ctx_fmt%3Dinfo%3Aofi%2Ffmt%3Akev%3Amtx%3Actx%26rft.artnum%3DARTN%2B533%26rft.atitle%3DGeo-hydrological%2Binferences%2Bthrough%2Bmorphometric%2Baspects%2Bof%2Bthe%2BHimalayan%2Bglacial-fed%2Briver%253A%2Ba%2Bcase%2Bstudy%2Bof%2Bthe%2BMadhyamaheshwar%2BRiver%2Bbasin%26rft.aufirst%3DAkhilesh%2BKumar%26rft.auinit%3DAK%26rft.aulast%3DMishra%26rft.date%3D2020%26rft_id%3Dinfo%3Adoi%2F10.1007%252Fs12517-020-05571-9%26rft.eissn%3D1866-7538%26rft.genre%3Darticle%26rft.issn%3D1866-7511%26rft.issue%3D13%26rft.jtitle%3DARABIAN%2BJOURNAL%2BOF%2BGEOSCIENCES%26rft_val_fmt%3Dinfo%3Aofi%2Ffmt%3Akev%3Amtx%3Ajournal%26rfr_id%3Dinfo%3Asid%2Fwebofscience.com%3AWOS%3AWOS%26rft.stitle%3DARAB%2BJ%2BGEOSCI%26rft.volume%3D13%26rft.au%3DMishra%252C%2BAK%26rft.au%3DRai%252C%2BSC&DestApp=OTHER_OpenURL&SrcAppSID=EUW1ED0A842rfIDuzr9JRdDbngbvZ&SrcJTitle=ARABIAN+JOURNAL+OF+GEOSCIENCES&SrcPubType=MD_FORMAT,10.1007/s12517-020-05571-9,"Morphometric parameters,Himalayas,Slope,Alaknanda River basin","AVERAGE SLOPE MAP,RELIEF,SYSTEMS",,"Univ Delhi, Kalindi Coll, Dept Geog, New Delhi, India"
21,21,"D'Ambrosio, E",2018 ,Coupling the water footprint accounting of crops and in-stream monitoring activities at the catchment scale,METHODSX,"In this work, a simple approach for calibrating the water footprint (WF) accounting of crops with in-stream measurements at the catchment scale was developed. The green and blue components of the WF were evaluated by performing a soil-water balance at a 10-day time-interval. The surface runoff was calibrated based on continuous streamflow measurements. Meanwhile, the grey component of the WF related to nitrogen use was quantified by means of the results from the in-stream monitoring activities.The methodology can be applied to any catchment where soil, land use, weather, agricultural practices, nitrogen balance and stream data are available. This methodological approach can support local authorities in the decision-making process for effective agricultural policy setting and water planning.The WF accounting for an agricultural catchment is coupled with surface-water monitoring resultsThe green and blue WF are assessed by performing a soil-water balanceSurface runoff and grey water accounts are based on in-stream monitoring activities (C) 2018 The Authors. Published by Elsevier B.V.Show less",https://www.webofscience.com/wos/woscc/full-record/WOS:000454531500136,https://www.webofscience.com/api/gateway?GWVersion=2&SrcAuth=OpenURL&SrcApp=WOS&DestURL=https%3A%2F%2Fwww.redi-bw.de%2Flinks%2Funist%3Furl_ver%3DZ39.88-2004%26url_ctx_fmt%3Dinfo%3Aofi%2Ffmt%3Akev%3Amtx%3Actx%26rft.atitle%3DCoupling%2Bthe%2Bwater%2Bfootprint%2Baccounting%2Bof%2Bcrops%2Band%2Bin-stream%2Bmonitoring%2Bactivities%2Bat%2Bthe%2Bcatchment%2Bscale%26rft.aufirst%3DErsilia%26rft.auinit%3DE%26rft.aulast%3DD%2527Ambrosio%26rft.date%3D2018%26rft_id%3Dinfo%3Adoi%2F10.1016%252Fj.mex.2018.10.003%26rft.eissn%3D2215-0161%26rft.epage%3D1240%26rft.genre%3Darticle%26rft.jtitle%3DMETHODSX%26rft_val_fmt%3Dinfo%3Aofi%2Ffmt%3Akev%3Amtx%3Ajournal%26rft.pages%3D1221-1240%26rfr_id%3Dinfo%3Asid%2Fwebofscience.com%3AWOS%3AWOS%26rft.spage%3D1221%26rft.stitle%3DMETHODSX%26rft.volume%3D5%26rft.au%3DD%2527Ambrosio%252C%2BE%26rft.au%3DDe%2BGirolamo%252C%2BAM%26rft.au%3DRulli%252C%2BMC&DestApp=OTHER_OpenURL&SrcAppSID=EUW1ED0A842rfIDuzr9JRdDbngbvZ&SrcJTitle=METHODSX&SrcPubType=MD_FORMAT,10.1016/j.mex.2018.10.003,"Water footprint,Soil water balance,Runoff calibration,Nitrogen export coefficient,Temporary river,Surface water monitoring","RIVER-BASIN LEVEL,REFERENCE EVAPOTRANSPIRATION,SCARCITY,NITROGEN,BLUE,AGRICULTURE,UNCERTAINTY,CONSUMPTION,ECOSYSTEMS,INDICATORS",,"CNR, Water Res Inst, I-70132 Bari, Italy"
22,22,"Pointet, T",17th Session of the CST (SHF),"Water exchanges between aquifer and river, observations out of some river low water records",HOUILLE BLANCHE-REVUE INTERNATIONALE DE L EAU,,https://www.webofscience.com/wos/woscc/full-record/WOS:000224474900013,https://www.webofscience.com/api/gateway?GWVersion=2&SrcAuth=OpenURL&SrcApp=WOS&DestURL=https%3A%2F%2Fwww.redi-bw.de%2Flinks%2Funist%3Furl_ver%3DZ39.88-2004%26url_ctx_fmt%3Dinfo%3Aofi%2Ffmt%3Akev%3Amtx%3Actx%26rft.atitle%3DWater%2Bexchanges%2Bbetween%2Baquifer%2Band%2Briver%252C%2Bobservations%2Bout%2Bof%2Bsome%2Briver%2Blow%2Bwater%2Brecords%26rft.aufirst%3DT%26rft.auinit%3DT%26rft.aulast%3DPointet%26rft.date%3D2004%26rft_id%3Dinfo%3Adoi%2F10.1051%252Flhb%253A200404013%26rft.epage%3D91%26rft.genre%3Darticle%26rft.issn%3D0018-6368%26rft.issue%3D4%26rft.jtitle%3DHOUILLE%2BBLANCHE-REVUE%2BINTERNATIONALE%2BDE%2BL%2BEAU%26rft_val_fmt%3Dinfo%3Aofi%2Ffmt%3Akev%3Amtx%3Ajournal%26rft.pages%3D87-91%26rfr_id%3Dinfo%3Asid%2Fwebofscience.com%3AWOS%3AWOS%26rft.spage%3D87%26rft.stitle%3DHOUILLE%2BBLANCHE&DestApp=OTHER_OpenURL&SrcAppSID=EUW1ED0A842rfIDuzr9JRdDbngbvZ&SrcJTitle=HOUILLE+BLANCHE-REVUE+INTERNATIONALE+DE+L+EAU&SrcPubType=MD_FORMAT,10.1051/lhb:200404013,,,,
