,Unnamed: 0,First author,Year,Title,Journal,Abstract,wos_link,fulltext_link,doi,Keywords,Plus keywords,Research areas,Corresponding address
31,31,"Birkel, C",Apr 2016 ,Heat-based hyporheic flux calculations in heterogeneous salmon spawning gravels,AQUATIC SCIENCES,"Groundwater-surface water interactions in rivers are a critically important factor for fish spawning, as streamwater downwelling or upwelling of low-oxygen groundwater can affect egg survival. Assessing such dynamics at the reach scale using distributed temperature measurements as a tracer proved reliable in determining flux rates and directions in the hyporheic zone in a number of studies. Here, we report heat-based vertical flux rates from a heterogeneous gravel-bed stream reach used by spawning Atlantic salmon in the Scottish Highlands. Results showed mostly small downwelling fluxes (similar to 0.3 m d(-1)), which were largely independent of discharge. Contrasting, and at times unusual flux-depth profiles (e.g., increasing flux with depth) were detected, consistent with the heterogeneous streambed material causing diverse hyporheic flow paths. This was tested in a numerical 2-D model setup attempting to reproduce such behavior with variable random hydraulic conductivity (K) fields. The 2-D model clearly demonstrated that strong deviations from the expected decrease of fluxes with depth can be explained by high heterogeneity coupled with relatively low K fields. This showed that using simple 1-D heat-based flux estimates in combination with 2-D models is a useful approach to testing hypotheses about the influence of variable streambed materials on groundwater-surface water exchange in an ecological context.Show less",https://www.webofscience.com/wos/woscc/full-record/WOS:000372599000001,https://www.webofscience.com/api/gateway?GWVersion=2&SrcAuth=OpenURL&SrcApp=WOS&DestURL=https%3A%2F%2Fwww.redi-bw.de%2Flinks%2Funist%3Furl_ver%3DZ39.88-2004%26url_ctx_fmt%3Dinfo%3Aofi%2Ffmt%3Akev%3Amtx%3Actx%26rft.atitle%3DHeat-based%2Bhyporheic%2Bflux%2Bcalculations%2Bin%2Bheterogeneous%2Bsalmon%2Bspawning%2Bgravels%26rft.aufirst%3DChristian%26rft.auinit%3DC%26rft.aulast%3DBirkel%26rft.date%3D2016%26rft_id%3Dinfo%3Adoi%2F10.1007%252Fs00027-015-0417-4%26rft.eissn%3D1420-9055%26rft.epage%3D213%26rft.genre%3Darticle%26rft.issn%3D1015-1621%26rft.issue%3D2%26rft.jtitle%3DAQUATIC%2BSCIENCES%26rft_val_fmt%3Dinfo%3Aofi%2Ffmt%3Akev%3Amtx%3Ajournal%26rft.pages%3D203-213%26rfr_id%3Dinfo%3Asid%2Fwebofscience.com%3AWOS%3AWOS%26rft.spage%3D203%26rft.stitle%3DAQUAT%2BSCI%26rft.volume%3D78%26rft.au%3DBirkel%252C%2BC%26rft.au%3DSoulsby%252C%2BC%26rft.au%3DTetzlaff%252C%2BD&DestApp=OTHER_OpenURL&SrcAppSID=EUW1ED0C934DBaBOmaBFvAACNzVIP&SrcJTitle=AQUATIC+SCIENCES&SrcPubType=MD_FORMAT,10.1007/s00027-015-0417-4,"Hyporheic zone,Heat tracer,Ground water-surface water interaction,VFLUX,Numerical 2-D model","SURFACE-WATER INTERACTIONS,HYDRAULIC CONDUCTIVITY,SPATIAL-PATTERNS,EMBRYO SURVIVAL,GROUNDWATER,EXCHANGE,VARIABILITY,DISCHARGE,MODELS,STREAM",,"Univ Aberdeen, Northern Rivers Inst, Aberdeen AB23 4UF, Scotland"
32,32,"Hirst, C",Jun 26 2020 ,"Silicon Isotopes Reveal a Non-glacial Source of Silicon to Crescent Stream, McMurdo Dry Valleys, Antarctica",FRONTIERS IN EARTH SCIENCE,"In high latitude environments, silicon is supplied to river waters by both glacial and non-glacial chemical weathering. The signal of these two end-members is often obscured by biological uptake and/or groundwater input in the river catchment. McMurdo Dry Valleys streams in Antarctica have no deep groundwater input, no connectivity between streams and no surface vegetation cover, and thus provide a simplified system for us to constrain the supply of dissolved silicon (DSi) to rivers from chemical weathering in a glacial environment. Here we report dissolved Si concentrations, germanium/silicon ratios (Ge/Si) and silicon isotope compositions (delta Si-30(DSi)) in Crescent Stream, McMurdo Dry Valleys for samples collected between December and February in the 2014-2015, 2015-2016, and 2016-2017 austral seasons. The delta(30)Si(DSi)compositions and DSi concentrations are higher than values reported in wet-based glacial meltwaters, and form a narrow cluster within the range of values reported for permafrost dominated Arctic Rivers. High delta(30)Si(DSi)compositions, ranging from +0.90 parts per thousand to +1.39 parts per thousand, are attributed to (i) the precipitation of amorphous silica during freezing of waters in isolated pockets of the hyporheic zone in the winter and the release of Si from unfrozen pockets during meltwater-hyporheic zone exchange in the austral summer, and (ii) additional Si isotope fractionation via long-term Si uptake in clay minerals and seasonal Si uptake into diatoms superimposed on this winter-derived isotope signal. There is no relationship between delta(30)Si(DSi)compositions and DSi concentrations with seasonal and daily discharge, showing that stream waters contain DSi that is in equilibrium with the formation of secondary Si minerals in the hyporheic zone. We show that delta(30)Si(DSi)compositions can be used as tracers of silicate weathering in the hyporheic zone and possible tracers of freeze-thaw conditions in the hyporheic zone. This is important in the context of the ongoing warming in McMurdo Dry Valleys and the supply of more meltwaters to the hyporheic zone of McMurdo Dry Valley streams.Show less",https://www.webofscience.com/wos/woscc/full-record/WOS:000551655900001,https://www.webofscience.com/api/gateway?GWVersion=2&SrcAuth=OpenURL&SrcApp=WOS&DestURL=https%3A%2F%2Fwww.redi-bw.de%2Flinks%2Funist%3Furl_ver%3DZ39.88-2004%26url_ctx_fmt%3Dinfo%3Aofi%2Ffmt%3Akev%3Amtx%3Actx%26rft.artnum%3DARTN%2B229%26rft.atitle%3DSilicon%2BIsotopes%2BReveal%2Ba%2BNon-glacial%2BSource%2Bof%2BSilicon%2Bto%2BCrescent%2BStream%252C%2BMcMurdo%2BDry%2BValleys%252C%2BAntarctica%26rft.aufirst%3DCatherine%26rft.auinit%3DC%26rft.aulast%3DHirst%26rft.date%3D2020%26rft_id%3Dinfo%3Adoi%2F10.3389%252Ffeart.2020.00229%26rft.eissn%3D2296-6463%26rft.genre%3Darticle%26rft.jtitle%3DFRONTIERS%2BIN%2BEARTH%2BSCIENCE%26rft_val_fmt%3Dinfo%3Aofi%2Ffmt%3Akev%3Amtx%3Ajournal%26rfr_id%3Dinfo%3Asid%2Fwebofscience.com%3AWOS%3AWOS%26rft.stitle%3DFRONT%2BEARTH%2BSC-SWITZ%26rft.volume%3D8%26rft.au%3DHirst%252C%2BC%26rft.au%3DOpfergelt%252C%2BS%26rft.au%3DLyons%252C%2BWB&DestApp=OTHER_OpenURL&SrcAppSID=EUW1ED0C934DBaBOmaBFvAACNzVIP&SrcJTitle=FRONTIERS+IN+EARTH+SCIENCE&SrcPubType=MD_FORMAT,10.3389/feart.2020.00229,"silicon isotopes,hyporheic zone,permafrost,weathering,Antarctica","SOUTHERN VICTORIA LAND,TAYLOR VALLEY,MELTWATER STREAMS,HYPORHEIC EXCHANGE,FRYXELL BASIN,ICE-SHEET,ROSS SEA,FRACTIONATION,GERMANIUM,PERMAFROST",,"Catholic Univ Louvain, Environm Sci, Earth & Life Inst, Louvain La Neuve, Belgium"
33,33,"Marzadri, A",Nov 17 2011 ,A semianalytical three-dimensional process-based model for hyporheic nitrogen dynamics in gravel bed rivers,WATER RESOURCES RESEARCH,"We present a three-dimensional semianalytical process-based model of dissolved oxygen and dissolved inorganic nitrogen (DIN) transformation within the hyporheic zone of gravel bed rivers. Oxygen and multispecies solute transport is solved within a Lagrangian framework with transformation of DIN species modeled by linearized Monod's kinetics, with temperature-dependent reaction rate coefficients derived from field experiments. Our solutions, which are obtained under the assumptions of sediments with uniform hydraulic properties and negligible local dispersion, highlight the importance of morphological characteristics of the streambed on DIN transformations within the hyporheic zone. By means of this model we explore the effects of streambed topography and relative abundance of ammonium and nitrate in stream waters on the reactive nitrogen cycle in the hyporheic zone of gravel bed rivers with a pool and riffle morphology. Our model shows complex concentration dynamics within the hyporheic zone that may act as a source or a sink of nitrogen depending on the residence time distribution, which can be parameterized in terms of streambed morphology, and the ratio between the in-stream concentrations of ammonium and nitrate. Application of the model to seven natural streams shows good agreement between predicted and measured nitrous oxide emissions from their hyporheic zone.Show less",https://www.webofscience.com/wos/woscc/full-record/WOS:000297262900003,https://www.webofscience.com/api/gateway?GWVersion=2&SrcAuth=OpenURL&SrcApp=WOS&DestURL=https%3A%2F%2Fwww.redi-bw.de%2Flinks%2Funist%3Furl_ver%3DZ39.88-2004%26url_ctx_fmt%3Dinfo%3Aofi%2Ffmt%3Akev%3Amtx%3Actx%26rft.artnum%3DARTN%2BW11518%26rft.atitle%3DA%2Bsemianalytical%2Bthree-dimensional%2Bprocess-based%2Bmodel%2Bfor%2Bhyporheic%2Bnitrogen%2Bdynamics%2Bin%2Bgravel%2Bbed%2Brivers%26rft.aufirst%3DAlessandra%26rft.auinit%3DA%26rft.aulast%3DMarzadri%26rft.date%3D2011%26rft_id%3Dinfo%3Adoi%2F10.1029%252F2011WR010583%26rft.eissn%3D1944-7973%26rft.genre%3Darticle%26rft.issn%3D0043-1397%26rft.jtitle%3DWATER%2BRESOURCES%2BRESEARCH%26rft_val_fmt%3Dinfo%3Aofi%2Ffmt%3Akev%3Amtx%3Ajournal%26rfr_id%3Dinfo%3Asid%2Fwebofscience.com%3AWOS%3AWOS%26rft.stitle%3DWATER%2BRESOUR%2BRES%26rft.volume%3D47%26rft.au%3DMarzadri%252C%2BA%26rft.au%3DTonina%252C%2BD%26rft.au%3DBellin%252C%2BA&DestApp=OTHER_OpenURL&SrcAppSID=EUW1ED0C934DBaBOmaBFvAACNzVIP&SrcJTitle=WATER+RESOURCES+RESEARCH&SrcPubType=MD_FORMAT,10.1029/2011WR010583,,"SOLUTE TRANSPORT,WATER INTERFACE,NITRATE REMOVAL,SEDIMENT-WATER,DENITRIFICATION,STREAM,EXCHANGE,NITRIFICATION,GROUNDWATER,ZONE",,"Univ Trento, Dept Civil & Environm Engn, Via Mesiano 77, I-38123 Trento, Italy"
34,34,"Li, AG",Feb 2021 ,Residence Time in Hyporheic Bioactive Layers Explains Nitrate Uptake in Streams,WATER RESOURCES RESEARCH,"The Tracer Additions for Spiraling Curve Characterization (TASCC) model has been rapidly adopted to interpret in-stream nutrient spiraling metrics over a range of concentrations from breakthrough curves (BTCs) obtained during pulse solute injection experiments. TASCC analyses often identify hysteresis in the relationship between spiraling metrics and concentration as nutrient concentration in BTCs rises and falls. The mechanisms behind these hysteresis patterns have yet to be determined. We hypothesized that differences in the time a solute is exposed to bioactive environments (i.e., biophysical opportunity) between the rising and falling limbs of BTCs causes hysteresis in TASCCs. We tested this hypothesis using nitrate data from Elkhorn Creek (CO, USA) combined with a process-based particle-tracking model representing travel times and transformations along each flow path in the water column and hyporheic zone, from which the bioactive zone comprised only a thin superficial layer. In-stream nitrate uptake was controlled by hyporheic exchange and the cumulative time nitrate spend in the bioactive layer. This bioactive residence time generally increased from the rising to the falling limb of the BTC, systematically generating hysteresis in the TASCC curves. Hysteresis decreased when nutrient uptake primarily occurred in the water column compared to the hyporheic zone, and with increasing the distance between the injection and sampling points. Hysteresis increased with the depth of the hyporheic bioactive layer. Our results emphasize that good characterization of spatial heterogeneity of surface-subsurface flow paths and bioactive hot spots within streams is essential to understanding the mechanisms of in-stream nutrient uptake.Show less",https://www.webofscience.com/wos/woscc/full-record/WOS:000624603200053,https://www.webofscience.com/api/gateway?GWVersion=2&SrcAuth=OpenURL&SrcApp=WOS&DestURL=https%3A%2F%2Fwww.redi-bw.de%2Flinks%2Funist%3Furl_ver%3DZ39.88-2004%26url_ctx_fmt%3Dinfo%3Aofi%2Ffmt%3Akev%3Amtx%3Actx%26rft.artnum%3DARTN%2Be2020WR027646%26rft.atitle%3DResidence%2BTime%2Bin%2BHyporheic%2BBioactive%2BLayers%2BExplains%2BNitrate%2BUptake%2Bin%2BStreams%26rft.aufirst%3DAngang%26rft.auinit%3DAG%26rft.aulast%3DLi%26rft.date%3D2021%26rft_id%3Dinfo%3Adoi%2F10.1029%252F2020WR027646%26rft.eissn%3D1944-7973%26rft.genre%3Darticle%26rft.issn%3D0043-1397%26rft.issue%3D2%26rft.jtitle%3DWATER%2BRESOURCES%2BRESEARCH%26rft_val_fmt%3Dinfo%3Aofi%2Ffmt%3Akev%3Amtx%3Ajournal%26rfr_id%3Dinfo%3Asid%2Fwebofscience.com%3AWOS%3AWOS%26rft.stitle%3DWATER%2BRESOUR%2BRES%26rft.volume%3D57%26rft.au%3DLi%252C%2BAG%26rft.au%3DBernal%252C%2BS%26rft.au%3DPackman%252C%2BAI&DestApp=OTHER_OpenURL&SrcAppSID=EUW1ED0C934DBaBOmaBFvAACNzVIP&SrcJTitle=WATER+RESOURCES+RESEARCH&SrcPubType=MD_FORMAT,10.1029/2020WR027646,,"NUTRIENT-UPTAKE,UPTAKE KINETICS,ORGANIC-CARBON,NONSORBING SOLUTES,NITROGEN-RETENTION,SEASONAL-VARIATION,SHINGOBEE RIVER,ROCKY-MOUNTAINS,POROUS BED,DENITRIFICATION",,"Northwestern Univ, Civil & Environm Engn, Evanston, IL 60208 USA"
35,35,"Qian, Q",Jul 31 2008 ,A vertical dispersion model for solute exchange induced by underflow and periodic hyporheic flow in a stream gravel bed,WATER RESOURCES RESEARCH,"[1] Interstitial flows in stream gravel beds are driven by stream slope and controlled by hydraulic conductivity (underflows) or induced by pressure differentials on the streambed surface (hyporheic flows). They enhance solute exchange between surface water and a streambed. To study the solute transport in a stream gravel bed, a 2-D transient advection dispersion mass transfer model was formulated. The velocity field includes an underflow and a spatially periodic hyporheic flow, e. g., due to standing surface waves or bed forms. Two dimensionless scaling parameters emerged: R measures the relative strength of hyporheic flow to underflow in the streambed and l is the ratio of dispersivity of the gravel bed to the pressure wavelength along the streambed. In the analysis of mass transfer of nonconservative substances into a streambed, an explicit 2-D analysis of interstitial flow is often undesirable. Therefore the numerical solutions for the 2-D concentration fields under periodic boundary conditions were reduced to 1-D vertical concentration profiles ( by streamwise averaging of the solute concentrations). The profiles were matched to the solution of an unsteady vertical 1-D dispersion equation that introduces a depth variable ""enhanced dispersion coefficient D(E)(y)'' that lumps all forms of interstitial advective and dispersive transport in the streambed. Functions D(E)(y) were determined for many combinations of independent parameters by inverse modeling, and the dependence of D(E)(y) on the dimensionless parameters R and gimel was determined from these results. Analytical relationships for D(E)(y, R, gimel) have been proposed and validated against available experimental data. Knowledge of D(E)(y) allows the estimation of solute/mass transfer rates in streambeds under wavy boundary conditions, without explicit analysis of the interstitial flow. This is a distinct advantage for applications in stream water quality and/or pore water quality studies.Show less",https://www.webofscience.com/wos/woscc/full-record/WOS:000258158300002,https://www.webofscience.com/api/gateway?GWVersion=2&SrcAuth=OpenURL&SrcApp=WOS&DestURL=https%3A%2F%2Fwww.redi-bw.de%2Flinks%2Funist%3Furl_ver%3DZ39.88-2004%26url_ctx_fmt%3Dinfo%3Aofi%2Ffmt%3Akev%3Amtx%3Actx%26rft.artnum%3DARTN%2BW07422%26rft.atitle%3DA%2Bvertical%2Bdispersion%2Bmodel%2Bfor%2Bsolute%2Bexchange%2Binduced%2Bby%2Bunderflow%2Band%2Bperiodic%2Bhyporheic%2Bflow%2Bin%2Ba%2Bstream%2Bgravel%2Bbed%26rft.aufirst%3DQin%26rft.auinit%3DQ%26rft.aulast%3DQian%26rft.date%3D2008%26rft_id%3Dinfo%3Adoi%2F10.1029%252F2007WR006366%26rft.genre%3Darticle%26rft.issn%3D0043-1397%26rft.issue%3D7%26rft.jtitle%3DWATER%2BRESOURCES%2BRESEARCH%26rft_val_fmt%3Dinfo%3Aofi%2Ffmt%3Akev%3Amtx%3Ajournal%26rfr_id%3Dinfo%3Asid%2Fwebofscience.com%3AWOS%3AWOS%26rft.stitle%3DWATER%2BRESOUR%2BRES%26rft.volume%3D44%26rft.au%3DQian%252C%2BQ%26rft.au%3DVoller%252C%2BVR%26rft.au%3DStefan%252C%2BHG&DestApp=OTHER_OpenURL&SrcAppSID=EUW1ED0C934DBaBOmaBFvAACNzVIP&SrcJTitle=WATER+RESOURCES+RESEARCH&SrcPubType=MD_FORMAT,10.1029/2007WR006366,,"TRANSIENT STORAGE MODEL,CONVECTIVE-TRANSPORT,SEDIMENT,RIVERS,FORMS,COLLOIDS,MEDIA",,"Univ Minnesota, Dept Civil Engn, St Anthony Falls Lab, 2 3rd Ave SE, Minneapolis, MN 55414 USA"
36,36,"Uzarski, DG",Jul 1 2001 ,A new chamber design for measuring community metabolism in a Michigan stream,HYDROBIOLOGIA,"We designed an open-ended community metabolism chamber to simultaneously measure surface and hyporheic metabolism. Our chamber design eliminated reaeration, compartmentalized metabolism, maintained ambient conditions and included hyporheic respiration. We compared results from our hyporheic chamber to results obtained from: (1) closed benthic community metabolism chambers constructed as recommended by Bott et al. (1978), and (2) whole-stream metabolism techniques as modified by Marzolf et al. (1994). Simultaneous comparisons of all three procedures were made for a 35 m riffle section of Augusta Creek, a 3rd-order Michigan stream, in July 1997 and repeated in July 1998. Simultaneous comparisons of all three procedures were also made for a 30 m sandy run section of Augusta Creek in September 1997, and repeated in September 1998. Our hyporheic chamber estimates for community respiration (CR24) were similar to those obtained using the whole-stream metabolism procedure but were considerably higher than estimates obtained using the closed benthic chambers in three of the four experiments. These data suggest that our chamber design provided estimates of community metabolism which included both benthic and hyporheic respiration. The chamber incorporates several positive aspects of both closed chambers and the whole-stream method. This new method can be replicated, eliminates the need for a reaeration coefficient, ambient conditions are better approximated since it remains an open system, and it appears to provide more realistic estimates of whole-stream metabolism compared to the traditional chamber approach.Show less",https://www.webofscience.com/wos/woscc/full-record/WOS:000173247400014,https://www.webofscience.com/api/gateway?GWVersion=2&SrcAuth=OpenURL&SrcApp=WOS&DestURL=https%3A%2F%2Fwww.redi-bw.de%2Flinks%2Funist%3Furl_ver%3DZ39.88-2004%26url_ctx_fmt%3Dinfo%3Aofi%2Ffmt%3Akev%3Amtx%3Actx%26rft.atitle%3DA%2Bnew%2Bchamber%2Bdesign%2Bfor%2Bmeasuring%2Bcommunity%2Bmetabolism%2Bin%2Ba%2BMichigan%2Bstream%26rft.aufirst%3DDG%26rft.auinit%3DDG%26rft.aulast%3DUzarski%26rft.date%3D2001%26rft_id%3Dinfo%3Adoi%2F10.1023%252FA%253A1011929719866%26rft.epage%3D155%26rft.genre%3Darticle%26rft.issn%3D0018-8158%26rft.jtitle%3DHYDROBIOLOGIA%26rft_val_fmt%3Dinfo%3Aofi%2Ffmt%3Akev%3Amtx%3Ajournal%26rft.pages%3D137-155%26rfr_id%3Dinfo%3Asid%2Fwebofscience.com%3AWOS%3AWOS%26rft.spage%3D137%26rft.stitle%3DHYDROBIOLOGIA%26rft.volume%3D455%26rft.au%3DUzarski%252C%2BDG%26rft.au%3DBurton%252C%2BTM%26rft.au%3DStricker%252C%2BCA&DestApp=OTHER_OpenURL&SrcAppSID=EUW1ED0C934DBaBOmaBFvAACNzVIP&SrcJTitle=HYDROBIOLOGIA&SrcPubType=MD_FORMAT,10.1023/A:1011929719866,"stream metabolism,metabolism chamber,whole-stream metabolism,hyporheic respiration,P/R,primary productivity","OXYGEN CHANGE TECHNIQUE,VERTICAL HYDROLOGIC EXCHANGE,DISSOLVED ORGANIC-CARBON,SONORAN DESERT STREAM,SURFACE-WATER,ECOSYSTEM METABOLISM,HYPORHEIC ZONE,NUTRIENT DYNAMICS,CURRENT VELOCITY,MOUNTAIN STREAM",,"Michigan State Univ, Dept Zool, E Lansing, MI 48824 USA"
37,37,"Boano, F",Feb 13 2010 ,Biogeochemical zonation due to intrameander hyporheic flow,WATER RESOURCES RESEARCH,"The dynamics of chemicals within a catchment are strongly affected by the exchange between surface water and groundwater. The activity of hyporheic microorganisms plays a key role in these processes, as they are able to oxidize and reduce organic matter and nutrients. The interplay between the residence times in the hyporheic zone and the temporal scales of the microbial reactions must thus be understood in order to improve our understanding of the role of fluvial environments in nutrient cycling. In this paper we focus on the intrameander hyporheic region and investigate the links between river morphology, hyporheic flow field, and biogeochemical processes. We adopt a modeling framework that considers the planimetric evolution of a meandering river, the hyporheic flow field induced by the river sinuosity, and the main biogeochemical reactions of organic carbon degradation. The chemical zonation of the intrameander hyporheic zone clearly emerges as a result of the coupling between hyporheic flow and biochemical activity. The resulting patterns of nutrient concentrations are strongly influenced by the river morphology. We also show how to estimate the characteristic timescales of the redox reactions and that their interplay with the kinematic timescales of the hyporheic flow controls both the biochemical zonation and the overall rate of nutrient transformation.Show less",https://www.webofscience.com/wos/woscc/full-record/WOS:000274466600002,https://www.webofscience.com/api/gateway?GWVersion=2&SrcAuth=OpenURL&SrcApp=WOS&DestURL=https%3A%2F%2Fwww.redi-bw.de%2Flinks%2Funist%3Furl_ver%3DZ39.88-2004%26url_ctx_fmt%3Dinfo%3Aofi%2Ffmt%3Akev%3Amtx%3Actx%26rft.artnum%3DARTN%2BW02511%26rft.atitle%3DBiogeochemical%2Bzonation%2Bdue%2Bto%2Bintrameander%2Bhyporheic%2Bflow%26rft.aufirst%3DF.%26rft.auinit%3DF%26rft.aulast%3DBoano%26rft.date%3D2010%26rft_id%3Dinfo%3Adoi%2F10.1029%252F2008WR007583%26rft.eissn%3D1944-7973%26rft.genre%3Darticle%26rft.issn%3D0043-1397%26rft.jtitle%3DWATER%2BRESOURCES%2BRESEARCH%26rft_val_fmt%3Dinfo%3Aofi%2Ffmt%3Akev%3Amtx%3Ajournal%26rfr_id%3Dinfo%3Asid%2Fwebofscience.com%3AWOS%3AWOS%26rft.stitle%3DWATER%2BRESOUR%2BRES%26rft.volume%3D46%26rft.au%3DBoano%252C%2BF%26rft.au%3DDemaria%252C%2BA%26rft.au%3DRidolfi%252C%2BL&DestApp=OTHER_OpenURL&SrcAppSID=EUW1ED0C934DBaBOmaBFvAACNzVIP&SrcJTitle=WATER+RESOURCES+RESEARCH&SrcPubType=MD_FORMAT,10.1029/2008WR007583,,"NITRATE USE,STREAM,TRANSPORT,EXCHANGE,SOLUTES,RIVER,CHEMISTRY,GEOMETRY,MEANDER,MODEL",,"Politecn Torino, Dept Hydraul Transports & Civil Infrastruct, Corso Duca Abruzzi 24, I-10129 Turin, Italy"
38,38,"Harjung, A",Jan 2018 ,Hydrological connectivity drives dissolved organic matter processing in an intermittent stream,LIMNOLOGICA,"Hydrological conditions are key drivers of dissolved organic matter (DOM) processing in intermittent streams. However, there still exist major gaps in knowledge regarding the temporal dynamics of DOM processing during drought periods, as well as the role of the hyporheic zone (HZ). We conducted weekly sampling of surface water and hyporheic pore water during a drying/rewetting cycle and characterized DOM by fluorescence and absorbance properties. Overall, the contribution of allochthonous and humic-like DOM increased during base flow in early summer (pre-drought) and continued increasing throughout the drought period, which covered three phases: contraction, fragmentation and dry. The contribution of autochthonous DOM during this period was restricted to very specific points in time (the transition from contraction to fragmentation phase) and space (the HZ). Hydrological connectivity between the HZ and the surface water was a driver of DOM composition by supplying terrestrial, aromatic DOM to the HZ. The disconnection of the stream from the riparian groundwater enabled us to quantify the DOM retention/release in the HZ. DOM mass balance at the stream-hyporheic interface revealed the occurrence of two time periods with disproportionately high rates for DOM processing (hot moments) during the study period: (1) a short pulse of protein-like, autochthonous DOM net release at the beginning of the disconnection; and (2) a longer time period of increasing net dissolved organic carbon (DOC) retention up to 30% along 25 m of HZ length during fragmentation and dry phase. Remarkably, the net carbon retention was coupled to a decrease of aromatic and high molecular weight compounds, while protein-like, autochthonous DOM was released. This result evidenced that under drought conditions, the HZ becomes a sink for DOM compounds previously assumed to be recalcitrant in aquatic ecosystems and therefore highlights the importance of hydrological drivers on DOM processing. (C) 2017 The Authors. Published by Elsevier GmbH.Show less",https://www.webofscience.com/wos/woscc/full-record/WOS:000428014700008,https://www.webofscience.com/api/gateway?GWVersion=2&SrcAuth=OpenURL&SrcApp=WOS&DestURL=https%3A%2F%2Fwww.redi-bw.de%2Flinks%2Funist%3Furl_ver%3DZ39.88-2004%26url_ctx_fmt%3Dinfo%3Aofi%2Ffmt%3Akev%3Amtx%3Actx%26rft.atitle%3DHydrological%2Bconnectivity%2Bdrives%2Bdissolved%2Borganic%2Bmatter%2Bprocessing%2Bin%2Ban%2Bintermittent%2Bstream%26rft.aufirst%3DAstrid%26rft.auinit%3DA%26rft.aulast%3DHarjung%26rft.date%3D2018%26rft_id%3Dinfo%3Adoi%2F10.1016%252Fj.limno.2017.02.007%26rft.eissn%3D1873-5851%26rft.epage%3D81%26rft.genre%3Darticle%26rft.issn%3D0075-9511%26rft.jtitle%3DLIMNOLOGICA%26rft_val_fmt%3Dinfo%3Aofi%2Ffmt%3Akev%3Amtx%3Ajournal%26rft.pages%3D71-81%26rfr_id%3Dinfo%3Asid%2Fwebofscience.com%3AWOS%3AWOS%26rft.spage%3D71%26rft.stitle%3DLIMNOLOGICA%26rft.volume%3D68%26rft.au%3DHarjung%252C%2BA%26rft.au%3DSabater%252C%2BF%26rft.au%3DButturini%252C%2BA&DestApp=OTHER_OpenURL&SrcAppSID=EUW1ED0C934DBaBOmaBFvAACNzVIP&SrcJTitle=LIMNOLOGICA&SrcPubType=MD_FORMAT,10.1016/j.limno.2017.02.007,"DOM processing,DOM optical properties,Intermittent streams,Hyporheic zone,Droughta","CARBON-DIOXIDE EMISSIONS,FLUORESCENCE SPECTROSCOPY,HYPORHEIC ZONE,MEDITERRANEAN STREAM,MOLECULAR-WEIGHT,WATER EXCHANGE,DYNAMICS,QUALITY,BIOAVAILABILITY,GROUNDWATER",,"Univ Barcelona, Dept Ecol, Av Diagonal 643, E-08028 Barcelona, Spain"
