,Unnamed: 0,First author,Year,Title,Journal,Abstract,wos_link,fulltext_link,doi,Keywords,Plus keywords,Research areas,Corresponding address
21,21,"Lewandowski, J",Apr 15 2011 ,Fate of organic micropollutants in the hyporheic zone of a eutrophic lowland stream: Results of a preliminary field study,SCIENCE OF THE TOTAL ENVIRONMENT,"Many rivers and streams worldwide are impacted by pharmaceuticals originating from sewage. The hyporheic zone underlying streams is often regarded as reactive bioreactor with the potential for eliminating such sewage-born micropollutants. The present study aims at checking the elimination potential and analyzing the coupling of hydrodynamics, biogeochemistry and micropollutant processing. To this end, two sites at the lowland stream Erpe, which receives a high sewage burden, were equipped and sampled with nested piezometers. From temperature depth profiles we determined that at one of the sites infiltration of surface water into the aquifer occurs while exfiltration dominates at the other site. Biogeochemical data reveal intense mineralization processes and strictly anoxic conditions in the streambed sediments at both sites. Concentrations of the pharmaceuticals indomethacin, diclofenac, ibuprofen, bezafibrate, ketoprofen, naproxen and clofibric acid were high in the surface water and also in the subsurface at the infiltrating site. The evaluation of the depth profiles indicates some attenuation but due to varying surface water composition the evaluation of subsurface processes is quite complex. Borate and non-geogenic gadolinium were measured as conservative wastewater indicators. To eliminate the influence of fluctuating sewage proportions in the surface water, micropollutant concentrations are related to these indicators. The indicators can cope with different dilutions of the sewage but not with temporally varying sewage composition. (C) 2011 Elsevier B.V. All rights reserved.Show less",https://www.webofscience.com/wos/woscc/full-record/WOS:000289394900010,https://www.webofscience.com/api/gateway?GWVersion=2&SrcAuth=OpenURL&SrcApp=WOS&DestURL=https%3A%2F%2Fwww.redi-bw.de%2Flinks%2Funist%3Furl_ver%3DZ39.88-2004%26url_ctx_fmt%3Dinfo%3Aofi%2Ffmt%3Akev%3Amtx%3Actx%26rft.atitle%3DFate%2Bof%2Borganic%2Bmicropollutants%2Bin%2Bthe%2Bhyporheic%2Bzone%2Bof%2Ba%2Beutrophic%2Blowland%2Bstream%253A%2BResults%2Bof%2Ba%2Bpreliminary%2Bfield%2Bstudy%26rft.aufirst%3DJoerg%26rft.auinit%3DJ%26rft.aulast%3DLewandowski%26rft.date%3D2011%26rft_id%3Dinfo%3Adoi%2F10.1016%252Fj.scitotenv.2011.01.028%26rft.eissn%3D1879-1026%26rft.epage%3D1835%26rft.genre%3Darticle%26rft.issn%3D0048-9697%26rft.issue%3D10%26rft.jtitle%3DSCIENCE%2BOF%2BTHE%2BTOTAL%2BENVIRONMENT%26rft_val_fmt%3Dinfo%3Aofi%2Ffmt%3Akev%3Amtx%3Ajournal%26rft.pages%3D1824-1835%26rfr_id%3Dinfo%3Asid%2Fwebofscience.com%3AWOS%3AWOS%26rft.spage%3D1824%26rft.stitle%3DSCI%2BTOTAL%2BENVIRON%26rft.volume%3D409%26rft.au%3DLewandowski%252C%2BJ%26rft.au%3DPutschew%252C%2BA%26rft.au%3DRadke%252C%2BM&DestApp=OTHER_OpenURL&SrcAppSID=EUW1ED0F39vUy74Y9nfvfg8aiKYkH&SrcJTitle=SCIENCE+OF+THE+TOTAL+ENVIRONMENT&SrcPubType=MD_FORMAT,10.1016/j.scitotenv.2011.01.028,"Pharmaceuticals,Ibuprofen,Hyporheic zone,Self-purification capacity,Gadolinium,Borate,Hydrology,Biogeochemistry","WASTE-WATER TREATMENT,RAY CONTRAST-MEDIA,SURFACE-WATER,ACIDIC PHARMACEUTICALS,HOSPITAL EFFLUENTS,NUTRIENT RETENTION,HEADWATER STREAMS,CLOFIBRIC ACID,RIVER WATERS,GADOLINIUM",,"Leibniz Inst Freshwater Ecol & Inland Fisheries, Dept Ecohydrol, Muggelseedamm 310, D-12587 Berlin, Germany"
22,22,"Kasahara, T",Jan 2006 ,Effects of riffle-step restoration on hyporheic zone chemistry in N-rich lowland streams,CANADIAN JOURNAL OF FISHERIES AND AQUATIC SCIENCES,"Stream restoration projects that aim to rehabilitate ecosystem health have not considered surface-subsurface linkages, although stream water and groundwater interaction has an important role in sustaining stream ecosystem functions. The present study examined the effect of constructed riffles and a step on hyporheic exchange flow and chemistry in restored reaches of several N-rich agricultural and urban streams in southern Ontario. Hydrometric data collected from a network of piezometers and conservative tracer releases indicated that the constructed riffles and steps were effective in inducing hyporheic exchange. However, despite the use of cobbles and boulders in the riffle construction, high stream dissolved oxygen (DO) concentrations were depleted rapidly with depth into the hyporheic zones. Differences between observed and predicted nitrate concentrations based on conservative ion concentration patterns indicated that these hyporheic zones were also nitrate sinks. Zones of low hydraulic conductivity and the occurrence of interstitial fines in the restored cobble-boulder layers suggest that siltation and clogging of the streambed may reduce the downwelling of oxygen- and nitrate-rich stream water. Increases in streambed DO levels and enhancement of habitat for hyporheic fauna that result from riffle-step construction projects may only be temporary in streams that receive increased sediment and nutrient inputs from urban areas and croplands.Show less",https://www.webofscience.com/wos/woscc/full-record/WOS:000235231400010,https://www.webofscience.com/api/gateway?GWVersion=2&SrcAuth=OpenURL&SrcApp=WOS&DestURL=https%3A%2F%2Fwww.redi-bw.de%2Flinks%2Funist%3Furl_ver%3DZ39.88-2004%26url_ctx_fmt%3Dinfo%3Aofi%2Ffmt%3Akev%3Amtx%3Actx%26rft.atitle%3DEffects%2Bof%2Briffle-step%2Brestoration%2Bon%2Bhyporheic%2Bzone%2Bchemistry%2Bin%2BN-rich%2Blowland%2Bstreams%26rft.aufirst%3DT%26rft.auinit%3DT%26rft.aulast%3DKasahara%26rft.date%3D2006%26rft_id%3Dinfo%3Adoi%2F10.1139%252FF05-199%26rft.eissn%3D1205-7533%26rft.epage%3D133%26rft.genre%3Darticle%26rft.issn%3D0706-652X%26rft.issue%3D1%26rft.jtitle%3DCANADIAN%2BJOURNAL%2BOF%2BFISHERIES%2BAND%2BAQUATIC%2BSCIENCES%26rft_val_fmt%3Dinfo%3Aofi%2Ffmt%3Akev%3Amtx%3Ajournal%26rft.pages%3D120-133%26rfr_id%3Dinfo%3Asid%2Fwebofscience.com%3AWOS%3AWOS%26rft.spage%3D120%26rft.stitle%3DCAN%2BJ%2BFISH%2BAQUAT%2BSCI%26rft.volume%3D63%26rft.au%3DKasahara%252C%2BT%26rft.au%3DHill%252C%2BAR&DestApp=OTHER_OpenURL&SrcAppSID=EUW1ED0F39vUy74Y9nfvfg8aiKYkH&SrcJTitle=CANADIAN+JOURNAL+OF+FISHERIES+AND+AQUATIC+SCIENCES&SrcPubType=MD_FORMAT,10.1139/F05-199,,"GROUNDWATER EXCHANGE,NITROGEN DYNAMICS,WATER EXCHANGE,SURFACE,DENITRIFICATION,RETENTION,FLOW,TOPOGRAPHY,TRANSPORT,HABITAT",,"Utah State Univ, Dept Aquat Watershed & Earth Resources, 5210 Old Main Hill, Logan, UT 84322 USA"
23,23,"Xu, SF",Mar 2017 ,Variability of Darcian Flux in the Hyporheic Zone at a Natural Channel Bend,WATER,"Channel bends are one of the most important characteristic features of natural streams. These bends often create the conditions for a hyporheic zone, which has been recognized as a critical component of stream ecosystems. The streambed vertical hydraulic conductivity (K-v), vertical hydraulic gradient (VHG) and Darcian flux (DF) in the hyporheic zone were estimated at 61 locations along a channel bend of the Beiluo River during July 2015 and January 2016. All the streambed attributes showed great spatial variability along the channel bend. Both upward fluxes and downward fluxes occurred during the two test periods, most of studied stream sections were controlled by downwelling, indicating stream water discharge into the subsurface. The average downward flux was higher at the downstream side than at the upstream side of the channel bend, especially in July 2015. The distribution of streambed sediment grain size has a significant influence on the variability of K-v; high percentages of silt and clay sediments generally lead to low K-v values. Higher K-v at the depositional left bank at the upstream site shifted toward the erosional right bank at the downstream site, with K-v values positively correlated with the water depth. This study suggested that the variabilities of K-v and VHG were influenced by the stream geomorphology and that the distribution of K-v was inversely related, to a certain extent, to the distribution of VHG across the channel bend. K-v and VHG were found to have opposite effects on the DF, and the close relationship between K-v and DF indicated that the water fluxes were mainly controlled by K-v.Show less",https://www.webofscience.com/wos/woscc/full-record/WOS:000398721300021,https://www.webofscience.com/api/gateway?GWVersion=2&SrcAuth=OpenURL&SrcApp=WOS&DestURL=https%3A%2F%2Fwww.redi-bw.de%2Flinks%2Funist%3Furl_ver%3DZ39.88-2004%26url_ctx_fmt%3Dinfo%3Aofi%2Ffmt%3Akev%3Amtx%3Actx%26rft.artnum%3DARTN%2B170%26rft.atitle%3DVariability%2Bof%2BDarcian%2BFlux%2Bin%2Bthe%2BHyporheic%2BZone%2Bat%2Ba%2BNatural%2BChannel%2BBend%26rft.aufirst%3DShaofeng%26rft.auinit%3DSF%26rft.aulast%3DXu%26rft.date%3D2017%26rft_id%3Dinfo%3Adoi%2F10.3390%252Fw9030170%26rft.genre%3Darticle%26rft.issn%3D2073-4441%26rft.issue%3D3%26rft.jtitle%3DWATER%26rft_val_fmt%3Dinfo%3Aofi%2Ffmt%3Akev%3Amtx%3Ajournal%26rfr_id%3Dinfo%3Asid%2Fwebofscience.com%3AWOS%3AWOS%26rft.stitle%3DWATER-SUI%26rft.volume%3D9%26rft.au%3DXu%252C%2BSF%26rft.au%3DSong%252C%2BJX%26rft.au%3DXue%252C%2BY&DestApp=OTHER_OpenURL&SrcAppSID=EUW1ED0F39vUy74Y9nfvfg8aiKYkH&SrcJTitle=WATER&SrcPubType=MD_FORMAT,10.3390/w9030170,"hyporheic zone,Darcian flux,channel bend,vertical hydraulic conductivity,stream topography,grain size,porosity","STREAMBED HYDRAULIC CONDUCTIVITY,GAINING STREAM,SURFACE-WATER,GROUNDWATER,EXCHANGE,POROSITY,RIVER,FLOW,NEBRASKA,AQUIFERS",,"Northwest Univ Xian, Coll Urban & Environm Sci, Xian 710127, Peoples R China"
24,24,"Cornut, J",Dec 1 2012 ,Effect of acidification on leaf litter decomposition in benthic and hyporheic zones of woodland streams,WATER RESEARCH,"Anthropogenic acidification has deleterious effects on both structure and functioning of surface water ecosystems. This study examined how it may affect the leaf decomposition rate and the community structure and activity of decomposers in both benthic and hyporheic zones of five headwater streams along an acidification gradient from highly acidic (pH 4.6) to circumneutral (pH 7.4). Overall, responses to acidification in hyporheic zones were less pronounced, but followed the same pattern as in their benthic counterparts. Leaf decomposition was much faster in the circumneutral stream, both in the hyporheic and benthic zones (k = 0.0068 and 0.0534 d(-1), respectively), than in the most acidic one (k = 0.0016 and 0.0055 d(-1), respectively), and correlated well with the acidic gradient in both compartments. Interestingly, leaf litter decomposition was less affected by acidification in hyporheic compared to benthic compartments, likely due to the relatively low sensitivity of fungi, which were the main decomposers of buried coarse particulate organic matter. These results argue in favour of conserving hyporheic habitats in acidified streams as they can maintain matter and species fluxes that are essential to the ecosystem. (C) 2012 Elsevier Ltd. All rights reserved.Show less",https://www.webofscience.com/wos/woscc/full-record/WOS:000312972200025,https://www.webofscience.com/api/gateway?GWVersion=2&SrcAuth=OpenURL&SrcApp=WOS&DestURL=https%3A%2F%2Fwww.redi-bw.de%2Flinks%2Funist%3Furl_ver%3DZ39.88-2004%26url_ctx_fmt%3Dinfo%3Aofi%2Ffmt%3Akev%3Amtx%3Actx%26rft.atitle%3DEffect%2Bof%2Bacidification%2Bon%2Bleaf%2Blitter%2Bdecomposition%2Bin%2Bbenthic%2Band%2Bhyporheic%2Bzones%2Bof%2Bwoodland%2Bstreams%26rft.aufirst%3DJulien%26rft.auinit%3DJ%26rft.aulast%3DCornut%26rft.date%3D2012%26rft_id%3Dinfo%3Adoi%2F10.1016%252Fj.watres.2012.09.023%26rft.epage%3D6444%26rft.genre%3Darticle%26rft.issn%3D0043-1354%26rft.issue%3D19%26rft.jtitle%3DWATER%2BRESEARCH%26rft_val_fmt%3Dinfo%3Aofi%2Ffmt%3Akev%3Amtx%3Ajournal%26rft.pages%3D6430-6444%26rfr_id%3Dinfo%3Asid%2Fwebofscience.com%3AWOS%3AWOS%26rft.spage%3D6430%26rft.stitle%3DWATER%2BRES%26rft.volume%3D46%26rft.au%3DCornut%252C%2BJ%26rft.au%3DClivot%252C%2BH%26rft.au%3DGuerold%252C%2BF&DestApp=OTHER_OpenURL&SrcAppSID=EUW1ED0F39vUy74Y9nfvfg8aiKYkH&SrcJTitle=WATER+RESEARCH&SrcPubType=MD_FORMAT,10.1016/j.watres.2012.09.023,"River sediment,Aquatic fungi,Shredders,pH,Organic matter breakdown,Ecosystem functioning","AQUATIC HYPHOMYCETE DIVERSITY,PARTICULATE ORGANIC-MATTER,VOSGES MOUNTAINS,FUNGAL BIOMASS,MICROBIAL ECOLOGY,ACID-RAIN,SEDIMENTS,EXCHANGE,RIVER,COMMUNITIES",,"Leibniz Inst Freshwater Ecol & Inland Fisheries, Dept Limnol Stratified Lakes, Alte Fischerhutte 2, D-16775 Neuglobsow, Germany"
25,25,"Jin, GQ",Mar 2022 ,Transport of Phosphorus in the Hyporheic Zone,WATER RESOURCES RESEARCH,"Phosphorus is not only an essential nutrient for organisms but also a major contributor to the eutrophication of fluvial ecosystems. Previous studies have focused on the flux of phosphorus at the water-sediment interface, and very little is known about the transport and distribution of phosphorus in bedforms. In this study, a series of flume experiments and numerical simulations were conducted to investigate phosphorus dynamics in the hyporheic zone. The results show that the phosphorus concentration in the overlying water decreases faster than that of conservative solutes because of sediment adsorption. It is also found that the hyporheic exchange flux of phosphorus is more sensitive to the maximum adsorption capacity than to the equilibrium isotherm distribution coefficient, and the penetration depth is inhibited at higher maximum adsorption capacity. The mass proportion of phosphorus is decreased by 19.5% in the pore water but increased by 95.9% in the sediment with the increase of the maximum adsorption capacity from 0.5 to 1. These findings provide a better understanding of the transport and distribution of phosphorus in the riverbed and the contribution of transient flows such as flood to phosphorus dynamics in the hyporheic zone.Show less",https://www.webofscience.com/wos/woscc/full-record/WOS:000773693900001,https://www.webofscience.com/api/gateway?GWVersion=2&SrcAuth=OpenURL&SrcApp=WOS&DestURL=https%3A%2F%2Fwww.redi-bw.de%2Flinks%2Funist%3Furl_ver%3DZ39.88-2004%26url_ctx_fmt%3Dinfo%3Aofi%2Ffmt%3Akev%3Amtx%3Actx%26rft.artnum%3DARTN%2Be2021WR031292%26rft.atitle%3DTransport%2Bof%2BPhosphorus%2Bin%2Bthe%2BHyporheic%2BZone%26rft.aufirst%3DGuangqiu%26rft.auinit%3DGQ%26rft.aulast%3DJin%26rft.date%3D2022%26rft_id%3Dinfo%3Adoi%2F10.1029%252F2021WR031292%26rft.eissn%3D1944-7973%26rft.genre%3Darticle%26rft.issn%3D0043-1397%26rft.issue%3D3%26rft.jtitle%3DWATER%2BRESOURCES%2BRESEARCH%26rft_val_fmt%3Dinfo%3Aofi%2Ffmt%3Akev%3Amtx%3Ajournal%26rfr_id%3Dinfo%3Asid%2Fwebofscience.com%3AWOS%3AWOS%26rft.stitle%3DWATER%2BRESOUR%2BRES%26rft.volume%3D58%26rft.au%3DJin%252C%2BGQ%26rft.au%3DChen%252C%2BHX%26rft.au%3DTang%252C%2BHW&DestApp=OTHER_OpenURL&SrcAppSID=EUW1ED0F39vUy74Y9nfvfg8aiKYkH&SrcJTitle=WATER+RESOURCES+RESEARCH&SrcPubType=MD_FORMAT,10.1029/2021WR031292,"phosphorus,bedform,hyporheic exchange,nonlinear adsorption,recirculating flume","WATER EXCHANGE,FRESH-WATER,SEDIMENT,NITROGEN,RIVER,EUTROPHICATION,LIMITATION,MORPHOLOGY,ADSORPTION,BASEFLOW",,"Hohai Univ, State Key Lab Hydrol Water Resources & Hydraul En, Nanjing, Peoples R China"
26,26,"Gandy, CJ",Feb 15 2007 ,Attenuation of mining-derived pollutants in the hyporheic zone: A review,SCIENCE OF THE TOTAL ENVIRONMENT,"Mine water pollution is a major cause of surface- and groundwater pollution in former mining districts throughout Europe. It is a potential barrier to achieving good status water bodies, which is a requirement of the EU Water Framework Directive. In the UK, a concerted effort has been made over the last decade or so to address the scientific and practical challenges relating to the remediation of mine water pollution. However, most of this work has focused on remediation of point sources of pollution (typically arising from abandoned mines and shafts), while the behaviour of mine water at the groundwater-surface water interface (the ""hyporheic zone"") has received far less attention in relevant scientific and engineering literature. The extent of mine water pollution and capacity for its attenuation at the hyporheic zone has not been well quantified while, furthermore, the complex chemical and microbial processes occurring there (specifically with reference to mining-derived pollutants) have not been investigated in any depth. The absence of such data may relate, in a large part, to the difficulty in physically measuring volumes and concentrations associated with these river inputs/exports. A far greater body of literature addresses biogeochemical processes at the hyporheic zone (especially relating to manganese), albeit many such articles relate to aqueous metal dynamics in general, rather than mine water specifically. This paper presents a review of the natural attenuation processes that may limit the movement and availability of mining-derived pollutants at the groundwater-surface water (GW-SW) interface, and specifically within the hyporheic zone. A substantial part focuses on precipitation and adsorption processes at the hyporheic zone, as well as discussing the role of microbial processes in governing metal ion mobility. (c) 2006 Elsevier B.V. All rights reserved.Show less",https://www.webofscience.com/wos/woscc/full-record/WOS:000244629100001,https://www.webofscience.com/api/gateway?GWVersion=2&SrcAuth=OpenURL&SrcApp=WOS&DestURL=https%3A%2F%2Fwww.redi-bw.de%2Flinks%2Funist%3Furl_ver%3DZ39.88-2004%26url_ctx_fmt%3Dinfo%3Aofi%2Ffmt%3Akev%3Amtx%3Actx%26rft.atitle%3DAttenuation%2Bof%2Bmining-derived%2Bpollutants%2Bin%2Bthe%2Bhyporheic%2Bzone%253A%2BA%2Breview%26rft.aufirst%3DC.%2BJ.%26rft.auinit%3DCJ%26rft.aulast%3DGandy%26rft.date%3D2007%26rft_id%3Dinfo%3Adoi%2F10.1016%252Fj.scitotenv.2006.11.004%26rft.eissn%3D1879-1026%26rft.epage%3D446%26rft.genre%3Darticle%26rft.issn%3D0048-9697%26rft.issue%3D2-3%26rft.jtitle%3DSCIENCE%2BOF%2BTHE%2BTOTAL%2BENVIRONMENT%26rft_val_fmt%3Dinfo%3Aofi%2Ffmt%3Akev%3Amtx%3Ajournal%26rft.pages%3D435-446%26rfr_id%3Dinfo%3Asid%2Fwebofscience.com%3AWOS%3AWOS%26rft.spage%3D435%26rft.stitle%3DSCI%2BTOTAL%2BENVIRON%26rft.volume%3D373%26rft.au%3DGandy%252C%2BCJ%26rft.au%3DSmith%252C%2BJWN%26rft.au%3DJarvis%252C%2BAP&DestApp=OTHER_OpenURL&SrcAppSID=EUW1ED0F39vUy74Y9nfvfg8aiKYkH&SrcJTitle=SCIENCE+OF+THE+TOTAL+ENVIRONMENT&SrcPubType=MD_FORMAT,10.1016/j.scitotenv.2006.11.004,"mine water,pollution,hyporheic,attenuation,aquifer,river","MICROBIAL COMMUNITY STRUCTURE,STREAM-SUBSURFACE EXCHANGE,BIOGEOCHEMICAL PROCESSES,TRACE-METALS,RIVER,CONTAMINATION,WATER,PHOSPHORUS,NUTRIENTS,TRANSPORT",,"Newcastle Univ, Inst Res Environm & Sustainabil, Hydrogeochem Engn Res & Outreach, Newcastle Upon Tyne NE1 7RU, Tyne & Wear, England"
27,27,"Reeder, WJ",Jul 2018 ,Hyporheic Source and Sink of Nitrous Oxide,WATER RESOURCES RESEARCH,"Nitrous oxide (N2O) is a potent greenhouse gas with an estimated 10% of anthropogenic N2O coming from the hyporheic zone of streams and rivers. However, difficulty in making accurate fine-scale field measurements has prevented detailed understanding of the processes of N2O production and emission at the bedform and flowline scales. Using large-scale, replicated flume experiments that employed high-density chemical concentration measurements, we have been able to refine the current conceptualization of N2O production, consumption, and emission from the hyporheic zone. We present a predictive model based on a Damkohler-type transformation ((tau) over tilde) in which the hyporheic residence times (tau) along the flowlines are multiplied by the dissolved oxygen consumption rate constants for those flowlines. This model can identify which bedforms have the potential to produce and emit N2O, as well as the portion and location from which those emissions may occur. Our results indicate that flowlines with (tau) over tilde (up) ((tau) over tilde as the flowline returns to the surface flow) values between 0.54 and 4.4 are likely to produce and emit N2O. Flowlines with (tau) over tilde (up) values of less than 0.54 will have the same N2O as the surface water and those with values greater than 4.4 will likely sink N2O (reference conditions: 17C, surface dissolved oxygen 8.5mg/L). N2O production peaks approximately at (tau) over tilde =1.8. A cumulative density function of (tau) over tilde (up) values for all flowlines in a bedform (or multiple bedforms) can be used to estimate the portion of flowlines, and in turn the portion of the streambed, with the potential to emit N2O.Show less",https://www.webofscience.com/wos/woscc/full-record/WOS:000442502100046,https://www.webofscience.com/api/gateway?GWVersion=2&SrcAuth=OpenURL&SrcApp=WOS&DestURL=https%3A%2F%2Fwww.redi-bw.de%2Flinks%2Funist%3Furl_ver%3DZ39.88-2004%26url_ctx_fmt%3Dinfo%3Aofi%2Ffmt%3Akev%3Amtx%3Actx%26rft.atitle%3DHyporheic%2BSource%2Band%2BSink%2Bof%2BNitrous%2BOxide%26rft.aufirst%3DW.%2BJeffery%26rft.auinit%3DWJ%26rft.aulast%3DReeder%26rft.date%3D2018%26rft_id%3Dinfo%3Adoi%2F10.1029%252F2018WR022564%26rft.eissn%3D1944-7973%26rft.epage%3D5016%26rft.genre%3Darticle%26rft.issn%3D0043-1397%26rft.issue%3D7%26rft.jtitle%3DWATER%2BRESOURCES%2BRESEARCH%26rft_val_fmt%3Dinfo%3Aofi%2Ffmt%3Akev%3Amtx%3Ajournal%26rft.pages%3D5001-5016%26rfr_id%3Dinfo%3Asid%2Fwebofscience.com%3AWOS%3AWOS%26rft.spage%3D5001%26rft.stitle%3DWATER%2BRESOUR%2BRES%26rft.volume%3D54%26rft.au%3DReeder%252C%2BWJ%26rft.au%3DQuick%252C%2BAM%26rft.au%3DTonina%252C%2BD&DestApp=OTHER_OpenURL&SrcAppSID=EUW1ED0F39vUy74Y9nfvfg8aiKYkH&SrcJTitle=WATER+RESOURCES+RESEARCH&SrcPubType=MD_FORMAT,10.1029/2018WR022564,"nitrous oxide,hyporheic,predictive model","N2O EMISSIONS,STREAM,BATHYMETRY,WATER,DENITRIFICATION,TOPOGRAPHY,DYNAMICS,EXCHANGE,IMAGERY,SCALE",,"Univ Idaho, Dept Civil Engn, Moscow, ID 83843 USA"
28,28,"Jonsson, K",Jul 25 2003 ,Hyporheic exchange of reactive and conservative solutes in streams - tracer methodology and model interpretation,JOURNAL OF HYDROLOGY,"A transient storage model is evaluated using results from a tracer experiment, where a conservative and a reactive tracer (H-3 and Cr-51(III)) were injected simultaneously and monitored in stream water and bed sediment. About 76% of the chromium was lost from the stream water on the reach 30 km downstream of the injection point directly after the passage of the pulse in the flowing water. The bed sediment hosted the main part of the retained chromium. The time to washout 75% of the maximum solute uptake in the sediment was similar to 85 times longer for chromium than for tritium (i.e. similar to 45 days). It was possible to describe the sediment-water exchange with a diffusive flux formulation that could be evaluated using tritium breakthrough curves in the stream water or the tritium inventory breakthrough curves in the sediment. This experiment revealed further that observations of chromium concentrations in the sediment were essential for the quantifying of sorption properties, as it was not possible to catch accurately the time scale of sorption within the duration of the breakthrough curves in the stream water. There was a clear need for a rate-limited description of the sorption of chromium in the sediment. We found that a first-order kinetic description of the sorption process could acceptably describe the breakthrough curves in both the stream water and the bed sediment. (C) 2003 Elsevier Science B.V. All rights reserved.Show less",https://www.webofscience.com/wos/woscc/full-record/WOS:000184198300012,https://www.webofscience.com/api/gateway?GWVersion=2&SrcAuth=OpenURL&SrcApp=WOS&DestURL=https%3A%2F%2Fwww.redi-bw.de%2Flinks%2Funist%3Furl_ver%3DZ39.88-2004%26url_ctx_fmt%3Dinfo%3Aofi%2Ffmt%3Akev%3Amtx%3Actx%26rft.atitle%3DHyporheic%2Bexchange%2Bof%2Breactive%2Band%2Bconservative%2Bsolutes%2Bin%2Bstreams%2B-%2Btracer%2Bmethodology%2Band%2Bmodel%2Binterpretation%26rft.aufirst%3DK%26rft.auinit%3DK%26rft.aulast%3DJonsson%26rft.date%3D2003%26rft_id%3Dinfo%3Adoi%2F10.1016%252FS0022-1694%252803%252900140-9%26rft.epage%3D171%26rft.genre%3Darticle%26rft.issn%3D0022-1694%26rft.issue%3D1-4%26rft.jtitle%3DJOURNAL%2BOF%2BHYDROLOGY%26rft_val_fmt%3Dinfo%3Aofi%2Ffmt%3Akev%3Amtx%3Ajournal%26rft.pages%3D153-171%26rfr_id%3Dinfo%3Asid%2Fwebofscience.com%3AWOS%3AWOS%26rft.spage%3D153%26rft.stitle%3DJ%2BHYDROL%26rft.volume%3D278%26rft.au%3DJonsson%252C%2BK%26rft.au%3DJohansson%252C%2BH%26rft.au%3DWorman%252C%2BA&DestApp=OTHER_OpenURL&SrcAppSID=EUW1ED0F39vUy74Y9nfvfg8aiKYkH&SrcJTitle=JOURNAL+OF+HYDROLOGY&SrcPubType=MD_FORMAT,10.1016/S0022-1694(03)00140-9,"sorption kinetics,sediment,stream,tracer experiment,transient storage","TRANSIENT STORAGE,NONSORBING SOLUTES,NATURAL-WATERS,RIFFLE STREAM,MASS-TRANSFER,BED FORMS,TRANSPORT,PARAMETERS,SORPTION,ZONE",,"Uppsala Univ, Dept Earth Sci, Villavagen 16, SE-75236 Uppsala, Sweden"
