,Unnamed: 0,First author,Year,Title,Journal,Abstract,wos_link,fulltext_link,doi,Keywords,Plus keywords,Research areas,Corresponding address
14,14,"Morris, MR",Sep 2010 ,Successional changes in soil and hyporheic nitrogen fertility on an alluvial flood plain: implications for riparian vegetation,AQUATIC SCIENCES,"In floodplain primary succession, vegetation colonizes nitrogen-poor alluvial deposits and fertility improves as soil nitrogen accumulates over time. It is generally assumed that vegetation assimilates the vast majority of its nitrogen from the soil; however, recent studies have suggested that the hyporheic zone also may be an important nitrogen source. We investigated the potential relative importance of hyporheic nitrogen by comparing fertility indices, specifically total (TN), dissolved inorganic (DIN), potentially mineralizable (PMN) and ion exchange resin nitrogen (IERN) in both soils and the hyporheic zone at early, mid and late succession stands on an expansive river flood plain. We also constructed mesocosms to assess growth of cottonwood cuttings with access to soil and/or hyporheic water. We found TN and PMN increased from early to mid succession in both the soil (to 10 cm) and hyporheic zone (in a 10 cm layer). While TN, DIN and PMN were an order of magnitude higher in the soil than in the hyporheic zone, IERN was higher in the hyporheic zone, indicating that subsurface flow through the flood plain may be important in delivering nitrogen to the root zone. However, even when flux was added to the hyporheic PMN pool, nitrogen availability in the hyporheic zone (in a 10 cm layer) was vastly lower than soil PMN (to 10 cm). Further, the instantaneous standing stock of DIN in the surface soil alone was about equal to the sum of the DIN pool, the mean subsurface flux and the PMN pool in a 10 cm layer of hyporheic zone. In the mesocosm experiment, cottonwood cuttings with access to both soil and hyporheic water grew fastest; however, they also had the lowest foliar nitrogen concentrations, indicating that this was not due to greater nitrogen availability. In the field, nitrogen content of cottonwood foliage increased along with soil (but potentially hyporheic as well) nitrogen accumulation during succession, suggesting the vegetation responded to increasing nitrogen fertility. We conclude that at least on a per unit-volume basis, the hyporheic zone probably provides little nitrogen relative to the surface soil, except on new alluvial bars that characteristically are nitrogen poor. Therefore, the hyporheic zone is probably a much smaller nitrogen source for mature forests relative to the surface soil unless the vegetation exploits a much larger volume of the hyporheic zone than surface soil.Show less",https://www.webofscience.com/wos/woscc/full-record/WOS:000281934200011,https://www.webofscience.com/api/gateway?GWVersion=2&SrcAuth=OpenURL&SrcApp=WOS&DestURL=https%3A%2F%2Fwww.redi-bw.de%2Flinks%2Funist%3Furl_ver%3DZ39.88-2004%26url_ctx_fmt%3Dinfo%3Aofi%2Ffmt%3Akev%3Amtx%3Actx%26rft.atitle%3DSuccessional%2Bchanges%2Bin%2Bsoil%2Band%2Bhyporheic%2Bnitrogen%2Bfertility%2Bon%2Ban%2Balluvial%2Bflood%2Bplain%253A%2Bimplications%2Bfor%2Briparian%2Bvegetation%26rft.aufirst%3DMichael%2BR.%26rft.auinit%3DMR%26rft.aulast%3DMorris%26rft.date%3D2010%26rft_id%3Dinfo%3Adoi%2F10.1007%252Fs00027-010-0153-8%26rft.eissn%3D1420-9055%26rft.epage%3D532%26rft.genre%3Darticle%26rft.issn%3D1015-1621%26rft.issue%3D4%26rft.jtitle%3DAQUATIC%2BSCIENCES%26rft_val_fmt%3Dinfo%3Aofi%2Ffmt%3Akev%3Amtx%3Ajournal%26rft.pages%3D519-532%26rfr_id%3Dinfo%3Asid%2Fwebofscience.com%3AWOS%3AWOS%26rft.spage%3D519%26rft.stitle%3DAQUAT%2BSCI%26rft.volume%3D72%26rft.au%3DMorris%252C%2BMR%26rft.au%3DBrouwer%252C%2BBO%26rft.au%3DStanford%252C%2BJA&DestApp=OTHER_OpenURL&SrcAppSID=EUW1ED0F39vUy74Y9nfvfg8aiKYkH&SrcJTitle=AQUATIC+SCIENCES&SrcPubType=MD_FORMAT,10.1007/s00027-010-0153-8,"Flood plain,River,Nitrogen,Soil,Hyporheic,Ground water,Populus,Riparian","ION-EXCHANGE-RESIN,RIVER,STREAM,ACCUMULATION,GROUNDWATER,NITRATE,GROWTH,WATER,ZONE,AVAILABILITY",,"Univ Montana, Div Biol Sci, Flathead Lake Biol Stn, 32125 Bio Stn Lane, Polson, MT 59860 USA"
15,15,"Fernald, AG",Jun 2001 ,"Transient storage and hyporheic flow along the Willamette River, Oregon: Field measurements and model estimates",WATER RESOURCES RESEARCH,"Transient storage is a measure of the exchange of main channel flow with subsurface hyporheic flow and surface water dead zones. Hyporheic flow, in which river water enters the channel bed and banks to reemerge downstream, promotes biochemical processes that are important for water quality and aquatic habitat. Previous studies have quantified transient storage and hyporheic flow on small streams but were not specifically developed to identify both of these processes over long reaches of large rivers. We studied transient storage on the eighth-order upper Willamette River, which flows through high-porosity gravel deposits conducive to hyporheic flow. We used main channel dye tracer studies and solute transport modeling to estimate transient storage on nine study reaches in a 26-km-long study area. We also took dye measurements within the transient storage zone to identify transient storage Bow paths. We obtained estimates of transient storage exchange coefficient, alpha (s) (mean equals 1.6 x 10(-4) s(-1)), and transient storage to main channel cross-sectional area, A(s)/A (mean equal to 0.28), that show that significant amounts of water follow flow paths with 0.2-30 hour transient storage zone residence times. Our dye measurements from the transient storage zone itself showed the occurrence of both subsurface and surface flow paths, confirming that hyporheic flow is an important component of estimated transient storage. We found that the two highest A(s)/A estimates were for reaches that spanned the only length of active main channel in our study area that is unconstrained and where the river can rework large gravel deposits. Much of the natural channel complexity that historically promoted hyporheic flow no longer exists on the upper Willamette River. River management targeting the ecological functions provided by hyporheic flow might best focus on restoring historic hydrogeomorphic processes for creating sites conducive to hyporheic flow.Show less",https://www.webofscience.com/wos/woscc/full-record/WOS:000168845200012,https://www.webofscience.com/api/gateway?GWVersion=2&SrcAuth=OpenURL&SrcApp=WOS&DestURL=https%3A%2F%2Fwww.redi-bw.de%2Flinks%2Funist%3Furl_ver%3DZ39.88-2004%26url_ctx_fmt%3Dinfo%3Aofi%2Ffmt%3Akev%3Amtx%3Actx%26rft.atitle%3DTransient%2Bstorage%2Band%2Bhyporheic%2Bflow%2Balong%2Bthe%2BWillamette%2BRiver%252C%2BOregon%253A%2BField%2Bmeasurements%2Band%2Bmodel%2Bestimates%26rft.aufirst%3DAG%26rft.auinit%3DAG%26rft.aulast%3DFernald%26rft.date%3D2001%26rft_id%3Dinfo%3Adoi%2F10.1029%252F2000WR900338%26rft.eissn%3D1944-7973%26rft.epage%3D1694%26rft.genre%3Darticle%26rft.issn%3D0043-1397%26rft.issue%3D6%26rft.jtitle%3DWATER%2BRESOURCES%2BRESEARCH%26rft_val_fmt%3Dinfo%3Aofi%2Ffmt%3Akev%3Amtx%3Ajournal%26rft.pages%3D1681-1694%26rfr_id%3Dinfo%3Asid%2Fwebofscience.com%3AWOS%3AWOS%26rft.spage%3D1681%26rft.stitle%3DWATER%2BRESOUR%2BRES%26rft.volume%3D37%26rft.au%3DFernald%252C%2BAG%26rft.au%3DWigington%252C%2BPJ%26rft.au%3DLanders%252C%2BDH&DestApp=OTHER_OpenURL&SrcAppSID=EUW1ED0F39vUy74Y9nfvfg8aiKYkH&SrcJTitle=WATER+RESOURCES+RESEARCH&SrcPubType=MD_FORMAT,10.1029/2000WR900338,,"SALMON ONCORHYNCHUS-KISUTCH,SUBSURFACE WATER EXCHANGE,STREAMBED SEDIMENT,SOLUTE TRANSPORT,MOUNTAIN STREAM,MASS-TRANSFER,SURFACE,DENITRIFICATION,AQUIFER,ZONE",,"New Mexico State Univ, Sustainable Agr Sci Sct, POB 159, Alcalde, NM 87511 USA"
16,16,"Song, JX",Apr 14 2007 ,Effects of hyporheic processes on streambed vertical hydraulic conductivity in three rivers of Nebraska,GEOPHYSICAL RESEARCH LETTERS,"Streambed hydraulic conductivity is of great importance in the analysis of stream-aquifer interactions and stream ecosystems. We investigated streambed vertical hydraulic conductivity (K-v) with two connected depths in three rivers of Nebraska. Our results demonstrated that streambed K-v in the upper sediment layer was much higher than that in the sediment of the lower layer. We speculate that hyporheic processes can result in larger streambed K-v in the upper layer. Specifically, water exchange through upwelling and downwelling zones can lead to bigger pore spaces and a more unconsolidated structure of sediments in the upper layer. The upward movement of gas produced by redox processes can loosen the sediments and further enlarge pore spaces in the upper layers. Also, permeability can increase as a result of expanded pore spaces caused by invertebrate activities in the upper part of streambed. The higher K-v will likely enhance exchange processes between stream and sediments.Show less",https://www.webofscience.com/wos/woscc/full-record/WOS:000245726600005,https://www.webofscience.com/api/gateway?GWVersion=2&SrcAuth=OpenURL&SrcApp=WOS&DestURL=https%3A%2F%2Fwww.redi-bw.de%2Flinks%2Funist%3Furl_ver%3DZ39.88-2004%26url_ctx_fmt%3Dinfo%3Aofi%2Ffmt%3Akev%3Amtx%3Actx%26rft.artnum%3DARTN%2BL07409%26rft.atitle%3DEffects%2Bof%2Bhyporheic%2Bprocesses%2Bon%2Bstreambed%2Bvertical%2Bhydraulic%2Bconductivity%2Bin%2Bthree%2Brivers%2Bof%2BNebraska%26rft.aufirst%3DJinxi%26rft.auinit%3DJX%26rft.aulast%3DSong%26rft.date%3D2007%26rft_id%3Dinfo%3Adoi%2F10.1029%252F2007GL029254%26rft.genre%3Darticle%26rft.issn%3D0094-8276%26rft.issue%3D7%26rft.jtitle%3DGEOPHYSICAL%2BRESEARCH%2BLETTERS%26rft_val_fmt%3Dinfo%3Aofi%2Ffmt%3Akev%3Amtx%3Ajournal%26rfr_id%3Dinfo%3Asid%2Fwebofscience.com%3AWOS%3AWOS%26rft.stitle%3DGEOPHYS%2BRES%2BLETT%26rft.volume%3D34%26rft.au%3DSong%252C%2BJX%26rft.au%3DChen%252C%2BXH%26rft.au%3DWen%252C%2BFJ&DestApp=OTHER_OpenURL&SrcAppSID=EUW1ED0F39vUy74Y9nfvfg8aiKYkH&SrcJTitle=GEOPHYSICAL+RESEARCH+LETTERS&SrcPubType=MD_FORMAT,10.1029/2007GL029254,,"GAS-BUBBLES,ZONE,INVERTEBRATES,EXCHANGE,WATER,GROUNDWATER,AQUIFERS,FAUNA",,"Univ Nebraska, Sch Nat Resources, 623 Hardin Hall, Lincoln, NE 68583 USA"
17,17,"Cornut, J",Dec 2010 ,Early stages of leaf decomposition are mediated by aquatic fungi in the hyporheic zone of woodland streams,FRESHWATER BIOLOGY,"1. Leaf litter constitutes the major source of organic matter and energy in woodland stream ecosystems. A substantial part of leaf litter entering running waters may be buried in the streambed as a consequence of flooding and sediment movement. While decomposition of leaf litter in surface waters is relatively well understood, its fate when incorporated into river sediments, as well as the involvement of invertebrate and fungal decomposers in such conditions, remain poorly documented.2. We tested experimentally the hypotheses that the small interstices of the sediment restrict the access of the largest shredders to buried organic matter without compromising that of aquatic hyphomycetes and that fungal decomposers in the hyporheic zone, at least partly, compensate for the role of invertebrate detritivores in the benthic zone.3. Alder leaves were introduced in a stream either buried in the sediment (hyporheic), buried after 2 weeks of exposure at the sediment surface (benthic-hyporheic), or exposed at the sediment surface for the entire experiment (benthic). Leaf decomposition was markedly faster on the streambed surface than in the two other treatments (2.1- and 2.8-fold faster than in the benthic-hyporheic and hyporheic treatments, respectively).4. Fungal assemblages were generally less diverse in the hyporheic habitat with a few species tending to be relatively favoured by such conditions. Both fungal biomass and sporulation rates were reduced in the hyporheic treatment, with the leaves subject to the benthic-hyporheic treatment exhibiting an intermediate pattern. The initial 2-week stage in the benthic habitat shaped the fungal assemblages, even for leaves later subjected to the hyporheic conditions.5. The abundance and biomass of shredders drastically decreased with burial, except for Leuctra spp., which increased and was by far the most common leaf-associated taxon in the hyporheic zone. Leuctra spp. was one of the rare shredder taxa displaying morphological characteristics that increased performance within the limited space of sediment interstices.6. The carbon budgets indicated that the relative contributions of the two main decomposers, shredders and fungi, varied considerably depending on the location within the streambed. While the shredder biomass represented almost 50% of the initial carbon transformed after 80 days in the benthic treatment, its contribution was < 0.3% in the hyporheic one and 2.0% in the combined benthic-hyporheic treatment. In contrast, mycelial and conidial production in the permanently hyporheic environment accounted for 12% of leaf mass loss, i.e. 2-3 times more than in the two other conditions. These results suggest that the role of fungi is particularly important in the hyporheic zone.7. Our findings indicate that burial within the substratum reduces the litter breakdown rate by limiting the access of both invertebrate and fungal decomposers to leaves. As a consequence, the hyporheic zone may be an important region of organic matter storage in woodland streams and serve as a fungal inoculum reservoir contributing to further dispersal. Through the temporary retention of litter by burial, the hyporheic zone must play a significant role in the carbon metabolism and overall functioning of headwater stream ecosystems.Show less",https://www.webofscience.com/wos/woscc/full-record/WOS:000283725300009,https://www.webofscience.com/api/gateway?GWVersion=2&SrcAuth=OpenURL&SrcApp=WOS&DestURL=https%3A%2F%2Fwww.redi-bw.de%2Flinks%2Funist%3Furl_ver%3DZ39.88-2004%26url_ctx_fmt%3Dinfo%3Aofi%2Ffmt%3Akev%3Amtx%3Actx%26rft.atitle%3DEarly%2Bstages%2Bof%2Bleaf%2Bdecomposition%2Bare%2Bmediated%2Bby%2Baquatic%2Bfungi%2Bin%2Bthe%2Bhyporheic%2Bzone%2Bof%2Bwoodland%2Bstreams%26rft.aufirst%3DJulien%26rft.auinit%3DJ%26rft.aulast%3DCornut%26rft.date%3D2010%26rft_id%3Dinfo%3Adoi%2F10.1111%252Fj.1365-2427.2010.02483.x%26rft.eissn%3D1365-2427%26rft.epage%3D2556%26rft.genre%3Darticle%26rft.issn%3D0046-5070%26rft.issue%3D12%26rft.jtitle%3DFRESHWATER%2BBIOLOGY%26rft_val_fmt%3Dinfo%3Aofi%2Ffmt%3Akev%3Amtx%3Ajournal%26rft.pages%3D2541-2556%26rfr_id%3Dinfo%3Asid%2Fwebofscience.com%3AWOS%3AWOS%26rft.spage%3D2541%26rft.stitle%3DFRESHWATER%2BBIOL%26rft.volume%3D55%26rft.au%3DCornut%252C%2BJ%26rft.au%3DElger%252C%2BA%26rft.au%3DChauvet%252C%2BE&DestApp=OTHER_OpenURL&SrcAppSID=EUW1ED0F39vUy74Y9nfvfg8aiKYkH&SrcJTitle=FRESHWATER+BIOLOGY&SrcPubType=MD_FORMAT,10.1111/j.1365-2427.2010.02483.x,"aquatic hyphomycetes,litter breakdown,organic matter,river sediment,shredders","VERTICAL HYDROLOGIC EXCHANGE,ORGANIC-MATTER STORAGE,LITTER BREAKDOWN,DECAYING FUNGI,LOW-GRADIENT,DEAD LEAVES,DRY MASS,INVERTEBRATES,BIOMASS,RIVER",,"Lab Ecol Fonct, 29 Rue Jeanne Marvig, F-31055 Toulouse, France"
18,18,"Palumbo-Roe, B",Jun 2013 ,The hyporheic zone composition of a mining-impacted stream: Evidence by multilevel sampling and DGT measurements,APPLIED GEOCHEMISTRY,"The importance of the hyporheic zone in influencing stream solute loads and stream ecosystems has been increasingly recognised. The hyporheic zone physicochemical composition of a stream stretch of the Rookhope Burn, a tributary of the River Wear in the North Pennines, UK, affected by historical mining of Pb ore, was characterised at two contrasting flow and temperature regimes. Vertical element concentration gradients were obtained using multilevel samplers down to a depth of 40 cm below the water-sediment boundary. Additional in situ Diffuse Gradients in Thin films (DGT) measurements of surface water and pore water were obtained.Circumneutral pH and oxidising conditions characterised the hyporheic zone of the study reach, composed of coarse-textured bed sediments. The surface hyporheic zone (top 15-20 cm) was dominated by the chemistry of the overlying water, while interactions with the solid phase were important for some elements in the deeper section of the hyporheic zone.Manganese was attenuated in the hyporheic zone as shown by SEM analysis of Mn-rich grain coatings from the bed sediment. Fine resolution data obtained through the use of the DGT probe deployed in the sediment at one sampling location, showed localised loss in Mn and Zn concentrations at 1.5-4.5 cm below the water-sediment interface. There was clear evidence for hyporheic pore water enrichment in Pb, which was unaffected seasonally, while Zn was greater in the summer sampling. These temporal variations of the hyporheic zone composition warrant consideration when accounting for the contribution of disperse inputs to mining impacted catchments, highlighting the need for hyporheic zone studies taking into account differences in seasons.The significance of the observed sediment-scale hyporheic processes on the reach-scale geochemical mass balance was estimated by using surface water geochemical loading calculations. Water metal mass balance from four previous sampling events indicated a constant loss of Mn load, a continuous gain of Pb load and a more temporally variable loss of Zn load for a 700 m stream stretch which included the study site. These results closely agreed with the present observations at the stream bed sediment scale, supporting the importance of hyporheic dynamic solute exchanges in affecting surface water quality for the study stream. (c) 2013 Natural Environment Research Council. Published by Elsevier Ltd. All rights reserved.Show less",https://www.webofscience.com/wos/woscc/full-record/WOS:000318615100027,https://www.webofscience.com/api/gateway?GWVersion=2&SrcAuth=OpenURL&SrcApp=WOS&DestURL=https%3A%2F%2Fwww.redi-bw.de%2Flinks%2Funist%3Furl_ver%3DZ39.88-2004%26url_ctx_fmt%3Dinfo%3Aofi%2Ffmt%3Akev%3Amtx%3Actx%26rft.atitle%3DThe%2Bhyporheic%2Bzone%2Bcomposition%2Bof%2Ba%2Bmining-impacted%2Bstream%253A%2BEvidence%2Bby%2Bmultilevel%2Bsampling%2Band%2BDGT%2Bmeasurements%26rft.aufirst%3DBarbara%26rft.auinit%3DB%26rft.aulast%3DPalumbo-Roe%26rft.date%3D2013%26rft_id%3Dinfo%3Adoi%2F10.1016%252Fj.apgeochem.2013.03.003%26rft.epage%3D345%26rft.genre%3Darticle%26rft.issn%3D0883-2927%26rft.jtitle%3DAPPLIED%2BGEOCHEMISTRY%26rft_val_fmt%3Dinfo%3Aofi%2Ffmt%3Akev%3Amtx%3Ajournal%26rft.pages%3D330-345%26rfr_id%3Dinfo%3Asid%2Fwebofscience.com%3AWOS%3AWOS%26rft.spage%3D330%26rft.stitle%3DAPPL%2BGEOCHEM%26rft.volume%3D33%26rft.au%3DPalumbo-Roe%252C%2BB%26rft.au%3DDearden%252C%2BR&DestApp=OTHER_OpenURL&SrcAppSID=EUW1ED0F39vUy74Y9nfvfg8aiKYkH&SrcJTitle=APPLIED+GEOCHEMISTRY&SrcPubType=MD_FORMAT,10.1016/j.apgeochem.2013.03.003,,"ACID-MINE DRAINAGE,TRACE-METALS,CONTAMINATED STREAM,WASTE ROCK,SEDIMENTS,SPECIATION,CHEMISTRY,TRANSPORT,CREEK,SOILS",,"British Geol Survey, Keyworth NG12 5GG, Notts, England"
19,19,"Norman, FA",Apr 2014 ,Heat transport in hyporheic zones due to bedforms: An experimental study,WATER RESOURCES RESEARCH,"Heat transport in hyporheic zones is critical for many temperature-sensitive physical, chemical, and biological processes. It also plays a role in the energy balance of rivers. To complement previous theoretical studies, we investigated the effects of hyporheic flow due to bed topography on hyporheic thermal dynamics through flume experiments. Diel temperature cycles were imposed in the channel and propagation of temperature signals into the sediment was examined for three different bed morphologies (flat bed, pool-riffle-pool, and rippled bed), three-channel flow rates, and two sediment grain sizes. Results show that the downwelling upstream and downstream of the bedforms and upwelling focused near the crest caused substantial advective heat transport and distinct thermal patterns in the sediment, with downwelling zones reflecting most of the surface water diel thermal range whereas upwelling zones were more buffered. Increasing permeability and channel flow rates increased advective transport. The results corroborate previous theoretical models further showing that hyporheic flow distinctly affects thermal patchiness in sediment. The results also have implications for heat tracing using analytical models which work well for flow fields without pronounced divergence and convergence and minimal dispersion, features atypical of hyporheic flow.Show less",https://www.webofscience.com/wos/woscc/full-record/WOS:000336026000046,https://www.webofscience.com/api/gateway?GWVersion=2&SrcAuth=OpenURL&SrcApp=WOS&DestURL=https%3A%2F%2Fwww.redi-bw.de%2Flinks%2Funist%3Furl_ver%3DZ39.88-2004%26url_ctx_fmt%3Dinfo%3Aofi%2Ffmt%3Akev%3Amtx%3Actx%26rft.atitle%3DHeat%2Btransport%2Bin%2Bhyporheic%2Bzones%2Bdue%2Bto%2Bbedforms%253A%2BAn%2Bexperimental%2Bstudy%26rft.aufirst%3DFrancis%2BA.%26rft.auinit%3DFA%26rft.aulast%3DNorman%26rft.date%3D2014%26rft_id%3Dinfo%3Adoi%2F10.1002%252F2013WR014673%26rft.eissn%3D1944-7973%26rft.epage%3D3582%26rft.genre%3Darticle%26rft.issn%3D0043-1397%26rft.issue%3D4%26rft.jtitle%3DWATER%2BRESOURCES%2BRESEARCH%26rft_val_fmt%3Dinfo%3Aofi%2Ffmt%3Akev%3Amtx%3Ajournal%26rft.pages%3D3568-3582%26rfr_id%3Dinfo%3Asid%2Fwebofscience.com%3AWOS%3AWOS%26rft.spage%3D3568%26rft.stitle%3DWATER%2BRESOUR%2BRES%26rft.volume%3D50%26rft.au%3DNorman%252C%2BFA%26rft.au%3DCardenas%252C%2BMB&DestApp=OTHER_OpenURL&SrcAppSID=EUW1ED0F39vUy74Y9nfvfg8aiKYkH&SrcJTitle=WATER+RESOURCES+RESEARCH&SrcPubType=MD_FORMAT,10.1002/2013WR014673,"hyporheic zone,heat transport,streambed,bedform,hyporheic exchange,temperature","TEMPERATURE TIME-SERIES,STREAMBED TEMPERATURES,LABORATORY EXPERIMENTS,GROUNDWATER DISCHARGE,METAL CONCENTRATIONS,SUBSURFACE EXCHANGE,NONSORBING SOLUTES,EPHEMERAL CHANNELS,DIEL CYCLES,WATER FLUX",,"Univ Texas Austin, Austin, TX 78712 USA"
20,20,"Musial, CT",Feb 28 2016 ,Surface water-groundwater exchange dynamics in a tidal freshwater zone,HYDROLOGICAL PROCESSES,"In coastal rivers, tides can propagate for tens to hundreds of kilometres inland beyond the saltwater line. Yet the influence of tides on river-aquifer connectivity and solute transport in tidal freshwater zones (TFZs) is largely unknown. We estimate that along the TFZ of White Clay Creek (Delaware, USA), 11% of river water exchanges through tidal bank storage zones. Additional hyporheic processes such as flow through bedforms likely contribute even more exchange. The turnover length associated with tidal bank storage is 150km, on the order of turnover lengths for all hyporheic exchange processes in non-tidal rivers of similar size. Based on measurements at a transect of piezometers located 17km from the coast, tides exchange 0.36m(3) of water across the banks and 0.86m(3) across the bed per unit river length. Exchange fluxes range from -1.66 to 2.26mday(-1) across the bank and -0.84 to 1.88mday(-1) across the bed. During rising tide, river water infiltrates into the riparian aquifer, and the downstream transport rate in the channel is low. During falling tide, stored groundwater is released to the river, and the downstream transport rate in the channel increases. Tidal bank storage zones may remove nutrients or other contaminants from river water and attenuate nutrient loads to coasts. Alternating expansion and contraction of aerobic zones in the riparian aquifer likely influence contaminant removal along flow paths. A clear need exists to understand contaminant removal and other ecosystem services in TFZs and adopt best management practices to promote these ecosystem services. Copyright (c) 2015 John Wiley & Sons, Ltd.Show less",https://www.webofscience.com/wos/woscc/full-record/WOS:000370639100006,https://www.webofscience.com/api/gateway?GWVersion=2&SrcAuth=OpenURL&SrcApp=WOS&DestURL=https%3A%2F%2Fwww.redi-bw.de%2Flinks%2Funist%3Furl_ver%3DZ39.88-2004%26url_ctx_fmt%3Dinfo%3Aofi%2Ffmt%3Akev%3Amtx%3Actx%26rft.atitle%3DSurface%2Bwater-groundwater%2Bexchange%2Bdynamics%2Bin%2Ba%2Btidal%2Bfreshwater%2Bzone%26rft.aufirst%3DCole%2BT.%26rft.auinit%3DCT%26rft.aulast%3DMusial%26rft.date%3D2016%26rft_id%3Dinfo%3Adoi%2F10.1002%252Fhyp.10623%26rft.eissn%3D1099-1085%26rft.epage%3D750%26rft.genre%3Darticle%26rft.issn%3D0885-6087%26rft.issue%3D5%26rft.jtitle%3DHYDROLOGICAL%2BPROCESSES%26rft_val_fmt%3Dinfo%3Aofi%2Ffmt%3Akev%3Amtx%3Ajournal%26rft.pages%3D739-750%26rfr_id%3Dinfo%3Asid%2Fwebofscience.com%3AWOS%3AWOS%26rft.spage%3D739%26rft.stitle%3DHYDROL%2BPROCESS%26rft.volume%3D30%26rft.au%3DMusial%252C%2BCT%26rft.au%3DSawyer%252C%2BAH%26rft.au%3DKnights%252C%2BD&DestApp=OTHER_OpenURL&SrcAppSID=EUW1ED0F39vUy74Y9nfvfg8aiKYkH&SrcJTitle=HYDROLOGICAL+PROCESSES&SrcPubType=MD_FORMAT,10.1002/hyp.10623,"hyporheic exchange,bank storage,coastal rivers,tidal freshwater zone,tidal pumping,water quality","HYPORHEIC EXCHANGE,NUMERICAL-SIMULATION,STREAM CHANNEL,RIPARIAN ZONE,NITRATE,DENITRIFICATION,RETENTION,NITROGEN,STORAGE,FLUX",,"Ohio State Univ, Sch Earth Sci, Columbus, OH 43210 USA"
