,Unnamed: 0,First author,Year,Title,Journal,Abstract,wos_link,fulltext_link,doi,Keywords,Plus keywords,Research areas,Corresponding address
29,29,"Fortner, SK",Jan 30 2013 ,"Diel stream geochemistry, Taylor Valley, Antarctica",HYDROLOGICAL PROCESSES,"Unlike temperate and polythermal proglacial streams, the proglacial streams in Taylor Valley ( TV), Antarctica, are derived primarily from glacier surface melt with no subglacial or groundwater additions. Solute responses to flow reflect only the interaction of glacial meltwater with the valley floor surrounding the stream channel. We have investigated the major, minor and trace element 24-h variations of two proglacial melt streams, Andersen Creek and Canada Stream, originating from the Canada Glacier in TV, Antarctica. Both streams exhibited diel mid-austral summer diurnal flow variation, with maximum flow being more than 50 times the minimum flow. Dissolved (< 0.4 mu m) major, minor and trace solute behaviors through diel periods were strongly controlled by the availability of readily solubilized material on the valley floor and hyporheic-biological exchanges. Anderson Creek had generally greater solute concentrations than Canada Stream because of its greater receipt of eolian sediment. Andersen Creek also acquired greater solute concentrations in the rising limb of the hydrograph than the falling limb because of dissolution of eolian material at the surface of the stream channel coupled with minimal hyporheic-biological exchange. Conversely, Canada Stream had less available eolian sediment, but a greater hyporheic-biological exchange, which preferentially removed trace and major solutes in the rising limb and released them in the falling limb. Given the dynamic nature of discharge, eolian, and hyporheic-biological processes, solute loads in TV streams are difficult to predict. Copyright (C) 2012 John Wiley & Sons, Ltd.Show less",https://www.webofscience.com/wos/woscc/full-record/WOS:000313989000008,https://www.webofscience.com/api/gateway?GWVersion=2&SrcAuth=OpenURL&SrcApp=WOS&DestURL=https%3A%2F%2Fwww.redi-bw.de%2Flinks%2Funist%3Furl_ver%3DZ39.88-2004%26url_ctx_fmt%3Dinfo%3Aofi%2Ffmt%3Akev%3Amtx%3Actx%26rft.atitle%3DDiel%2Bstream%2Bgeochemistry%252C%2BTaylor%2BValley%252C%2BAntarctica%26rft.aufirst%3DSarah%2BK.%26rft.auinit%3DSK%26rft.aulast%3DFortner%26rft.date%3D2013%26rft_id%3Dinfo%3Adoi%2F10.1002%252Fhyp.9255%26rft.eissn%3D1099-1085%26rft.epage%3D404%26rft.genre%3Darticle%26rft.issn%3D0885-6087%26rft.issue%3D3%26rft.jtitle%3DHYDROLOGICAL%2BPROCESSES%26rft_val_fmt%3Dinfo%3Aofi%2Ffmt%3Akev%3Amtx%3Ajournal%26rft.pages%3D394-404%26rfr_id%3Dinfo%3Asid%2Fwebofscience.com%3AWOS%3AWOS%26rft.spage%3D394%26rft.stitle%3DHYDROL%2BPROCESS%26rft.volume%3D27%26rft.au%3DFortner%252C%2BSK%26rft.au%3DLyons%252C%2BWB%26rft.au%3DMunk%252C%2BL&DestApp=OTHER_OpenURL&SrcAppSID=EUW1ED0F39vUy74Y9nfvfg8aiKYkH&SrcJTitle=HYDROLOGICAL+PROCESSES&SrcPubType=MD_FORMAT,10.1002/hyp.9255,"diel,trace elements,streams,Antarctica,major ions","MCMURDO DRY VALLEYS,GLACIAL MELTWATER STREAM,SOUTHERN VICTORIA LAND,HYPORHEIC ZONE,TRANSIENT STORAGE,SIERRA-NEVADA,FRYXELL BASIN,WATER,RIVER,CHEMISTRY",,"Ohio State Univ, Byrd Polar Res Ctr, 1090 Carmack Rd, Columbus, OH 43210 USA"
30,30,"Jiang, QH",Aug 2020 ,Density-dependent solute transport in a layered hyporheic zone,ADVANCES IN WATER RESOURCES,"Hyporheic exchange is affected by bedform geometry, which induces complex flow paths within the bedform. Additional factors that influence flow and solute transport in the hyporheic zone are layered profile sediments and density-driven flow. This study explored the combined effects of these factors on hyporheic exchange through laboratory experiments and numerical simulations involving infiltrating solute displacing less-dense resident water in a layered bedform with a low permeability layer (LPL). The bedform consisted of three horizontal layers, in which the hydraulic conductivity of the middle layer (LPL) was less than that of the top (TL) and bottom layers (BL). The results demonstrated that a previously unexplored combination of mechanisms (density effects and layered bedform) produces irregular spatial patterns of solute transport in the hyporheic zone. For instance, the width of solute plume within the bottom layers becomes narrowed compared with tracer transport. With increasing density contrast between infiltrating solute and resident water, the solute plume becomes much narrower, forming fingers. Numerical modeling further shows that the hydraulic conductivity contrast (HCC) and relative thickness (RT) of the hyporheic zone layers also affect the spatial solute transport patterns. As the hydraulic conductivity contrast or relative thickness increases, the plume becomes much narrower. Horizontal ambient flow (HAF) dominated in the bottom layers, and lateral solute spreading and mixing intensified with a higher hydraulic conductivity contrast and relative thickness. Furthermore, the vertical solute plume was detached by the horizontal ambient flow in the bottom layers with a discontinuous low permeability layer, forming a discontinuous zone of vertical solute transport.Show less",https://www.webofscience.com/wos/woscc/full-record/WOS:000550807600007,https://www.webofscience.com/api/gateway?GWVersion=2&SrcAuth=OpenURL&SrcApp=WOS&DestURL=https%3A%2F%2Fwww.redi-bw.de%2Flinks%2Funist%3Furl_ver%3DZ39.88-2004%26url_ctx_fmt%3Dinfo%3Aofi%2Ffmt%3Akev%3Amtx%3Actx%26rft.artnum%3DARTN%2B103645%26rft.atitle%3DDensity-dependent%2Bsolute%2Btransport%2Bin%2Ba%2Blayered%2Bhyporheic%2Bzone%26rft.aufirst%3DQihao%26rft.auinit%3DQH%26rft.aulast%3DJiang%26rft.date%3D2020%26rft_id%3Dinfo%3Adoi%2F10.1016%252Fj.advwatres.2020.103645%26rft.eissn%3D1872-9657%26rft.genre%3Darticle%26rft.issn%3D0309-1708%26rft.jtitle%3DADVANCES%2BIN%2BWATER%2BRESOURCES%26rft_val_fmt%3Dinfo%3Aofi%2Ffmt%3Akev%3Amtx%3Ajournal%26rfr_id%3Dinfo%3Asid%2Fwebofscience.com%3AWOS%3AWOS%26rft.stitle%3DADV%2BWATER%2BRESOUR%26rft.volume%3D142%26rft.au%3DJiang%252C%2BQH%26rft.au%3DJin%252C%2BGQ%26rft.au%3DBarry%252C%2BDA&DestApp=OTHER_OpenURL&SrcAppSID=EUW1ED0F39vUy74Y9nfvfg8aiKYkH&SrcJTitle=ADVANCES+IN+WATER+RESOURCES&SrcPubType=MD_FORMAT,10.1016/j.advwatres.2020.103645,"Hyporheic exchange,Layered profile,Density-driven flow,Low- permeability layer","SUBSURFACE EXCHANGE,NONSORBING SOLUTES,ORGANIC-CARBON,WASTE-WATER,GROUNDWATER,STREAM,FLOW,FLUXES,DISCHARGE,BEDFORMS",,"Hohai Univ, State Key Lab Hydrol Water Resources & Hydraul En, Nanjing, Peoples R China"
31,31,"Lyu, HH",Jan 1 2020 ,Stream order and connectivity affect phosphorus distribution in plain river network,ENVIRONMENTAL POLLUTANTS AND BIOAVAILABILITY,"The order and connectivity of streams influence phosphorus distribution extensively. In this work, the space-and-time variabilities of total phosphorus (TP), particulate phosphorus (PP), total dissolved phosphorus (TDP), dissolved reactive phosphorus (DRP), and dissolved unreactive phosphorus (DUP) in streams of three orders (?, ?, III) were analyzed during each spring of 2016-2018 in a plain river network area, China. The results show that: ? PP was the main form of TP and DRP was the main form of TDP. ? The average concentrations of phosphorus in the order ? streams were significant larger than those in the order III streams. ? The concentrations of TP, PP, TDP, and DRP in the poor-connected streams were considerably higher than those in the well-connected streams. Therefore, it is essential to implement effective practices to improve the protection and appropriate connectivity of small streams in plain river network areas.Show less",https://www.webofscience.com/wos/woscc/full-record/WOS:000687191400003,https://www.webofscience.com/api/gateway?GWVersion=2&SrcAuth=OpenURL&SrcApp=WOS&DestURL=https%3A%2F%2Fwww.redi-bw.de%2Flinks%2Funist%3Furl_ver%3DZ39.88-2004%26url_ctx_fmt%3Dinfo%3Aofi%2Ffmt%3Akev%3Amtx%3Actx%26rft.atitle%3DStream%2Border%2Band%2Bconnectivity%2Baffect%2Bphosphorus%2Bdistribution%2Bin%2Bplain%2Briver%2Bnetwork%26rft.aufirst%3DHuihua%26rft.auinit%3DHH%26rft.aulast%3DLyu%26rft.date%3D2020%26rft_id%3Dinfo%3Adoi%2F10.1080%252F26395940.2020.1820906%26rft.eissn%3D2639-5940%26rft.epage%3D153%26rft.genre%3Darticle%26rft.issn%3D2639-5932%26rft.issue%3D1%26rft.jtitle%3DENVIRONMENTAL%2BPOLLUTANTS%2BAND%2BBIOAVAILABILITY%26rft_val_fmt%3Dinfo%3Aofi%2Ffmt%3Akev%3Amtx%3Ajournal%26rft.pages%3D146-153%26rfr_id%3Dinfo%3Asid%2Fwebofscience.com%3AWOS%3AWOS%26rft.spage%3D146%26rft.stitle%3DENV%2BPOLLUT%2BBIOAVAIL%26rft.volume%3D32&DestApp=OTHER_OpenURL&SrcAppSID=EUW1ED0F39vUy74Y9nfvfg8aiKYkH&SrcJTitle=ENVIRONMENTAL+POLLUTANTS+AND+BIOAVAILABILITY&SrcPubType=MD_FORMAT,10.1080/26395940.2020.1820906,"Stream order,connectivity,phosphorus,plain river network area","WATER-QUALITY,DELIVERY,RETENTION,NITROGEN,SIZE",,"Yancheng Inst Technol, Sch Environm Sci & Engn, Yancheng, Peoples R China"
32,32,"Constantz, J",Apr 2013 ,Streambed exchanges along tributary streams in humid watersheds,WATER RESOURCES RESEARCH,"Tributary streams flow from the headwaters directly to the main stem in the valley axis and represent an important general stream type with high surface areas to volume and high streambed exchanges along much of their length. These characteristics strongly influence water quantity and quality in tributary streams, as well as the underlying groundwater and, eventually, the main stem. Tributary streams can be described as consisting of upland, central, and distal reaches, each with temporal trends in streambed exchanges unique to their spatial position along the tributary stream. In this work, thermal tracing and hydraulic monitoring reported in earlier works have been analyzed to compare surface-water/groundwater streambed exchange patterns along Fish Creek Wyoming (US), a well-studied tributary stream in a humid watershed. Results of this analysis demonstrate that composite thermal/hydraulic techniques successfully differentiated reach-specific streambed exchanges to distinguish upland, central, and distal reaches along Fish Creek above the Snake River. The upland and central reaches streambed exchanges were primarily vertical and horizontal streambed exchanges normal to general streamflow, while the distal reach streambed exchanges were lower in magnitude and more longitudinal in the same direction as streamflow. Heat-based streambed hydraulic conductivities were highest (and isotropic) for the upland reach and lowest (and strongly anisotropic) for the distal reach, in accordance with general downstream sediment fining approaching a main stem. These distinct reach patterns should show general transfer value, since general tributary streambed exchange patterns are expected to be influenced by proximity to headwaters in the upland reach, by buffering within alluvial fill in the central reach, and by proximity to the main stem in the distal reach.Show less",https://www.webofscience.com/wos/woscc/full-record/WOS:000319282100031,https://www.webofscience.com/api/gateway?GWVersion=2&SrcAuth=OpenURL&SrcApp=WOS&DestURL=https%3A%2F%2Fwww.redi-bw.de%2Flinks%2Funist%3Furl_ver%3DZ39.88-2004%26url_ctx_fmt%3Dinfo%3Aofi%2Ffmt%3Akev%3Amtx%3Actx%26rft.atitle%3DStreambed%2Bexchanges%2Balong%2Btributary%2Bstreams%2Bin%2Bhumid%2Bwatersheds%26rft.aufirst%3DJim%26rft.auinit%3DJ%26rft.aulast%3DConstantz%26rft.date%3D2013%26rft_id%3Dinfo%3Adoi%2F10.1002%252Fwrcr.20194%26rft.eissn%3D1944-7973%26rft.epage%3D2204%26rft.genre%3Darticle%26rft.issn%3D0043-1397%26rft.issue%3D4%26rft.jtitle%3DWATER%2BRESOURCES%2BRESEARCH%26rft_val_fmt%3Dinfo%3Aofi%2Ffmt%3Akev%3Amtx%3Ajournal%26rft.pages%3D2197-2204%26rfr_id%3Dinfo%3Asid%2Fwebofscience.com%3AWOS%3AWOS%26rft.spage%3D2197%26rft.stitle%3DWATER%2BRESOUR%2BRES%26rft.volume%3D49%26rft.au%3DConstantz%252C%2BJ%26rft.au%3DEddy-Miller%252C%2BCA%26rft.au%3DEssaid%252C%2BHI&DestApp=OTHER_OpenURL&SrcAppSID=EUW1ED0F39vUy74Y9nfvfg8aiKYkH&SrcJTitle=WATER+RESOURCES+RESEARCH&SrcPubType=MD_FORMAT,10.1002/wrcr.20194,"tributary stream,streambed exchanges,groundwater,heat tracing","GROUNDWATER DISCHARGE,TEMPERATURE PROFILES,HEAT,FLOW,TRANSPORT,SOLUTE,FLUX,SUBSURFACE,SIMULATION,TRANSIENT",,"US Geol Survey, Natl Res Program, Menlo Pk, CA 94025 USA"
33,33,"Zachara, JM",Feb 2020 ,Kilometer-Scale Hydrologic Exchange Flows in a Gravel Bed River Corridor and Their Implications to Solute Migration,WATER RESOURCES RESEARCH,"A well-characterized field site along a major, gravel bed river corridor was used to investigate the dynamic pathways and impacts of subsurface hydrogeologic structure on kilometer-scale hydrologic exchange flows between river water and groundwater. An aqueous uranium (U-aq) plume exists within a hyporheic alluvial aquifer at the site that discharges to the Columbia River. We performed temporally intensive monitoring of specific conductance (SpC) and U-aq concentrations within the plume for a 2-year period at varying distances from the river shoreline, both within and outside a presumed subsurface pathway of lateral hydrologic exchange. SpC and U-aq were utilized as in situ tracers of hydrologic exchange and associated groundwater-surface water mixing. Seasonal river stage variations by more than 2 m caused distinct events of river water intrusion and retreat from the nearshore, hyporheic alluvial aquifer, resulting in highly dynamic SpC and U-aq patterns in monitoring wells. Simulations of hydrologic exchange and mixing were performed with PFLOTRAN to understand the observed SpC and U-aq behaviors linked to predominant flow directions and velocities in the river corridor as influenced by river stage dynamics and variable aquitard topography. By coupling robust monitoring with numerical flow and transport modeling, we demonstrate complicated multidirectional flow behaviors at the kilometer scale that strongly influenced plume dynamics. Therefore, hyporheic aquifer must be frequently monitored under different flow conditions if water quality is of concern. The resulting hydrologic understanding enables improved interpretation of hydrogeochemical data from this site and other large gravel bed river corridors in the United States and elsewhere.Show less",https://www.webofscience.com/wos/woscc/full-record/WOS:000535672800040,https://www.webofscience.com/api/gateway?GWVersion=2&SrcAuth=OpenURL&SrcApp=WOS&DestURL=https%3A%2F%2Fwww.redi-bw.de%2Flinks%2Funist%3Furl_ver%3DZ39.88-2004%26url_ctx_fmt%3Dinfo%3Aofi%2Ffmt%3Akev%3Amtx%3Actx%26rft.artnum%3DARTN%2Be2019WR025258%26rft.atitle%3DKilometer-Scale%2BHydrologic%2BExchange%2BFlows%2Bin%2Ba%2BGravel%2BBed%2BRiver%2BCorridor%2Band%2BTheir%2BImplications%2Bto%2BSolute%2BMigration%26rft.aufirst%3DJohn%2BM.%26rft.auinit%3DJM%26rft.aulast%3DZachara%26rft.date%3D2020%26rft_id%3Dinfo%3Adoi%2F10.1029%252F2019WR025258%26rft.eissn%3D1944-7973%26rft.genre%3Darticle%26rft.issn%3D0043-1397%26rft.issue%3D2%26rft.jtitle%3DWATER%2BRESOURCES%2BRESEARCH%26rft_val_fmt%3Dinfo%3Aofi%2Ffmt%3Akev%3Amtx%3Ajournal%26rfr_id%3Dinfo%3Asid%2Fwebofscience.com%3AWOS%3AWOS%26rft.stitle%3DWATER%2BRESOUR%2BRES%26rft.volume%3D56%26rft.au%3DZachara%252C%2BJM%26rft.au%3DChen%252C%2BXY%26rft.au%3DResch%252C%2BCT&DestApp=OTHER_OpenURL&SrcAppSID=EUW1ED0F39vUy74Y9nfvfg8aiKYkH&SrcJTitle=WATER+RESOURCES+RESEARCH&SrcPubType=MD_FORMAT,10.1029/2019WR025258,"surface water-groundwater interaction,gravel bed river corridor,hydrologic exchange,subsurface hydrogeologic structures,riverine and groundwater modeling,contaminant plume dynamics","SURFACE-WATER INTERACTIONS,HYPORHEIC ZONE,GROUNDWATER-FLOW,DAM OPERATIONS,BANK STORAGE,AQUIFER,STREAM,CONNECTIVITY,DYNAMICS,HETEROGENEITY",,"Pacific Northwest Natl Lab, Richland, WA 99352 USA"
34,34,"Song, JX",Sep 2010 ,Observation of bioturbation and hyporheic flux in streambeds,FRONTIERS OF ENVIRONMENTAL SCIENCE & ENGINEERING IN CHINA,"In the Elkhorn River, burrows, tubes, and sediment mounds created by invertebrate bioturbation were observed in the exposed streambed and commonly concentrated on the fine-sediment patches, which consist of silt, clay, and organic matter. These invertebrate activities could loosen the thin layer of clogging sediments and result in an increase of pore size in the sediments, leading to greater vertical hydraulic conductivity of the streambed (K (v) ). The measurements of the vertical hydraulic gradient across the submerged streambed show that vertical flux in the hyporheic zone can alter directions (upward versus downward) for two locations only a few meters apart. In situ permeameter tests show that streambed K (v) in the upper sediment layer is much higher than that in the lower sediment layer, and the calculated K (v) in the submerged streambed is consistently greater than that in the clogged sediments around the shorelines of the sand bars. Moreover, a phenomenon of gas bubble release at the water-sediment interface from the subsurface sediments was observed in the groundwater seepage zone where flow velocity is extremely small. The bursting of gas bubbles can potentially break the thin clogging layer of sediments and enhance the vertical hydraulic conductivity of the streambed.Show less",https://www.webofscience.com/wos/woscc/full-record/WOS:000281668700011,https://www.webofscience.com/api/gateway?GWVersion=2&SrcAuth=OpenURL&SrcApp=WOS&DestURL=https%3A%2F%2Fwww.redi-bw.de%2Flinks%2Funist%3Furl_ver%3DZ39.88-2004%26url_ctx_fmt%3Dinfo%3Aofi%2Ffmt%3Akev%3Amtx%3Actx%26rft.atitle%3DObservation%2Bof%2Bbioturbation%2Band%2Bhyporheic%2Bflux%2Bin%2Bstreambeds%26rft.aufirst%3DJinxi%26rft.auinit%3DJX%26rft.aulast%3DSong%26rft.date%3D2010%26rft_id%3Dinfo%3Adoi%2F10.1007%252Fs11783-010-0233-y%26rft.eissn%3D1673-7520%26rft.epage%3D348%26rft.genre%3Darticle%26rft.issn%3D1673-7415%26rft.issue%3D3%26rft.jtitle%3DFRONTIERS%2BOF%2BENVIRONMENTAL%2BSCIENCE%2B%2526%2BENGINEERING%2BIN%2BCHINA%26rft_val_fmt%3Dinfo%3Aofi%2Ffmt%3Akev%3Amtx%3Ajournal%26rft.pages%3D340-348%26rfr_id%3Dinfo%3Asid%2Fwebofscience.com%3AWOS%3AWOS%26rft.spage%3D340%26rft.stitle%3DFRONT%2BENVIRON%2BSCI%2BEN%26rft.volume%3D4%26rft.au%3DSong%252C%2BJX%26rft.au%3DChen%252C%2BXH%26rft.au%3DCheng%252C%2BC&DestApp=OTHER_OpenURL&SrcAppSID=EUW1ED0F39vUy74Y9nfvfg8aiKYkH&SrcJTitle=FRONTIERS+OF+ENVIRONMENTAL+SCIENCE+%26+ENGINEERING+IN+CHINA&SrcPubType=MD_FORMAT,10.1007/s11783-010-0233-y,"invertebrate bioturbation,clogging,hyporheic exchange,streambed,the Elkhorn River","HYDRAULIC CONDUCTIVITY,SUBSURFACE EXCHANGE,SURFACE-WATER,GAS-BUBBLES,ZONE,SEDIMENT,GROUNDWATER,RIVER,INVERTEBRATES,ECOSYSTEMS",,"Northwest Univ, Coll Urban & Environm Sci, Xian 710127, Peoples R China"
35,35,"Byrne, P",Mar 15 2015 ,Diffusive equilibrium in thin films provides evidence of suppression of hyporheic exchange and large-scale nitrate transformation in a groundwater-fed river,HYDROLOGICAL PROCESSES,"The hyporheic zone of riverbed sediments has the potential to attenuate nitrate from upwelling, polluted groundwater. However, the coarse-scale (5-10cm) measurement of nitrogen biogeochemistry in the hyporheic zone can often mask fine-scale (<1cm) biogeochemical patterns, especially in near-surface sediments, leading to incomplete or inaccurate representation of the capacity of the hyporheic zone to transform upwelling NO3-. In this study, we utilised diffusive equilibrium in thin-films samplers to capture high resolution (cm-scale) vertical concentration profiles of NO3-, SO42-, Fe and Mn in the upper 15cm of armoured and permeable riverbed sediments. The goal was to test whether nitrate attenuation was occurring in a sub-reach characterised by strong vertical (upwelling) water fluxes. The vertical concentration profiles obtained from diffusive equilibrium in thin-films samplers indicate considerable cm-scale variability in NO3- (4.4 +/- 2.9mg N/L), SO42- (9.9 +/- 3.1mg/l) and dissolved Fe (1.6 +/- 2.1mg/l) and Mn (0.2 +/- 0.2mg/l). However, the overall trend suggests the absence of substantial net chemical transformations and surface-subsurface water mixing in the shallow sediments of our sub-reach under baseflow conditions. The significance of this is that upwelling NO3--rich groundwater does not appear to be attenuated in the riverbed sediments at <15cm depth as might occur where hyporheic exchange flows deliver organic matter to the sediments for metabolic processes. It would appear that the chemical patterns observed in the shallow sediments of our sub-reach are not controlled exclusively by redox processes and/or hyporheic exchange flows. Deeper-seated groundwater fluxes and hydro-stratigraphy may be additional important drivers of chemical patterns in the shallow sediments of our study sub-reach. (c) 2015 The Authors. Hydrological Processes Published by John Wiley & Sons Ltd.Show less",https://www.webofscience.com/wos/woscc/full-record/WOS:000350548100044,https://www.webofscience.com/api/gateway?GWVersion=2&SrcAuth=OpenURL&SrcApp=WOS&DestURL=https%3A%2F%2Fwww.redi-bw.de%2Flinks%2Funist%3Furl_ver%3DZ39.88-2004%26url_ctx_fmt%3Dinfo%3Aofi%2Ffmt%3Akev%3Amtx%3Actx%26rft.atitle%3DDiffusive%2Bequilibrium%2Bin%2Bthin%2Bfilms%2Bprovides%2Bevidence%2Bof%2Bsuppression%2Bof%2Bhyporheic%2Bexchange%2Band%2Blarge-scale%2Bnitrate%2Btransformation%2Bin%2Ba%2Bgroundwater-fed%2Briver%26rft.aufirst%3DP.%26rft.auinit%3DP%26rft.aulast%3DByrne%26rft.date%3D2015%26rft_id%3Dinfo%3Adoi%2F10.1002%252Fhyp.10269%26rft.eissn%3D1099-1085%26rft.epage%3D1396%26rft.genre%3Darticle%26rft.issn%3D0885-6087%26rft.issue%3D6%26rft.jtitle%3DHYDROLOGICAL%2BPROCESSES%26rft_val_fmt%3Dinfo%3Aofi%2Ffmt%3Akev%3Amtx%3Ajournal%26rft.pages%3D1385-1396%26rfr_id%3Dinfo%3Asid%2Fwebofscience.com%3AWOS%3AWOS%26rft.spage%3D1385%26rft.stitle%3DHYDROL%2BPROCESS%26rft.volume%3D29%26rft.au%3DByrne%252C%2BP%26rft.au%3DZhang%252C%2BH%26rft.au%3DTrimmer%252C%2BM&DestApp=OTHER_OpenURL&SrcAppSID=EUW1ED0F39vUy74Y9nfvfg8aiKYkH&SrcJTitle=HYDROLOGICAL+PROCESSES&SrcPubType=MD_FORMAT,10.1002/hyp.10269,"nitrate cycling,riverbed sediment,water quality,pollution,hyporheic zone,groundwater,pore water,DET","IN-SITU MEASUREMENT,SURFACE WATER INTERFACE,SEDIMENT PORE-WATERS,PERFORMANCE-CHARACTERISTICS,CONSTRAINED DET,DISSOLVED IRON,LEAF-LITTER,GEL PROBES,RESOLUTION,STREAM",,"Liverpool John Moores Univ, Sch Nat Sci & Psychol, Liverpool L3 3AF, Merseyside, England"
36,36,"Singh, T",Aug 2020 ,Effects of Successive Peak Flow Events on Hyporheic Exchange and Residence Times,WATER RESOURCES RESEARCH,"Hyporheic exchange is a crucial control of the type and rates of streambed biogeochemical processes, including metabolism, respiration, nutrient turnover, and the transformation of pollutants. Previous work has shown that increasing discharge during an individual peak flow event strengthens biogeochemical turnover by enhancing the exchange of water and dissolved solutes. However, due to the nonsteady nature of the exchange process, successive peak flow events do not exhibit proportional variations in residence time and turnover, and in some cases, can reduce the hyporheic zones' biogeochemical potential. Here, we used a process-based model to explore the role of successive peak flow events on the flow and transport characteristics of bedform-induced hyporheic exchange. We conducted a systematic analysis of the impacts of the events' magnitude, duration, and time between peaks in the hyporheic zone's fluxes, penetration, and residence times. The relative contribution of each event to the transport of solutes across the sediment-water interface was inferred from transport simulations of a conservative solute. In addition to temporal variations in the hyporheic flow field, our results demonstrate that the separation between two events determines the temporal evolution of residence time and that event time lags longer than the memory of the system result in successive events that can be treated independently. This study highlights the importance of discharge variability in the dynamics of hyporheic exchange and its potential implications for biogeochemical transformations and fate of contaminants along river corridors.Show less",https://www.webofscience.com/wos/woscc/full-record/WOS:000582701700019,https://www.webofscience.com/api/gateway?GWVersion=2&SrcAuth=OpenURL&SrcApp=WOS&DestURL=https%3A%2F%2Fwww.redi-bw.de%2Flinks%2Funist%3Furl_ver%3DZ39.88-2004%26url_ctx_fmt%3Dinfo%3Aofi%2Ffmt%3Akev%3Amtx%3Actx%26rft.artnum%3DARTN%2Be2020WR027113%26rft.atitle%3DEffects%2Bof%2BSuccessive%2BPeak%2BFlow%2BEvents%2Bon%2BHyporheic%2BExchange%2Band%2BResidence%2BTimes%26rft.aufirst%3DTanu%26rft.auinit%3DT%26rft.aulast%3DSingh%26rft.date%3D2020%26rft_id%3Dinfo%3Adoi%2F10.1029%252F2020WR027113%26rft.eissn%3D1944-7973%26rft.genre%3Darticle%26rft.issn%3D0043-1397%26rft.issue%3D8%26rft.jtitle%3DWATER%2BRESOURCES%2BRESEARCH%26rft_val_fmt%3Dinfo%3Aofi%2Ffmt%3Akev%3Amtx%3Ajournal%26rfr_id%3Dinfo%3Asid%2Fwebofscience.com%3AWOS%3AWOS%26rft.stitle%3DWATER%2BRESOUR%2BRES%26rft.volume%3D56%26rft.au%3DSingh%252C%2BT%26rft.au%3DGomez-Velez%252C%2BJD%26rft.au%3DKrause%252C%2BS&DestApp=OTHER_OpenURL&SrcAppSID=EUW1ED0F39vUy74Y9nfvfg8aiKYkH&SrcJTitle=WATER+RESOURCES+RESEARCH&SrcPubType=MD_FORMAT,10.1029/2020WR027113,,"DISSOLVED ORGANIC-CARBON,GROUNDWATER EXCHANGES,STREAM DISCHARGE,STORM EVENTS,ZONE,NITRATE,DISTRIBUTIONS,PERMEABILITY,INTERFACES,PATTERNS",,"Univ Birmingham, Sch Geog Earth & Environm Sci, Birmingham, W Midlands, England"
