,Unnamed: 0,First author,Year,Title,Journal,Abstract,wos_link,fulltext_link,doi,Keywords,Plus keywords,Research areas,Corresponding address
23,23,"Lefebvre, S",47th Congress of the French-Limnological-Association,Nitrogen dynamics in rural streams: differences between geomorphologic units,ANNALES DE LIMNOLOGIE-INTERNATIONAL JOURNAL OF LIMNOLOGY,,https://www.webofscience.com/wos/woscc/full-record/WOS:000236571100006,https://www.webofscience.com/api/gateway?GWVersion=2&SrcAuth=OpenURL&SrcApp=WOS&DestURL=https%3A%2F%2Fwww.redi-bw.de%2Flinks%2Funist%3Furl_ver%3DZ39.88-2004%26url_ctx_fmt%3Dinfo%3Aofi%2Ffmt%3Akev%3Amtx%3Actx%26rft.atitle%3DNitrogen%2Bdynamics%2Bin%2Brural%2Bstreams%253A%2Bdifferences%2Bbetween%2Bgeomorphologic%2Bunits%26rft.aufirst%3DS%26rft.auinit%3DS%26rft.aulast%3DLefebvre%26rft.date%3D2006%26rft_id%3Dinfo%3Adoi%2F10.1051%252Flimn%252F2006005%26rft.epage%3D52%26rft.genre%3Darticle%26rft.issn%3D0003-4088%26rft.issue%3D1%26rft.jtitle%3DANNALES%2BDE%2BLIMNOLOGIE-INTERNATIONAL%2BJOURNAL%2BOF%2BLIMNOLOGY%26rft_val_fmt%3Dinfo%3Aofi%2Ffmt%3Akev%3Amtx%3Ajournal%26rft.pages%3D43-52%26rfr_id%3Dinfo%3Asid%2Fwebofscience.com%3AWOS%3AWOS%26rft.spage%3D43%26rft.stitle%3DANN%2BLIMNOL-INT%2BJ%2BLIM%26rft.volume%3D42%26rft.au%3DLefebvre%252C%2BS%26rft.au%3DMarmonier%252C%2BP%26rft.au%3DPeiry%252C%2BJL&DestApp=OTHER_OpenURL&SrcAppSID=EUW1ED0C934DBaBOmaBFvAACNzVIP&SrcJTitle=ANNALES+DE+LIMNOLOGIE-INTERNATIONAL+JOURNAL+OF+LIMNOLOGY&SrcPubType=MD_FORMAT,10.1051/limn/2006005,"river,sediments,hydrological exchanges,hyporheic zone,denitrification","RIFFLE-POOL SEQUENCES,HYPORHEIC ZONE,DESERT STREAM,SURFACE-WATER,HYDROLOGIC EXCHANGE,SEASONAL-VARIATION,RIVER SEDIMENTS,FOREST STREAM,DENITRIFICATION,ECOSYSTEM",,"Univ Rennes 1, CNRS, UMR 6553, ECOBIO, Ave Gen Leclerc, F-35042 Rennes, France"
24,24,"Hu, HZ",Nov 2014 ,Impact of microforms on nitrate transport at the groundwater-surface water interface in gaining streams,ADVANCES IN WATER RESOURCES,"Small streambed structures (or microforms, 0.01-1 m in length) exist ubiquitously in riverbed systems. Small-scale topography is potentially important in controlling hyporheic exchange flow and transport of conservative and reactive solutes at the groundwater-surface water interface. The role of microforms on NO3- transfer in a riffle-scale (macroforms of > 1 m length) hyporheic zone within a gaining river setting is investigated using a 2-D flow and transport model which accounts for both nitrification and denitrification. Results show that the short pathlines caused by microforms lead to more NO3- discharge to the river compared with a macroform-only condition due to shortened residence times of both surface water and groundwater in mixing zones. Short hyporheic exchange flow pathways caused by microforms could remain oxic along their entire length or switch from nitrate producing to nitrate consuming as oxygen concentrations decline. Microforms affect net NO3- flux by the combined effect of introducing more stream mass flux and reducing their residence time in mixing zones under different hydrological and biogeochemical conditions. Our findings underscore that ignoring microforms in river beds may underestimate NO3- load to the river and have practical implications for pore water sampling strategies in groundwater-surface water studies. (C) 2014 Elsevier Ltd. All rights reserved.Show less",https://www.webofscience.com/wos/woscc/full-record/WOS:000344068000015,https://www.webofscience.com/api/gateway?GWVersion=2&SrcAuth=OpenURL&SrcApp=WOS&DestURL=https%3A%2F%2Fwww.redi-bw.de%2Flinks%2Funist%3Furl_ver%3DZ39.88-2004%26url_ctx_fmt%3Dinfo%3Aofi%2Ffmt%3Akev%3Amtx%3Actx%26rft.atitle%3DImpact%2Bof%2Bmicroforms%2Bon%2Bnitrate%2Btransport%2Bat%2Bthe%2Bgroundwater-surface%2Bwater%2Binterface%2Bin%2Bgaining%2Bstreams%26rft.aufirst%3DHaizhu%26rft.auinit%3DHZ%26rft.aulast%3DHu%26rft.date%3D2014%26rft_id%3Dinfo%3Adoi%2F10.1016%252Fj.advwatres.2014.07.013%26rft.eissn%3D1872-9657%26rft.epage%3D197%26rft.genre%3Darticle%26rft.issn%3D0309-1708%26rft.jtitle%3DADVANCES%2BIN%2BWATER%2BRESOURCES%26rft_val_fmt%3Dinfo%3Aofi%2Ffmt%3Akev%3Amtx%3Ajournal%26rft.pages%3D185-197%26rfr_id%3Dinfo%3Asid%2Fwebofscience.com%3AWOS%3AWOS%26rft.spage%3D185%26rft.stitle%3DADV%2BWATER%2BRESOUR%26rft.volume%3D73%26rft.au%3DHu%252C%2BHZ%26rft.au%3DBinley%252C%2BA%26rft.au%3DMao%252C%2BXM&DestApp=OTHER_OpenURL&SrcAppSID=EUW1ED0C934DBaBOmaBFvAACNzVIP&SrcJTitle=ADVANCES+IN+WATER+RESOURCES&SrcPubType=MD_FORMAT,10.1016/j.advwatres.2014.07.013,"Hyporheic flow,Nitrate transfer,Riffle-pool sequence,Microform,Nitrification,Denitrification","HYPORHEIC ZONE,EXCHANGE PROCESSES,NONSORBING SOLUTES,NITROGEN DYNAMICS,DENITRIFICATION,RIVER,TOPOGRAPHY,MODEL,FLOW",,"China Agr Univ, Coll Water Resources & Civil Engn, 17 Qinghua East Rd, Beijing 100083, Peoples R China"
25,25,"Storey, RG",Nov 2004 ,Spatial responses of hyporheic invertebrates to seasonal changes in environmental parameters,FRESHWATER BIOLOGY,"1. Spatial relationships between hyporheic invertebrates and subsurface water flow patterns, sediment characteristics, water physicochemical parameters and several possible food sources were compared over three seasons at one site beneath a riffle. Measures of food sources included particulate organic matter (POM), bacterial activity (aerobic respiration, nitrate respiration and mineralisation of organic nitrogen) and microbial abundance.2. Patterns of water flow changed significantly over the 9-month study period, from predominantly upwelling beneath the entire riffle in spring, to distinct differentiation between downwelling and upwelling zones in summer and autumn. Water physicochemical parameters changed accordingly, showing gradually weaker correlations with depth and stronger correlations with zone between spring and autumn.3. Despite these changes, depth remained the strongest predictor of invertebrate richness, density and taxon composition throughout the study period. However, invertebrate distributions were secondarily correlated with water physicochemical parameters, and a minor gradient in invertebrate distributions between downwelling and upwelling zones became stronger from spring to summer.4. The correlations between invertebrates and physicochemical parameters changed in both magnitude and direction with season. In spring, invertebrates showed a negative correlation with surface water infiltration, whereas in summer and autumn, the correlation was positive. Correlations were strongest in summer, when interstitial dissolved oxygen concentrations were lowest.5. No relationships were found between hyporheic invertebrates and POM, microbial abundance or activity. This suggests that at this site, proximity to the streambed surface and physicochemical variables are more important than the abundance of food in controlling invertebrate distributions.Show less",https://www.webofscience.com/wos/woscc/full-record/WOS:000224434500008,https://www.webofscience.com/api/gateway?GWVersion=2&SrcAuth=OpenURL&SrcApp=WOS&DestURL=https%3A%2F%2Fwww.redi-bw.de%2Flinks%2Funist%3Furl_ver%3DZ39.88-2004%26url_ctx_fmt%3Dinfo%3Aofi%2Ffmt%3Akev%3Amtx%3Actx%26rft.atitle%3DSpatial%2Bresponses%2Bof%2Bhyporheic%2Binvertebrates%2Bto%2Bseasonal%2Bchanges%2Bin%2Benvironmental%2Bparameters%26rft.aufirst%3DRG%26rft.auinit%3DRG%26rft.aulast%3DStorey%26rft.date%3D2004%26rft_id%3Dinfo%3Adoi%2F10.1111%252Fj.1365-2427.2004.01284.x%26rft.eissn%3D1365-2427%26rft.epage%3D1486%26rft.genre%3Darticle%26rft.issn%3D0046-5070%26rft.issue%3D11%26rft.jtitle%3DFRESHWATER%2BBIOLOGY%26rft_val_fmt%3Dinfo%3Aofi%2Ffmt%3Akev%3Amtx%3Ajournal%26rft.pages%3D1468-1486%26rfr_id%3Dinfo%3Asid%2Fwebofscience.com%3AWOS%3AWOS%26rft.spage%3D1468%26rft.stitle%3DFRESHWATER%2BBIOL%26rft.volume%3D49%26rft.au%3DStorey%252C%2BRG%26rft.au%3DWilliams%252C%2BDD&DestApp=OTHER_OpenURL&SrcAppSID=EUW1ED0C934DBaBOmaBFvAACNzVIP&SrcJTitle=FRESHWATER+BIOLOGY&SrcPubType=MD_FORMAT,10.1111/j.1365-2427.2004.01284.x,"hyporheic,invertebrates,lotic,meiofauna,streams","ORGANIC-MATTER,STREAM,SEDIMENT,EXCHANGE,SURFACE,ZONE,RIFFLE,FAUNA,RIVER,MEIOFAUNA",,"Natl Inst Water & Atmospher Res, POB 11-115, Hamilton, New Zealand"
26,26,"Kunz, JV",Dec 2017 ,"Hyporheic Passive Flux Meters Reveal Inverse Vertical Zonation and High Seasonality of Nitrogen Processing in an Anthropogenically Modified Stream (Holtemme, Germany)",WATER RESOURCES RESEARCH,"Transformation and retention of nitrogen and other biologically reactive solutes in the hyporheic zones of running water contribute to an essential ecosystem service. However, the synoptic impact of intense agricultural or urban land-uses, elevated nutrient loading, flow alterations, riparian clear-cutting, and channelization on the source-sink behavior of solutes in hyporheic zones remains largely uncharacterized and unquantified. Therefore, we studied nutrient dynamics in a hydromorphologically and chemically modified stream reach using a new monitoring approach allowing the simultaneous measurement of nutrient and water flux through a screened area in the subsurface of rivers (hyporheic passive flux meter, HPFM). With HPFMs we directly assessed time-integrated lateral hyporheic nitrate fluxes during early spring and midsummer covering different temperature and discharge regimes. Contrary to our expectations, higher stream discharge coincided with substantially lower hyporheic exchange rates. While in streams featuring a natural morphology, bed form induced exchange commonly increases with surface flow, the influence of groundwater level was dominant in this reach. Furthermore, in contrast to less impacted environments, where progressive substrate depletion with depths reduces metabolic rates in the subsurface, we identified not the upper, but the intermediate layer of the hyporheic zone as hot spot of nutrient turnover. Overall, the hyporheic zone at the study site functioned partly as nitrate source, partly as a sink. Neither of the commonly used determinants redox state and residence time could explain this source or sink function. Our results give clear evidence to carefully transfer the knowledge of hyporheic zone processes from ""natural'' systems to anthropologically modified streams.Show less",https://www.webofscience.com/wos/woscc/full-record/WOS:000423299000010,https://www.webofscience.com/api/gateway?GWVersion=2&SrcAuth=OpenURL&SrcApp=WOS&DestURL=https%3A%2F%2Fwww.redi-bw.de%2Flinks%2Funist%3Furl_ver%3DZ39.88-2004%26url_ctx_fmt%3Dinfo%3Aofi%2Ffmt%3Akev%3Amtx%3Actx%26rft.atitle%3DHyporheic%2BPassive%2BFlux%2BMeters%2BReveal%2BInverse%2BVertical%2BZonation%2Band%2BHigh%2BSeasonality%2Bof%2BNitrogen%2BProcessing%2Bin%2Ban%2BAnthropogenically%2BModified%2BStream%2B%2528Holtemme%252C%2BGermany%2529%26rft.aufirst%3DJulia%2BVanessa%26rft.auinit%3DJV%26rft.aulast%3DKunz%26rft.date%3D2017%26rft_id%3Dinfo%3Adoi%2F10.1002%252F2017WR020709%26rft.eissn%3D1944-7973%26rft.epage%3D10172%26rft.genre%3Darticle%26rft.issn%3D0043-1397%26rft.issue%3D12%26rft.jtitle%3DWATER%2BRESOURCES%2BRESEARCH%26rft_val_fmt%3Dinfo%3Aofi%2Ffmt%3Akev%3Amtx%3Ajournal%26rft.pages%3D10155-10172%26rfr_id%3Dinfo%3Asid%2Fwebofscience.com%3AWOS%3AWOS%26rft.spage%3D10155%26rft.stitle%3DWATER%2BRESOUR%2BRES%26rft.volume%3D53%26rft.au%3DKunz%252C%2BJV%26rft.au%3DAnnable%252C%2BMD%26rft.au%3DBorchardt%252C%2BD&DestApp=OTHER_OpenURL&SrcAppSID=EUW1ED0C934DBaBOmaBFvAACNzVIP&SrcJTitle=WATER+RESOURCES+RESEARCH&SrcPubType=MD_FORMAT,10.1002/2017WR020709,,"ORGANIC-CARBON,SURFACE-WATER,RIVER,ZONE,DENITRIFICATION,EXCHANGE,NUTRIENT,FLOW,NITRIFICATION,RESTORATION",,"UFZ Helmholtz Ctr Environm Res, Magdeburg, Germany"
27,27,"Chestnut, TJ",Jun 2000 ,"C and N dynamics in the riparian and hyporheic zones of a tropical stream, Luquillo Mountains, Puerto Rico",JOURNAL OF THE NORTH AMERICAN BENTHOLOGICAL SOCIETY,"Hydrologic and chemical characteristics were determined for both riparian and hyporheic subsurface flow along a 100-m reach of a sandy-bottom tributary of the Rio Icacos in the Luquillo Experimental Forest, Puerto Rico. Hydrologic data (vertical hydraulic gradient and hydraulic conductivity of streambed sediments) and the topographic and morphological features of the watershed indicated diffuse inputs of groundwater from the near-stream riparian zone along this site. Cumulative groundwater discharge, determined by tracer dilution techniques, was similar to 1.5 L/s or 10% of the total stream discharge. Spatial heterogeneity in hydrologic and chemical properties of riparian and hyporheic sediments was large. Hydraulic conductivity explained much of the variation in NH4-N and dissolved organic carbon (DOC) concentrations, with highest concentrations in sites having low conductivity. A mass-balance approach was used to examine the influence of the near-stream zone on nutrient transport and retention. Outwelling riparian groundwater had the potential to increase stream N concentrations by up to 84% and DOC concentrations by up to 38% along our 100-m reach. Because stream concentrations were constant downstream despite this input, we conclude that significant N and C retention or loss were occurring in the near-stream zone. Lotic ecosystems and their associated riparian groundwater can have a quantitatively significant impact on the nutrient budgets of tropical headwater catchments.Show less",https://www.webofscience.com/wos/woscc/full-record/WOS:000088106300001,https://www.webofscience.com/api/gateway?GWVersion=2&SrcAuth=OpenURL&SrcApp=WOS&DestURL=https%3A%2F%2Fwww.redi-bw.de%2Flinks%2Funist%3Furl_ver%3DZ39.88-2004%26url_ctx_fmt%3Dinfo%3Aofi%2Ffmt%3Akev%3Amtx%3Actx%26rft.atitle%3DC%2Band%2BN%2Bdynamics%2Bin%2Bthe%2Briparian%2Band%2Bhyporheic%2Bzones%2Bof%2Ba%2Btropical%2Bstream%252C%2BLuquillo%2BMountains%252C%2BPuerto%2BRico%26rft.aufirst%3DTJ%26rft.auinit%3DTJ%26rft.aulast%3DChestnut%26rft.date%3D2000%26rft_id%3Dinfo%3Adoi%2F10.2307%252F1468065%26rft.epage%3D214%26rft.genre%3Darticle%26rft.issn%3D0887-3593%26rft.issue%3D2%26rft.jtitle%3DJOURNAL%2BOF%2BTHE%2BNORTH%2BAMERICAN%2BBENTHOLOGICAL%2BSOCIETY%26rft_val_fmt%3Dinfo%3Aofi%2Ffmt%3Akev%3Amtx%3Ajournal%26rft.pages%3D199-214%26rfr_id%3Dinfo%3Asid%2Fwebofscience.com%3AWOS%3AWOS%26rft.spage%3D199%26rft.stitle%3DJ%2BN%2BAM%2BBENTHOL%2BSOC%26rft.volume%3D19%26rft.au%3DChestnut%252C%2BTJ%26rft.au%3DMcDowell%252C%2BWH&DestApp=OTHER_OpenURL&SrcAppSID=EUW1ED0C934DBaBOmaBFvAACNzVIP&SrcJTitle=JOURNAL+OF+THE+NORTH+AMERICAN+BENTHOLOGICAL+SOCIETY&SrcPubType=MD_FORMAT,10.2307/1468065,"tropical rainforest,nutrient cycling,nitrogen,DOC,riparian zone,hyporheic zone,hydrologic characteristics","DISSOLVED ORGANIC-CARBON,SUBSURFACE WATER EXCHANGE,CENTRAL AMAZON BASIN,DESERT STREAM,GROUNDWATER NITRATE,NITROGEN DYNAMICS,SURFACE-WATER,HYDROLOGIC EXCHANGE,INORGANIC NITROGEN,STORM DYNAMICS",,"Univ New Hampshire, Dept Nat Resources, 215 James Hall, Durham, NH 03824 USA"
28,28,"Weber, MD",Jul 16 2013 ,Dynamic ice formation in channels as a driver for stream-aquifer interactions,GEOPHYSICAL RESEARCH LETTERS,"This research introduces and provides evidence of a novel mechanism of stream-aquifer exchange caused by dynamic ice formation on streams. At a stream site in southwestern Wisconsin, we document a significant fluctuation in stream depth and the potentiometric surface in the adjacent aquifer during periods of ice formation, suggesting that stream-aquifer interactions may be influenced by these transient events. Four years of winter stream data document that dynamic ice formation (1) causes an average increase in stream depth of 106%, (2) affects stream depth on 20% of days from December through February, and (3) substantially alters stream-aquifer interactions by reducing the hydraulic gradient toward the channel during ice formation events. Dynamic ice formation represents a potentially widespread mechanism for altering stream-aquifer interactions and associated biogeochemical transformations. The sensitivity of this process to air temperature indicates a need for further research on the impacts of climate warming.Show less",https://www.webofscience.com/wos/woscc/full-record/WOS:000326396600025,https://www.webofscience.com/api/gateway?GWVersion=2&SrcAuth=OpenURL&SrcApp=WOS&DestURL=https%3A%2F%2Fwww.redi-bw.de%2Flinks%2Funist%3Furl_ver%3DZ39.88-2004%26url_ctx_fmt%3Dinfo%3Aofi%2Ffmt%3Akev%3Amtx%3Actx%26rft.atitle%3DDynamic%2Bice%2Bformation%2Bin%2Bchannels%2Bas%2Ba%2Bdriver%2Bfor%2Bstream-aquifer%2Binteractions%26rft.aufirst%3DMatthew%2BD.%26rft.auinit%3DMD%26rft.aulast%3DWeber%26rft.date%3D2013%26rft_id%3Dinfo%3Adoi%2F10.1002%252Fgrl.50620%26rft.eissn%3D1944-8007%26rft.epage%3D3412%26rft.genre%3Darticle%26rft.issn%3D0094-8276%26rft.issue%3D13%26rft.jtitle%3DGEOPHYSICAL%2BRESEARCH%2BLETTERS%26rft_val_fmt%3Dinfo%3Aofi%2Ffmt%3Akev%3Amtx%3Ajournal%26rft.pages%3D3408-3412%26rfr_id%3Dinfo%3Asid%2Fwebofscience.com%3AWOS%3AWOS%26rft.spage%3D3408%26rft.stitle%3DGEOPHYS%2BRES%2BLETT%26rft.volume%3D40%26rft.au%3DWeber%252C%2BMD%26rft.au%3DBooth%252C%2BEG%26rft.au%3DLoheide%252C%2BSP&DestApp=OTHER_OpenURL&SrcAppSID=EUW1ED0C934DBaBOmaBFvAACNzVIP&SrcJTitle=GEOPHYSICAL+RESEARCH+LETTERS&SrcPubType=MD_FORMAT,10.1002/grl.50620,"stream-aquifer interactions,hyporheic exchange,dynamic ice formation,diurnal fluctuations,river ice","HYPORHEIC EXCHANGE,SURFACE-WATER,RIVER ICE,GROUNDWATER,ZONE,HETEROGENEITY,ECOSYSTEMS,DISCHARGE,IMPACT",,"Univ Wisconsin, Dept Civil & Environm Engn, 1269C Engn Hall,1415 Engn Dr, Madison, WI 53706 USA"
29,29,"Dole-Olivier, MJ",Aug 1998 ,Surface water-groundwater exchanges in three dimensions on a backwater of the Rhone River,FRESHWATER BIOLOGY,"1. Hydrological exchange between the surface stream and the hyporheic zone is well documented in the main channel of rivers, especially at the reach scale. Hydrological processes of advection/convection occur at different scales, and in secondary channels of large rivers little is known about these exchanges in the hyporheic zone on a broad scale (i.e. kilometres). This work studied exchanges of water and biota in a secondary channel on a large scale (4 km), using a three-dimensional framework.2. The exchanges of water were described using physicochemical indicators of surface and groundwaters. Samples of water and biota were taken in three dimensions: (i) vertically from benthic (i.e. 0.20 m below the surface of the substratum) to hyporheic (0.50 m) and deep interstitial (1.0 m) zones; (ii) laterally from the right to the left bank (i.e. right, middle and left positions); and (iii) longitudinally from upstream to downstream (seven stations regularly distributed along the channel).3. The physicochemical indicators clearly revealed hydrological heterogeneity in the longitudinal and vertical dimensions, whereas lateral variability was not significant.4. Spatial distribution of biota exhibited strong longitudinal variations that were not gradual as predicted by an upstream/downstream continuum, but patchy and discontinuous. No significant differences were found between the three positions across the channel.5. Analyses of both physicochemical and faunal data sets produced matched ordination of samples and stations, indicating that interstitial-surface flow relationships appear to be an important governing factor in the distribution of interstitial biota at this broad scale.6. Results are discussed in relation to the hypothetical three-dimensional models of the hyporheic zone in rivers. Contrasting with other observations on the main channel (where advection/convection patterns are dominated by morphological changes of the river-bed morphology), it is proposed that water exchanges in backwaters are more likely to be related to local modifications of stream-bed porosity.Show less",https://www.webofscience.com/wos/woscc/full-record/WOS:000075462200009,https://www.webofscience.com/api/gateway?GWVersion=2&SrcAuth=OpenURL&SrcApp=WOS&DestURL=https%3A%2F%2Fwww.redi-bw.de%2Flinks%2Funist%3Furl_ver%3DZ39.88-2004%26url_ctx_fmt%3Dinfo%3Aofi%2Ffmt%3Akev%3Amtx%3Actx%26rft.atitle%3DSurface%2Bwater-groundwater%2Bexchanges%2Bin%2Bthree%2Bdimensions%2Bon%2Ba%2Bbackwater%2Bof%2Bthe%2BRhone%2BRiver%26rft.aufirst%3DMJ%26rft.auinit%3DMJ%26rft.aulast%3DDole-Olivier%26rft.date%3D1998%26rft_id%3Dinfo%3Adoi%2F10.1046%252Fj.1365-2427.1998.00335.x%26rft.eissn%3D1365-2427%26rft.epage%3D109%26rft.genre%3Darticle%26rft.issn%3D0046-5070%26rft.issue%3D1%26rft.jtitle%3DFRESHWATER%2BBIOLOGY%26rft_val_fmt%3Dinfo%3Aofi%2Ffmt%3Akev%3Amtx%3Ajournal%26rft.pages%3D93-109%26rfr_id%3Dinfo%3Asid%2Fwebofscience.com%3AWOS%3AWOS%26rft.spage%3D93%26rft.stitle%3DFRESHWATER%2BBIOL%26rft.volume%3D40&DestApp=OTHER_OpenURL&SrcAppSID=EUW1ED0C934DBaBOmaBFvAACNzVIP&SrcJTitle=FRESHWATER+BIOLOGY&SrcPubType=MD_FORMAT,10.1046/j.1365-2427.1998.00335.x,,"SONORAN DESERT STREAM,VERTICAL HYDROLOGIC EXCHANGE,HYPORHEIC ZONE,SPATIAL-DISTRIBUTION,INTEGRATING HYDROLOGY,DISTRIBUTION PATTERNS,ALLUVIAL RIVER,ECOSYSTEMS,DYNAMICS,FAUNA",,"Univ Lyon 1, CNRS, ESA 5023, Freshwater & River Ecol Res Unit, 1-43 Bd 11 Novembre 1918, F-69622 Villeurbanne, France"
30,30,"Nagorski, SA",Nov 1999 ,Arsenic mobilization in the hyporheic zone of a contaminated stream,WATER RESOURCES RESEARCH,"Arsenic behavior was examined in a contaminated stream by sampling the dissolved (<0.45 mu m) arsenic and metals in surface water, shallow hyporheic zone water, and adjacent ground water. Surface water was oxic and slightly basic, and ground water was anoxic and acidic. Hyporheic zone water had pH values of 6-7, dissolved oxygen concentrations mostly between 0 and 3 mg L-1, and mean concentrations of most metals inbetween surface and ground water sample concentrations. However, arsenic and iron were enriched in the hyporheic zone. Most of the hyporheic zone dissolved arsenic was in the form of As(III), which is considered to be more toxic to some organisms than As(V). In the oxic surface water, 20% of the total dissolved As was found to occur in its reduced form. We hypothesize that upon burial and reduction of Fe-oxhydroxides in the streambed, sediment-bound arsenic is transferred into the dissolved phase as As(III), and it is subsequently released into the surface water, where it does not immediately reoxidize. A continual flux of reduced As to the surface water maintains Pb(III) concentrations above that expected in oxygenated surface waters.Show less",https://www.webofscience.com/wos/woscc/full-record/WOS:000083342400019,https://www.webofscience.com/api/gateway?GWVersion=2&SrcAuth=OpenURL&SrcApp=WOS&DestURL=https%3A%2F%2Fwww.redi-bw.de%2Flinks%2Funist%3Furl_ver%3DZ39.88-2004%26url_ctx_fmt%3Dinfo%3Aofi%2Ffmt%3Akev%3Amtx%3Actx%26rft.atitle%3DArsenic%2Bmobilization%2Bin%2Bthe%2Bhyporheic%2Bzone%2Bof%2Ba%2Bcontaminated%2Bstream%26rft.aufirst%3DSA%26rft.auinit%3DSA%26rft.aulast%3DNagorski%26rft.date%3D1999%26rft_id%3Dinfo%3Adoi%2F10.1029%252F1999WR900204%26rft.epage%3D3450%26rft.genre%3Darticle%26rft.issn%3D0043-1397%26rft.issue%3D11%26rft.jtitle%3DWATER%2BRESOURCES%2BRESEARCH%26rft_val_fmt%3Dinfo%3Aofi%2Ffmt%3Akev%3Amtx%3Ajournal%26rft.pages%3D3441-3450%26rfr_id%3Dinfo%3Asid%2Fwebofscience.com%3AWOS%3AWOS%26rft.spage%3D3441%26rft.stitle%3DWATER%2BRESOUR%2BRES%26rft.volume%3D35%26rft.au%3DNagorski%252C%2BSA%26rft.au%3DMoore%252C%2BJN&DestApp=OTHER_OpenURL&SrcAppSID=EUW1ED0C934DBaBOmaBFvAACNzVIP&SrcJTitle=WATER+RESOURCES+RESEARCH&SrcPubType=MD_FORMAT,10.1029/1999WR900204,,"DISSOLVED ORGANIC-CARBON,SONORAN DESERT STREAM,MOUNTAIN STREAM,NATURAL-WATERS,SURFACE-WATER,SEDIMENTS,RIVER,OXIDATION,EXCHANGE,GROUNDWATER",,"Univ Montana, Dept Geol, Murdock Environm Biochem Lab, Missoula, MT 59812 USA"
