,First author,Year,Title,Journal,Abstract
14,"Xie, YQ",Sep 2017 ,Limits of heat as a tracer to quantify transient lateral river-aquifer exchanges,WATER RESOURCES RESEARCH,"The application of heat as a tracer for assessing river-aquifer exchanges has been mainly limited to vertical flow through the riverbed. Lateral river-aquifer exchanges become more important than vertical riverbed exchanges if the river is deeply incised into an aquifer. Few studies have examined lateral river-aquifer exchanges and the ability of heat to constrain such exchanges. This study aims to perform a robust assessment of the limits of heat as a tracer to quantify lateral river-aquifer exchanges. The study is based on a section of the Meuse River in Belgium, a river predominantly gaining in the studied area and becoming intermittently losing in the winter time. A calibrated transect model shows that river temperature can affect groundwater temperature up to 9 m into the aquifer. An accompanying synthetic modeling investigation using Monte Carlo simulation shows that heat data for distances between 4 and 9 m from the river can reduce the uncertainty of river-aquifer exchanges for conditions similar to those of the transect model. The ability of heat to reduce the river-aquifer exchange uncertainty improves with distance from the river because of the reduction in the number of acceptable model realizations. The optimal distance is 8 m from the river where the groundwater temperature is no longer affected by the river temperature. The synthetic modeling also indicates that heat alone cannot constrain river-aquifer exchanges better than the commonly used hydraulic head. However, when combined with hydraulic head, heat can significantly reduce the uncertainty of river-aquifer lateral exchanges under gaining conditions.Show less"
15,"Romeijn, P",Apr 20 2021 ,Macrophyte Controls on Urban Stream Microbial Metabolic Activity,ENVIRONMENTAL SCIENCE & TECHNOLOGY,"Urban rivers worldwide are affected directly by macrophyte growth, causing reduced flow velocity and risks of flooding. Therefore, cutting macrophytes is a common management practice to ensure free drainage. The impacts of macrophyte removal on transient storage dynamics and microbial metabolic activity of wastewater-fed urban streams are unknown, preventing any assessment of the hydrodynamic and biogeochemical consequences of this management practice. Slug tracer injections were performed with the conservative tracer uranine and the reactive tracer resazurin to quantify the implications of macrophyte cutting on stream flow dynamics and metabolism. Macrophyte cutting reduced mean tracer arrival times in managed stream reaches but did not significantly decrease whole-stream microbial metabolic activity. In fact, transient storage indices were found to have increased after cutting, suggesting that macrophyte removal and the resulting increase in flow velocity may have enhanced hyporheic exchange flow through streambed sediments. Our results evidence that macrophyte cutting in nutrient-rich urban streams does not necessarily lead to lower in-stream storage and metabolism but that the gain in hyporheic exchange and streambed microbial metabolic activity can compensate for reduced in-stream storage. Increased stream flow resulting from macrophyte removal may therefore even enhance nutrient and pollutant attenuation capacity of streambed sediments.Show less"
16,"Kim, H",Apr 2019 ,Culturable bacteria diversity in surface water-groundwater exchange zones by 16S rRNA gene analysis,JOURNAL OF THE GEOLOGICAL SOCIETY OF KOREA,"This study identified 16S rRNA genes using PCR to find out culturable microorganisms living in the samples of surface water, surface water-groundwater exchange zones (hyporheic zones), ground water collected in the Haean bain, Yanggu-gun, Gangwon-do. Bacterial count of culturable microorganisms was 2.5x10(5) CFU/ml in the hyporheic water, which was over 10 times higher than those in the surface water and the ground water. Moreover, measurements of bacterial counts by separation into aerobic and anaerobic microorganisms found 10-100 times more aerobic bacteria than anaerobic bacteria. Identification through sequencing of 16S rRNA gene resulted in 40 genera of aerobic bacteria and 21 genera of anaerobic bacteria in the hyporheic water. Of the aerobic bacteria, the Pseudomonas genus was most dominant with about 29.3% in proportion, followed by the Flavobacterium genus with about 15.3%. Excluding genera separated from the surface water and the ground water, a total of 31 aerobic genera and 16 anaerobic genera were identified in the hyporheic water. It is expected that a comparative analysis between metagenomics data obtained from samples in the hyporheic water by pyrosequencing and culturable microorganisms of the present study should be able to provide more solid fundamental data on physiological characteristics and roles of microorganisms living in hyporheic zones and would enable to conduct more quantitative study.Show less"
17,"Akhtar, N",Feb 2022 ,Upscaling of Surface Water and Groundwater Interactions in Hyporheic Zone from Local to Regional Scale,WATER,"The groundwater (GW) and surface water (SW) interaction (SW-GW) through the hyporheic zone is a significant component in sustainable water resource management. The complexities in SW-GW interactions increase from a local to a regional scale and are affected by variation in hydraulic, hydrologic, and hydrogeologic (3H) processes. Controlling factors and their upscaling of these processes to assess SW-GW interaction have not been addressed sufficiently in previous studies. Additionally, it is unclear what the effective factors are at different scales during the upscaling. Therefore, the present review focused on controlling factors of 3H processes in SW-GW interaction and their upscaling techniques. Relevancy of controlling factors was identified at different scales. Applications of different approaches and their uncertainties were also discussed for the characterization of SW-GW interactions. The study revealed that the improved data from different approaches is crucial for machine learning training and its application in the SW and GW assessment at local, sub-catchment, and catchment scales. Based on the outcomes, a framework has been proposed to execute modalities of controlling factors using remote sensing, geophysics, and artificial intelligence. The proposed framework could help in handling big data and accurate upscaling for water resource management.Show less"
18,"Cheng, ZL",Jul 2022 ,Recession and hysteresis effects of hyporheic zone permeability changes on baseflow in seasonal freeze-thaw mountainous areas,JOURNAL OF HYDROLOGY,"Baseflow is the main groundwater discharge mode from mountainous areas to rivers and is an important component of river runoff. Temperature changes in the hyporheic zone in seasonal freeze-thaw areas cause changes in its permeability, which then affect the recession of baseflow. It is critical to study underground surface water transformation processes in cold regions to explore baseflow recession and hysteresis effects caused by permeability changes in the hyporheic zone under variable temperatures. In this study, we investigated the Hanyangtun Basin in the Changbai Mountain District to determine the functional relationship between permeability and temperature in the hyporheic zone using theoretical analysis combined with laboratory saturated permeability experiments using medium-and fine-grained sand at variable temperatures. We then calculated and analyzed the recession amplitude and hysteresis time of the baseflow caused by permeability changes in the hyporheic zone of this freeze-thaw mountainous area using water temperature and reference baseflow data. The results indicate that owing to large temperature changes in the study area, the permeability of the hyporheic zone changed substantially. Lower permeability leads to the blocking of groundwater discharging to surface water, i. e., the baseflow hysteresis effect. The recession amplitude of the baseflow caused by lower permeability increased with decreasing temperatures, reaching a maximum of 41.67%. The groundwater discharge hysteresis time increased with decreasing temperature. The hysteresis effect was most obvious during the stable melting period, with a maximum hysteresis time of 16 days, while the total annual hysteresis time was 60 days. This study provides a new perspective for qualitative and quantitative studies of the relationship between groundwater and surface water in the mountainous areas that experience seasonal freeze-thaw.Show less"
19,"Van den Brink, FWB",Oct 2013 ,Seasonal changes in caddis larvae assemblages in river-floodplain habitats along a hydrological connectivity gradient,HYDROBIOLOGIA,"In order to assess the impact of seasonality versus connectivity on the ecological quality of the Lower Rhine river-floodplain habitats, we studied the seasonal variation in diversity and species assemblages of caddis larvae by monthly sampling of the littoral zone of four water bodies over a lateral connectivity gradient. Seasonal variation in diversity showed a general pattern in these floodplain habitats and could be related to caddisfly life history and habitat preferences. Despite this seasonal variation, caddis larvae species assemblages in the water bodies appeared to be rather stable and could be firmly related to the position of their habitats over the connectivity gradient. The main channel (lotic habitat) was clearly separated from the lentic water bodies, and also the sparsely vegetated water bodies from the well-vegetated water bodies. It is concluded that the impact of connectivity, and related parameters such as stream velocity and vegetation coverage, outweighed the impact of season on the caddis larvae assemblages.Show less"
20,"Deng, XJ",Nov 2018 ,"Spatial-temporal changes in the longitudinal functional connectivity of river systems in the Taihu Plain, China",JOURNAL OF HYDROLOGY,"The longitudinal functional connectivity of river systems refers to the process-based connections between upstream and downstream areas and is fundamental to understanding the dynamic and nonlinear hydrological behaviour of river basins. However, the quantification of such connectivity remains a challenge due to the absence of a consensus on the appropriate data and methods, especially in delta plains. In this study, based on the difference between water level fluctuations at adjacent stations, a new and quantitative longitudinal functional connectivity index (LFCI) was developed for delta plains. Focusing on the Taihu Plain, we then analysed the spatial-temporal changes in the LFCI during 1960-2012 and investigated the correlations between the LFCI and climate change and human activities. We found that the decadal, annual and seasonal changes in the average LFCI all presented slightly increasing trends in the recent 50 period, but the annual average LFCI increased significantly after 1978; the average LFCIs in June, July, and August of the flood season were less than those in other months in the Taihu Plain. We also found that the spatial-temporal changes in the average LFCI exhibited larger differences at the subregional and station scales; those in the Wu-Cheng-Xi-Yu subregion were least, and the average LFCIs at stations near the borders of adjacent subregions were less than those at other stations. Moreover, we found that the average LFCI had significant correlations with precipitation, river density and water surface ratio. Our results were consistent with common sense facts, which demonstrated that the indicator developed in this study can quite effectively quantify the longitudinal functional connectivity of river systems in delta plains.Show less"
21,"Sullivan, SMP",May 2009 ,"Stream-floodplain connectivity and fish assemblage diversity in the Champlain Valley, Vermont, USA",JOURNAL OF FISH BIOLOGY,"To evaluate the influence of main channel-floodplain connectivity on fish assemblage diversity in floodplains associated with streams and small rivers, fish assemblages and habitat characteristics were surveyed at 24 stream reaches in the Champlain Valley of Vermont, U.S.A. Fish assemblages differed markedly between the main channel and the floodplain. Fish assemblage diversity was greatest at reaches that exhibited high floodplain connectivity. Whereas certain species inhabited only main channels or floodplains, others utilized both main channel and floodplain habitats. Both floodplain fish alpha-diversity and gamma-diversity of the entire stream corridor were positively correlated with connectivity between the main channel and its floodplain. Consistent with these results, species turnover (as measured by beta-diversity) was negatively correlated with floodplain connectivity. Floodplains with waterbodies characterized by a wide range of water depths and turbidity levels exhibited high fish diversity. The results suggest that by separating rivers from their floodplains, incision and subsequent channel widening will have detrimental effects on multiple aspects of fish assemblage diversity across the stream-floodplain ecosystem.Show less"
22,"Sondergaard, M",Dec 2007 ,"Anthropogenic impacts on lake and stream ecosystems, and approaches to restoration",JOURNAL OF APPLIED ECOLOGY,"Freshwater ecosystems have long been affected by numerous types of human interventions that have a negative impact on their water quality and ecological state. Fortunately, in most western countries the input of sewage to freshwater systems has been reduced, but hydromorphological alterations, eutrophication-related turbidity and loss of biodiversity remain major problems in many parts of the world. Such impacts prevent the achievement of a high or good ecological state, as defined by the European Water Framework Directive (WFD) or other standards.This paper synthesizes and links the findings presented in the seven papers of this special profile, focusing on the effects of anthropogenic stressors on freshwater ecosystems and on how to maintain and restore ecological quality. The papers cover a broad range of research areas and methods, but are all centred on the relationship between dispersal barriers, the connectivity of waterways and the restoration of rivers and lakes.The construction of dams and reservoirs disturbs the natural functioning of many streams and rivers and shore-line development around lakes may reduce habitat complexity. New methods demonstrate how reservoirs may have a severe impact on the distribution and connectivity of fish populations, and new techniques illustrate the potential of using graph theory and connectivity models to illustrate the ecological implications. Hydromorphologically degraded rivers and streams can be restored by addition of wood debris, but 'passive' restoration via natural wood recruitment may be preferable. The most cost-effective way to restore streams may also include information campaigns to farmers on best management practices. Removal of zooplanktivorous fish often has marked positive effects on trophic structure in lakes, but there is a tendency to return to turbid conditions after 8-10 years or less unless fish removal is repeated.Synthesis and applications. Development of new methods, as well as derivation of more general conclusions from reviewing the effects of previous restoration efforts, are crucial to achieve progress in applied freshwater research. The papers contained in this Special Profile contribute on both counts, as well as illustrating the importance of well-designed research projects and monitoring programmes to record the effects of the interventions. Such efforts are vital if we are to improve our knowledge of freshwater systems and to elaborate the best and most cost-effective recommendations. They may also help in achieving a good ecological state or potential in water bodies by 2015, as demanded by the European WFD.Show less"
23,"Costa, D",Dec 2016 ,Coupling spatially distributed river and groundwater transport models to investigate contaminant dynamics at river corridor scales,ENVIRONMENTAL MODELLING & SOFTWARE,"Rivers and aquifers are mutually dependent components of the hydrological cycle, typically characterised by temporal dynamics that are a few orders of magnitude apart. This characteristic is often advocated to justify the use of independent single-system models to maximise the outcome for the available computational resources. However, the rapid increase in computational power presently provides means to explore new and more complex modelling schemes, which better reflect the complex physical reality. We present a new modelling framework, FLUXOS, developed from the full coupling of modified versions of state-of-the-art standalone river and groundwater flow and transport models. The model is validated against analytical solutions and applied to real world scenarios in the complex urban corridor of the Ciliwung River in Jakarta to show its flexibility for practical applications and its capabilities as an exploratory tool for realistic investigation of contamination sources and pathways determining nonlinear behaviours of river-aquifer interactions. (C) 2016 Elsevier Ltd. All rights reserved.Show less"
24,"Merenlender, AM",Nov 2013 ,Maintaining and restoring hydrologic habitat connectivity in mediterranean streams: an integrated modeling framework,HYDROBIOLOGIA,"Hydrologic alterations designed to provide a stable water supply and to prevent flooding are commonly used in mediterranean-climate river (med-rivers) basins, and these alterations have led to habitat loss and significant declines in aquatic biodiversity. Often the health of freshwater ecosystems depends on maintaining and recovering hydrologic habitat connectivity, which includes structural components related to the physical landscape, functionality of flow dynamics, and an understanding of species habitat requirements for movement, reproduction, and survival. To advance our understanding of hydrologic habitat connectivity and benefits of habitat restoration alternatives we provide: (1) a review of recent perspectives on hydrologic connectivity, including quantitative methods; and (2) a modeling framework to quantify the effects of restoration on hydrologic habitat connectivity. We then illustrate this approach through a case study on lateral hydrologic habitat connectivity that results from channel restoration scenarios using scenarios with different historic and climate-change flows to restore fish floodplain habitat in a med-river, the San Joaquin River, California. Case study results show that in addition to the channel alterations, higher flows are required to recover significant flooded habitat area, especially given reductions in flows expected under climate change. These types of studies will help the planning for restoration of hydrologic habitat connectivity in med-rivers, a critical step for mediterranean species recovery.Show less"
25,"Irawan, DE",Feb 2015 ,"Groundwater-surface water interactions of Ciliwung River streams, segment Bogor-Jakarta, Indonesia",ENVIRONMENTAL EARTH SCIENCES,"CiliwungRiver water quality and its vicinity have been continuously degraded with the increasing population. The objective of this research is to understand the association between river and groundwater, and the water quality profile. Field measurements ware taken from 65 stations from Bogor to Jakarta. Water level, temperature, pH, and TDS were measured to build the water flow map and hydrochemical profile. Small-scale geoelectrical survey was conducted at five locations to capture the aquifer's geometry. We identified three types of stream relationships between river and groundwater: effluent from Bogor to Katulampa (Segment 1), perched at the University of Indonesia (UI) area (Segment 2), and influent from UI to Muara (Segment 3), with low gradient from <0.1 to 0.3. The temperature profile of river and groundwater shows similar pattern as well as TDS profile. All similarities support close connection of river and groundwater. The increasing TDS towards downstream shows increasing enrichment and contamination. The erratic pattern of pH indicates chemical instability due to high contamination. This study highlights the benefit of understanding the hydrodynamic relationship between river water and groundwater. Such interaction triggers water quality exchange between both water bodies. Therefore, a similar study should also be done on other riverbanks in Indonesia to protect water quality.Show less"
26,"Fusco, NA",Jan 2021 ,Urbanization reduces gene flow but not genetic diversity of stream salamander populations in the New York City metropolitan area,EVOLUTIONARY APPLICATIONS,"Natural landscape heterogeneity and barriers resulting from urbanization can reduce genetic connectivity between populations. The evolutionary, demographic, and ecological effects of reduced connectivity may lead to population isolation and ultimately extinction. Alteration to the terrestrial and aquatic environment caused by urban influence can affect gene flow, specifically for stream salamanders who depend on both landscapes for survival and reproduction. To examine how urbanization affects a relatively common stream salamander species, we compared genetic connectivity ofEurycea bislineata(northern two-lined salamander) populations within and between streams in an urban, suburban, and rural habitat around the New York City (NYC) metropolitan area. We report reduced genetic connectivity between streams within the urban landscape found to correspond with potential barriers to gene flow, that is, areas with more dense urbanization (roadways, industrial buildings, and residential housing). The suburban populations also exhibited areas of reduced connectivity correlated with areas of greater human land use and greater connectivity within a preserve protected from development. Connectivity was relatively high among neighboring rural streams, but a major roadway corresponded with genetic breaks even though the habitat contained more connected green space overall. Despite greater human disturbance across the landscape, urban and suburban salamander populations maintained comparable levels of genetic diversity to their rural counterparts. Yet small effective population size in the urban habitats yielded a high probability of loss of heterozygosity due to genetic drift in the future. In conclusion, urbanization impacted connectivity among stream salamander populations where its continual influence may eventually hinder population persistence for this native species in urban habitats.Show less"
27,"Querner, EP",Jan 2 2016 ,Simulating streamflow variability and aquatic states in temporary streams using a coupled groundwater-surface water model,HYDROLOGICAL SCIENCES JOURNAL-JOURNAL DES SCIENCES HYDROLOGIQUES,"In order to apply the EU Water Framework Directive for temporary streams, it is important to quantify the space-time development of different aquatic states. We report on research on the development of aquatic states for temporary streams in the Evrotas basin, Greece. The SIMGRO regional hydrological model was used in a GIS framework to generate flow time series for the Evrotas River and all major tributaries. Five flow phases were distinguished: flood conditions, riffles, connected pools, isolated pools and dry bed conditions. Thresholds based on local hydraulic characteristics were identified per stream reach and flow phase, enabling the frequency of flow phases per month and the average frequencies for all streams to be derived. Three historical scenarios within the 20th century, marking periods of major changes in water management, were investigated. Additionally, a climate scenario for the 2050s was analysed. Simulations revealed that low flows are now much lower, mainly because more groundwater is abstracted for irrigation. The consequence is that stretches of the river fall dry during several months, causing the ecological status to deteriorate.Show less"
28,"Cucchi, K",Jun 2018 ,LOMOS-mini: A coupled system quantifying transient water and heat exchanges in streambeds,JOURNAL OF HYDROLOGY,"The LOMOS-mini is a new experimental system monitoring transient water and heat fluxes in the hyporheic zone at a sub-daily resolution. Given the coupling of high-frequency hydraulic head gradient and temperature measurements, its innovation when compared to currently available monitoring systems is to operate under transient conditions and to allow the quantification of coupled water and heat exchanges with an unprecented fine temporal resolution, such as the rainfall event time scale. The LOMOS-mini is low-cost, easy to construct from individual microelectronic components and has an autonomy of several months in the field. Its robust implementation protocol makes it suitable for a wide variety of geological environments, from soft loamy, sandy, clayey streambeds to compact colluvial environments. Hydraulic head gradients are measured using the pressure sensor technology presented in Greswell et al. (2009). The sensibility of pressure estimates to ambient temperature is demonstrated; the measurement error is evaluated to decrease by up to one order of magnitude when accounting for temperature in the calibration relationship. Coupled with a physically-based hydrothermal model, the LOMOS-mini provides transient estimates of vertically distributed Darcy fluxes, conductive and advective heat fluxes. The methodology is illustrated on a colluvial streambed case study. (C) 2017 Elsevier B.V. All rights reserved.Show less"
