,First author,Year,Title,Journal,Abstract
16,"Lasne, E",Dec 2008 ,European eel distribution and body condition in a river floodplain: effect of longitudinal and lateral connectivity,ECOLOGY OF FRESHWATER FISH,"We studied eel population characteristics (size classes, densities and body condition) in the lower Loire River floodplain (France) to evaluate the effects of longitudinal and lateral gradients. A total of 36 sites were electrofished in June 2005. The sites were grouped first into three river segments according to the distance inland corresponding to a longitudinal gradient and secondly into three lateral connectivity categories. Results indicate that small eels, especially those <= 300 mm, were very abundant downstream but density rapidly decreased upstream. In addition, eels <= 150 mm tended to be most abundant in connected waterbodies. Conversely, the distribution of larger eels was quite uniform across both dimensions. Eel condition decreased upstream. In parallel, in downstream river segment, eels had a lower condition in disconnected waterbodies than in connected ones. Eel specialists still have only a longitudinal perception of eel habitat. Our results suggest that lateral gradients should be also taken into consideration.Show less"
17,"Laenen, A",Apr 2001 ,"Transient storage assessments of dye-tracer injections in rivers of the Willamette Basin, Oregon",JOURNAL OF THE AMERICAN WATER RESOURCES ASSOCIATION,"Rhodamine WT dye-tracer injections in rivers of the Willamette Basin yield concentration-time curves with characteristically long recession times suggestive of active transient storage processes. The scale of drainage areas contributing to the stream reaches studied in the Willamette Basin ranges from 10 to 12,000 km(2). A transient storage assessment of the tracer studies has been completed using the U.S. Geological Survey's One-dimensional Transport with Inflow and Storage (OTIS) model, which incorporates storage exchange and decay functions along with the traditional dispersion and advection transport equation. The analysis estimates solute transport of the dye. It identifies first-order decay coefficients to be on the order of 10(-5)/sed for the nonconservative Rhodamine WT. On an individual subreach basis, the first-order decay is slower (typically by an order of magnitude) than the transient storage process, indicating that nonconservative tracers may be used to evaluate transient storage in rivers. In the transient storage analysis, a dimensionless parameter (A(S)/A) expresses the spatial extent of storage zone area relative to stream cross section. In certain reaches of Willamette Basin pool-and-riffle, gravel-bed rivers, this parameter was as large as 0.5. A measure of the storage exchange flux was calculated for each stream subreach in the simulation analysis. This storage exchange is shown subjectively to be higher at higher stream discharges. Hyporheic linkage between streams and subsurface flows is the probable physical mechanism contributing to a significant part of this inferred active transient storage. Hyporheic linkages are further suggested by detailed measurements of river discharge with an Acoustic Doppler Current Profiler system delineating zones in two large rivers where water alternately enters and leaves the surface channels through gravel-and-cobble riverbeds. Measurements show patterns of hyporheic exchange that are highly variable in time and space.Show less"
18,"Roche, KR",May 2018 ,Turbulence Links Momentum and Solute Exchange in Coarse-Grained Streambeds,WATER RESOURCES RESEARCH,"The exchange of solutes between surface and pore waters is an important control over stream ecology and biogeochemistry. Free-stream turbulence is known to enhance transport across the sediment-water interface (SWI), but the link between turbulent momentum and solute transport within the hyporheic zone remains undetermined due to a lack of in situ observations. Here, we relate turbulent momentum and solute transport using measurements within a streambed with 0.04 m diameter sediment. Pore water velocities were measured using endoscopic particle image velocimetry and used to generate depth profiles of turbulence statistics. Solute transport was observed directly within the hyporheic zone using an array of microsensors. Solute injection experiments were used to assess turbulent fluxes across the SWI and patterns of hyporheic mixing. Depth profiles of fluctuations in solute concentration were compared with profiles of turbulence statistics, and profiles of mean solute concentration were compared to an effective dispersion model. Fluorescent visualization experiments at a Reynolds number of Re >= 27,000 revealed the presence of large-scale motions that ejected tracer from the pore waters, and that these events were not present at Re = 13,000. Turbulent shear stresses and high-frequency concentration fluctuations decayed greatly within 1-2 grain diameters below the SWI. However, low-frequency concentration fluctuations penetrated to greater depths than high-frequency fluctuations. Comparison with a constant-coefficient dispersion model showed that hyporheic mixing was enhanced in regions where turbulent stresses were observed. Together, these results show that the penetration of turbulence into the bed directly controls both interfacial exchange and mixing within a transition layer below the SWI.Plain Language Summary Streams and rivers continuously exchange water with their underlying sediments in a region called the hyporheic zone. This zone is a hotspot of transformation for many societally relevant chemicals, including carbon, nutrients, and contaminants. Accurate predictions for how much transformation occurs in the hyporheic zone requires an improved understanding of how reactive chemicals are transported into, and within, this region of a riverbed. Although fluid turbulence can be the dominant process controlling surface-subsurface exchange in gravel-bed streams, its influence is poorly understood due to the difficulty of measuring turbulent fluid velocities and concentrations within the streambed. In this experimental study, we show that turbulence strongly couples surface waters with hyporheic waters in a thin layer where the water column and stream sediments meet. As a result, fluid transport and mixing are enhanced several centimeters into the hyporheic zone of gravel-bed streams. These findings support recent theoretical arguments that surface and subsurface waters are not independent and must instead be treated as a single unit to accurately model solute, particulate and pollutant transport in streams and rivers.Show less"
19,"Kim, H",Apr 16 2014 ,Numerical verification of hyporheic zone depth estimation using streambed temperature,JOURNAL OF HYDROLOGY,"The hyporheic zone is the active region of groundwater and surface water mixing, and consequently, through which the contaminants released to surface water are transferred to groundwater. Because of the high energy demand and expense associated with the remediation of contaminated groundwater, it has become a matter of primary concern to find an efficient and cost-effective way to restore the contaminated groundwater. Therefore delineating the hyporheic zone is of vital importance for the prevention and management of groundwater contamination. This paper proposes a method to estimate the depth of the hyporheic zone using heat transfer analysis for a streambed. In order to assess the adequacy of the proposed method, the sensitivity of the results of heat transfer analyses to the hyporheic flux was evaluated. Due to the high sensitivity to the hyporheic zone depth, the heat transfer analysis was determined to be appropriate to delineate the hyporheic zone depth. The depth estimated from the heat transfer analysis was comparable with that from a conventional tracer test. The proposed method has an advantage over existing methods of determining the hyporheic zone depth due to the fact that it only requires field temperature measurements. (C) 2014 Published by Elsevier B.V.Show less"
20,"Lefebvre, S",Oct 2005 ,Nutrient dynamics in interstitial habitats of low-order rural streams with different bedrock geology,ARCHIV FUR HYDROBIOLOGIE,"We Studied water exchange, nutrient dynamics, and microbial activities between the Surface and interstitial habitats of six low-order streams with catchments dominated by agriculture during high and low water periods. In each stream, surface (open) water and interstitial water form downwelling and Upwelling zones were considered. Interstitial habitats of most streams acted as a sink for nitrate, but as a source for ammonium and soluble reactive phosphorus (SRP). The nitrate sink persisted in shallow sediments of downwelling zones, while the source of ammonium and SRP persisted in deeper sediments of upwelling zones, where organic matter was decomposed and microbial uptake was lower than the production of nutrients. Geology (granite versus schist substratum) was the main variable controlling the nutrient contents and the microbial activity within interstitial habitats due to varying sediment grain size and hydraulic properties. Schist streams had the finest sediment grain size and lowest hydrologic connectivity between Surface water and interstitial habitats, and had the highest potential microbial activities, especially for denitrification. Land-use of the catchments (percentage of forested area), channel morphology (river incision), and local characteristics of the benthic sediment (partial clogging) also influenced nutrient concentrations and microbial activities irrespectively of the geology of the catchment.Show less"
21,"Gulley, J",Nov 2013 ,"Dissolution in a variably confined carbonate platform: effects of allogenic runoff, hydraulic damming of groundwater inputs, and surface-groundwater exchange at the basin scale",EARTH SURFACE PROCESSES AND LANDFORMS,"In variably confined carbonate platforms, impermeable confining units collect rainfall over large areas and deliver runoff to rivers or conduits in unconfined portions of platforms. Runoff can increase river stage or conduit heads in unconfined portions of platforms faster than local infiltration of rainfall can increase groundwater heads, causing hydraulic gradients between rivers, conduits and the aquifer to reverse. Gradient reversals cause flood waters to flow from rivers and conduits into the aquifer where they can dissolve limestone. Previous work on impacts of gradient reversals on dissolution has primarily emphasized individual caves and little research has been conducted at basin scales. To address this gap in knowledge, we used legacy data to assess how a gradient of aquifer confinement across the Suwannee River Basin, north-central Florida affected locations, magnitudes and processes of dissolution during 2005-2007, a period with extreme ranges of discharge. During intense rain events, runoff from the confining unit increased river stage above groundwater heads in unconfined portions of the platform, hydraulically damming inputs of groundwater along a 200 km reach of river. Hydraulic damming allowed allogenic runoff with SICAL<-4 to fill the entire river channel and flow into the aquifer via reversing springs. Storage of runoff in the aquifer decreased peak river discharges downstream and contributed to dissolution within the aquifer. Temporary storage of allogenic runoff in karst aquifers represents hyporheic exchange at a scale that is larger than found in streams flowing over non-karst aquifers because conduits in karst aquifers extend the area available for exchange beyond river beds deep into aquifers. Post-depositional porosity in variably confined carbonate platforms should thus be enhanced along rivers that originate on confining units. This distribution should be considered in models of porosity distribution used to manage water and hydrocarbon resources in carbonate rocks. Copyright (c) 2013 John Wiley & Sons, Ltd.Show less"
22,"Li, XJ",Nov 4 2019 ,Acoustofluidic enzyme-linked immunosorbent assay (ELISA) platform enabled by coupled acoustic streaming,ANALYTICA CHIMICA ACTA,"Bead-based ELISA in microfluidics is a promising platform for reducing the reagent consumption and improving assay throughput due to its fast binding kinetics and low reagent consumption. Current microfluidic bead-based immunoassay mainly relies on magnetic and centrifugal forces to manipulate microparticles to complete an assay protocol. Here we report an acoustic streaming-based microfluidic method that can perform all the fluid and particle operations of bead-based ELISA. A series of sharp-edge structures are used to generate a long-range coupled acoustic streaming that enables simultaneous particle trapping and active molecular exchange in a dead-end microchannel. The device achieved > 99% of molecular exchange in 4 min, while maintaining a particle trapping efficiency of 85%. This acoustofluidic-based method demonstrates all three key operations in a bead-based immunoassay: (1) Beads ""immobilization""; (2) Active mixing of fluid for bead/target binding; (3) Active molecular exchange for reagent loading and washing. Finally, on-chip quantitative detection of biomarker IL-6 with a limit of detection similar to 50 pg/mL is achieved using this platform including an enzymatic signal amplification step. The small footprint, simple setup, and continuous flow operation of the acoustic streaming-based method makes it an attractive platform for continuous flow bead-based immunoassay. (C) 2019 Elsevier B.V. All rights reserved.Show less"
23,"Zhao, YH",Oct 2021 ,Coordination Study on Ecological and Economic Coupling of the Yellow River Basin,INTERNATIONAL JOURNAL OF ENVIRONMENTAL RESEARCH AND PUBLIC HEALTH,"The coupling and coordination relationship between ecology and the economy in the Yellow River Basin is a hot topic in sustainable development research. Said research has important guiding significance for the ecological security and comprehensive development of the Yellow River Basin. Taking the Yellow River Basin as the object of our study, based on the data of the economy, energy consumption data, ecology data and water resources data, we construct an indicator system of the economic development and ecological status of the Yellow River Basin and use the principal component analysis method to calculate the economic development and ecological status index. Then, we use the evaluation method, the coupling degree model and the coupling coordination degree model to analyze the time and space evolution trends of economic development and ecological state, coupling degree and coupling coordination degree. The results show that: (1) From 2000 to 2018, the economic development index of the Yellow River Basin rose steadily; the ecological status index showed a slow rise and then a downward trend. (2) The degree of coupling between economic development and ecological state has been considered as intensity coupling after 2005. The coupling trend slowly increased and then decreased, indicating that the interaction effect between the economy and ecology was first significantly enhanced and then slowly weakened. (3) The degree of coupling coordination increased from 0.2994 to 0.6266 and then decreased to 0.5917, reflecting the continuous improvement of the relationship between the regional economy and the ecological environment and the trend toward coordination. From 2015 to 2018, due to the gradual increase in the difference between economic development and ecological conditions, the coupling and coordination between the two decreased. Studies have shown that ecological construction and protection should be strengthened to ease the contradiction between the economy and ecology and achieve coordinated development.Show less"
24,"da Silva, AMF",8th International Conference on Fluvial Hydraulics (River Flow),Physical and numerical modeling of hyporheic flow through a gravel bar,,
25,"Mouchlianitis, FA",Oct 2021 ,Does fragmented river connectivity alter the reproductive behavior of the potamodromous fish Alburnus vistonicus?,HYDROBIOLOGIA,"Blocked riverine spawning migration routes constitute one of the main threats of potamodromous fish that require well-connected habitats of high quality to maintain their unique life-history form. Alburnus vistonicus, a potamodromous species inhabiting the Vistonis freshwater system in northern Greece, manages to cope with wide salinity fluctuations in Vistonis Lake, but the impact of the fragmented connectivity of the lake's two main freshwater suppliers, Kosynthos and Kompsatos rivers, has not been assessed. We analyzed the species whole reproductive cycle and we divided it into phases. Cyclicity was observed in gonadosomatic index and oocyte diameter, while total fecundity remained constant prior to the onset of the spawning season. Stomach fullness and condition factor differed among the surveyed habitats. Successful spawning and multiple spawning were verified, as well as spawning migration and potamodromy. However, mature females with markers of recent spawning activity were captured also in the lake, suggesting spawning occurrence in the lake or a previously undocumented oscillatory behavior between the lake and the rivers during the spawning season and between sequential spawning events. Either behavior may serve as a mechanism to overcome the restricted spawning migration routes due to the fragmented river connectivity.Show less"
26,"Battin, TJ",Oct 1999 ,Hydrologic flow paths control dissolved organic carbon fluxes and metabolism in an alpine stream hyporheic zone,WATER RESOURCES RESEARCH,"The objective of the present paper was to link reach-scale streambed reactive uptake of dissolved organic carbon (DOC) and dissolved oxygen (DO) to subsurface flow paths in an alpine stream (Oberer Seebach (OSB)). The topography adjacent to the stream channel largely determined flow paths, with shallow hillslope groundwater flowing beneath the stream and entering the alluvial groundwater at the opposite bank. As computed from hydrometric data, OSB consistently lost stream water to groundwater with fluxes out of the stream averaging 943 +/- 47 and 664 +/- 45 L m(-2) h(-1) at low (Q < 600 L s(-1)) and high (Q > 600 L s(-1)) flow, respectively. Hydrometric segregation of streambed fluxes and physicochemical mixing analysis indicated that stream water was the major input component to the streambed with average contributions of 70-80% to the hyporheic zone (i.e., the subsurface zone where shallow groundwater and stream water mix). Surface water was also the major source of DOC with 0.512 +/- 0.043 mg C m(-2) h(-1) to the streambed. The DOC flux from shallow riparian groundwater was lower (0.309 +/- 0.071 mg C m(-2) h(-1)) and peaked in autumn with 1.011 mg C m(-2) h(-1). I computed the relative proportion of downstream discharge through the streambed as the ratio of the downstream length (S-sw) a stream water parcel travels before entering the streambed to the downstream length (S-hyp) a streambed water parcel travels before returning to the stream water. The relative streambed DOC retention efficiency, calculated as (input-output)/input of interstitial DOG, correlated with the proportion (S-sw/S-hyp) of downstream discharge (r(2) = 0.76, p = 0.006), Also, did the streambed metabolism (calculated as DO uptake from mass balance) decrease with low subsurface downstream routing, whereas elevated downstream discharge through the streambed stimulated DO uptake (r(2) = 0.69, p = 0.019)? Despite the very short DOC turnover times (similar to 0.05 days, calculated as mean standing stock/annual input) within the streambed, the latter constitutes a net sink of DOC (similar to 14 mg C m(-2) h(-1)). Along with high standing stocks of sediment associated particulate organic carbon, these results suggest microbial biofilms as the major retention and storage site of DOC in an alpine stream where large hydrologic exchange controls DOC fluxes.Show less"
27,"Emanuel, RE",Apr 2014 ,Vegetation and topographic influences on the connectivity of shallow groundwater between hillslopes and streams,ECOHYDROLOGY,"Little is known about the combined effects of vegetation and topography on hillslope water table dynamics. In forested headwater catchments, complex terrain and vegetation intersect to impose large spatial and temporal variability in the vertical and lateral redistribution of water from hillslopes to streams. Here, we demonstrate, using empirical data from the Northern Rocky Mountains, that vegetation interacts with landscape topography to influence hillslope-riparian-stream hydrologic connectivity. We compared a measured relationship between hillslope contributing area and hydrologic connectivity during the growing season to LiDAR-derived vegetation characteristics and found that two behavioural regimes emerged. Among some hillslopes, hydrologic connectivity decreased as vegetation density increased, demonstrating that growing season hydrologic connectivity is subject to the balance between evapotranspiration and lateral redistribution of soil water. Among other hillslopes, hydrologic connectivity increased as vegetation density increased. For the latter set of hillslopes, hydrologic connectivity cannot be explained by topography and vegetation alone. When we compared joint distributions of vegetation density and modelled solar irradiance between the two regimes as another indicator of evapotranspiration, we found that conditions were generally more favourable for higher transpiration on hillslopes where hydrologic connectivity decreased as vegetation density increased than on hillslopes where the opposite behaviour was observed. Our results demonstrate not only the importance of vegetation heterogeneity for hillslope-riparian-stream connectivity but also the importance of other spatially distributed variables such as energy availability when considering the influence of topography on hydrological processes. Copyright (c) 2013 John Wiley & Sons, Ltd.Show less"
28,"Butturini, A",Jun 2002 ,The influence of riparian-hyporheic zone on the hydrological responses in an intermittent stream,HYDROLOGY AND EARTH SYSTEM SCIENCES,"Stream and riparian groundwater hydrology has been studied in a small intermittent stream draining a forested catchment for a system representative of a Mediterranean climate, The relationship between precipitation and stream runoff and the interactions between stream water and the surrounding riparian groundwater have been analysed under a wide spectrum of meteorological conditions. The hypothesis that the hydrological condition of the near-stream groundwater compartment can regulate the runoff generation during precipitation events was tested, Stream runoff is characterised by a summer dry period, and precipitation input explained only 250,6 of runoff variability over the study period (r(2)=0.25, d.f,=5 1, p<0,001). The variability of precipitation v. stream runoff is explained partly by the hydrogeological properties of the riparian near-stream zone. This zone is characterised by high hydrological conductivity values and abrupt changes in groundwater level in summer. The summer dry period begins with a rapid decrease in near-stream groundwater level, and ends just after the first autumnal rain when the original groundwater level recovers suddenly. Within this period, storms do not cause major stream runoff since water infiltrates rapidly into the riparian compartment until it is refilled during the subsequent winter and spring; then the precipitation explains the 80% of the stream runoff variability (r(2)=0. 80, d.f.=34, p<0.001), These results suggest that the hydrological interaction between the riparian groundwater compartment and the stream channel is important in elucidating the hydrological responses during drought periods in small Mediterranean streams.Show less"
