,First author,Year,Title,Journal,Abstract
0,"Krylov, A",4th International Conference on River Basin Management,Importance of the process of mass-exchange between main stream of a river and underflow for modelling of concentration of radioactive substances in river water and bed sediments,,
1,"Riedel, JW",Sep 2022 ,Investigating Thermal Controls on the Hyporheic Flux as Evaluated Using Numerical Modeling of Flume-Derived Data,HYDROLOGY,"The flux of water through the hyporheic zone (HZ) is controlled by stream bedforms, sinuosity, surface water velocity, local water table, seasonality, and hydraulic conductivity (K) of the bed material. Dependent on both the kinematic viscosity and density of water, K values are a function of temperature. In most studies, changes in temperature have been neglected because of the limited effect either density or viscosity has on K values. However, these variations are important given the role of K in HZ flux, which lead to the hypothesis that flow into the HZ would be more efficient (faster rate and greater depth) under warmer conditions than under cool conditions. To discern how water temperature affects flow depth in the HZ, VS2DHI simulations were created to map flow under both warm and cool thermal conditions. The models employed data collected from a series of varying temperature hydrologic flume tests in which the effects of hyporheic flow altering variables such as sinuosity, surface water velocity and volume, and bed-forms were controlled. Results verify that K values in the HZ were larger under warm conditions generating deeper HZ pathways, while the smaller K values under cool conditions produced shallower pathways. The simulations confirmed a faster speed of frontal movement under warm conditions than cool. Peclet numbers revealed a shallower advective extinction depth under cool conditions as opposed to warm.Show less"
2,"Collins, BM",Jun 2007 ,Subsurface flowpaths in a forested headwater stream harbor a diverse macroinvertebrate community,WETLANDS,"Headwater streams and wetlands with a combination of surface and subsurface flows are common features of many upland-forested watersheds. Unlike headwater stream reaches with continuous surface flow, the hydrology and ecology of subsurface stream reaches are poorly studied and not factored into existing wetland legislation. We assessed subsurface habitats and associated biota in a 435-m reach of a first-order, intermittent stream draining a riparian zone dominated by eastern hemlock (Tsuga canadensis) in north central Massachusetts. Stream flow was found only in subsurface flowpaths beneath large boulders and surface root mats over approximately 70% of the total stream length at summer base flow. Temperature, specific conductivity, dissolved oxygen, and dissolved organic carbon concentrations of subsurface water were similar to surface water. Macroinvertebrates were found in subsurface habitats but at a lower abundance and richness per unit area compared to surface habitats. Collectors such as Chironomidae, Polycentropodidae, and Ephemerellidae were generally the most abundant families in both surface and subsurface habitats. Our findings indicate that in some glaciated watersheds, intermittent streams with no visual evidence of surface flow may contain subsurface flowpaths with water chemistry and biota comparable to coupled perennial surface flow reaches. The prevalence and importance of subsurface habitats in some headwater streams may warrant review or revision of existing state and local regulatory definitions of intermittent and headwater streams.Show less"
3,"Lai, HC",29th ACM International Conference on Information and Knowledge Management (CIKM),Live Multi-Streaming and Donation Recommendations via Coupled Donation-Response Tensor Factorization,,
4,"Hong, M",Sep 2020 ,"An Explicit Scheme to Represent the Bidirectional Hydrologic Exchanges Between the Vadose Zone, Phreatic Aquifer, and River",WATER RESOURCES RESEARCH,"Understanding groundwater storage variations as a result of effects from both the vadose zone and the river is of critical importance in the hydraulically connected surface-subsurface system. In this study, we present a novel Bidirectional Exchange Scheme in Surface and Subsurface (BE3S) that represents bidirectional exchanges between the vadose zone, phreatic aquifer, and river. The approach enables explicit representations of each flow regime while conserving mass, and successfully yields solutions of the coupled system for multiple temporal resolutions. We test the scheme by comparing the BE3S-derived outputs against other models and corresponding observational data. We apply the scheme to simulate hydrologic states in a reach of the Brazos River in Southeast Texas, such as soil moisture content, groundwater level, and river stage as well as net subsurface discharge fluxes. Good agreements between the simulated and observed data for all the components show the suitability of the proposed scheme in modeling the bidirectional flows and exchanges. We also assess how the bidirectional hydrologic exchanges are affected by adjacent flow domains. We find that vertical percolation is significantly affected by unsaturated soil thickness, resulting in the spatial variability of vertical percolation across sloping topography. Hilltop-to-valley convergent groundwater flow is also found to impede vertical percolation in river valleys due to shallow water table while facilitating percolation in the hilltops. The capability of the presented scheme that accounts for the topographically driven lateral groundwater flow and drainage dynamics provides the potential to enhance the representation of the surface-subsurface system in Earth System Models (ESMs).Show less"
5,"Zilli, FL",Dec 2013 ,"Distribution of benthic invertebrate biomass and secondary production in relation to floodplain connectivity in a large river system (Parana River, Argentina)",INTERNATIONAL REVIEW OF HYDROBIOLOGY,"An investigation of benthic invertebrates was conducted in the Parana River (Argentina) floodplain to assess patterns of biomass and production in relation to lateral river connectivity. Environmental and invertebrate samples were collected monthly from April 2005 to March 2006 at sites with different lateral surface-connection. The investigated invertebrate assemblages were characterized by high biomass and high production. The key factor determining the benthic assemblages was river connectivity and indirectly, substrate characteristics, water transparency, and depth. With increasing river connectivity, biomass and production of oligochaetes, native bivalves, and dipterans decreased, whereas both variables increased for non-native bivalves, gastropods and ephemeropterans. Benthic assemblages of most of sites had an average similarity in the composition of about 50% along the study period, but the number of taxa contributing to the overall similarity was lower at sites located at long distance from the main channel than at sites located next to it. Potential production was high compared to literature data, which underscores the importance of preserving floodplain areas and maintaining natural lateral connectivity. High habitat patchiness mediated by lateral-surface connectivity appeared to promote benthic resources diversity, which in turn controls productivity of this floodplain-river system.Show less"
6,"Bajpai, M",Apr 2022 ,Optimization of Groundwater Pumping and River-Aquifer Exchanges for Management of Water Resources,WATER RESOURCES MANAGEMENT,"Multi-objective optimization problems can be solved through Simulation-Optimization (S-O) techniques where the pareto front gives the optimal solutions in the problem domains. During the selection of different modelling methods, optimization techniques and management scenarios, several pareto fronts can be generated. In the present work, an attempt has been made by performing intensive comparisons between different pareto fronts to compare the efficiency and convergence of different S-O models. In this process, groundwater models were developed to simulate the River-Aquifer (R-A) exchanges for the study area as groundwater pumping influences the rate of R-A exchanges and alters the flow dynamics. The developed models were coupled with optimization models and were executed to solve the multi-objective optimization problems based on the maximization of discharge through pumping wells and maximization of groundwater input into the river through R-A exchanges. The distinctive features of the paper include a pareto front comparison where fronts developed by different S-O models were compared and analysed based on various parameters. The results show the dominance of Multi-Objective Particle Swarm Optimization (MOPSO) over other optimization algorithms and concluded that the maximization of pumping rate significantly changes after considering the R-A exchanges-based objective functions. This study concludes that the model domain also alters the output of simulation-optimization. Therefore, model domain and corresponding boundary conditions should be selected carefully for the field application of management models. The artificial neural network (ANN) models have been also developed to deal with the computationally expensive simulation models by reducing the processing time and found efficient.Show less"
7,"Dou, P",Mar 2016 ,Macrobenthos Diversity Response to Hydrological Connectivity Gradient,WETLANDS,"The abundant riparian wetlands supported by the complex river network in Pearl River Delta (PRD) are under an intensely anthropogenic disturbance that threatens the local ecological environment. This paper examined the benthic invertebrate diversity and biomass within the Pearl River through a field study. A fieldwork was conducted to assess a hydrological connectivity gradient among the main channel of the Pearl River. The responses of macroinvertebrate metrics to the connectivity gradient and the restoration history in the river channel were examined. The Shannon diversity index ranged from 0.75 to 2.08, which was the highest among most connectivity river channels. Statistical analyses (PCA and CCA) revealed that the benthic abundance in high hydrological connectivity riverine habitats is clearly distinct from the low connectivity habitats. Results demonstrated that the diversity and density of macrobenthos are determined by hydrological connectivity and time span of the restoration (river channels). Therefore, conservation and restoration efforts should focus on the macroinvertebrate response to the hydrological connectivity of the river channels in PRD.Show less"
8,"Clow, DW",Sep 2021 ,Spatiotemporal Dynamics of CO2 Gas Exchange From Headwater Mountain Streams,JOURNAL OF GEOPHYSICAL RESEARCH-BIOGEOSCIENCES,
9,"Ren, J",Jan 2020 ,"Vertical fluid flux in the hyporheic zone: field investigation, model, and comparative analysis",ARABIAN JOURNAL OF GEOSCIENCES,"The hyporheic zone (HZ) is a saturated sediment layer connecting groundwater (GW) and surface water (SW) along a riverbed and river channel. The HZ plays an important role in connecting SW and GW in a river ecosystem, thereby helping maintain the ecological health of rivers. Studies on the HZ have therefore increased in many disciplines. This study used the VFLUX 2 software to assess vertical fluid flux in the HZ, in which the Hatch, Kerry, McCallum, and Luce models were applied and compared. The simulations were calibrated against data measured by the US Geological Survey at a water diversion channel within the Walker River Basin in Nevada. Using COMSOL Multiphysics, we developed a two-dimensional coupled numerical model of the saturated seepage and temperature fields, calibrated against measured temperature data. We also determined the vertical seepage velocity and compared the simulations with those of the analytical models in VFLUX 2. The results showed that the temperature field distribution of the HZ is obviously nonuniform in space. With a deeper monitoring point, the thermal response of each temperature measurement pointed to periodic temperature fluctuations of the SW, which exhibited attenuation and hysteresis characteristics. When the vertical flow velocity of GW was sufficiently large, an error in the accuracy of the Kerry model amplitude ratio was observed, regardless of the heat dispersion coefficient used. Under conditions of local GW recharge by SW and a heterogeneous permeability coefficient, the use of the amplitude ratio method is recommended to quantify the vertical GW flow rate in the HZ.Show less"
10,"Keesstra, SD",Mar 2019 ,"Coupling hysteresis analysis with sediment and hydrological connectivity in three agricultural catchments in Navarre, Spain",JOURNAL OF SOILS AND SEDIMENTS,"PurposeRain storm events mobilise large proportions of fine sediments in catchment systems. Sediments from agricultural catchments are often adsorbed by nutrients, heavy metals and other (in)organic pollutants that may impact downstream environments. To mitigate erosion, sediment transport and associated pollutant transport, it is crucial to know the origin of the sediment that is found in the drainage system, and therefore, it is important to understand catchment sediment dynamics throughout the continuity of runoff events.Materials and methodsTo assess the impact of the state of a catchment on the transport of fine suspended sediment to catchment outlets, an algorithm has been developed which classifies rain storm events into simple (clockwise, counter-clockwise) and compound (figure-of-eight; complex) events. This algorithm is the first tool that uses all available discharge and suspended sediment data and analyses these data automatically. A total of 797 runoff events from three experimental watersheds in Navarre (Spain) were analysed with the help of long-term, high-resolution discharge and sediment data that was collected between 2000 and 2014.Results and discussionMorphological complexity and in-stream vegetation structures acted as disconnecting landscape features which caused storage of sediment along the transport cascade. The occurrence of sediment storage along transport paths was therefore responsible for clockwise hysteresis due to the availability of in-stream sediment which could cause the first flush affect. Conversely, the catchment with steeper channel gradients and a lower stream density showed much more counter-clockwise hysteresis due to better downstream and lateral surface hydrological connectivity. In this research, hydrological connectivity is defined as the actual and potential transfer paths in a catchment. The classification of event SSC-Q hysteresis provided a seasonal benchmark value to which catchment managers can compare runoff events in order to understand the origin and locations of suspended sediment in the catchment.ConclusionsA new algorithm uses all available discharge and suspended sediment data to assess catchment sediment dynamics. From these analyses, the catchment connectivity can be assessed which is useful to develop catchment land management.Show less"
11,"Marion, A",Oct 14 2008 ,Solute transport in rivers with multiple storage zones: The STIR model,WATER RESOURCES RESEARCH,"Solute transport in rivers is controlled by surface hydrodynamics and by mass exchanges between the surface stream and distinct retention zones. This paper presents a residence time model for stream transport of solutes, Solute Transport in Rivers (STIR), that accounts for the effect of the stream-subsurface interactions on river mixing. A stochastic approach is used to derive a relation between the in-stream solute concentration and the residence time distributions (RTDs) in different retention domains. Particular forms of the RTD are suggested for the temporary storage within surface dead zones and for bed form-induced hyporheic exchange. This approach is advantageous for at least two reasons. The first advantage is that exchange parameters can generally be expressed as functions of physical quantities that can be reasonably estimated or directly measured. This gives the model predictive capabilities, and the results can be generalized to conditions different from those directly observed in field experiments. The second reason is that individual exchange processes are represented separately by appropriate residence time distributions, making the model flexible and modular, capable of incorporating the effects of a variety of exchange processes and chemical reactions in a detailed way. The capability of the model is illustrated with an example and with an application to a field case. Analogies and differences with other established models are also discussed.Show less"
12,"Pate, AA",Nov 15 2020 ,Streamflow permanence in headwater streams across four geomorphic provinces in Northern California,HYDROLOGICAL PROCESSES,"Mountainous headwater streams represent a substantial proportion of the global stream network. These small streams may flow episodically, seasonally, or perennially, providing diverse values and services. Given their broad importance and growing pressures on terrestrial and aquatic resources, we must improve our understanding of the drivers of flow permanence to facilitate informed land and water management decisions. We used field observations from >10 cross-sections in each of 101 non-fish bearing, headwater streams across four geomorphic provinces in Northern California to quantify flow permanence and network connectivity during the summer low flow period in 2018. At each stream cross-section, we noted the presence or absence of streamflow and used this information to classify streams as perennial (continuous streamflow in all cross-sections) or non-perennial and connected (surface water in the most downstream cross-section) or disconnected. At each cross-section, we also quantified channel size (width and depth) and grain size. We coupled field observations with geospatial data of catchment physiography, hydrology, and climate in random forest models to investigate controls of flow permanence and network connectivity. Potential drivers of flow permanence or network connectivity included in our models were channel geometry, grain size, slope, aspect, elevation, annual and seasonal precipitation, air temperature, and topographic wetness index. We found more perennial streams in the Klamath Mountains and Sierra Nevada than in the Cascades and N. Coast regions. Streams in the Klamath were the most connected followed by streams in the N. Coast, Sierra Nevada, and Cascades. The most important variables for predicting flow permanence were channel grain size, winter 2018 precipitation, and drainage area. Comparatively, the most important variables for predicting network connectivity were winter and spring 2018 precipitation, grain size, and bankfull depth. Our study illustrated the complexity of the processes that drive flow permanence and highlighted the uncertainty in projecting the precense of water in streams across diverse regions.Show less"
13,"Hiatt, M",Mar 2018 ,Channel-Island Connectivity Affects Water Exposure Time Distributions in a Coastal River Delta,WATER RESOURCES RESEARCH,"The exposure time is a water transport time scale defined as the cumulative amount of time a water parcel spends in the domain of interest regardless of the number of excursions from the domain. Transport time scales are often used to characterize the nutrient removal potential of aquatic systems, but exposure time distribution estimates are scarce for deltaic systems. Here we analyze the controls on exposure time distributions using a hydrodynamic model in two domains: the Wax Lake delta in Louisiana, USA, and an idealized channel-island complex. In particular, we study the effects of river discharge, vegetation, network geometry, and tides and use a simple model for the fractional removal of nitrate. In both domains, we find that channel-island hydrological connectivity significantly affects exposure time distributions and nitrate removal. The relative contributions of the island and channel portions of the delta to the overall exposure time distribution are controlled by island vegetation roughness and network geometry. Tides have a limited effect on the system's exposure time distribution but can introduce significant spatial variability in local exposure times. The median exposure time for the WLD model is 10 h under the conditions tested and water transport within the islands contributes to 37-50% of the network-scale exposure time distribution and 52-73% of the modeled nitrate removal, indicating that islands may account for the majority of nitrate removal in river deltas.Show less"
14,"Biron, PM",Sum 2018 ,The need for river management and stream restoration practices to integrate hydrogeomorphology,CANADIAN GEOGRAPHER-GEOGRAPHE CANADIEN,"There is growing support amongst scientists worldwide about the need for a shift in river management approaches to include hydrogeomorphic processes. However, the degree to which these concepts are transferred to governmental agencies and practitioners varies widely. In Quebec, for example, many stream restoration projects are based on the (incorrect) assumption that river mobility and its inevitable consequences (bank erosion of meanders, presence of woody debris in the channel) are problematic for salmonids. This paper presents examples drawn from current guidelines on stream restoration for fish habitat in Quebec to demonstrate the need to improve the knowledge exchange among scientists and decision makers about the positive impact of river mobility and large wood dynamics on biodiversity. Our observations reveal that existing guidelines for stream restoration in Quebec need to be revised to better integrate hydrogeomorphic concepts and to no longer assume that maintaining rivers in a static state is beneficial for fish. Adopting the freedom space for rivers approach would likely result in improved habitat as it combines natural processes related to mobility, flooding, and riparian wetland connectivity to determine the minimal space around rivers where development should not be allowed, thus allowing river processes to be restored.La necessite d'integrer l'hydrogeomorphologie pour la gestion des rivieres et les pratiques de restauration des cours d'eau Il existe un consensus croissant parmi les scientifiques du monde entier qu'il est necessaire de changer les approches de gestion des rivieres pour inclure les processus hydrogeomorphologiques. Cependant, la mesure dans laquelle ces concepts sont transferes aux agences et praticiens gouvernementaux varie considerablement. Au Quebec par exemple, plusieurs projets de restauration des cours d'eau sont bases sur l'hypothese (incorrecte) que la mobilite des rivieres et leurs consequences inevitables (erosion de berge des meandres, presence de debris ligneux dans le chenal) sont problematiques pour les salmonides. Cet article presente des exemples tires des lignes directrices actuelles sur la restauration de l'habitat du poisson au Quebec pour demontrer la necessite d'ameliorer le transfert de connaissances entre scientifiques et decideurs sur l'impact positif de la mobilite des rivieres et de la dynamique des bois morts sur la biodiversite. Nos observations revelent que les lignes directrices existantes pour la restauration des cours d'eau au Quebec doivent etre revisees afin de mieux integrer les concepts hydrogeomorphologiques et de ne plus supposer que le maintien des rivieres dans un etat statique soit benefique pour les poissons. Adopter l'approche de gestion par << espace de liberte des cours d'eau >> entrainerait probablement une amelioration de l'habitat, car elle associe des processus naturels lies a la mobilite, aux inondations et a la connectivite des milieux humides riverains pour determiner l'espace minimal autour des rivieres oU le developpement ne devrait pas etre autorise, permettant ainsi de restaurer les processus fluviaux.Show less"
15,"Wade, J",Dec 2020 ,Beaver dam analogues drive heterogeneous groundwater-surface water interactions,HYDROLOGICAL PROCESSES,"Beaver dam analogues (BDAs) are a cost-effective stream restoration approach that leverages the recognized environmental benefits of natural beaver dams on channel stability and local hydrology. Although natural beaver dams are known to exert considerable influence on the hydrologic conditions of a stream system by mediating geomorphic processes, nutrient cycling, and groundwater-surface water interactions, the impacts of beaver-derived restoration methods on groundwater-surface water exchange are poorly characterized. To address this deficit, we monitored hyporheic exchange fluxes and streambed porewater biogeochemistry across a sequence of BDAs installed along a central Wyoming stream during the summer of 2019. Streambed fluxes were quantified by heat tracing methods and vertical hydraulic gradients. Biogeochemical activity was evaluated using major ion porewater chemistry and principal component analysis. Vertical fluxes of approximately 1.0 m/day were observed around the BDAs, as was the development of spatially heterogeneous zones of nitrate production, groundwater upwelling, and anaerobic reduction. Strong contrasts in hyporheic zone processes were observed across BDAs of differing sizes. This suggests that structures may function with size-dependent behaviour, only altering groundwater-surface water interactions after a threshold hydraulic step height is exceeded. Patterns of hyporheic exchange and biogeochemical cycling around the studied BDAs resemble those around natural beaver dams, suggesting that BDAs may provide comparable benefits to channel complexity and near-stream function over a 1-year period.Show less"
