,First author,Year,Title,Journal,Abstract
42,"Rodriguez-Ramos, JA",Aug 30 2022 ,Genome-Resolved Metaproteomics Decodes the Microbial and Viral Contributions to Coupled Carbon and Nitrogen Cycling in River Sediments,MSYSTEMS,"Rivers have a significant role in global carbon and nitrogen cycles, serving as a nexus for nutrient transport between terrestrial and marine ecosystems. Although rivers have a small global surface area, they contribute substantially to worldwide greenhouse gas emissions through microbially mediated processes within the river hyporheic zone. Despite this importance, research linking microbial and viral communities to specific biogeochemical reactions is still nascent in these sediment environments. To survey the metabolic potential and gene expression underpinning carbon and nitrogen biogeochemical cycling in river sediments, we collected an integrated data set of 33 metagenomes, metaproteomes, and paired metabolomes. We reconstructed over 500 microbial metagenome-assembled genomes (MAGs), which we dereplicated into 55 unique, nearly complete medium- and high-quality MAGs spanning 12 bacterial and archaeal phyla. We also reconstructed 2,482 viral genomic contigs, which were dereplicated into 111 viral MAGs (vMAGs) of >10 kb in size. As a result of integrating gene expression data with geochemical and metabolite data, we created a conceptual model that uncovered new roles for microorganisms in organic matter decomposition, carbon sequestration, nitrogen mineralization, nitrification, and denitrification. We show how these metabolic pathways, integrated through shared resource pools of ammonium, carbon dioxide, and inorganic nitrogen, could ultimately contribute to carbon dioxide and nitrous oxide fluxes from hyporheic sediments. Further, by linking viral MAGs to these active microbial hosts, we provide some of the first insights into viral modulation of river sediment carbon and nitrogen cycling.IMPORTANCE Here we created HUM-V (hyporheic uncultured microbial and viral), an annotated microbial and viral MAG catalog that captures strain and functional diversity encoded in these Columbia River sediment samples. Demonstrating its utility, this genomic inventory encompasses multiple representatives of dominant microbial and archaeal phyla reported in other river sediments and provides novel viral MAGs that can putatively infect these. Furthermore, we used HUM-V to recruit gene expression data to decipher the functional activities of these MAGs and reconstruct their active roles in Columbia River sediment biogeochemical cycling. Ultimately, we show the power of MAG-resolved multi-omics to uncover interactions and chemical handoffs in river sediments that shape an intertwined carbon and nitrogen metabolic network. The accessible microbial and viral MAGs in HUM-V will serve as a community resource to further advance more untargeted, activity-based measurements in these, and related, freshwater terrestrial-aquatic ecosystems.Show less"
43,"Rathore, SS",May 2021 ,On the Reliability of Parameter Inferences in a Multiscale Model for Transport in Stream Corridors,WATER RESOURCES RESEARCH,"Nonreacting tracer tests capture information about physical processes in transient storage zones including the hyporheic zone (HZ). However, reliably extracting this information from breakthrough curves (BTCs) and distinguishing the effects of in-channel dispersion and transient storage are well-known challenges. Using BTCs from a nonreacting tracer test monitored at multiple locations, we explore ways for reliable parameter estimations. The identifiability of parameters is greatly influenced by the choice of forward and inverse modeling frameworks in addition to the quality of the data. Our forward model is a recently proposed multiscale model that uses subgrid transport models written in the Lagrangian form to represent transport along a diverse set of HZ pathways with a shape-free distribution of travel times. Joint distributions of HZ and channel parameters are estimated using the Markov Chain Monte Carlo technique. Numerical experiments show ambiguity between channel dispersion and HZ transport when the reach length is too short to allow significant solute-HZ interaction, the observation period is too brief to observe the tailing behavior, or the solute source is spread in time. In contrast, we obtained reliable parameter estimates by simultaneously fitting BTCs observed at different locations in the test reach using a single set of HZ parameters and section-specific channel areas and dispersion coefficients. This study demonstrates the estimation of travel time distributions, HZ exchange rates, and channel parameters in a new multiscale approach and offers guidance for extracting reliable parameter estimates from multiple BTCs.Show less"
44,"Yoshikuni, N",Mar 2001 ,Determination of boron in river-water by ICP-AES coupled with anion-exchange preconcentration,BUNSEKI KAGAKU,"Trace amounts of boron in river-water samples were determined by a combined method of anion-exchange preconcentration and ICP-AES. dm(-3) or 0.2 mol dm(-3) with hydrofluoric acid. The sample was permitted to stand for 1 h and then passed through an anion-exchange column(Bio-Rad, AGI-X8, 100 similar to 200 mesh, F form, 3 g) at a flow rate of about 1 cm(3) min(-1). The boron adsorbed on the ion exchange column was at a flow rate of about 1 cm(3) min(-1) washed with 20 cm(3) of 1 mol dm(-3) nitric acid, and then eluted with 20 cm(3) of 6.5 mol dm(-3) nitric acid. After the effluent was collected in a 100 cm(3) quartz beaker, 10 cm(3) of 1.47 mol dm(-3) H3PO4 was added and evaporated to about 2 cm(3) on a hotplate. Any organic materials in the affluent were decomposed with mixed H3PO4-HClO4-HNO3. The content in the beaker was then transfered a 25 cm(3) PTFE standard flask, and diluted to the mark with water. The boron contents were determined by ICP-AES(182.6 nm). The present method was successfully applied to the analysis of standard reference materials(JAC0032) and to samples from Doshi river. The determination of boron in the standard reference materials showed good agreement and precision with already published values. The boron contents in the upper, middle and lower reaches in the river were 3.5 +/- 0.1 mug/l (n = 3), 5.1 +/- 0.1 mug/l (n = 6) and 9.4 +/- 0.6 mug/l (n = 4), respectively.Show less"
45,"Heindel, RC",Feb 2021 ,"Diatoms in Hyporheic Sediments Trace Organic Matter Retention and Processing in the McMurdo Dry Valleys, Antarctica",JOURNAL OF GEOPHYSICAL RESEARCH-BIOGEOSCIENCES,"In low-nutrient streams in cold and arid ecosystems, the spiraling of autochthonous particulate organic matter (POM) may provide important nutrient subsidies downstream. Because of its lability and the spatial heterogeneity of processing in hyporheic sediments, the downstream transport and fate of autochthonous POM can be difficult to trace. In Antarctic McMurdo Dry Valley (MDV) streams, any POM retained in the hyporheic zone is expected to be derived from surface microbial mats that contain diatoms with long-lasting silica frustules. We tested whether diatom frustules can be used to trace the retention of autochthonous POM in the hyporheic zone and whether certain geomorphic locations promote this process. The accumulation of diatom frustules in hyporheic sediments, measured as biogenic silica, was correlated with loss-on-ignition organic matter and sorbed ammonium, suggesting that diatoms can be used to identify locations where POM has been retained and processed over long timescales, regardless of whether the POM remains intact. In addition, by modeling the upstream sources of hyporheic diatom assemblages, we found that POM was predominantly derived from N-fixing microbial mats of the genus Nostoc. In terms of spatial variability, we conclude that the hyporheic sediments adjacent to the stream channel that are regularly inundated by daily flood pulses are where the most POM has been retained over long timescales. Autochthonous POM is retained in hyporheic zones of low-nutrient streams beyond the MDVs, and we suggest that biogenic silica and diatom composition can be used to identify locations where this transfer is most prevalent.Show less"
46,"Vergnes, JP",Nov 2018 ,Impact of river water levels on the simulation of stream-aquifer exchanges over the Upper Rhine alluvial aquifer (France/Germany),HYDROGEOLOGY JOURNAL,"This study aims to assess the sensitivity of river level estimations to the stream-aquifer exchanges within a hydrogeological model of the Upper Rhine alluvial aquifer (France/Germany), characterized as a large shallow aquifer with numerous hydropower dams. Two specific points are addressed: errors associated with digital elevation models (DEMs) and errors associated with the estimation of river level. The fine-resolution raw Shuttle Radar Topographic Mission dataset is used to assess the impact of the DEM uncertainties. Specific corrections are used to overcome these uncertainties: a simple moving average is applied to the topography along the rivers and additional data are used along the Rhine River to account for the numerous dams. Then, the impact of the river-level temporal variations is assessed through two different methods based on observed rating curves and on the Manning formula. Results are evaluated against observation data from 37 river-level points located over the aquifer, 190 piezometers, and a spatial database of wetlands. DEM uncertainties affect the spatial variability of the stream-aquifer exchanges by inducing strong noise and unrealistic peaks. The corrected DEM reduces the biases between observations and simulations by 22 and 51% for the river levels and the river discharges, respectively. It also improves the agreement between simulated groundwater overflows and observed wetlands. Introducing river-level time variability increases the stream-aquifer exchange range and reduces the piezometric head variability. These results confirm the need to better assess river levels in regional hydrogeological modeling, especially for applications in which stream-aquifer exchanges are important.Show less"
47,"Torres, KMM",Jun 2016 ,Taxonomic and functional organization in metacommunity structure of stream-fish assemblages among and within river basins in Texas,AQUATIC ECOLOGY,"Metacommunities are spatially structured communities linked by dispersal. They provide a connection between local community assembly and regional-level processes. One of the more widely used methods to address questions related to metacommunity concepts is those that characterize elements of metacommunity structure by quantifying aspects of coherence, species turnover, and boundary clumping. In this study, we used this approach to study the spatial ecology of freshwater fishes in Texas. Stream-fish assemblages in Texas provide an excellent opportunity to examine the patterns of metacommunity structure due to the number of drainages that empty directly into the Gulf of Mexico, which minimizes the likelihood of dispersal between basins while allowing for longitudinal movement within basins. We used fisheries data published by the Texas Parks and Wildlife Department and from the North American Water Quality Association, which consisted of 94 sampling localities distributed across 18 river basins and 11 ecoregions. To examine within-basin patterns, we focused only on the Brazos, Colorado, and Trinity rivers because of the number of sites within each of these basins. From a taxonomic standpoint, we consistently observed Clementsian patterns regardless of whether it was among or within river basins, whereas we mostly observed Gleasonian patterns from a functional perspective. Only one functional group was found at all sites in each of the three main river basins, which consisted of invertivores with an equilibrium life-history strategy. Various bioclimatic variables were significantly correlated with metacommunity structure, but these correlations differed between taxonomic and functional organization and differed depending on which river basin was considered. The results of this study support previous findings that species composition and functional traits relate to environmental gradients, but further our understanding by providing additional evidence that species sorting processes are the dominant structuring mechanisms.Show less"
48,"Painter, SL",Oct 2018 ,Multiscale Framework for Modeling Multicomponent Reactive Transport in Stream Corriders,WATER RESOURCES RESEARCH,"Travel time-based representations of transport, a highly successful strategy for modeling conservative tracer transport in stream corridors, are extended to accommodate multicomponent reactive transport. Specifically, convolution representations used to model exchange of solute with the hyporheic zone are shown to be equivalent to solving one-dimensional subgrid models in Lagrangian form coupled to the advection dispersion equation for the stream channel. Unlike the convolution-based representations of previous travel time-based stream transport models, the subgrid model generalizes to include multicomponent reactive transport with general nonlinear reactions. An example involving biomass growth, the establishment of redox zonation, and the resulting impact on denitrification rates demonstrate reach-scale application of the new approach. Although simplified, those example simulations show some of the key phenomena associated with hyporheic zone denitrification that are not represented with conventional first-order estimates.Show less"
49,"Covino, T",Dec 16 2011 ,Stream-groundwater exchange and hydrologic turnover at the network scale,WATER RESOURCES RESEARCH,"The exchange of water between streams and groundwater can influence stream water quality, hydrologic mass balances, and attenuate solute export from watersheds. We used conservative tracer injections (chloride, Cl-) across 10 stream reaches to investigate stream water gains and losses from and to groundwater at larger spatial and temporal scales than typically associated with hyporheic exchanges. We found strong relationships between reach discharge, median tracer velocity, and gross hydrologic loss across a range of stream morphologies and sizes in the 11.4 km(2) Bull Trout Watershed of central ID. We implemented these empirical relationships in a numerical network model and simulated stream water gains and losses and subsequent fractional hydrologic turnover across the stream network. We found that stream gains and losses from and to groundwater can influence source water contributions and stream water compositions across stream networks. Quantifying proportional influences of source water contributions from runoff generation locations across the network on stream water composition can provide insight into the internal mechanisms that partially control the hydrologic and biogeochemical signatures observed along networks and at watershed outlets.Show less"
