,First author,Year,Title,Journal,Abstract
43,"Migliaccio, R",2016 ,Functional Connectivity of Ventral and Dorsal Visual Streams in Posterior Cortical Atrophy,JOURNAL OF ALZHEIMERS DISEASE,"Background: Posterior cortical atrophy (PCA) induces progressive dysfunction of ventral and dorsal visual networks. Little is known, however, about corresponding changes in functional connectivity (FC).Objectives: To investigate FC changes in the visual networks, their relationship with cortical atrophy, and the association with Alzheimer's disease (AD) pathology.Methods: Ten PCA patients and 28 age-matched controls participated in the study. Using resting state fMRI, we measured FC in ventral and dorsal cortical visual networks, defined on the basis of a priori knowledge of long-range white matter connections. To assess the relationships with AD, we determined AD biomarkers in cerebrospinal fluid and FC in the default mode network (DMN), which is vulnerable to AD pathology. Voxel-based morphometry analysis assessed the pattern of grey matter (GM) atrophy.Results: PCA patients showed GM atrophy in bilateral occipital and inferior parietal regions. PCA patients had lower FC levels in a ventral network than controls, but higher FC in inferior components of the dorsal network. In particular, the increased connectivity correlated with greater GM atrophy in occipital regions. All PCA patients had positive cerebrospinal fluid biomarkers for AD; however, FC in global DMN did not differ from controls.Conclusions: FC in PCA reflects brain structure in a non-univocal way. Hyperconnectivity of dorsal networks may indicate aberrant communication in response to posterior brain atrophy or processes of neural resilience during the initial stage of brain dysfunction. The lack of difference from controls in global DMN FC highlights the atypical nature of PCA with respect to typical AD.Show less"
44,"Kazezyilmaz-Alhan, CM",Jan 15 2008 ,Analytical solutions for contaminant transport in streams,JOURNAL OF HYDROLOGY,"The importance of the effect of surface/ground water interactions on contaminant transport in streams and rivers has been greatly recognized in the last two decades. Bencala and Walters (1983) [Bencala, K.E., Walters, R.A., 1983. Simulation of solute transport in a mountain pool-and-riffle stream - a transient storage model. Water Resources Research 19 (3), 718-724.] developed a mathematical model for the transient storage zone to represent the movement of solute from main streams into stagnant zones and back to the main stream. This model calculates the concentrations of a main channel and a storage zone and the transient storage is represented by the mass exchange due to the concentration difference between the stream and the storage zone. Later, Kazezyllmaz-Alhan and Medina (2006) [Kazezyitmaz-Alhan, C.M., Medina Jr., M.A., 2006. Stream solute transport incorporating hyporheic zone processes. Journal of Hydrology 329 (1-2), 26-38.] made several improvements to this transient storage model by incorporating advection and dispersion into the hyporheic zone and representing the mass transport between the channel and hyporheic zone by mass flux terms. In this study, analytical solutions are derived for both transient storage models for the cases of continuous and finite injections of a tracer. The analytical. solutions provide the researchers with computational speed in obtaining results for contaminant transport problems, and a means to check the validity of the numerical models. The analytical solutions are compared to the numerical solutions for hypothetical problems. Comparison of results shows that the numerical and analytical solutions are in very good agreement. (c) 2007 Elsevier B.V. All rights reserved.Show less"
45,"Esmaeili, S",Sep 2016 ,Investigation of streaming potential coupling coefficients and zeta potential at low and high salinity conditions: Experimental and modeling approaches,JOURNAL OF PETROLEUM SCIENCE AND ENGINEERING,"Streaming potential measurement is one of the electrokinetic techniques used to determine the average zeta potential of porous rock which can provide reliable information on reservoir flow behavior and wettability state of the rock surface. Streaming potential measurement using electrodes has recently been introduced in the oil reservoirs applications and there are still significant uncertainties during the measurements and interpretation of streaming potential results. The primary purpose of this work is to establish a setup to measure the streaming potential of porous media with low scattering and evaluate voltage measurements based on the paired stabilization and pressure ramping methods. Streaming potential coupling coefficients of 36 samples of sand particle are measured in salinity from 0.0005 M to 0.025 M NaCl solutions. Then, the measured streaming potential coupling coefficients and zeta potential are compared with the published experimental results. Besides the good agreement that was achieved with the published experimental results, much lower scattering in the data points was accomplished for different saline injecting water. An accurate empirical expression is proposed for the measured coupling coefficients which predicts streaming potential coupling coefficients and zeta potential in the salinity range from 0.0001 M to 5.5 M. (C) 2016 Elsevier B.V. All rights reserved.Show less"
46,"Diaz, M",Dec 2020 ,Modelling of Groundwater-Surface Water Interaction Applying the Hyporheic Flux Model,WATER,"The objective of the present paper is to develop a methodology that could allow the representation of the analytical hyporheic flux equation model (AHF) in a numerical model done in MODFLOW. Therefore, the scope of the research is to show the viability of the methodology suggested in a real case (Biebrza river, Poland, Europe). Considering that the model requires extensive manipulation in the creation of the packages, a test phase through the seepage package of MODFLOW is carried out with the aim of representing the river package of MODFLOW. FloPy is the tool chosen to develop this implementation due to the versatility of manipulating the packages available in MODFLOW through coding. The obtained results showed a correct implementation of the AHF model using the example of the Biebrza River. The results obtained will enable a better understanding regarding the modelling of the interaction between the river and the aquifer, considering streams with specific geometries where the depth is dimensionally higher than the width.Show less"
47,"David, CH",Apr 2013 ,"Regional-scale river flow modeling using off-the-shelf runoff products, thousands of mapped rivers and hundreds of stream flow gauges",ENVIRONMENTAL MODELLING & SOFTWARE,"The permanent rivers and streams of the United States - i.e. the ""blue lines"" from the United States Geological Survey (USGS) - maps are available in a Geographic Information System dataset called NHDPlus in which network connectivity for approximately three million reaches is known. The USGS also measures stream flow at about twenty thousand gauges whose locations are known exactly on NHDPlus rivers. The Routing Application for Parallel computation of Discharge (RAPID) is a river network model that can be run on NHDPlus if given inflow to rivers from runoff. The second phase of the North American Land Data Assimilation System (NLDAS2) provides runoff estimates from four land surface models over the continent. One could therefore combine RAPID with NLDAS2 runoff to compute stream flow in all NHDPlus ""blue lines"" and compare computations with USGS observations over the United States. The work presented here investigates such a combination but focuses on the Texas Gulf Coast Hydrologic Region as a test case for regional-scale river flow modeling using off-the-shelf runoff products, thousands of mapped rivers and hundreds of stream flow gauges. Despite initial difficulties in the determination of water inflow from gridded NLDAS2 runoff datasets to NHDPlus rivers, the ""blue line"" approach is shown to be advantageous partly because hundreds of gauges are easily located on river networks and used throughout basins. Such use of a large number of gauges allows for new investigations related to the analysis of flow computations and to the optimization of model parameters thereby bridging the gap between continental-scale environmental modeling and local-scale planning and decision making. The quality of NLDAS2 runoff relative to locally-calibrated data is assessed through comparison between computed and observed river flow. With the exception of large outliers at a few gauges, the best NLDAS2 runoff products perform similarly to the regional dataset Such outliers prevent the successful optimization of river model parameters but a careful selection of what stations to use for optimization is shown to overcome this difficulty. While river model parameters determined separately for each runoff dataset allow obtaining best results, a single set of parameters is sufficient to assess the relative quality of runoff datasets. The detailed NHDPlus description of river reaches also allows investigating the impact of increased spatial variability in model parameters which following optimization of model computations suggests that those parameters of reaches located on the main stems of large rivers tend to have the largest influence on the quality of flow simulations. Published by Elsevier Ltd.Show less"
48,"Manning, A",Jul 2020 ,Riparian vegetation as an indicator of stream channel presence and connectivity in arid environments,JOURNAL OF ARID ENVIRONMENTS,"Stream channels in the American Southwest are misunderstood because they have been understudied and overgeneralized. This misunderstanding has serious consequences for environmental policy, particularly in defining the scope of jurisdiction under the Clean Water Act. While the current status of regulations defining the scope of jurisdictional waters is in flux, the currently-codified regulations require that jurisdictional tributaries must have a physical, chemical, or biological connection to downstream traditional navigable waters. The lack of consistent flow in arid stream channels causes misinterpretations of physio-chemical indicators that are commonly used in perennial streams of humid environments. Here we overview the use of riparian vegetation as a biological indicator of stream channel presence and connectivity in arid environments. Based on a thorough literature review and synthesis of arid region studies, we found key spatiotemporal patterns of arid riparian vegetation that could potentially be used to determine hydrologic connectivity. Much of the vegetation along arid stream channels is well-adapted to water scarcity and varies in response to differences in geomorphology, hydrology, and land use across multiple scales. Riparian vegetation in arid environments ranges from hydroriparian to xeroriparian and can include, or be made up exclusively, of upland species. Regardless of species type, plants near stream channels tend to be denser and larger than upland plants. Access to reliable water results in denser, larger plants and more water-dependent species. To demonstrate the potential of riparian vegetation as an indicator of connectivity, we conclude with a case study of Little Sycamore Wash in northern Arizona. We used the Normalized Difference Vegetation Index to (1) distinguish between riparian and upland vegetation, and (2) assess connectivity of patches of riparian vegetation. By understanding the spatiotemporal variability of riparian vegetation along arid stream channels, we can make better decisions on their regulation and management.Show less"
49,"Li, LL",9th International Conference on Hydrodynamics (ICHD-2010),Hydrodynamics of coupled river-lake system,,
