,First author,Year,Title,Journal,Abstract
42,"Ruhala, SS",Jan 2018 ,"Exploring dissolved organic carbon cycling at the stream-groundwater interface across a third-order, lowland stream network",BIOGEOCHEMISTRY,"The stream-groundwater interface (SGI) is thought to be an important location within stream networks for dissolved organic carbon (DOC) processing (e.g., degradation, removal), since it is considered a hotspot for microbial activity and biogeochemical reactions. This research is one of the first attempts to collect and assess DOC conditions at the SGI across a stream network-an entire third-order, lowland watershed in Michigan, USA. We present an initial exploration of this unique data set and highlight some of the challenges when working at these scales. Overall, our results show that SGI DOC conditions are complex at the network scale and do not conform to predictions based upon previous point- and small-scale studies. We found no strong pattern of DOC removal within the SGI at the network scale even after using chloride and temperature as natural tracers to differentiate between hydrological processes and biogeochemical reactions influencing DOC cycling. Instead, trends in DOC quantity and molecular qualities suggest that potential biotic reactions, including aerobic microbial respiration, had an influence on DOC concentrations at only some of the sites, while physical mixing of ground and stream surface waters appears to explain the majority of the observed changes in DOC concentrations at other sites. In addition, results show that neither SGI sites indicating DOC removal nor DOC molecular quality shifts measured correlated with stream order. It did reveal that DOC variability across surface water, groundwater, and the SGI locations was consistently greatest in the shallow sediments of the SGI, demonstrating that the SGI is a systematically distinct location for DOC conditions in the watershed. Our empirical stream network-scale SGI data are some of the first that are compatible with recently developed process-based, network-scale, SGI models. Our results indicate that these process-based models may not accurately represent SGI exchange of lowland, groundwater discharge-dominated streams like the one in this study. Lastly, this study shows that new methods are needed to achieve the goal of making and linking SGI observations to network-scale biogeochemical processes and theory. To help develop these methods we provide a discussion of the approach we used (i.e., ""lessons-learned"") that might become the basis for systematic data analysis of SGI porewaters in future, network-wide biogeochemical studies of the SGI.Show less"
43,"Liu, JK",Dec 1 2019 ,Capturing hydrological connectivity structure of wetlands with indices based on graph theory: A case study in Yellow River Delta,JOURNAL OF CLEANER PRODUCTION,"Coastal wetlands, greatly influenced by hydrological processes, are highly productive ecosystems but have suffered serious degradation in many locations. Hydrological connectivity frameworks provide a new perspective to study both hydrological behavior and the relationship between hydrological and ecological processes. Although some indices have been developed to parameterize hydrological connectivity structure (HCS) in different environments, the indices only consider soil water content (SWC) or topography and are limited in some specific areas. Due to its importance to understand ecological-hydrological interaction and wetland conservation and restoration. There is still a necessity to develop indices to capture hydrological attributes. In the current study, we collected soil-hydrological data in the Yellow River Delta and three indices, main flow direction (TM) based on topography, over field capacity index (OFCI) based on SWC, and topographic over field capacity index (TOFCI) based on both topography and SWC are developed using graph theory. The results show OFCI in a semi-artificial pond is significantly higher than in intertidal flats, tidal marshes and riverside wetlands, and TOFCI values in four wetland types differ significantly. TM does not show statistical differences for wetland types explored. According to the parameterized values, the semi-artificial pond has the strongest HCS, followed by intertidal flats. Tidal marshes and riverside wetlands have the weakest HCS. The landscapes of different wetland types are related to the HCS on the surface soil layer, and four wetland types in the Yellow River Delta can be distinguished by TOFCI values. The results also indicate that TOFCI can be used to locate degraded wetland areas for restoration, however more specific relationships between HCS indices and ecological structure are desirable in the future. (C) 2019 Elsevier Ltd. All rights reserved.Show less"
44,"Anderson, KE",Aug 2006 ,Instream flow needs in streams and rivers: the importance of understanding ecological dynamics,FRONTIERS IN ECOLOGY AND THE ENVIRONMENT,"Resource managers have traditionally had to rely on simple hydrological and habitat-association methods to predict how changes in river flow regimes will affect the viability of instream populations and communities. Yet these systems are characterized by dynamic feedbacks among system components, a high degree of spatial and temporal variability, and connectivity between habitats, none of which can be adequately captured in the commonly employed management methods. We argue that process-oriented ecological models, which consider dynamics across scales and levels of biological organization, are better suited to guide flow regime management. We review how ecological dynamics in streams and rivers are shaped by a combination of the flow regime and internal feedbacks, and proceed to describe ecological modeling tools that have the potential to characterize such dynamics. We conclude with a suggested research agenda to facilitate the inclusion of ecological dynamics into instream flow needs assessments.Show less"
45,"McKnight, DM",Aug 2015 ,Potential for real-time understanding of coupled hydrologic and biogeochemical processes in stream ecosystems: Future integration of telemetered data with process models for glacial meltwater streams,WATER RESOURCES RESEARCH,"While continuous monitoring of streamflow and temperature has been common for some time, there is great potential to expand continuous monitoring to include water quality parameters such as nutrients, turbidity, oxygen, and dissolved organic material. In many systems, distinguishing between watershed and stream ecosystem controls can be challenging. The usefulness of such monitoring can be enhanced by the application of quantitative models to interpret observed patterns in real time. Examples are discussed primarily from the glacial meltwater streams of the McMurdo Dry Valleys, Antarctica. Although the Dry Valley landscape is barren of plants, many streams harbor thriving cyanobacterial mats. Whereas a daily cycle of streamflow is controlled by the surface energy balance on the glaciers and the temporal pattern of solar exposure, the daily signal for biogeochemical processes controlling water quality is generated along the stream. These features result in an excellent outdoor laboratory for investigating fundamental ecosystem process and the development and validation of process-based models. As part of the McMurdo Dry Valleys Long-Term Ecological Research project, we have conducted field experiments and developed coupled biogeochemical transport models for the role of hyporheic exchange in controlling weathering reactions, microbial nitrogen cycling, and stream temperature regulation. We have adapted modeling approaches from sediment transport to understand mobilization of stream biomass with increasing flows. These models help to elucidate the role of in-stream processes in systems where watershed processes also contribute to observed patterns, and may serve as a test case for applying real-time stream ecosystem models.Show less"
46,"Brunke, M",Dec 2003 ,Patchiness of river-groundwater interactions within two floodplain landscapes and diversity of aquatic invertebrate communities,ECOSYSTEMS,"In fluvial systems, the interactions between rivers and groundwater significantly affect various ecological structures (for example, riparian vegetation) and functions. To examine the effects of hydrological exchange between groundwater and surface water on the distribution of aquatic invertebrates within a riverine landscape, we investigated the main stem, tributaries, and various surface and subsurface waters of two floodplains of a southern Alpine river (Brenno, Switzerland) in terms of their physicochemical, hydraulic, substratum, and faunal characteristics. The origins of the water were investigated by analyzing geomorphic settings and physicochemical variables. The two floodplains had different hydrological regimes. The middle floodplain was dominated by lateral inputs and exfiltration of hillslope groundwater from two different subcatchments. Bank filtration of river water sustained subsurface water only close to the channel. The aquatic habitats of the middle floodplain formed a rather homogeneous group with high taxon richness and intrahabitat diversities. These aquatic habitats resembled mountain springbrooks in their physicochemical characteristics and faunal compositions. In the lower floodplain, the exchange between river water and groundwater was more extensive. The aquatic floodplain habitats of the lower floodplain were fed mainly by deep and shallow alluvial groundwater, hyporheic exfiltration, and partly by surface water. In contrast to aquatic habitats of the middle floodplain, habitats of the lower floodplain showed a low intrahabitat and a high interhabitat diversity in terms of both substrate characteristics and faunal compositions. For both floodplains, ordination analyses showed a high concordance between the structure of the invertebrate community and the characteristics of the environmental habitat, including chemical, geomorphic, and hydraulic variables. Ordinations grouped aquatic habitats according to the origins of the waters. Taxon richness was related to local structural diversity, but species turnover was related to differential vertical and lateral connectivity. Exfiltration of groundwaters provided aquatic floodplain habitats for several specialized species. The results of this study show the significance of the river-groundwater connectivity for the creation of the habitat mosaic that sustains biodiversity in floodplains and thus have important implications for managing the ecological integrity of floodplains.Show less"
47,"Thomas, DA",Jun 2006 ,A comparison of fish community composition of headwater and adventitious streams in a coldwater river system,JOURNAL OF FRESHWATER ECOLOGY,"The river continuum concept is an overarching paradigm in stream ecology, but the concept makes no provision for adventitious streams (i.e., low-ordered tributaries to larger rivers). We examined the fish community and habitat of the fifth-order mainstem, two second-order adventitious tributaries to the mainstem, and three second-order headwater streams of the Pine River (Alcona County, Michigan) from May through August 2000. Fish species richness generally increased with increasing stream order and was higher in the adventitious streams than in the headwater streams. The fish species composition of adventitious streams was more similar to the mainstem than to the headwater streams but showed greater month-to-month variability than either the mainstem or headwater streams. Habitat conditions in headwater and adventitious streams were similar except adventitious streams were generally warmer. These results indicate that factors in addition to stream order, such as stream connectivity and temperature, are important determinants of stream fish assemblage.Show less"
48,"Duraes, L",Aug 24 2016 ,Simulating the role of connectivity in shaping stream insect metacommunities under colonization cycle dynamics,ECOLOGICAL MODELLING,"We simulated metacommunities in a hypothetical riverine network to investigate whether and how connectivity affects the species richness of groups with different dispersal abilities under different niche and dispersal-assembly rules. The simulated network was represented by a graph in which the nodes represented habitat patches, each with a particular environmental condition. We built our model based on Muller's ""colonization cycle"" hypothesis, in which adult aquatic insects compensate for the gradual downstream movement of larvae by flying preferentially upstream to oviposition. Species occurrence in each patch was probabilistically determined, taking into account environmental filtering and/or dispersal ability in different assembly scenarios. Variation in local species richness was explained by connectivity in both assembly scenarios, especially when dispersal ability was weak. In niche assembly metacommunities, the effect of connectivity was also dependent on the location of preferable patches. In general, local species richness was higher when dispersal ability was strong. Our findings suggest that the role of connectivity in shaping riverine metacommunities is context dependent and that the spatial structure of riverine networks should be considered in monitoring freshwater biota. (C) 2016 Elsevier B.V. All rights reserved.Show less"
49,"Alexander, RB",Feb 2007 ,The role of headwater streams in downstream water quality,JOURNAL OF THE AMERICAN WATER RESOURCES ASSOCIATION,"Knowledge of headwater influences on the water-quality and flow conditions of downstream waters is essential to water-resource management at all governmental levels; this includes recent court decisions on the jurisdiction of the Federal Clean Water Act (CWA) over upland areas that contribute to larger downstream water bodies. We review current watershed research and use a water-quality model to investigate headwater influences on downstream receiving waters. Our evaluations demonstrate the intrinsic connections of headwaters to landscape processes and downstream waters through their influence on the supply, transport, and fate of water and solutes in watersheds. Hydrological processes in headwater catchments control the recharge of subsurface water stores, flow paths, and residence times of water throughout landscapes. The dynamic coupling of hydrological and biogeochemical. processes in upland streams further controls the chemical form, timing, and longitudinal distances of solute transport to downstream waters. We apply the spatially explicit, mass-balance watershed model SPARROW to consider transport and transformations of water and nutrients throughout stream networks in the northeastern United States. We simulate fluxes of nitrogen, a primary nutrient that is a water-quality concern for acidification of streams and lakes and eutrophication of coastal waters, and refine the model structure to include literature observations of nitrogen removal in streams and lakes. We quantify nitrogen transport from headwaters to downstream navigable waters, where headwaters are defined within the model as first-order, perennial streams that include flow and nitrogen contributions from smaller, intermittent and ephemeral streams. We find that first-order headwaters contribute approximately 70% of the mean-annual water volume and 65% of the nitrogen flux in second-order streams. Their contributions to mean water volume and nitrogen flux decline only marginally to about 55% and 40% in fourth- and higher-order rivers that include navigable waters and their tributaries. These results underscore the profound influence that headwater areas have on shaping downstream water quantity and water quality. The results have relevance to water-resource management and regulatory decisions and potentially broaden understanding of the spatial extent of Federal CWA jurisdiction in U.S. waters.Show less"
