,First author,Year,Title,Journal,Abstract
44,"Maheswaran, R",Jul 11 2012 ,Wavelet-Volterra coupled model for monthly stream flow forecasting,JOURNAL OF HYDROLOGY,"Natural stream flow dynamics is an outcome of complex nonlinear and multiscale phenomena, integrated together in some coherent manner and this paper is an attempt to model them by combining wavelet decomposition with Volterra models. This paper describes a methodology that yields a 1 month ahead forecast of stream flow using wavelets based multiscale nonlinear models. The method uses the multi resolution decomposition capability of wavelets to obtain corresponding scale specific features of the underlying generating system and the reconstruction of the given time series is accomplished by linking together the derived decompositions using second order Volterra kernels which are estimated in an online mode using the well known Kalman filter formulation. The model has been applied to two case studies from Cauvery River Basin, India. Results also indicate presence of discernable nonlinear characteristics in the stream flow data as evidenced by the results of the BDS non-linearity test. The proposed model performed well for both the stations when compared to the Wavelet based Linear models, the linear regression models and other nonlinear approaches such as the coupled Wavelets-Artificial Neural Networks based models. (c) 2012 Elsevier B.V. All rights reserved.Show less"
45,"Farkas-Ivanyi, K",Aug 2015 ,"THE INFLUENCE OF THE RIVER REGULATIONS ON THE AQUATIC HABITATS IN RIVER DANUBE, AT THE BODAK BRANCH-SYSTEM, HUNGARY AND SLOVAKIA",CARPATHIAN JOURNAL OF EARTH AND ENVIRONMENTAL SCIENCES,"Human influences increasingly modify the fluvial dynamics while the value of the clear drinking water worldwide increases. Water demand escalates as the population grows and as the engineering technology evolves. However the near-river inhabitants perceives the less sustainable water management concepts, from extreme floods through decrease of river recreation sites and termination of oxbow-lakes, the near-natural dynamics of the river has been forgotten. The aim of our study was to explore the near-natural river dynamics comparing with the current conditions and to examine its sustainability. The river landscape system in near-natural circumstances was highly related to the predictable fluvial disturbances, which sustained both the lateral and the vertical connectivity of the river branch system. During floods the main channel was able to refresh the habitats of the side-arms and the backwaters. The ebb and flow of the river was unhindered through channels, which were established to lead away the floods rolling back the level of it, and to collect the residual waters of the ebb. River regulation of the late 19th century and the construction of the Slovakian hydropower dam system in the late 20th century extremely changed the physical framework conditions of the upper part of the Danube in Hungary. The study analyses the effect of human impacts on the aquatic habitats, through the spatiotemporal changes of the aquatic habitats. It was hypothesized, that based on historical maps we can make difference between the natural and human induced river dynamics patterns which can help to project the potential effects of the river renaturalization and the construction of water reservoirs on aquatic habitats.Show less"
46,"Preetha, PP",Jul 2021 ,Quantifying Surface Water and Ground Water Interactions using a Coupled SWAT_FEM Model: Implications of Management Practices on Hydrological Processes in Irrigated River Basins,WATER RESOURCES MANAGEMENT,"This study coupled the Soil and Water Assessment Tool (SWAT) with a ground water finite element model (FEM) with the enhancements of multiple interface conversions and management practices. The coupled model, SWAT_FEM was applied to assess the hydrology of the Chennai River basin in India, a coastal zone with significant irrigation. The SWAT_FEM enhanced the predictions of stream flows and ground water levels (R-2:0.69,0.81; Nash Sutcliffe Efficiency (NSE):0.64,0.74) compared to the standalone model, SWAT (R-2:0.64,0.66; NSE:0.60,0.63) respectively. The coupled model produced an all-inclusive representation of the impacts of management practices on the hydrological processes and generated insights into the spatiotemporal patterns of the surface water and ground water interactions in the study area. The results showed that the interactions of surface water and ground water were significant in the mainstream of Chennai River basin. The seasonal ground water levels obtained with the SWAT_FEM model reinforced the increases in exorbitant ground water abstraction rates (9%-44%) with the introduction of management practices including reservoirs, pond irrigation, and agricultural water use. The results emphasized that if the ground water demand continued to increase, accelerated and unregulated ground water extraction is bound to happen shortly to suffice the water use, which can bring about environmental problems to this basin. Overall, this study demonstrated the applicability of the SWAT_FEM model and its value to the water resources management in irrigated areas with management practices. The developed model can be utilized in water resources assessment tools for effective predictions of ground water contributions in river basins.Show less"
47,"Zhang, SQ",2nd International Yellow River Forum,"Successful Experiment on the ""Secondary Suspended River"" Training of the Lower Yellow River",,
48,"Barrie, CJ",Apr 2022 ,"Steady vs dynamic stream-aquifer interactions: Lower Flint River Basin, Southwest Georgia, USA",JOURNAL OF HYDROLOGY-REGIONAL STUDIES,"Study region: The Lower Flint River Basin (LFRB): a karst catchment in southwestern Georgia, USA. Study focus: A year-long field campaign from July 2018 to July 2019 measured steady and dynamic stream-aquifer exchanges on Ichawaynochaway Creek (INC), a fifth-order tributary to the karstic Flint River in Georgia. The net change in discharge along a 24-km Creek segment was determined between two US Geological Survey gaging stations with no surface-water inflows. Stream-aquifer interactions were measured along a 120-m piezometer transect perpendicular to the bank. Hydraulic parameters to aid future modeling efforts were estimated using the method of moments applied to changes in bank flow direction from Hurricane Michael. New hydrological insights for the region: Results display the effects of local water use on streamflow as most channel storage gains occurred in the fall and winter. Negligible net channel gains and some losses occurred during the spring and summer months. Approximately 150 million m3 of net channel gains were observed during the study period. Initial stormflow contributed to aquifer recharge as indicated by reversals in the hydraulic gradient. Diffusivity and transmissivity increased along the transect (9-420 m(2)/d) and (3-150 m(2)/d), respectively, and hydraulic conductivity equaled 2.85 m/d. Stream-reach orientation with respect to regional groundwater gradients explains increased stream-aquifer interactions. Surface-groundwater interactions in karst systems are better understood after characterizing variation of hydraulic processes.Show less"
49,"Phillips, RW",Joint Meeting of the Canadian-Geophysical-Union/Canadian-Meteorology-and-Oceanographic-Society,Connectivity and runoff dynamics in heterogeneous basins,HYDROLOGICAL PROCESSES,
