,First author,Year,Title,Journal,Abstract
0,"Zimmer, MA",Mar 2018 ,"Lateral, Vertical, and Longitudinal Source Area Connectivity Drive Runoff and Carbon Export Across Watershed Scales",WATER RESOURCES RESEARCH,"Watersheds are three-dimensional hydrologic systems where the longitudinal expansion/contraction of stream networks, vertical connection/disconnection between shallow and deep groundwater systems, and lateral connectivity of these water sources to streams mediate runoff production and nutrient export. The connectivity of runoff source areas during both baseflow and stormflow conditions and their combined influence on biogeochemical fluxes remain poorly understood. Here we focused on a set of 3.3 and 48.4 ha nested watersheds (North Carolina, USA). These watersheds comprise ephemeral and intermittent runoff-producing headwaters and perennial runoff-producing lowlands. Within these landscape elements, we characterized the timing and magnitude of precipitation, runoff, and runoff-generating flow paths. The active surface drainage network (ASDN) reflected connectivity to, and contributions from, source areas that differed under baseflow and stormflow conditions. The baseflow-associated ASDN expanded and contracted seasonally, driven by the rise and fall of the seasonal water table. Superimposed on this were event-activated source area contributions driven by connectivity to surficial and shallow subsurface flow paths. Frequently activated shallow flow paths also caused increased in-stream dissolved organic carbon (DOC) concentrations with increases in runoff across both watershed scales. The spread and variability within this DOC-runoff relationship was driven by a seasonal depletion of DOC from continual shallow subsurface flow path activation and subsequent replenishment from autumn litterfall. Our findings suggest that hydrobiogeochemical signals at larger watershed outlets can be driven by the expansion, contraction, and connection of lateral, longitudinal, and vertical source areas with distinct runoff generation processes.Show less"
1,"Teitelbaum, Y",Feb 28 2022 ,A Novel Framework for Simulating Particle Deposition With Moving Bedforms,GEOPHYSICAL RESEARCH LETTERS,"Previous modeling studies of hyporheic exchange induced by moving bedforms have used a moving reference frame, typically corresponding to an individual moving bedform. However, this approach is not suitable for simulating the exchange and accumulation of immobile fine particles beneath moving bedforms, which commonly occurs in sand-bed streams, as both moving and stationary features must be considered. Here we present a novel simulation framework that may represent arbitrarily shaped, generally aperiodic mobile bedforms within a stationary reference frame. We combine this approach with particle tracking to successfully reproduce observations of clay deposition in sand beds, and the resulting development of a low-conductivity layer near the scour zone. We find that increased bedform celerity and filtration both lead to a shallower depth of clay deposition and a more compact deposition layer. While increased filtration causes more clay to deposit, increased celerity reduces deposition by flattening hyporheic exchange flowpaths.Show less"
2,"Jarvie, HP",Dec 4 2018 ,Coupling High-Frequency Stream Metabolism and Nutrient Monitoring to Explore Biogeochemical Controls on Downstream Nitrate Delivery,ENVIRONMENTAL SCIENCE & TECHNOLOGY,"Instream biogeochemical process measurements are often short-term and localized. Here we use in situ sensors to quantify the net effects of biogeochemical processes on seasonal patterns in baseflow nitrate retention at the river-reach scale. Dual-station high-frequency in situ nitrate measurements, were coupled with high-frequency measurements of stream metabolism and dissolved inorganic carbon, in a tributary of the Buffalo National River, Arkansas. Nitrate assimilation was calculated from net primary production, and combined with mass-balance measurements, to estimate net nitrification and denitrification. The combined net effects of these instream processes (assimilation, denitrification, and nitrification) removed >30-90% of the baseflow nitrate load along a 6.5 km reach. Assimilation of nitrate by photoautotrophs during spring and early summer was buffered by net nitrification. Net nitrification peaked during the spring. After midsummer, there was a pronounced switch from assimilatory nitrate uptake to denitrification. There was clear synchronicity between the switch from nitrate assimilation to denitrification, a reduction in river baseflows, and a shift in stream metabolism from autotrophy to heterotrophy. The results show how instream nitrate retention and downstream delivery is driven by seasonal shifts in metabolic pathways; and how continuous in situ stream sensor networks offer new opportunities for quantifying the role of stream biota in the dynamics, fate, and transport of nitrogen in fluvial systems.Show less"
3,"Li, NJ",International Symposium on Project Management,Shaw River Hydropower Station CDM Development and Creating National Carbon Exchanges Study,,
4,"Dodds, PS",Jan 2001 ,Geometry of river networks. III. Characterization of component connectivity,PHYSICAL REVIEW E,"Essential to understanding the overall structure of river networks is a knowledge of their detailed architecture. Here we explore the presence of randomness in river network structure and the details of its consequences. We first show that an averaged view of network architecture is provided by a proposed self-similarity statement about the scaling of drainage density, a local measure of stream concentration. This scaling of drainage density is shown to imply Tokunaga's law, a description of the scaling of side branch abundance along a given stream, as well as a scaling law for stream lengths. We then consider fluctuations in drainage density and consequently the numbers of side branches. Data are analyzed for the Mississippi River basin and a model of random directed networks. Numbers of side streams are found to follow exponential distributions, as are intertributary distances along streams. Finally, we derive a joint variation of side stream abundance with stream length, affording a full description of fluctuations in network structure. Fluctuations in side stream numbers are shown to be a direct result of fluctuations in stream lengths. This is the last paper in a series of three on the geometry of river networks.Show less"
5,"Garcea, FE",Jul 2018 ,Task- and domain-specific modulation of functional connectivity in the ventral and dorsal object-processing pathways,BRAIN STRUCTURE & FUNCTION,"A whole-brain network of regions collectively supports the ability to recognize and use objects-the Tool Processing Network. Little is known about how functional interactions within the Tool Processing Network are modulated in a task-dependent manner. We designed an fMRI experiment in which participants were required to either generate object pantomimes or to carry out a picture matching task over the same images of tools, while holding all aspects of stimulus presentation constant across the tasks. The Tool Processing Network was defined with an independent functional localizer, and functional connectivity within the network was measured during the pantomime and picture matching tasks. Relative to tool picture matching, tool pantomiming led to an increase in functional connectivity between ventral stream regions and left parietal and frontal-motor areas; in contrast, the matching task was associated with an increase in functional connectivity among regions in ventral temporo-occipital cortex, and between ventral temporal regions and the left inferior parietal lobule. Graph-theory analyses over the functional connectivity data indicated that the left premotor cortex and left lateral occipital complex were hub-like (exhibited high betweenness centrality) during tool pantomiming, while ventral stream regions (left medial fusiform gyrus and left posterior middle temporal gyrus) were hub-like during the picture matching task. These results demonstrate task-specific modulation of functional interactions among a common set of regions, and indicate dynamic coupling of anatomically remote regions in task-dependent manner.Show less"
6,"Spurgeon, JJ",Sep 2018 ,Spatial structure of large-river fish populations across main-stem and tributary habitats,RIVER RESEARCH AND APPLICATIONS,"The spatial variability in demographic parameters represents fundamental information for conservation and management of large-river fish populations. We assessed demographic processes including survival and movement across macroscale habitats in a large-river network using 2 candidate large-river species with contrasting life history strategies. We used mark-recapture data and a multistate model framework to estimate survival and transition probabilities between main-stem and tributary habitats for both channel catfish and shovelnose sturgeon. Annual survival for channel catfish was similar in main-stem and tributary habitats (range in S=0.47-0.58). Annual survival for shovelnose sturgeon was less in the tributary (S=0.68) compared with the main stem (S=0.83). The probability of movement among macroscale habitats differed between species. However, the greatest probability of movement occurred from the tributary to the main-stem for both channel catfish (=0.42) and shovelnose sturgeon (=0.27). Movement between main-stem and tributary rivers may be a prominent characteristic for both channel catfish and shovelnose sturgeon and could influence population demographic rates and abundance across systems. Riverine fish populations are likely structured across multiple salient scalesincluding tributary and main-stem habitats. Consideration of connectivity across tributary and main-stem habitats with respect to species' life history strategy and life stage may better integrate a systems' perspective for conservation and management of large-river fish populations.Show less"
7,"Tsartsali, EE",Jun 2022 ,Impact of resolution on the atmosphere-ocean coupling along the Gulf Stream in global high resolution models,CLIMATE DYNAMICS,"We have investigated the horizontal resolution dependence of the ocean-atmosphere coupling along the Gulf Stream, of simulations made by six Global Climate Models according to the HighResMIP protocol, and compared it with reanalysis and remote sensing observations. Two ocean-atmosphere interaction mechanisms are explored in detail: The Vertical Mixing Mechanism (VMM) associated with the intensification of downward momentum transfer, and the Pressure Adjustment Mechanism (PAM) associated with secondary circulations driven by pressure gradients. Both VMM and PAM are found to be active even in the eddy-parameterized models. However, increasing ocean and/or atmosphere resolution leads to enhanced ocean-atmosphere coupling and improved agreement with reanalysis and observations. Our results indicate that while one part of the stronger air-sea coupling is attributable to the refinement of the oceanic component to eddy-permitting, optimal results are obtained only by further increase of the atmosphere resolution too. The use of the eddy-resolving model show weaker or same coupling strength over the eddy-permitting resolution. We conclude that at least eddy-permiting ocean resolution and comparable atmosphere resolution are required for a reliable ocean-atmosphere coupling along the Gulf Stream.Show less"
8,"van de Wolfshaar, KE",Sep 2011 ,"Linking Flow Regime, Floodplain Lake Connectivity and Fish Catch in a Large River-Floodplain System, the Volga-Akhtuba Floodplain (Russian Federation)",ECOSYSTEMS,"River-floodplain systems are amongst the most productive-but often severely impacted-aquatic systems worldwide. We explored the ecological response of fish to flow regime in a large river-floodplain system by studying the relationships between (1) discharge and inundated floodplain area, with a focus on spatial and temporal patterns in floodplain lake connectivity, and (2) flood volume and fisheries catch. Our results demonstrate a non-linear relationship between discharge and floodplain inundation with considerable hysteresis due to differences in inundation and drainage rate. Inundation extent was mostly determined by flood volume, not peak discharge. We found that the more isolated lakes (that is, lakes with a shorter connection duration to the river) are located at higher local elevation and at larger hydrological distance from the main rivers: geographical distance to the river appears a poor predictor of lake isolation. Although year-to-year fish catches in the floodplain were significantly larger with larger flood volumes in the floodplain, they were not in the main river, suggesting that mechanisms that increase catch, such as increased floodplain access or increased somatic growth, are stimulated by flooding in the floodplain, but not in the river. Fish species that profit from flooding belong to different feeding guilds, suggesting that all trophic levels may benefit from flooding. We found indications that the ecological functioning of floodplains is not limited to its temporary availability as habitat. Refugia can be present within the floodplain itself, which should be considered in the management of large rivers and their floodplain.Show less"
9,"Joo, H",Apr 2021 ,Stream gauge network grouping analysis using community detection,STOCHASTIC ENVIRONMENTAL RESEARCH AND RISK ASSESSMENT,"Stream gauging stations are important in hydrology and water science for obtaining water-related information, such as stage and discharge. However, for efficient operation and management, a more accurate grouping method is needed, which should be based on the interrelationships between stream gauging stations. This study presents a grouping method that employs community detection based on complex networks. The proposed grouping method was compared with the cluster analysis approach, which is based on statistics, to verify its adaptability. To achieve this goal, 39 stream gauging stations in the Yeongsan River basin of South Korea were investigated. The numbers of groups (clusters) in the study were two, four, six, and eight, which were determined to be suitable by fusion coefficient analysis. Ward's method was employed for cluster analysis, and multilevel modularity optimization was applied for community detection. A higher level of cohesion between stream gauging stations was observed in the community detection method at the basin scale and the stream link scale within the basin than in the cluster analysis. This suggests that community detection is more effective than cluster analysis in terms of hydrologic similarity, persistence, and connectivity. As such, these findings could be applied to grouping methods for efficient operation and maintenance of stream gauging stations.Show less"
10,"Malcolm, IA",Nov 2005 ,Catchment-scale controls on groundwater-surface water interactions in the hyporheic zone: Implications for salmon embryo survival,RIVER RESEARCH AND APPLICATIONS,"The spatial and temporal variability of groundwater-surface water (GW-SW) interactions in the hyporheic zone were investigated in a semi-pristine upland salmon spawning catchment (Girnock Burn) in the Cairngorm Mountains, northeast Scotland. Stream and hyporheic water quality (200-300 mm depth) were monitored fortnightly at 16 spawning locations distributed throughout the catchment. Hydrochemical tracers were used to assess local GW-SW interactions. Stratified streambed incubators (50-300 mm) provided information on salmon embryo mortality at a sub-set of ten locations. Hyporheic water quality varied both temporally and spatially according to local GW-SW interactions. It was possible to categorize sites into three broad typologies reflecting local stream-aquifer interactions: (1) groundwater-dominated; (2) surface water-dominated; and (3) sites exhibiting transient water table features. Groundwater upwelling occurred in areas where low permeability glacial moraine features caused substantive valley constriction. These locations were also conducive to accumulation of spawning grade gravels and consequently were utilized heavily by spawning salmon. Long residence groundwater was typically characterized by low dissolved oxygen (DO), of sufficiently low quality to be detrimental to salmon embryo survival. At sites dominated by surface water, hyporheic DO remained high throughout and rates of embryo survival were correspondingly high. Survival rates were also high at sites where hydrochemical characteristics indicated a transient water table. This is probably attributable to the hydrological conditions which resulted in increasing DO concentrations towards hatch time when embryo oxygen demand is at its maximum. The degree to which the findings of this study are directly applicable to other catchments is currently unknown. However, similar effects have been observed elsewhere, and based on the information presented here, there are clear implications for fisheries managers who may wish to consider the use of surface incubation facilities to negate the effects of low DO groundwater upwelling where it dominates available spawning habitat. It is suggested that future research should aim to integrate across spatial scales and disciplines to obtain a better understanding of the ways in which hillslope and riparian zone hydrology affect GW-SW interactions, hyporheic zone processes and stream ecology. (c) Crown copyright 2005. Reproduced with the permission of Her Majesty's Stationery Office. Published by John Wiley & Sons, Ltd.Show less"
11,"Bertoldi, W",4th European-Center-for-River-Restoration Conference,"UNDERSTANDING REFERENCE PROCESSES: LINKAGES BETWEEN RIVER FLOWS, SEDIMENT DYNAMICS AND VEGETATED LANDFORMS ALONG THE TAGLIAMENTO RIVER, ITALY",RIVER RESEARCH AND APPLICATIONS,
12,"Descloux, S",Oct 2013 ,Benthic and hyporheic invertebrate assemblages along a gradient of increasing streambed colmation by fine sediment,AQUATIC SCIENCES,"Streambed colmation by fine sediment, e.g. the deposition, accumulation and storage of fines in the substrate, is a major environmental concern throughout the world. Nevertheless, the ecological effects of streambed colmation on both benthic and hyporheic invertebrate assemblages have rarely been considered simultaneously. We studied a continuum of a naturally increasing percentage of fine sediment in three temperate rivers and hypothesized that the increasing percentage of fine sediment would decrease both benthic and hyporheic invertebrate densities and diversities, and reduce the similarities between them. To test these hypotheses, we first compared heavily, moderately and lightly clogged reaches located in downwelling areas and sampled invertebrates in the benthic zone and at 3 different depths (10, 30 and 50 cm) in the hyporheic zone. Secondly, we modified the sediment grain size distribution experimentally by increasing the percentage of fine sediment and using artificial substrates. The increasing colmation halved the hyporheic taxonomic richness and reduced benthic and hyporheic densities to a third. Some taxa were found in both zones, mainly in high colmation (e.g. Baetidae) or low colmation contexts (e.g. Orthocladiinae, Cyclopoida and Harpacticoida). The dissimilarity between benthic and hyporheic fauna (only at -50 cm) was significantly higher in heavily clogged reaches than in moderately and lightly clogged ones, suggesting reduced vertical exchange of invertebrates or differential impacts between zones. The total abundance, taxonomic richness, percentage of EPT taxa and densities of most organisms observed using the artificial substrates decreased linearly with the increasing percentage of fine sediment in the experiment. Only the Ephemeroptera Caenis spp. and Heptageniidae disappeared above 30 and 50 % of fine sediment, respectively, suggesting that the response to increasing colmation are strongly taxon-specific. High amount of fine sediments within the substrate significantly decreased habitat quality for benthic and hyporheic invertebrates and thus limit the production of streams and their capacity to recover after disturbance. Moreover, the use of hyporheic invertebrates seems more relevant than benthic invertebrates to assess the effect of colmation and thus could be tested in future research as indicators.Show less"
13,"Tsai, CH",Jul 2022 ,Transient Storage Model Parameter Optimization Using the Simulated Annealing Method,WATER RESOURCES RESEARCH,"Hyporheic exchange in streams is critical to ecosystem functions such as nutrient cycling along river corridors, especially for slowly moving or small stream systems. The transient storage model (TSM) has been widely used for modeling of hyporheic exchange. TSM calibration, for hyporheic exchange, is typically used to estimate four parameters, including the mass exchange rate coefficient, the dispersion coefficient, stream cross-sectional area, and hyporheic zone cross-sectional area. Prior studies have raised concerns regarding the non-uniqueness of the inverse problem for the TSM, that is, the occurrence of different parameter vectors resulting in TSM solution that reproduces the observed in-stream tracer break through curve (BTC) with the same error. This leads to practical non-identifiability in determining the unknown parameter vector values even when global-optimal values exist, and the parameter optimization becomes practically non-unique. To address this problem, we applied the simulated annealing method to calibrate the TSM to BTCs, because it is less susceptible to local minima-induced non-identifiability. A hypothetical (or synthetic) tracer test data set with known parameters was developed to demonstrate the capability of the simulated annealing method to find the global minimum parameter vector, and it identified the ""hypothetically-true"" global minimum parameter vector even with input data that were modified with up to 10% noise without increasing the number of iterations required for convergence. The simulated annealing TSM was then calibrated using two in-stream tracer tests conducted in East Fork Poplar Creek, Tennessee. Simulated annealing was determined to be appropriate for quantifying the TSM parameter vector because of its search capability for the global minimum parameter vector.Show less"
14,"Lisuzzo, NJ",2008 ,"Hydrologic controls on nitrogen availability in a high-latitude, semi-arid floodplain",ECOSCIENCE,"Past research shows a discrepancy between apparent nitrogen supply and the annual growth requirements for early successional plant Communities along the Tanana River floodplain in interior Alaska. Because previous measurements of nitrogen fixation, mineralization, and deposition can only account for approximately 26% of these communities' nitrogen requirements, other mechanisms of nitrogen supply should be operating. This study examined the potential for Subsurface hydrology to supply nitrogen to the rooting zones of early Successional plant communities. Three transects of ground water wells were established along the floodplain, and hydrologic characteristics and soil/water chemistry were measured for 2 y. Hydrologic measurements were then used to model the potential nitrogen contributions from advective flow and capillary rise. Ion exchange membranes and stable isotope tracers were used to identify the use of hyporheic nitrogen by vegetation. Nitrogen accumulation on ion exchange membranes showed a large input of nitrogen during a period of high water in 2003. Plants showed uptake of hyporheic N-15-labelled nitrogen at 2 of 4 locations. Models of capillary rise and advective flow estimated that nitrogen supply from subsurface water equalled or exceeded total nitrogen supply from nitrogen mineralization and processes in controlling nutrient supply nitrogen fixation combined. These findings underscore the of hyporheic to early successional vegetation on the Tanana River floodplain.Show less"
