,First author,Year,Title,Journal,Abstract
15,"Giblin, SM",Sep 2020 ,Environmental factors controlling phytoplankton dynamics in a large floodplain river with emphasis on cyanobacteria,RIVER RESEARCH AND APPLICATIONS,"Harmful algal blooms are occurring in large river ecosystems and at the mouth of large rivers with increasing frequency. In lentic systems, the chemical and physical conditions that promote harmful algal blooms are somewhat predictable but tracking prevalence and conditions that promote harmful algal blooms in lotic systems is much more difficult. We captured two of the most extreme discharge years within the last 20 years occurring in the Upper Mississippi River, allowing a natural experiment that evaluated how major shifts in discharge drive environmental variation and associated shifts in phytoplankton. Statistical models describing significant environmental covariates for phytoplankton assemblages and specific taxa were developed and used to identify management-relevant numeric breakpoints at which environmental variables may promote the growth of specific phytoplankton and/or cyanobacteria. Our analyses supported that potentially toxin-producing cyanobacteria dominate under high phosphorus concentration, low nitrogen concentration, low nitrogen-to-phosphorus ratio, low turbulence, low flushing, adequate light and warm temperatures. Cyanobacteria dominated in 2009 when low discharge and low flushing likely led to optimal growth environments forDolichospermum,AphanizomenonandMicrocystis. Rarely will a single factor lead to the dominance, but multiple positive factors working in concert can lead to cyanobacteria proliferation in large rivers. Certain isolated backwaters with high phosphorus, low nitrogen, warm water temperatures and low potential for flushing could benefit from increased connection to channel inputs to reduce cyanobacterial dominance. Numerous examples of this type of habitat currently exist in the Upper Mississippi River and could benefit from reconnection to channel habitats.Show less"
16,"Whitney, JE",Dec 2015 ,Consecutive wildfires affect stream biota in cold- and warmwater dryland river networks,FRESHWATER SCIENCE,"Climate change and fire suppression have altered fire regimes globally, leading to larger, more frequent, and more severe wildfires. Responses of coldwater stream biota to single wildfires are well studied, but measured responses to consecutive wildfires in warmwater systems that often include mixed assemblages of native and nonnative taxa are lacking. We quantified changes in physical habitat, resource availability, and biomass of cold- and warmwater oligochaetes, insects, crayfish, fishes, and tadpoles following consecutive megafires (covering >100 km(2)) in the upper Gila River, New Mexico, USA. We were particularly interested in comparing responses of native and nonnative fishes that might have evolved under different disturbance regimes. Changes in habitat and resource availability were related to cumulative fire effects, fire size, and postfire precipitation. The 2nd of 2 consecutive wildfires in the basin was larger and, coupled with moderate postfire discharge, resulted in increased siltation and decreased algal biomass. Several insect taxa responded to these fires with reduced biomass, whereas oligochaete biomass was unaffected. Biomass of 6 of 7 native fish species decreased after the fires, and decreases were associated with site proximity to fire. Nonnative fish decreases after fire were most pronounced for coldwater salmonids, and warmwater nonnative fishes exhibited limited responses. All crayfish and tadpoles collected were nonnative and were unresponsive to fire disturbance. More pronounced responses of native insects and fishes to fires indicate that increasing fire size and frequency threatens the persistence of native fauna and suggests that management activities promoting ecosystem resilience might help ameliorate wildfire effects.Show less"
17,"Greulich, RS",Oct 29 2020 ,Shared functional connectivity between the dorso-medial and dorso-ventral streams in macaques,SCIENTIFIC REPORTS,"Manipulation of an object requires us to transport our hand towards the object (reach) and close our digits around that object (grasp). In current models, reach-related information is propagated in the dorso-medial stream from posterior parietal area V6A to medial intraparietal area, dorsal premotor cortex, and primary motor cortex. Grasp-related information is processed in the dorso-ventral stream from the anterior intraparietal area to ventral premotor cortex and the hand area of primary motor cortex. However, recent studies have cast doubt on the validity of this separation in separate processing streams. We investigated in 10 male rhesus macaques the whole-brain functional connectivity of these areas using resting state fMRI at 7-T. Although we found a clear separation between dorso-medial and dorso-ventral network connectivity in support of the two-stream hypothesis, we also found evidence of shared connectivity between these networks. The dorso-ventral network was distinctly correlated with high-order somatosensory areas and feeding related areas, whereas the dorso-medial network with visual areas and trunk/hindlimb motor areas. Shared connectivity was found in the superior frontal and precentral gyrus, central sulcus, intraparietal sulcus, precuneus, and insular cortex. These results suggest that while sensorimotor processing streams are functionally separated, they can access information through shared areas.Show less"
18,"Winemiller, KO",Mar 2023 ,Can spatial food web subsidies associated with river hydrology and lateral connectivity be detected using stable isotopes?,FOOD WEBS,"During and following lateral connections, aquatic organisms residing in the river channel may assimilate material from sources imported from oxbows, and oxbow residents may consume and assimilate material imported from the channel. Hydrology, lateral connectivity, and stable isotope ratios of fishes and mussels were analyzed for evidence of spatial food web subsidies between the active channel and oxbow lakes in the floodplain of the Guadalupe River, Texas. During surveys conducted between March 2016 and April 2017, fish, mussel, periphyton, seston, and riparian plant samples were collected in and around two oxbows and adjacent channel sites for analysis of stable isotope ratios. Biplots of 813C and 815N were graphed for basal sources and specimens of six common fish species, four sunfish species (Lepomis spp. combined), and two mussel species (Unionidae combined) captured from oxbows and the channel. Within each graph, polygons were drawn to indicate the space occupied by animals that could have assimilated feasible combinations of source materials originating from either oxbows or the river channel. Based on positions of animals within source polygons, riparian C4 grasses were not an important source of organic matter supporting biomass of fishes and mussels within the channel or oxbows. Overall, 84% of organisms had isotopic signatures consistent with assimilation of in situ sources, but also 76% of all organisms were inconclusive with regards to cross-habitat exchanges. Outliers that may have assimilated ex situ source material were observed for only 4% of 313 organisms from oxbows and 9% of 232 organisms from the channel, and some but not all of these cases followed high flow pulses that connected oxbows for extended periods. Several issues that compromise inferences from stable isotope analysis were identified, and estimation of spatial food web subsidies in fluvial systems could be enhanced by analyzing additional biomarkers, such as isotopic ratios of other elements and compound-specific stable isotopes, as well as additional sources, timespecific biotracers, and experimental approaches that directly track movement of sources and organisms in spatially structured food webs.Show less"
19,"Franciskovic-Bilinski, S",Mar 2014 ,Magnetic spherules in sediments of the karstic Dobra River (Croatia),JOURNAL OF SOILS AND SEDIMENTS,"The paper describes an unusual finding of magnetic particles in stream sediments of the karstic Dobra River (Croatia). It aims to investigate the magnetic susceptibility properties of river sediments and to find links with their mineralogical and chemical composition. The goal of our research was to suggest the possible origin of magnetic particles in the river sediments within the Dinaric karst region, which to our knowledge was not exposed to metal manufacturing processes.A preliminary, exploratory sediment sampling programme was undertaken. Sediments were collected near the channel bank (from the top layer) at 16 representative stations distributed along the length of the Dobra River (110 km). Sediments were air-dried and passed through 2-mm and 63-mu m sieves, and analysed for magnetic susceptibility (and Curie temperature), isothermal remanent magnetism (IRM), stereo-microscopy of separated magnetic grains, mineralogical analysis (using X-ray diffraction), and chemical analysis (using inductively coupled plasma-mass spectrometry).Increased magnetic susceptibility and IRM values were observed mostly in the sediments of the Upper Dobra. Thermomagnetic curves show a distinctive Curie-point of magnetite at 580 A degrees C. Additional transformation observed at 520-560 A degrees C derives from titanomagnetite. There was no significant correlation between magnetic susceptibility and Fe. Magnetic particles from the Dobra River sediments contain pyroxene, plagioclase, hematite and quartz, in addition to magnetite. White spherules within magnetic grains are also present. The major constituent of five separated magnetic spherules is Fe; the minor constituents are Al, Ca, Mg and Si, and there are numerous trace elements (Ba, Cr, K, Mn, Na, Ni, Ti and V). The ratio Ni/ Fe versus Cr/Fe suggests that the magnetic spherules are impactites.Magnetic spherules were discovered for the first time in stream sediments of the sinking karstic Dobra River, a region where anthropogenic sources for that contribution are absent. Preliminary results point to a possible impactite, formed either by a shock event caused by a meteorite impact or by volcanic processes. The presence of magnetic spherules in the fluvial sediments of the Upper Dobra River represents a new and exciting finding and deserves further field work and laboratory research.Show less"
20,"Khosronejad, A",Jul 2015 ,Numerical simulation of large dunes in meandering streams and rivers with in-stream rock structures,ADVANCES IN WATER RESOURCES,"The evolution and migration of large dunes in a realistic intermediate-size experimental stream, the Saint Anthony Falls Laboratory (SAFL) Outdoor StreamLab (OSL), and two large-scale meandering rivers with in-stream rock structures are studied numerically using the SAFL Virtual StreamLab hydro-morphodynamic (VSL3D) model. Due to the challenges arising from mesh quality and large disparity in time-scales, coupled morpho- and hydro-dynamics simulations of bed forms has, for the most part, been restricted to sand wave amplitudes of few centimeters. In this work, we overcome such difficulties by employing the immersed boundary approach and a dual time-stepping technique of the VSL3D model [63]. The VSL3D employs the curvilinear immersed boundary (CURVIB) method along with a suspended sediment load module and is capable of simulating turbulent stratified flows coupled with bed morphodynamic evolution in realistic riverine environments with arbitrarily complex hydraulic structures. Turbulence is handled either via large-eddy simulation (LES) with the dynamic Smagorinski subgrid scale model or unsteady Reynolds-averaged Navier Stokes (URANS) equations closed with the k - omega turbulence model. Simulations in the intermediate-scale OSL channel, in which we also collected experimental morphodynamic data, show that LES can capture the evolution and migration of bed forms with characteristics that are in good agreement with experimental measurements. The URANS model, however, fails to excite the bed instability in the OSL channel but captures realistic dune evolution in the two large-scale meandering rivers. This finding is especially important as it demonstrates the potential of the VSL3D model as a powerful tool for simulating morphodynamic evolution under prototype conditions. To our knowledge, our work is the first attempt to simulate large-scale bed forms in waterways with an order of magnitude disparity in spatial scales, from the similar to 2.7 m wide OSL channel to the 27 m wide rivers. Accordingly, the height of the simulated dunes ranges from similar to 0.2 m to 2.0 m and the wavelength ranges from similar to 0.1 m to 50 m for the OSL and large-scale rivers, respectively. For all cases the statistical properties of the simulated bed forms are shown to agree well with those of bed forms observed in nature. (C) 2014 Elsevier Ltd. All rights reserved.Show less"
21,"Jerin, T",Feb 15 2021 ,Scale associated coupling between channel morphology and riparian vegetation in a bedrock-controlled stream,GEOMORPHOLOGY,"Most fluvial systems exhibit systematic, continuous upstream to downstream variations in channel morphology and related ecological and hydrological parameters (emphasized by conceptual frameworks such as downstream hydraulic geometry and the river continuum concept), and discontinuous, shorter range variations (emphasized by hierarchical patch dynamics). This study investigates the relative importance of broader-scale upstream to downstream variation and local variation at the hydraulic unit scale in a bedrock-controlled stream in central Kentucky, USA. A nested ANOVA analytical approach was used to determine the relative importance of three nested spatial scales in explaining variations in channel morphology and riparian trees. Results show that channel morphology is largely controlled by local-scale variation explaining about 92% of slope, 46% of bankfull width, 99% of average depth, 54% of width-depth ratio, 86% of channel cross-sectional area, and 100% of the hydraulic radius of the channel. Different categories of substrate characteristics, however, represent anomalies with respect to variance explained at different levels. Furthermore, local-scale controls explain 60% of variations in species richness, 59% of variations in the total number of individual trees, 68% of variation in the proportion of Platanus occidentalis basal area and 43% of variation in the total number of biogeomorphic impacts. These results are consistent with the idea of tight coupling between channel morphology and riparian vegetation, although they do not, by themselves, prove such interactions. The morphological variation of the channel at the local scale is primarily attributable to the geological controls (e.g., faults, bedding planes, joints and fractures) and incision status associated with the study area. The local scale variation in vegetation pattern can be explained by the highly local edaphic differences along the riparian corridor, which is likely to be related to the local scale fluvial process-form variations, and biogeomorphic impacts and feedbacks. These patterns may therefore be common in bedrock rivers strongly influenced by geological controls. (C) 2020 The Author. Published by Elsevier B.V.Show less"
22,"Danierhan, S",Oct 1 2013 ,Coupled GSI-SVAT Model with Groundwater-Surface Water Interaction in the Riparian Zone of Tarim River,JOURNAL OF HYDROLOGIC ENGINEERING,"The Tarim River is located in the arid areas of northwestern China, where groundwater (GW) and surface water (SW) in different landscape units have undergone regular and duplicate transformation processes, greatly improving the utilization of water resources. Investigation of the interaction between groundwater and surface water is critical to determine proper water resources planning and management in the Tarim River region. A new approach of coupling the soil-vegetation-atmosphere transport model (SVAT) with the groundwater-surface water interaction model (GSI) is presented in this paper. Usually, the surface water recharges to groundwater and groundwater-soil water exchange are not considered in the SVAT model. However, in reality, the soil water content profiles and soil heat profiles are intensely affected by shallow groundwater table, especially in arid riparian zones where groundwater levels fluctuate substantially. A new method linking the SVAT model with the GSI model is proposed in this paper to approach this issue. The groundwater-soil water exchange and groundwater evaporation can be effectively simulated using GW-SW interface in the coupled GSI-SVAT model. The coupled model is validated in the riparian zone of the upper reaches of the Tarim River with the simulation of heat and water transfer between groundwater level and soil surface, evapotranspiration, root water uptake, and groundwater-soil water exchange. The simulation results show good consistency with experimental data, indicating that the use of this coupled model could improve the accuracy of simulation of ecological water consumption in the riparian zone. The coupled GSI-SVAT model could be used for better planning and management of water resources in arid areas.Show less"
23,"Li, N",Aug 2014 ,Robust river boundaries extraction of dammed lakes in mountain areas after Wenchuan Earthquake from high resolution SAR images combining local connectivity and ACM,ISPRS JOURNAL OF PHOTOGRAMMETRY AND REMOTE SENSING,"River boundaries extraction from SAR imagery is valuable for flood monitoring and damage assessment. Several rivers, parts of which include dammed lakes caused by landslides and rock avalanches triggered by the 2008 Wenchuan Earthquake, were taken as a case study for robust extraction. In this paper, a novel state-of-the-art approach for automated river boundaries extraction using high resolution synthetic aperture radar (SAR) intensity imagery is presented. The key of our approach lies in the combined usage of local connectivity feature of the river and a region-based active contours model (ACM) in a variational level set framework to differentiate between river and the background. First, sub-patched intensity thresholding segmentation is applied to SAR imagery. Pixels with intensities below the threshold are selected as potential river pixels while the others are potential background pixels. Second, potential river pixels are divided into several connected regions, considering that the river is a big connected region, only relatively bigger regions with similar contrast value are retained as the regions of interest (ROI) while others are noise due to pixel-level decision approach in the first step or shadows due to mountains terrain. Third, the ROI and their contours are regarded as local region and the initial contours to refine the river boundaries, which are used to reduce the scene complexity of ACM and its sensitivity to initial situation, respectively. A novel ACM driven by local image fitting (LIF) energy is presented and used for river boundaries extraction for the first time, which is not only robust against inhomogeneity widely spread in SAR imagery but also can work with efficiency without the need of re-initialization during iteration compared to traditional ACM. The proposed approach was tested on numerous high resolution airborne SAR images containing connected rivers or dammed lakes obtained by Chinese domestic radar system after Wenchuan Earthquake. For the overall dataset, the average commission error, omission error and root mean squared error were 6.5%, 3.3%, and 0.51, respectively. The average computational time for 4000 by 4000 image size was 21 min using a PC-based MATLAB platform. Our experimental results demonstrate that the proposed approach is robust and effective. (C) 2014 International Society for Photogrammetry and Remote Sensing, Inc. (ISPRS). Published by Elsevier B.V. All rights reserved.Show less"
24,"Franssen, NR",Nov 2006 ,Effects of floods on fish assemblages in an intermittent prairie stream,FRESHWATER BIOLOGY,"1. Floods are major disturbances to stream ecosystems that can kill or displace organisms and modify habitats. Many studies have reported changes in fish assemblages after a single flood, but few studies have evaluated the importance of timing and intensity of floods on long-term fish assemblage dynamics.2. We used a 10-year dataset to evaluate the effects of floods on fishes in Kings Creek, an intermittent prairie stream in north-eastern, Kansas, U.S.A. Samples were collected seasonally at two perennial headwater sites (1995-2005) and one perennial downstream flowing site (1997-2005) allowing us to evaluate the effects of floods at different locations within a watershed. In addition, four surveys during 2003 and 2004 sampled 3-5 km of stream between the long-term study sites to evaluate the use of intermittent reaches of this stream.3. Because of higher discharge and bed scouring at the downstream site, we predicted that the fish assemblage would have lowered species richness and abundance following floods. In contrast, we expected increased species richness and abundance at headwater sites because floods increase stream connectivity and create the potential for colonisation from downstream reaches.4. Akaike Information Criteria (AIC) was used to select among candidate regression models that predicted species richness and abundance based on Julian date, time since floods, season and physical habitat at each site. At the downstream site, AIC weightings suggested Julian date was the best predictor of fish assemblage structure, but no model explained > 16% of the variation in species richness or community structure. Variation explained by Julian date was primarily attributed to a long-term pattern of declining abundance of common species. At the headwater sites, there was not a single candidate model selected to predict total species abundance and assemblage structure. AIC weightings suggested variation in assemblage structure was associated with either Julian date or local habitat characteristics.5. Fishes rapidly colonised isolated or dry habitats following floods. This was evidenced by the occurrence of fishes in intermittent reaches and the positive association between maximum daily discharge and colonisation events at both headwater sites.6. Our study suggests floods allow dispersal into intermittent habitats with little or no downstream displacement of fishes. Movement of fishes among habitats during flooding highlights the importance of maintaining connectivity of stream networks of low to medium order prairie streams.Show less"
25,"Ho, WY",1st International Yellow River Forum,Theoretical Research and Practice on River Dredging for Deposition Reduction in the Narrow Reach of the Lower Yellow River,,
26,"Kaufman, MH",Mar 18 2021 ,Evaluating a Laboratory Flume Microbiome as a Window Into Natural Riverbed Biogeochemistry,FRONTIERS IN WATER,"Riverbeds are hotspots for microbially-mediated reactions that exhibit pronounced variability in space and time. It is challenging to resolve biogeochemical mechanisms in natural riverbeds, as uncontrolled settings complicate data collection and interpretation. To overcome these challenges, laboratory flumes are often used as proxies for natural riverbed systems. Flumes capture spatiotemporal variability and thus allow for controlled investigations of riverbed biogeochemistry. These investigations implicitly rely on the assumption that the flume microbiome is similar to the microbiome of natural riverbeds. However, this assumption has not been tested and it is unknown how the microbiome of a flume compares to natural aquatic settings, including riverbeds. To evaluate the fundamental assumption that a flume hosts a microbiome similar to natural riverbed systems, we used 16s rRNA gene sequencing and publicly available data to compare the sediment microbiome of a single large laboratory flume to a wide variety of natural ecosystems including lake and marine sediments, river, lake, hyporheic, soil, and marine water, and bank and wetland soils. Richness and Shannon diversity metrics, analyses of variance, Bray-Curtis dissimilarity, and analysis of the common microbiomes between flume and river sediment all indicated that the flume microbiome more closely resembled natural riverbed sediments than other ecosystems, supporting the use of flume experiments for investigating natural microbially-mediated biogeochemical processes in riverbeds.Show less"
27,"Jiang, LL",22nd International Conference on Geoinformatics (GeoInformatics),River Classification and River Network Structuration in River Auto-Selection,,
