,First author,Year,Title,Journal,Abstract
15,"Granados, V",Apr 15 2020 ,The interruption of longitudinal hydrological connectivity causes delayed responses in dissolved organic matter,SCIENCE OF THE TOTAL ENVIRONMENT,"Hydrology is the main driver of dissolved organic matter (DOM) dynamics in intermittent rivers and ephemeral streams. However, it is still unclear how the timing and the spatial variation in flow connectivity affect the dynamics of DOM and inorganic solutes.This study focuses on the impact of flow cessation on the temporal and spatial heterogeneity of DOM quantity and quality along an intermittent stream. We monitored a headwater intermittent stream at high spatial and temporal frequencies during a summer drying episode and analysed dissolved organic carbon (DOC) and its spectroscopic properties, inorganic solutes and dissolved CO2. The drying period determined the disruption of the fluvial continuum with a recession of stream continuum at a rate of similar to 60 m/d and the gradual formation of a patched system of isolated pools of different sizes. Our results showed that the period of time that had elapsed since isolated pool formation (CI-days) was an essential factor for understanding how drying shaped the biogeochemistry of the fluvial system. Overall, drying caused a high DOC concentration and an increase in the humic-like fluorescence signal. Additionally, solutes showed contrasting responses to hydrological disconnection. Electrical conductivity, for instance, is a clear ""sentinel"" of the fragmentation process because it starts to increase before the hydrological disruption occurs. In contrast, DOC. most spectroscopic DOM descriptors and CO2 showed delayed responses of approximately 5-21 days after the formation of isolated pools. Furthermore, the spatial location and volume of each isolated pool seemed to exert a significant impact on most variables. In contrast, the temperature did not follow a dear pattern. These findings indicate that the fragmentation of longitudinal hydrological connectivity does not induce a single biogeochemical response but rather stimulates a set of solute-specific responses that generates a complex biogeochemical mosaic in a single fluvial unit. (C) 2020 Elsevier B.V. All rights reserved.Show less"
16,"Huang, ZH",Aug 2022 ,The Coupling Coordination Evolutionary Analysis of Tourism-Ecological Environment-Public Service for the Yellow River Basin of China,INTERNATIONAL JOURNAL OF ENVIRONMENTAL RESEARCH AND PUBLIC HEALTH,"In the context of the global pandemic, the development of tourism in the Yellow River Basin is constrained by the dual mechanisms of the decline in the quality of public service and the deterioration of the ecological environment. In order to promote the high-quality development of the ecological environment in the Yellow River Basin, this paper studies the coordinated development of tourism, the ecological environment and public service in the Yellow River Basin by treating tourism, the ecological environment and public service as a whole. Based on the coupling coordination function GM (1,1) grey prediction method and PVAR model, we discuss the characteristics of spatio-temporal differences, evolutionary trends and the interaction mechanism of the coupling coordination degree (CCD) of tourism-ecological environment-public service in nine provinces along the Yellow River Basin in China from 2008 to 2019. The results show that tourism and public service in the Yellow River Basin are closely related, and the protection of the ecological environment and tourism development are not contradictory. In terms of time, the overall trend is stable and upward from the perspective of the CCD of the three systems; in terms of space, Henan, Shandong, and Sichuan provinces have a relatively high level of CCD. While Qinghai, Gansu, Ningxia, Inner Mongolia, Shaanxi and Shanxi provinces have a lower level of CCD, which shows an upward trend from upstream to downstream in the space. The evolutionary trend of the CCD of the three systems in the basin will be upward in all provinces except for the Shandong province in the next five years. Tourism can promote both the ecological environment and public service from the perspective of the mutual influence mechanism.Show less"
17,"Argentina, JE",Oct 2018 ,Spatial extent of analysis influences observed patterns of population genetic structure in a widespread darter species (Percidae),FRESHWATER BIOLOGY,"1. Connectivity among stream fish populations allows for exchange of genetic material and helps maintain genetic diversity, adaptive potential and population stability over time. Changes in species demographics and population connectivity have the potential to permanently alter the genetic patterns of stream fish, although these changes through space and time are variable and understudied in small-bodied freshwater fish.2. As a spatially widespread, common species of benthic freshwater fish, the variegate darter (Etheostoma variatum) is a model species for documenting how patterns of genetic structure and diversity respond to increasing isolation due to large dams and how scale of study may shape our understanding of these patterns. We sampled variegate darters from 34 sites across their range in the North American Ohio River basin and examined how patterns of genetic structure and diversity within and between populations responded to historical population changes and dams within and between populations.3. Spatial scale and configuration of genetic structure varied across the eight identified populations, from tributaries within a watershed, to a single watershed, to multiple watersheds that encompass Ohio River mainstem habitats. This multiwatershed pattern of population structuring suggests genetic dispersal across large distances was and may continue to be common, although some populations remain isolated despite no apparent structural dispersal barriers. Populations with low effective population sizes and evidence of past population bottlenecks showed low allelic richness, but diversity patterns were not related to watershed size, a surrogate for habitat availability. Pairwise genetic differentiation (F-ST) increased with fluvial distance and was related to both historic and contemporary processes. Genetic diversity changes were influenced by underlying population size and stability, and while instream barriers were not strong determinants of genetic structuring or loss of genetic diversity, they reduce population connectivity and may impact long-term population persistence.4. The broad spatial scale of this study demonstrated the large spatial extent of some variegate darter populations and indicated that dispersal is more extensive than expected given the movement patterns typically observed for small-bodied, benthic fish. Dam impacts depended on underlying population size and stability, with larger populations more resilient to genetic drift and allelic richness loss than smaller populations.5. Other darters that inhabit large river habitats may show similar patterns in landscape-scale studies, and large river barriers may impact populations of small-bodied fish more than previously expected. Estimation of dispersal rates and behaviours is critical to conservation of imperilled riverine species such as darters.Show less"
18,"Lasne, E",Sep 2015 ,The Effects of DAM Removal on River Colonization by Sea Lamprey Petromyzon Marinus,RIVER RESEARCH AND APPLICATIONS,"Habitat fragmentation is an important cause of biodiversity loss in freshwater systems, as worldwide rivers have been fragmented by dams and other hydraulic structures. To restore freshwater fish populations, some barriers have been removed, but the long-term ecological effects of this removal have been rarely quantified. In the present study, we quantified the effects of barrier removal on river colonization by anadromous sea lamprey (Petromyzon marinus) by analyzing the spatial distribution and nest density in a small coastal river (France) from 1994 to 2011. Our results demonstrated the benefit of dam removal within few years after restoration. Indeed, the spatial distribution of nests shifted significantly upstream and was more uniform throughout the river after removal. Our results also suggest that the spatial patterns of habitat colonization were affected by the density of nests, river flow and connectivity. Finally, although the number of nests was significantly higher after removal, it was not possible to clearly identify the contribution of intrinsic versus external factors involved in this pattern. Further investigations are therefore needed to quantify the potential subsequent effects on juvenile recruitment and the overall population dynamics. Copyright (c) 2014 John Wiley & Sons, Ltd.Show less"
19,"Xu, YJ",Oct 2018 ,Assessing Resilience and Sustainability of the Mississippi River Delta as a Coupled Natural-Human System,WATER,"This book contains 14 articles selected from a special issue on the assessment of resilience and sustainability of the Mississippi River Delta as a coupled natural-human system. This effort is supported in part by a U. S. National Science Foundation grant. The goal of this book is to present some of the recent advances in research and research methodologies, major discoveries, and new understanding of the Mississippi River Delta, which represents one of the most challenging cases in finding the pathways for coastal resilience and sustainability because of the complexity of environmental and socioeconomic interactions. The articles are contributed by 39 researchers and they studied the deltaic system from five aspects including 1) riverine processes and sediment availability, 2) sediment deposition and land creation, 3) wetland loss, saltwater intrusion, and subsidence, 4) community resilience and planning, and 5) review and synthesis. As editors, by reviewing and putting these papers together, we have realized a major challenge in conducting an interdisciplinary assessment of resilience: How to identify a ""Common Threshold"" from different scientific disciplines for a highly nature-human intertwined river delta system? For instance, the threshold for sustaining a river delta in the view of physical sciences is different from that of social sciences. Such a common threshold would be a radical change and/or a collapse of a coupled natural-human delta system if nothing can be or will be done. Identifying the common threshold would help guide assessment and evaluation of the resilience of a CNH system as well as the feasibility and willingness of protecting the system's resilience. We hope this book will be a first step toward inspiring researchers from different disciplines to work closely together to solve real problems in sustaining precious river delta ecosystems across the globe.Show less"
20,"Gregory, MD",Dec 2019 ,Williams syndrome hemideletion and LIMK1 variation both affect dorsal stream functional connectivity,BRAIN,"Williams syndrome is a rare genetic disorder caused by hemizygous deletion of similar to 1.6 Mb affecting 26 genes on chromosome 7 (7q11.23) and is clinically typified by two cognitive/behavioural hallmarks: marked visuospatial deficits relative to verbal and nonverbal reasoning abilities and hypersocial personality. Clear knowledge of the circumscribed set of genes that are affected in Williams syndrome, along with the well-characterized neurobehavioural phenotype, offers the potential to elucidate neurogenetic principles that may apply in genetically and clinically more complex settings. The intraparietal sulcus, in the dorsal visual processing stream, has been shown to be structurally and functionally altered in Williams syndrome, providing a target for investigating resting-state functional connectivity and effects of specific genes hemideleted in Williams syndrome. Here, we tested for effects of the LIMK1 gene, deleted in Williams syndrome and important for neuronal maturation and migration, on intraparietal sulcus functional connectivity. We first defined a target brain phenotype by comparing intraparietal sulcus resting functional connectivity in individuals with Williams syndrome, in whom LIMK1 is hemideleted, with typically developing children. Then in two separate cohorts from the general population, we asked whether intraparietal sulcus functional connectivity patterns similar to those found in Williams syndrome were associated with sequence variation of the LIMK1 gene. Four independent between-group comparisons of resting-state functional MRI data (total n = 510) were performed: (i) 20 children with Williams syndrome compared to 20 age- and sex-matched typically developing children; (ii) a discovery cohort of 99 healthy adults stratified by LIMK1 haplotype; (iii) a replication cohort of 32 healthy adults also stratified by LIMK1 haplotype; and (iv) 339 healthy adolescent children stratified by LIMK1 haplotype. For between-group analyses, differences in intraparietal sulcus resting-state functional connectivity were calculated comparing children with Williams syndrome to matched typically developing children and comparing LIMK1 haplotype groups in each of the three general population cohorts separately. Consistent with the visuospatial construction impairment and hypersocial personality that typify Williams syndrome, the Williams syndrome cohort exhibited opposite patterns of intraparietal sulcus functional connectivity with visual processing regions and social processing regions: decreased circuit function in the former and increased circuit function in the latter. All three general population groups also showed LIMK1 haplotype-related differences in intraparietal sulcus functional connectivity localized to the fusiform gyrus, a visual processing region also identified in the Williams syndrome-typically developing comparison. These results suggest a neurogenetic mechanism, in part involving LIMK1, that may bias neural circuit function in both the general population and individuals with Williams syndrome.Show less"
21,"Schopper, N",Mar 25 2019 ,Analysis of lateral sediment connectivity and its connection to debris flow intensity patterns at different return periods in the Fella River system in northeastern Italy,SCIENCE OF THE TOTAL ENVIRONMENT,"A wide variety of issues are now being addressed using the concept of connectivity, which has initiated the development of various methods to assess a river's relationship to its catchment. This study tests two well established methods, the Effective Catchment Area (ECA) and the Index of Connectivity (IC) in the study area of the Fella River in northeastern Italy, to gain an idea of their potentials, limitations and ability to represent connectivity patterns observable in the field. The results show that both methods provide largely agreeing outputs, which widely match field observations. Disagreement is mainly found where human-induced features, especially roads, encroach the rivers system. Focusing on a natural hazard background, the study furthermore approaches the issue of events of different frequencies and magnitudes and their representation in terms of connectivity. This is done by correlating debris flows at varying return periods with the IC, which seemed more fitting for this comparison due to the differentiation between different intensities of connectivity. Over the entire catchment, patterns of debris flow intensities (DFI) only agree weakly with the patterns of the IC, however, debris flows reaching the main channel show strong correlations with IC values. This can be traced back to the fact that connectivity focuses on a catchment's relationship with the river anti does not include processes that happen in those parts of the catchment not directly linked to the main channel network. The IC is therefore able to represent patterns of processes reaching the main valley very well but cannot be used to explain or even predict the occurrence of processes that have no direct spatial connection to the river. (C) 2018 Elsevier B.V. All rights reserved.Show less"
22,"Anibas, C",May 2018 ,"Delineation of spatial-temporal patterns of groundwater/surface-water interaction along a river reach (Aa River, Belgium) with transient thermal modeling",HYDROGEOLOGY JOURNAL,"Among the advances made in analytical and numerical analysis methods to quantify groundwater/surface-water interaction, one methodology that stands out is the use of heat as an environmental tracer. A large data set of river and riverbed temperature profiles from the Aa River in Belgium has been used to examine the spatial-temporal variations of groundwater/surface-water interaction. Exchange fluxes were calculated with the numerical heat-transport code STRIVE. The code was applied in transient mode to overcome previous limitations of steady-state analysis, and allowed for the calculation of model quality. In autumn and winter the mean exchange fluxes reached -90 mm d(-1), while in spring and early summer fluxes were -42 mm d(-1). Predominantly gaining conditions occurred along the river reach; however, in a few areas the direction of flow changed in time. The river banks showed elevated fluxes up to a factor of 3 compared to the center of the river. Higher fluxes were detected in the upstream section of the reach. Due to the influence of exchange fluxes along the river banks, larger temporal variations were found in the downstream section. The exchange fluxes at the river banks seemed more driven by variable local exchange flows, while the center of the river was dominated by deep and steady regional groundwater flows. These spatial and temporal differences in groundwater/surface-water exchange show the importance of long-term investigations on the driving forces of hyporheic processes across different scales.Show less"
23,"Meier, W",Aug 2003 ,Modeling the effect of water diversion on the temperature of mountain streams,JOURNAL OF ENVIRONMENTAL ENGINEERING-ASCE,"Water diversion for hydroelectric power generation impacts the temperature of mountain streams. Such changes are estimated by using a coupled one-dimensional dead-zone heat balance model. In very steep river sections, the dissipation of kinetic energy is the dominant heat source. For such streams, water diversion has only a minor effect on water temperature, because dissipation-induced temperature changes are independent of discharge. In contrast, in river sections of gradual slope, the influence by solar radiation, long-wave radiation. and heat exchange with the streambed is stronger. In such cases, a discharge reduction can lead to significant temperature changes. For a small stream in the southern Swiss Alps, model results show that diversion increases temperature by about 3.7 (+/-0.9)degreesC in a 21 km long river section under high solar radiation during summer. During a cold winter episode, water temperature is estimated to be about 1.8 (+/-0.8)degreesC lower compared to natural conditions. This heat balance model can also be used to simulate the effect of different measures to reduce water temperature changes in affected streams.Show less"
24,"Miranda, LE",Nov 2005 ,Fish assemblages in oxbow lakes relative to connectivity with the Mississippi River,TRANSACTIONS OF THE AMERICAN FISHERIES SOCIETY,"The alluvial valley of the lower Mississippi River contains hundreds of fluvial lakes that are periodically connected to the river during high water, although the frequency, duration, and timing of the connections vary. To help design plans to restore and preserve fish assemblages in these alluvial lakes, this investigation tested whether predictable patterns in lake fish assemblages were linked to the level of connectivity with the river. Results suggested that connectivity played an important role in structuring fish assemblages and that it was correlated with variables such as lake size, depth, distance from the river, and age, which exhibit a continuum of predictable features as the river migrates away from abandoned channels. Annual floods homogenize the floodplain and promote connectivity to various degrees, allowing for fish exchanges between river and floodplain that directly affect fish assemblages. The major physical changes linked to reduced connectivity are loss of depth and area, which in turn affect a multiplicity of abiotic and biotic features that indirectly affect community structure. In advanced stages of disconnection, fish assemblages in oxbow lakes are expected to include largely species that thrive in turbid, shallow systems with few predators and low oxygen content. When the river flowed without artificial restraint, oxbow lakes were created at the rate of 13-15 per century. At present, no or few oxbow lakes are being formed, and as existing lakes age, they are becoming shallower, smaller, and progressively more disconnected from the river. Given that modifications to the Mississippi River appear to be irreversible, conservation of this resource requires maintenance of existing lakes at a wide range of aging phases that provide diverse habitats and harbor distinct species assemblages.Show less"
25,"Li, GY",2nd International Yellow River Forum,Keep Healthy Life of Rivers-A Case Study of the Yellow River,,
26,"Guerrero, M",36th IAHR World Congress,ACOUSTIC MEASURING OF STREAM FLOW AND SEDIMENT TRANSPORT TO ASSIST RIVER MORPHODYNAMICS MODELLING,,
27,"Cienciala, P",Apr 1 2020 ,"Lateral geomorphic connectivity in a fluvial landscape system: Unraveling the role of confinement, biogeomorphic interactions, and glacial legacies",GEOMORPHOLOGY,"The rates at which sediment from the landscape is recruited to channel networks reflect lateral geomorphic connectivity and have significant implications for biophysical river systems. By strongly influencing sediment supply regime, such inputs control the dynamics and characteristics of the channel as well as the associated habitat and biota. The main objective of this research was to disentangle the relative importance of geomorphic and biological factors which define spatial patterns in lateral connectivity by promoting or restricting bank erosion, avulsions, and slope failures. Focusing on a forested, formerly glaciated mountain basin in the interior Pacific Northwest, wecombined extensive field surveys with remote sensing data (LiDAR, aerial imagery) to obtainmetrics representing this complex suite of landscape characteristics. The interpretation of evidence yielded by correlations between these variables, a regime model, and qualitative observations, suggest that, at a multi-decadal timescale between major landscape disturbances, lateral connectivity patterns in Sullivan Creek may be, to a large extent, governed by a combination of biotic factors and glacial legacies. In particular, forest canopy metrics were key predictors of hillslope stability as well as bank and valley floor resistance, suggesting a pivotal influence of root reinforcement. On the other hand, instream large wood abundance was closely related to channel splitting, which reflects its role in promoting channel avulsions. More extensive bank erosion in reaches dominated by drift deposits appeared to indicate glacial legacies. Furthermore, a strong association between bank erosion and colluvial inputs suggested a close coupling within the channel-hillslope system. Lateral confinement - defined as the proportion of the channel length abutting against bedrock, terraces, fans and roads - was negatively associated with channel braiding; the relationships linking confinement with bank erosion and the magnitude of colluvial inputs (negative and positive association, respectively) were relatively weak. Taken together, findings emerging from this research suggest that better understanding of lateral geomorphic connectivity patterns in mountain river basins similar to our study site requires that both channel processes and broader, biophysical landscape system be considered. (C) 2020 Elsevier B.V. All rights reserved.Show less"
28,"Johnson, T",Jun 6 2022 ,Riverbed Temperature and 4D ERT Monitoring Reveals Heterogenous Horizontal and Vertical Groundwater-Surface Water Exchange Flows Under Dynamic Stage Conditions,FRONTIERS IN EARTH SCIENCE,"Groundwater surface water exchange plays a critical role in physical, biological, and geochemical function of coastal and riverine systems. Observing exchange flow behavior in heterogeneous systems is a primary challenge, particularly when flows are governed by dynamic river stage or tidal variations. In this paper we demonstrate a novel application of time-lapse 3D electrical resistivity tomography and temperature monitoring where an array of thermistors installed beneath a riverbed double as resistivity electrodes. We use the array to monitor stage driven exchange flows over a 6-day period in a dynamic, stage-driven high order stream. We present a method for addressing the otherwise confounding effects of the moving river-surface boundary on the raw resistivity data, thereby enabling successful tomographic imaging. Temperature time-series at each thermistor location and time-lapse 3D images of changes in bulk electrical conductivity together provide a detailed description of exchange dynamics over a 10-meter by 45-meter section of the riverbed, to a depth of approximately 5 m. Results reveal highly variable flux behavior throughout the monitoring domain including both horizontal and vertical exchange flows.Show less"
